資料集名稱,資料集識別碼,資料集描述,主要欄位說明,提供機關
高雄市與外國姊妹校締結名單,87223,高雄市與國外學校締結姊妹校名單。,校名;姊妹校國別;姊妹校所在區域;姊妹校名稱;締結時間,高雄市政府教育局
大高雄果菜、花卉批發市場基本資料一覽表,87231,大高雄果菜、花卉批發市場基本資料一覽表,市場;高雄果菜批發市場;岡山果菜批發市場;大樹果菜批發市場;旗山果菜批發市場;鳳山果菜批發市場;路竹果菜批發市場;燕巢果菜批發市場;大社果菜批發市場;林園果菜批發市場;高雄花卉批發市場,高雄市政府農業局
大高雄家禽批發市場基本資料一覽表,87232,大高雄家禽批發市場基本資料一覽表,市場;鳳山家禽批發交易市場;高雄市梓官區農會家禽批發市場,高雄市政府農業局
大高雄肉品批發市場基本資料一覽表,87233,大高雄肉品批發市場基本資料一覽表,市場;高雄肉品運銷股份有限公司;高雄市岡山肉品市場;高雄市鳳山肉品市場;高雄市鳳山肉品市場旗山分場,高雄市政府農業局
高雄市91年至105年刑事案件破獲率,87238,高雄市刑事案件破獲率,年月別;總計;竊盜;暴力犯罪;一般傷害;一般恐嚇取財;詐欺;違反毒品危害防制條例;公共危險;妨害自由;駕駛過失;偽造文書印文;妨害風化;侵占;違反槍砲彈藥刀械管制條例;妨害電腦使用;侵害智慧財產權;其他,高雄市政府警察局
高雄市各分局轄區重要指標,87239,高雄市各分局轄區重要指標,分局別;土地面積;人口數;人口密度;刑案發生數;刑案破獲數;刑案破獲率;刑案嫌疑犯;暴力發生數;暴力破獲數;暴力破獲率;暴力犯罪嫌疑犯;竊盜發生數,高雄市政府警察局
高雄市政府警察局處理家庭暴力績效,87241,家庭暴力績效,年月別;受理家庭暴力案件數;保護令;逮捕現行犯;聲請件數;核發件數;執行次數;違反件數;家庭暴力罪;違反保護令,高雄市政府警察局
高雄市警局現有正式員額,87244,高雄市警局現有正式員額,年份;縣市;性別;現有正式員額;20至24歲;25至29歲;30至34歲;35至39歲;40至44歲;45至49歲;50至54歲;55至59歲;60至64歲;65歲以上,高雄市政府警察局
高雄市輔導成立守望相助組織成果,87245,守望相助,年度;總隊數;總人數;里巡守隊隊數;里巡守隊人數;社區巡守隊隊數;社區巡守隊人數;公寓大廈巡守隊隊數;公寓大廈巡守隊人數;家戶聯防系統;警民連線系統;錄影監視系統,高雄市政府警察局
高雄市取締酒駕及危險駕車勤務,87249,高雄市取締酒駕及危險駕車勤務,年月別;酒駕勤務取締件數;酒駕勤務移送法辦件數;酒駕勤務移送法辦肇事件數;危險駕車勤務舉發件數;危險駕車勤務移送法辦件數;危險駕車勤務移送法辦人數,高雄市政府警察局
高雄市經濟案件與取締電玩攤販,87250,高雄市經濟案件與取締電玩攤販,年月別;經濟案件發生數;經濟案件侵害智慧財產權發生數;經濟案件違反金融發生數;經濟案件走私發生數;經濟案件金額;侵害智慧財產權金額;違反金融金額;走私金額;取締賭博電玩件數;取締賭博電玩臺數;取締違規攤販件數;取締違規攤販沒入攤架,高雄市政府警察局
高雄市違反社會秩序維護法案件,87251,高雄市違反社會秩序維護法案件,年月別;妨害安寧秩序件數;妨害安寧秩序人數;妨害善良風俗件數;妨害善良風俗人數;妨害他人身體財產件數;妨害他人身體財產人數;妨害公務件數;妨害公務人數;罰鍰金額,高雄市政府警察局
高雄市查獲毒品案件,87252,高雄市查獲毒品案件,年月別;查獲件數;嫌疑犯人數;嫌疑犯人數少年;嫌疑犯人數青年;重量;第一級毒品;海洛因;嗎啡;第一級其他;第二級毒品;罌粟;大麻;安非他命;第二級其他,高雄市政府警察局
高雄市住宅補貼辦理情形表,87256,提供高雄市住宅補貼辦理情形表,項目;計畫戶數;第一次公告受理_申請戶數;第一次公告受理_核准戶數;第二次公告受理_申請戶數;第二次公告受理_核准戶數;合計_申請戶數;合計_核准戶數;核准比率,高雄市政府都市發展局
高雄市二代戒菸合約機構,87259,醫事機構類別、醫事機構名稱、電話、區號、地址、給藥、衛教,醫事機構;醫事機構名稱;電話;區號;地址;給藥;衛教,高雄市政府衛生局
高雄市產後護理機構(產後護理之家)名冊,87260,提供高雄市產後護理機構(產後護理之家)名冊,單位;地址;電話,高雄市政府衛生局
高雄市一般護理之家立案機構名單,87261,提供高雄市一般護理之家立案機構名單,區別;機構名稱;機構地址;電話;分機;負責人;開放床數,高雄市政府衛生局
高雄市立特殊教育學校通訊資料,87262,提供高雄市立特殊教育學校通訊資料,機關名稱;地址;電話;lat;lng,高雄市政府教育局
休閒農場場址及聯絡電話,87263,提供休閒農場場址及聯絡電話,場名;地址;電話,高雄市政府農業局
高雄市105年度測速照相桿,87264,型式、測照地點、測照方向、管轄分局,型式;測照地點;測照方向;管轄分局,高雄市政府警察局
高雄市清潔針具自動服務機服務點,87265,提供高雄市清潔針具自動服務機服務點資料,設置地點執行點名稱;行政區域代碼;地址,高雄市政府衛生局
高雄市衛生自主管理標章認證業者名冊,87270,提供高雄市衛生自主管理標章認證業者名冊,業別;業者名稱;行政區域代碼;地址;有效日期,高雄市政府衛生局
高雄市優良餐飲認證業者名冊,87271,提供高雄市優良餐飲認證業者名冊,分級;業別;業者名稱;行政區域代碼;地址;有效日期,高雄市政府衛生局
污水下水道用戶接管普及率,87272,提供污水下水道用戶接管普及率,年-月份;原高雄市戶數;原高雄縣戶數;高雄市總戶數;總人口數;普及率%,高雄市政府水利局
高雄市清潔隊位置,87273,高雄市清潔隊位置,單位;地址;電話;分機,高雄市政府環境保護局
高雄市廢食用油清除機構名單,87274,提供廢食用油清除機構名單,管制編號;機構名稱;工作證序號;類別;車號或人員名稱;發證日期;有效日期;狀態,高雄市政府環境保護局
高雄市列管特定紀念樹木清冊,87275,提供高雄市列管特定紀念樹木清冊,編號;樹名;所在地;所在地地址;經度Lng;緯度Lat;資料序號Seq,高雄市政府農業局
高雄市土地增值稅漲價總數額-按移轉原因別-108,87491,土地增值稅漲價總數額-按移轉原因別,資料年期別;統計項目;移轉原因別;資料單位;值,高雄市政府財政局
105年度機關資料開放程度評鑑,87648,根據105年4月8日頒布的「高雄市政府資料開放行動方案」辦理。,項次;機關名稱;評鑑總分;1星等;2星等;3星等;資料項總數,高雄市政府研究發展考核委員會
高雄市政府處理違反有線廣播電視法案件裁量基準,87697,提供高雄市政府處理違反有線廣播電視法案件裁量基準,項次;違法事項;法條依據;法定罰鍰額度;裁罰基準<br>,高雄市政府新聞局
高雄市處理違反大眾捷運法第50條及50-1條事件概況表,87698,提供高雄市處理違反大眾捷運法第50條及50-1條事件概況表,法規;條例;97年;98年;99年;100年;101年;102年;103年;104年;105年;106年;備註,高雄市政府交通局
無障礙計程車營運情形,87701,提供無障礙計程車營運情形,年度;車輛數;搭乘趟次;博愛卡交易點數;月份,高雄市政府交通局
計程車彈性運輸服務月運量統計,87702,提供計程車彈性運輸服務月運量統計,年;月;大湖線;永安線;永安支線;大樹線;大寮線;燕巢線,高雄市政府交通局
計程車統計數量,87703,提供計程車統計數量,年度;計程車客運業;計程車客運服務業;計程車運輸合作社;計程車客運業兼營計程車客運服務業;個人計程車客運業;年分;月份;計程車客運服務業_純作派遣;掛牌總數,高雄市政府交通局
高雄厝,87704,高雄厝,申請類型;景觀陽臺_平方公尺;通用化廁所_平方公尺;通用化交誼室及昇降機_平方公尺;屋前綠能設施_平方公尺;屋後綠能設施_平方公尺;過樑處設置導風板_平方公尺;樓層;領得建照件數;領得使照件數;總戶數;領得使照比例;類別時間_年度;類別時間_月份;領得建造執照_件數;領得建造執照_棟數;領得建造執照_面積;領得建造執照_累計值_件數;領得建造執照_累計值_棟數;領得建造執照_累計值_面積;領得使用執照_件數;領得使用執照_棟數;領得使用執照_面積,高雄市政府工務局
建築物立體綠化,87705,高雄市推動建築物立體綠化成果及分析,年份;申請件數;屋頂綠化_平方公尺;太陽光電_峰瓦;自行車停車位_輛;自行車淋浴空間_平方公尺;雨水貯集;節能燈具_瓦數,高雄市政府工務局
路竹區公所資料盤點表,87706,高雄市路竹區公所資料盤點表,序號;管理單位;業務或資料集名稱;使用對象;資料分類;現況;開放程度;備註,高雄市路竹區公所
違章建築拆除結案作業原則,87707,違章建築拆除結案作業原則,辦法;法條;內容;條文內容,高雄市政府工務局
市政FAQ,87708,提供市政FAQ-問題集,SerialNo;CaseContent;OrganName;ViewCount;OrganNo;SeqNo<br>;kind;kind_name<br>,高雄市政府研究發展考核委員會
高雄市製冰冷藏及凍結概況,87711,高雄市製冰冷藏及凍結概況,鄉鎮市區別;營業類別;營業廠數;日產製冰能力;全年製冰數量;漁業用製冰能力;非漁業用製冰能力;製冰能力馬力數;冷藏室容積;冷藏能力;水產物冷藏數量;非水產物冷藏數量;冷藏馬力數;凍結室容積;凍結能力;水產物凍結;非水產物凍結;凍結馬力數,高雄市政府海洋局
愛河水域收費標準,87713,提供愛河水域收費標準,類別;項目;子目;金額;優惠規定,高雄市政府交通局
計程車費率比較表,87714,提供計程車費率比較表,城市;制定日期;起跳;續跳;延滯計時;夜間加成;多元化運價公告日;多元化運價;春節加價;106年春節加價;共同營業區;備註;計價方式;高雄市;臺北市;臺中市;桃園市,高雄市政府交通局
高雄市政府中程施政計畫目標體系,87716,提供高雄市政府中程施政計畫,目標大類;目標細項,高雄市政府研究發展考核委員會
高雄市大社區因應各項災害避難收容處所一覽表,87717,大社區因應各項災害，如水災、地震等災害，查調本區各里可避難收容場所(截至105年12月9日止)、收容人數等,,高雄市大社區公所
高雄市指定藥癮戒治機構及替代治療機構及非鴉片類藥癮治療補助機構,87718,"機構名稱,科別,聯繫電話",機構名稱;科別;聯繫電話;分機;服務內容,高雄市政府衛生局
高雄紅橘線捷運車站地址,88233,高雄紅橘線捷運車站地址,車站編號;車站中文名稱;車站英文名稱;地址,高雄市政府捷運工程局
婚姻狀況統計,88297,婚姻狀況統計,married;lostCompanion;yReport;notMarried;total;divorsed;districtName;type,高雄市政府民政局
高雄市公費流感抗病毒藥劑合約醫療院所,93806,提供高雄市公費流感抗病毒藥劑合約醫療院所資料,十碼章;醫院名稱;行政區;地址;聯絡電話;座標緯度;座標經度,高雄市政府衛生局
高雄市107年不動產買賣實價登錄資料下載,93807,提供高雄市107年各季實價登錄買賣成交案件資訊,申報種類;交易標的種類;土地數量;建物數量;車位數量;幾房;幾廳;幾衛;有無隔間;建物型態;房地總價;土地總價;建物總價;車位總價;有無管理組織;交易日期;備註欄;行政區代碼;代表段號;土地移轉面積;代表地號都市土地使用分區;代表地號非都市土地使用分區;代表地號非都市土地使用地;建物移轉面積;代表建號主要用途;代表建號主要建材;代表建號總層數;代表建號建築完成日期;代表建號屋齡;代表建號層次;車位總價格;車位總持分面積;地建號範圍;行政區;地段,高雄市政府地政局
107年高雄1999派工資料,93808,107年高雄1999派工資料 FileNo(案號)、Status(管制狀況代碼)、Cre_Date(反映日期)、ReplyUnit(權責單位代碼)、Zipcode(郵政區號)、ZipName(行政區域)、Address(維修地點)、UnitName(權責單位)、StatusName(管制狀況)、InformDesc(通報事項)、BeforeDesc(反映內容)、AfterDesc(處理結果)、Memo(備註)、Save_Date(通報日期)、Close_Date(結案日期)、Latitude(緯度)、Longitude(經度),FileNo;Status;Cre_Date;ReplyUnit;Zipcode;ZipName;Address;UnitName;StatusName;InformDesc;BeforeDesc;AfterDesc;Memo;Save_Date;Close_Date;Latitude;Longitude;memo,高雄市政府研究發展考核委員會
工務局工程範圍圖,93809,工務局工程基本資料與工程位置範圍圖,流水碼;標案名稱;執行機關;開工日期;預定完工日期;決標金額_千;工程位置,高雄市政府工務局
高雄市106年不動產買賣實價登錄資料下載,93816,提供高雄市106年各季實價登錄買賣成交案件資訊,申報種類;交易標的種類;土地數量;建物數量;車位數量;幾房;幾廳;幾衛;有無隔間;建物型態;房地總價;土地總價;建物總價;車位總價;有無管理組織;交易日期;備註欄;行政區代碼;代表段號;土地移轉面積;代表地號都市土地使用分區;代表地號非都市土地使用分區;代表地號非都市土地使用地;建物移轉面積;代表建號主要用途;代表建號主要建材;代表建號總層數;代表建號建築完成日期;代表建號屋齡;代表建號層次;車位總價格;車位總持分面積;地建號範圍;行政區;地段,高雄市政府地政局
高雄市土地徵收統計表,93831,高雄市土地徵收統計表,行政區別及事業別;合計筆數;合計公頃;國防事業;交通事業;公用事業;水利事業;公共衛生及環境保護事業;政府機關地方自治機關及其他公共建築;教育學術及文化事業;社會福利事業;國營事業;其他;合計新台幣元;地價補償;改良物補償;土地改良費;營業損失補償;遷移費,高雄市政府地政局
高雄市徵收工程,93832,高雄市徵收工程,用地機關;工程名稱;行政區別;公告期間;發價日期;事業別;事業別<br>,高雄市政府地政局
108年高雄市公告土地現值,98086,108年高雄市公告土地現值,行政區;地段;地號;公告土地現值,高雄市政府地政局
高雄市寺廟基本資料,98087,編號、寺廟名稱、主祀神佛像、場所縣市、場所區域、場所地址、組織型態、聯絡電話、負責人、宗教別、建別、新登記證字號正式登記、新登記證字號補辦登記,編號;寺廟名稱;主祀神佛像;場所縣市;場所區域;場所地址;組織型態;聯絡電話;負責人;宗教別;建別;新登記證字號正式登記;新登記證字號補辦登記,高雄市政府民政局
高雄市財團法人教會堂基本資料,98088,編號、財團法人名稱、場所縣市、場所區域、場所地址、聯絡電話、負責人、宗教別、法院設立日期,編號;財團法人名稱;場所縣市;場所區域;場所地址;聯絡電話;負責人;宗教別;法院設立日期,高雄市政府民政局
高雄市財團法人基金會基本資料,98089,編號、財團法人名稱、場所縣市、場所區域、場所地址、聯絡電話、負責人、宗教別、法院設立日期,編號;財團法人名稱;場所縣市;場所區域;場所地址;聯絡電話;負責人;宗教別;法院設立日期,高雄市政府民政局
107年高雄市納骨塔神主牌使用情形,98090,所在區、納骨塔名稱、可使用神主牌、已使用神主牌、未使用神主牌,所在區;納骨塔名稱;可使用神主牌;已使用神主牌;未使用神主牌,高雄市政府民政局
107年高雄市納骨塔櫃位使用情形,98091,所在區、納骨塔名稱、可使用櫃位、已使用櫃位、未使用櫃位,所在區;納骨塔名稱;可使用櫃位;已使用櫃位;未使用櫃位,高雄市政府民政局
107年高雄市樹葬使用情形,98092,所在區、名稱、面積(公頃)、可容納數量(位)、尚未使用數量(位),所在區;名稱;面積;可容納數量;尚未使用數量,高雄市政府民政局
107年高雄市海葬使用情形,98093,年度、申請件數,年度;申請件數,高雄市政府民政局
107年高雄市兵役處補助私人團體經費報告,98094,補助對象、補助事項、、累計撥付金額,補助對象;補助事項;累計撥付金額,高雄市政府民政局
高雄市戶政事務所聯絡資訊,98100,高雄市戶政事務所聯絡資訊，包含名稱、電話、地址、網址等資料,縣市;行政區;名稱;電話;地址;網址,高雄市政府民政局
高雄市107年固定式違規照相設備設置地點,98101,提供高雄市固定式違規闖紅燈及測速照相設備設置地點,編號;型式;測照地點;測照方向;行政區;測照型式;座標緯度;座標經度,高雄市政府警察局
高雄市垃圾清運路線及時間,98147,提供垃圾清運路線及時間,責任區;車次;回收日;停留時間;停留地點;行政區;村里;經度;緯度,高雄市政府環境保護局
108年高雄市不動產抵押權設定統計,98949,108年高雄市不動產抵押權設定統計 區名、件數、土地筆數、土地面積(平方公尺)、建物棟數、建物面積(平方公尺),區名;件數;土地筆數;土地面積;建物棟數;建物面積,高雄市政府地政局
108年高雄市不動產拍賣統計,98950,108年高雄市不動產拍賣統計,行政區;件數;土地筆數;土地面積;建物棟數;建物面積;區名,高雄市政府地政局
108年高雄市不動產買賣統計,98951,108年高雄市不動產買賣統計 行政區、件數、土地筆數、土地面積(平方公尺)、建物棟數、建物面積(平方公尺),區名;件數;土地筆數;土地面積;建物棟數;建物面積;行政區,高雄市政府地政局
108年高雄市建物第一次登記統計,98952,108年高雄市建物第一次登記統計,行政區;棟數;面積;區名,高雄市政府地政局
高雄市一般生育率,99166,一般生育率,年別;女;男,高雄市政府主計處
107年公告違反勞基法名單,99167,107年公告違反勞基法名單,公告日期;公司名稱;負責人;統編;違反法規條款;違反法規內容;處分字號;處分日期;處分金額;備註,高雄市政府勞工局
108年高雄市地政士開業資料,99516,提供高雄市合法之地政士資料,事務所名稱;事務所地址;電話;行動電話,高雄市政府地政局
108年高雄市完成設立備查之不動產經紀業,99517,每月統計高雄市完成設立備查之不動產經紀業者,經紀業名稱;地址;仲介;代銷;加盟經營加盟公司名稱;加盟經營，加盟公司名稱;加盟經營加盟公司名稱<br>;加盟經營加盟公司名稱,高雄市政府地政局
高雄市105年不動產買賣實價登錄資料下載,99751,提供高雄市105年各季實價登錄買賣成交案件資訊,申報種類;交易標的種類;土地數量;建物數量;車位數量;幾房;幾廳;幾衛;有無隔間;建物型態;房地總價;土地總價;建物總價;車位總價;有無管理組織;交易日期;備註欄;行政區代碼;代表段號;土地移轉面積;代表地號都市土地使用分區;代表地號非都市土地使用分區;代表地號非都市土地使用地;建物移轉面積;代表建號主要用途;代表建號主要建材;代表建號總層數;代表建號建築完成日期;代表建號屋齡;代表建號層次;車位總價格;車位總持分面積;地建號範圍;行政區;地段,高雄市政府地政局
高雄市104年不動產買賣實價登錄資料下載,99752,提供高雄市104年各季實價登錄買賣成交案件資訊,申報種類;交易標的種類;土地數量;建物數量;車位數量;幾房;幾廳;幾衛;有無隔間;建物型態;房地總價;土地總價;建物總價;車位總價;有無管理組織;交易日期;備註欄;行政區代碼;代表段號;土地移轉面積;代表地號都市土地使用分區;代表地號非都市土地使用分區;代表地號非都市土地使用地;建物移轉面積;代表建號主要用途;代表建號主要建材;代表建號總層數;代表建號建築完成日期;代表建號屋齡;代表建號層次;車位總價格;車位總持分面積;地建號範圍;行政區;地段,高雄市政府地政局
高雄市103年不動產買賣實價登錄資料下載,99753,提供高雄市103年各季實價登錄買賣成交案件資訊,申報種類;交易標的種類;土地數量;建物數量;車位數量;幾房;幾廳;幾衛;有無隔間;建物型態;房地總價;土地總價;建物總價;車位總價;有無管理組織;交易日期;備註欄;行政區代碼;代表段號;土地移轉面積;代表地號都市土地使用分區;代表地號非都市土地使用分區;代表地號非都市土地使用地;建物移轉面積;代表建號主要用途;代表建號主要建材;代表建號總層數;代表建號建築完成日期;代表建號屋齡;代表建號層次;車位總價格;車位總持分面積;地建號範圍;行政區;地段,高雄市政府地政局
高雄市102年不動產買賣實價登錄資料下載,99754,提供高雄市102年各季實價登錄買賣成交案件資訊,申報種類;交易標的種類;土地數量;建物數量;車位數量;幾房;幾廳;幾衛;有無隔間;建物型態;房地總價;土地總價;建物總價;車位總價;有無管理組織;交易日期;備註欄;行政區代碼;代表段號;土地移轉面積;代表地號都市土地使用分區;代表地號非都市土地使用分區;代表地號非都市土地使用地;建物移轉面積;代表建號主要用途;代表建號主要建材;代表建號總層數;代表建號建築完成日期;代表建號屋齡;代表建號層次;車位總價格;車位總持分面積;地建號範圍;行政區;地段,高雄市政府地政局
高雄市101年8月至12月不動產買賣實價登錄資料下載,99755,提供高雄市101年8月至12月實價登錄買賣成交案件資訊,申報種類;交易標的種類;土地數量;建物數量;車位數量;幾房;幾廳;幾衛;有無隔間;建物型態;房地總價;土地總價;建物總價;車位總價;有無管理組織;交易日期;備註欄;行政區代碼;代表段號;土地移轉面積;代表地號都市土地使用分區;代表地號非都市土地使用分區;代表地號非都市土地使用地;建物移轉面積;代表建號主要用途;代表建號主要建材;代表建號總層數;代表建號建築完成日期;代表建號屋齡;代表建號層次;車位總價格;車位總持分面積;地建號範圍;行政區;地段,高雄市政府地政局
高雄市動物保護處動物收容情形看板,100405,提供高雄市動物保護處公立收容處所動物收容情形看板,流水號;收容編號;入所日期;動物類別;品種;性別;入所原因;動物來源行政區;體型;年齡;毛色;是否開放認領養;收容所,高雄市政府農業局
高雄市鹽埕區107年公告地價,100584,高雄市鹽埕區107年公告地價,行政區;地段;地號;公告地價,高雄市政府地政局
高雄市三民區107年公告地價,100585,高雄市三民區107年公告地價,KK46N;KK48N;AA49;AA17,高雄市政府地政局
高雄市楠梓區107年公告地價,100586,高雄市楠梓區107年公告地價,KK46N;KK48N;AA49;AA17,高雄市政府地政局
高雄市左營區107年公告地價,100587,高雄市左營區107年公告地價,KK46N;KK48N;AA49;AA17,高雄市政府地政局
高雄市那瑪夏區108年公告土地現值,100588,高雄市那瑪夏區108年公告土地現值,行政區;地段;地號;公告土地現值,高雄市政府地政局
高雄市桃源區108年公告土地現值,100589,高雄市桃源區108年公告土地現值,行政區;地段;地號;公告土地現值,高雄市政府地政局
高雄市茂林區108年公告土地現值,100590,高雄市茂林區108年公告土地現值,行政區;地段;地號;公告土地現值,高雄市政府地政局
高雄市內門區108年公告土地現值,100591,高雄市內門區108年公告土地現值,行政區;地段;地號;公告土地現值,高雄市政府地政局
高雄市杉林區108年公告土地現值,100592,高雄市杉林區108年公告土地現值,行政區;地段;地號;公告土地現值,高雄市政府地政局
高雄市甲仙區108年公告土地現值,100593,高雄市甲仙區108年公告土地現值,行政區;地段;地號;公告土地現值,高雄市政府地政局
高雄市六龜區108年公告土地現值,100594,高雄市六龜區108年公告土地現值,行政區;地段;地號;公告土地現值,高雄市政府地政局
高雄市美濃區108年公告土地現值,100595,高雄市美濃區108年公告土地現值,行政區;地段;地號;公告土地現值,高雄市政府地政局
高雄市旗山區108年公告土地現值,100596,高雄市旗山區108年公告土地現值,行政區;地段;地號;公告土地現值,高雄市政府地政局
高雄市梓官區108年公告土地現值,100597,高雄市梓官區108年公告土地現值,行政區;地段;地號;公告土地現值,高雄市政府地政局
高雄市彌陀區108年公告土地現值,100598,高雄市彌陀區108年公告土地現值,行政區;地段;地號;公告土地現值,高雄市政府地政局
高雄市永安區108年公告土地現值,100599,高雄市永安區108年公告土地現值,行政區;地段;地號;公告土地現值,高雄市政府地政局
