資料集名稱,資料集識別碼,資料集描述,主要欄位說明,提供機關
科技部語言學門專題計畫補助清冊,40521,科技部語言學門專題計畫補助清冊,(核定)年度;學門(3碼);學門;計畫名稱;執行機關;執行期限(起);執行期限(迄),科技部
科技部歷史學門專題計畫補助清冊,40522,科技部歷史學門專題計畫補助清冊,執行年度;學門;機關名稱;計畫中文名稱;執行期限(起);執行期限(迄),科技部
科技部哲學學門專題計畫補助清冊,40523,科技部哲學學門專題計畫補助清冊,執行年度;學門;機關名稱;計畫中文名稱;執行期限(起);執行期限(迄),科技部
科技部藝術學門專題計畫補助清冊,40524,科技部藝術學門專題計畫補助清冊,執行年度;學門;機關名稱;計畫中文名稱;執行期限(起);執行期限(迄),科技部
科技部人類及族群研究學門專題計畫補助清冊,40525,科技部人類及族群研究學門專題計畫補助清冊,執行年度;學門;機關名稱;計畫中文名稱;執行期限(起);執行期限(迄),科技部
科技部社會學門(含傳播)專題計畫補助清冊,40526,科技部社會學門(含傳播)專題計畫補助清冊,執行年度;學門;機關名稱;計畫中文名稱;執行期限(起);執行期限(迄),科技部
科技部教育學門(含體育、圖資)專題計畫補助清冊,40527,科技部教育學門(含體育、圖資)專題計畫補助清冊,執行年度;學門;機關名稱;計畫中文名稱;執行期限(起);執行期限(迄),科技部
科技部心理學門專題計畫補助清冊,40528,科技部心理學門專題計畫補助清冊,執行年度;學門;機關名稱;計畫中文名稱;執行期限(起);執行期限(迄),科技部
科技部法律學門專題計畫補助清冊,40529,科技部法律學門專題計畫補助清冊,執行年度;學門;機關名稱;計畫中文名稱;執行期限(起);執行期限(迄),科技部
科技部政治學門專題計畫補助清冊,40530,科技部政治學門專題計畫補助清冊,執行年度;學門;機關名稱;計畫中文名稱;執行期限(起);執行期限(迄),科技部
科技部經濟學門專題計畫補助清冊,40531,科技部經濟學門專題計畫補助清冊,執行年度;學門;機關名稱;計畫中文名稱;執行期限(起);執行期限(迄),科技部
科技部財金及會計學門專題計畫補助清冊,40532,科技部財金及會計學門專題計畫補助清冊,執行年度;學門;機關名稱;計畫中文名稱;執行期限(起);執行期限(迄),科技部
科技部管理一學門專題計畫補助清冊,40533,科技部管理一學門專題計畫補助清冊,執行年度;學門;機關名稱;計畫中文名稱;執行期限(起);執行期限(迄),科技部
科技部管理二學門專題計畫補助清冊,40534,科技部管理二學門專題計畫補助清冊,執行年度;學門;機關名稱;計畫中文名稱;執行期限(起);執行期限(迄),科技部
科技部區域研究學門專題計畫補助清冊,40535,科技部區域研究學門專題計畫補助清冊,執行年度;學門;機關名稱;計畫中文名稱;執行期限(起);執行期限(迄),科技部
科技部科學園區用水量,40600,科技部科學園區用水量,,科技部
科技部科學園區污水處理量,40601,科技部科學園區污水處理量,,科技部
中部科學園區管理局簡訊,40602,中部科學園區管理局月刊雜誌,,科技部中部科學園區管理局
中部科學園區管理局人才培訓課程,40605,人才培訓相關課程資料表,課程類別;課程代碼;課程名稱;報名開放日期;報名截止日期;上課日期(起);上課日期(迄);上課時段;上課地點,科技部中部科學園區管理局
中部科學園區管理局優良廠商創新產品獎得獎資料,40606,為鼓勵園區廠商從事創新研究、開發新產品，以提升技術水準，強化產業競爭力，中科每年辦理優良廠商創新產品獎選拔乙次,年度;廠商名稱;得獎產品;產品說明,科技部中部科學園區管理局
中部科學園區管理局高科技設備前瞻技術補助對象資料,40607,高科技設備前瞻技術補助對象資料表,高科技設備前瞻技術發展計畫第二期計畫補助實施要點,科技部中部科學園區管理局
中部科學園區管理局參訪統計表(年度),40608,中部科學園區管理局內參訪統計資料,,科技部中部科學園區管理局
中部科學園區管理局輿情回應統計,40609,輿情回應統計,,科技部中部科學園區管理局
中部科學園區管理局園區巡迴巴士,40610,園區各線巡迴巴士班表,,科技部中部科學園區管理局
中部科學園區管理局土地規劃情形表,40611,各園區土地總面積資料,,科技部中部科學園區管理局
中部科學園區管理局工安環保月-各項球賽得獎名單,40613,工安環保月各項球賽得獎名單,活動日期;活動項目;比賽項目;得獎,科技部中部科學園區管理局
中部科學園區管理局性別與外籍員工統計,40614,從業員工數 亦即就業人數，包括園區事業、核准入區工商服務業、事業主管機關分支單位、育成中心、研究機構等之員工數，不包括營造廠或承攬商所僱用之員工數,,科技部中部科學園區管理局
中部科學園區管理局從業員工產業別統計,40615,從業員工產業別統計,,科技部中部科學園區管理局
中部科學園區管理局會議室租借資訊,40616,場地借用出租資訊明細表,會議室名稱;會議類別;會議日期;起迄時間;申請單位;會議內容,科技部中部科學園區管理局
中部科學園區管理局各園區聯絡資訊,40617,提供各組室相關聯繫資料,,科技部中部科學園區管理局
中部科學園區管理局公開採購計畫資料集,40618,公開採購計畫資料,,科技部中部科學園區管理局
中部科學園區管理局產業營業額成長情形比較表,40620,營業額:園區廠商之銷售淨額（產業分類、本月小計、本年累計、去年同期累計、同期成長率）,產業分類;本月小計;本年累計;去年同期累計;較去年同期累計成長率,科技部中部科學園區管理局
中部科學園區管理局出版品清單,40622,中部科學園區管理局出版品清單,發行日;發行期數;標題;連結項目,科技部中部科學園區管理局
中部科學園區管理局辦理國家賠償事件處理情形統計表,40623,中部科學園區國家賠償事件處理情資料,,科技部中部科學園區管理局
南部科學園區管理局來賓統計資料,40646,統計國內外學校(高中職以上)、企業界、政府單位、民意機構至南科參訪之來賓人數,,科技部南部科學園區管理局
南部科學園區管理局廠商資料,40647,南部科學園區管理局廠商資料,,科技部南部科學園區管理局
南部科學園區管理局每月新核准投資廠商,40649,南部科學園區管理局每月新核准投資廠商,引進年度、月份;廠商名稱;產業別;園區;投資額(億元);產品名稱,科技部南部科學園區管理局
南部科學園區管理局職業災害統計表,40650,南部科學園區管理局職業災害統計表,,科技部南部科學園區管理局
南部科學園區管理局南科盃敦親睦鄰球賽之各項球賽得獎名單,40651,南部科學園區管理局南科盃敦親睦鄰球賽之各項球賽得獎名單,,科技部南部科學園區管理局
南部科學園區管理局園區電影活動統計資料,40652,南部科學園區管理局園區電影活動統計資料,,科技部南部科學園區管理局
南部科學園區管理局太陽光電發電設備統計資料,41031,南部科學園區管理局太陽光電發電設備統計資料,年份;累積總設置量(kw);累積估計發電量(萬度/年);備註,科技部南部科學園區管理局
南部科學園區管理局申報管理費廠商家數,41033,南部科學園區管理局申報管理費廠商家數,,科技部南部科學園區管理局
南部科學園區管理局進出口情形,41034,南部科學園區管理局進出口情形,,科技部南部科學園區管理局
南部科學園區管理局採購案件統計資料,41035,提供本局每年採購案件總數、採購案件總金額，包括工程、勞務及財物採購,機關名稱;標案案號;標案名稱;決標方式;採購金額;預算金額;標的分類;招標方式;採購金額級距;得標廠商;決標日期;決標公告日期;底價金額;總決標金額;標比(％),科技部南部科學園區管理局
南部科學園區管理局工程採購案件,41036,提供南部科學園區管理局工程採購案件資料,,科技部南部科學園區管理局
南部科學園區管理局滿意度調查報告,41037,南部科學園區管理局滿意度調查報告,類別;年;項目;分數,科技部南部科學園區管理局
南部科學園區管理局創業工坊創業團隊進駐情形統計表,41038,南部科學園區管理局創業工坊創業團隊進駐情形統計表,年;月;說明;合計團隊數;創新創業激勵計畫;自行引進;備註,科技部南部科學園區管理局
科技部單位預算半年結算報告,41101,歲入來源別結算表、歲出機關別結算表,,科技部
科技部化學工程學門專題計畫補助清冊,41103,科技部化學工程學門專題計畫補助清冊,年度;學門;計畫中文名稱;機關名稱;執行期限(起);執行期限(迄),科技部
科技部材料學門專題計畫補助清冊,41104,科技部材料學門專題計畫補助清冊,年度;學門;計畫中文名稱;機關名稱;執行期限(起);執行期限(迄),科技部
科技部高分子學門專題計畫補助清冊,41105,科技部高分子學門專題計畫補助清冊,年度;學門;計畫中文名稱;機關名稱;執行期限(起);執行期限(迄),科技部
科技部土木工程學門專題計畫補助清冊,41106,科技部土木工程學門專題計畫補助清冊,年度;學門;計畫中文名稱;機關名稱;執行期限(起);執行期限(迄),科技部
科技部環境工程學門專題計畫補助清冊,41107,科技部環境工程學門專題計畫補助清冊,年度;學門;計畫中文名稱;機關名稱;執行期限(起);執行期限(迄),科技部
科技部醫學工程學門專題計畫補助清冊,41108,科技部醫學工程學門專題計畫補助清冊,年度;學門;計畫中文名稱;機關名稱;執行期限(起);執行期限(迄),科技部
科技部微電子學門專題計畫補助清冊,41109,科技部微電子學門專題計畫補助清冊,年度;學門;計畫中文名稱;機關名稱;執行期限(起);執行期限(迄),科技部
科技部資訊工程學門專題計畫補助清冊,41110,科技部資訊工程學門專題計畫補助清冊,年度;學門;計畫中文名稱;機關名稱;執行期限(起);執行期限(迄),科技部
科技部智慧計算學門專題計畫補助清冊,41111,科技部智慧計算學門專題計畫補助清冊,年度;學門;計畫中文名稱;機關名稱;執行期限(起);執行期限(迄),科技部
科技部電信工程學門專題計畫補助清冊,41112,科技部電信工程學門專題計畫補助清冊,年度;學門;計畫中文名稱;機關名稱;執行期限(起);執行期限(迄),科技部
科技部光電工程學門專題計畫補助清冊,41113,科技部光電工程學門專題計畫補助清冊,年度;學門;計畫中文名稱;機關名稱;執行期限(起);執行期限(迄),科技部
科技部機械固力學門專題計畫補助清冊,41114,科技部機械固力學門專題計畫補助清冊,年度;學門;計畫中文名稱;機關名稱;執行期限(起);執行期限(迄),科技部
科技部能源學門專題計畫補助清冊,41115,科技部能源學門專題計畫補助清冊,年度;學門;計畫中文名稱;機關名稱;執行期限(起);執行期限(迄),科技部
科技部熱流航太學門專題計畫補助清冊,41116,科技部熱流航太學門專題計畫補助清冊,年度;學門;計畫中文名稱;機關名稱;執行期限(起);執行期限(迄),科技部
科技部自動化學門專題計畫補助清冊,41117,科技部自動化學門專題計畫補助清冊,年度;學門;計畫中文名稱;機關名稱;執行期限(起);執行期限(迄),科技部
科技部控制工程學門專題計畫補助清冊,41118,科技部控制工程學門專題計畫補助清冊,年度;學門;計畫中文名稱;機關名稱;執行期限(起);執行期限(迄),科技部
科技部工業工程學門專題計畫補助清冊,41119,科技部工業工程學門專題計畫補助清冊,年度;核定年度;計畫中文名稱;機關名稱;執行期限(起);執行期限(迄),科技部
科技部電力工程學門專題計畫補助清冊,41120,科技部電力工程學門專題計畫補助清冊,年度;學門;計畫中文名稱;機關名稱;執行期限(起);執行期限(迄),科技部
科技部海工造船學門專題計畫補助清冊,41121,科技部海工造船學門專題計畫補助清冊,年度;學門;計畫中文名稱;機關名稱;執行期限(起);執行期限(迄),科技部
科技部103年度農產資源科學學門專題計畫補助清冊,41151,科技部103年度農產資源科學學門專題計畫補助清冊,年度;學門;計畫名稱;執行機關;執行期限(起);執行期限(訖),科技部
科技部103年度生物科學學門專題計畫補助清冊,41152,科技部103年度生物科學學門專題計畫補助清冊,,科技部
科技部103年度農業環境科學學門專題計畫補助清冊,41153,科技部103年度農業環境科學學門專題計畫補助清冊,年度;學門;計畫名稱;執行機關;執行期限(起);執行期限(訖),科技部
科技部103年度生物多樣性及長期生態學學門專題計畫補助清冊,41154,科技部103年度生物多樣性及長期生態學學門專題計畫補助清冊,"年度,學門,計畫名稱,執行機關,執行期限(起),執行期限 (訖),計畫類別 - 計畫別",科技部
科技部103年度藥學及中醫藥學學門專題計畫補助清冊,41155,科技部103年度藥學及中醫藥學學門專題計畫補助清冊,,科技部
科技部103年度形態及生理醫學學門專題計畫補助清冊,41157,科技部103年度形態及生理醫學學門專題計畫補助清冊,,科技部
科技部103年度生化及藥理醫學學門專題計畫補助清冊,41158,科技部103年度生化及藥理醫學學門專題計畫補助清冊,,科技部
科技部103年度內科系醫學(一)學門專題計畫補助清冊,41159,科技部103年度內科系醫學(一)學門專題計畫補助清冊,年度;學門;計畫名稱;執行機關;執行期限(起);執行期限(訖),科技部
科技部103年度內科系醫學(二)學門專題計畫補助清冊,41160,科技部103年度內科系醫學(二)學門專題計畫補助清冊,年度;學門;計畫名稱;執行機關;執行期限(起);執行期限(訖),科技部
科技部103年度社會醫學學門專題計畫補助清冊,41161,科技部103年度社會醫學學門專題計畫補助清冊,103;保健營養;DPP4、GLP-1受體及胰島素阻抗於洛神多酚改善糖尿病腎病變系統中所扮演之機制與角色探討;弘光科技大學護理系（所）;20140801;20150731,科技部
科技部103年度工程醫學學門專題計畫補助清冊,41162,科技部103年度工程醫學學門專題計畫補助清冊,年度;學門;計畫名稱;執行機關;執行期限(起);執行期限(訖),科技部
科技部103年度外科系醫學(一)學門專題計畫補助清冊,41193,科技部103年度外科系醫學(一)學門專題計畫補助清冊,年度;學門;計畫名稱;執行機關;執行期限(起);執行期限(訖),科技部
科技部103年度外科系醫學(二)學門專題計畫補助清冊,41194,科技部103年度外科系醫學(二)學門專題計畫補助清冊,,科技部
中部科學園區管理局新投資案核准情形,41195,中部科學園區管理局新投資案核准情形資料,,科技部中部科學園區管理局
中部科學園區管理局核准入區廠商一覽,41197,中部科學園區管理局核准入區廠商一覽表資料,,科技部中部科學園區管理局
中部科學園區管理局園區事業(年)投資引進家數(不含撤銷),41198,中部科學園區管理局園區事業(年)投資引進家數(不含撤銷)資料,中部科學工業園區管理局園區事業104年度投資引進家數(不含撤銷);,科技部中部科學園區管理局
中部科學園區管理局園區事業(年)投資引進家數(不含撤銷)(以基地區分),41199,中部科學園區管理局園區事業(年)投資引進家數(不含撤銷)(以基地區分)資料,,科技部中部科學園區管理局
中部科學園區管理局開發經費統計,41200,開發經費統計表,,科技部中部科學園區管理局
中部科學園區管理局公車交通路線圖及時刻表,41201,公車交通路線圖及時刻表,,科技部中部科學園區管理局
中部科學園區管理局緊急應變小組任務編組資訊,41202,緊急應變小組任務編組資訊,,科技部中部科學園區管理局
中部科學園區管理局巡迴巴士公告資訊,41203,園區交通巴士站公告資訊,,科技部中部科學園區管理局
中部科學園區管理局自行車道清單資訊,41204,自行車道清單資訊,,科技部中部科學園區管理局
中部科學園區管理局公共藝術裝置清單,41205,公共藝術裝置清單,,科技部中部科學園區管理局
中部科學園區管理局停車場資訊,41206,停車場資訊,,科技部中部科學園區管理局
中部科學園區管理局官等及性別統計表,41207,官等及性別統計表,,科技部中部科學園區管理局
中部科學園區管理局模範勞工清單,41208,區模範勞工清單,,科技部中部科學園區管理局
中部科學園區管理局工程承包商(用電)聯絡資訊,41209,工程承包商(用電)聯絡資訊,,科技部中部科學園區管理局
中部科學園區管理局轄內公共場地借用收費標準表,41210,公共場地借用收費標準表,,科技部中部科學園區管理局
中部科學園區管理局標準廠房進駐使用清單,41211,標準廠房進駐使用出租率,,科技部中部科學園區管理局
中部科學園區管理局標準廠房待租賃資訊,41212,標準廠房待租賃資訊,,科技部中部科學園區管理局
中部科學園區管理局用電統計,41213,用電統計,,科技部中部科學園區管理局
中部科學園區管理局用水統計,41214,用水統計,,科技部中部科學園區管理局
中部科學園區管理局工商服務業廠商資訊,41215,工商服務業廠商資訊,,科技部中部科學園區管理局
中部科學園區管理局宿舍使用統計資訊,41217,宿舍使用統計出租率計算表,,科技部中部科學園區管理局
中部科學園區管理局宿舍待租賃資訊,41218,宿舍待租賃收費一覽表,,科技部中部科學園區管理局
中部科學園區管理局高科技設備前瞻技術發展計畫,41219,高科技設備前瞻技術發展計畫,,科技部中部科學園區管理局
科技部大專學生研究創作獎獲獎人員名單資料集,41221,條列歷年大專學生研究創作獎獲獎人員名單,獲獎年度;計畫編號;學生姓名;就讀學校;年級;計畫名稱;指導教授;申請機關,科技部
中部科學園區管理局滯洪池清單資訊,41224,中部科學園區滯洪池清單資訊,,科技部中部科學園區管理局
南部科學園區管理局標準廠房待租賃資訊,41225,南部科學園區管理局標準廠房待租賃資訊,類別說明;總供給數;待出租數量,科技部南部科學園區管理局
南部科學園區管理局宿舍使用統計資訊,41228,宿舍使用統計資訊,類別說明;總供給數;已出租數,科技部南部科學園區管理局
南部科學園區管理局宿舍待租賃資訊,41230,宿舍待租賃資訊,類別說明;總供給數;待出租數量,科技部南部科學園區管理局
南部科學園區管理局台南園區免費巡迴巴士種類,41231,南部科學園區管理局台南園區免費巡迴巴士種類,園區巡迴巴士基本資料統計表;,科技部南部科學園區管理局
南部科學園區管理局廉政倫理事件登錄案件,41232,廉政倫理事件登錄統計表,期間;事由;案件數;百分比,科技部南部科學園區管理局
科技部103年度微免及檢驗醫學學門專題計畫補助清冊,41238,科技部103年度微免及檢驗醫學學門專題計畫補助清冊,年度;學門;計畫名稱;執行機關;執行期限(起);執行期限(訖),科技部
新竹科學園區管理局研發精進產學合作計畫核定補助清單,41239,補助單位（含申請機構、學校機構）,,科技部新竹科學園區管理局
新竹科學園區管理局園區簡訊,41240,簡訊期數、簡訊內容,發佈日期;標題;內容,科技部新竹科學園區管理局
新竹科學園區管理局有效核准廠商清單,41241,年月、核准日期、基地別、廠商名稱、產品項目,廠商代碼;基地別;園區廠商名稱;地址;統一編號;事業類別,科技部新竹科學園區管理局
新竹科學園區管理局服務業廠商資訊,41243,廠商名稱、廠商聯絡電話、廠商聯絡人、廠商地址、統一編號,廠商名稱;廠商聯絡電話;廠商聯絡人;中文廠商地址;統一編號,科技部新竹科學園區管理局
新竹科學園區管理局表單管理,41244,標題、分類、表單內容、公告日期,,科技部新竹科學園區管理局
新竹科學園區管理局常見問答,41245,FAQ標題、FAQ內容,主分類;業務名稱;問題;答覆,科技部新竹科學園區管理局
新竹科學園區管理局合約資訊,41246,合約代碼、合約名稱、合約起迄日、合約類別、合約金額,合約代碼;合約名稱;合約標的名稱;合約起日;合約迄日;合約類別;合約金額;廠商名稱,科技部新竹科學園區管理局
新竹科學園區管理局用水用電資訊,41247,廠商、用水資訊、用電資訊,,科技部新竹科學園區管理局
新竹科學園區管理局維修資訊,41248,維修日期、維修地點、維修項目、結案日期,案號;受理日期;建物名稱;項目名稱;維修內容;維修完成日期,科技部新竹科學園區管理局
新竹科學園區管理局_竹南園區行政中心場地資訊,41249,會議室名稱(場地別)、容納人數、場地維護費(元/場次)、彩排、佈置場地維護費(元/場次)、開放時間,場地名稱;時段;租金;場地說明,科技部新竹科學園區管理局
新竹科學園區管理局_竹南園區行政中心已預約場地資訊,41250,會議室名稱、預約廠商、預約時間、預約場地、場地備註,日期;場地名稱;時段;租用公司;備註說明,科技部新竹科學園區管理局
新竹科學園區管理局工安演講及活動資料,41251,活動名稱、活動日期、報名日期,年度;活動名稱;活動日期,科技部新竹科學園區管理局
科技部科技大觀園新知專欄,41257,新知報運用文字、圖片、動畫或影音等多媒體素材，將複雜艱澀的科技資訊轉化為高中程度以上之社會大眾容易理解的科普知識，以促進民眾理解科學。,標題;摘要;連結網址;作者;服務機構;發佈時間,科技部
科技部延攬科技人才名單,41258,學術補助獎勵延攬科技人才,,科技部
科技部補助舉辦國際學術研討會通過名單,41260,大學或學術研究機構在國內舉辦國際學術研討會申請科技部補助部分經費,資料集名稱;下載連結,科技部
南部科學園區管理局廢棄物量能統計,41261,南部科學園區管理局廢棄物量能統計,,科技部南部科學園區管理局
南部科學園區管理局工廠登記家數異動統計表,41262,統計工廠登記家數增減情形,,科技部南部科學園區管理局
中部科學園區管理局創新創業獲補助清單,41264,創新創業獲補助清單,,科技部中部科學園區管理局
科技部學門規劃重點研究項目,41265,各學門徵求重點,,科技部
新竹科學園區管理局職業災害統計月報,41266,月份、災害類別、災害件數、損失日數,,科技部新竹科學園區管理局
新竹科學園區管理局職業災害概況表,41267,月份、事業分類、陳報廠商數、總僱用勞工數、總公時數,,科技部新竹科學園區管理局
新竹科學園區管理局職業災害類別統計,41268,月份、事業分類、災害類別、災害件數,,科技部新竹科學園區管理局
新竹科學園區管理局年度核准入區案與增資案清單,41269,年/月份，投資申請：本年度累計核准家數、本年度核准資本額、本年度累計核准增資案件數、本年度核准增資金額,,科技部新竹科學園區管理局
南部科學園區管理局台南園區第一期第一階段公共藝術完成報告書,41270,公共藝術設置完成後，依公共藝術設置辦法第16條規定撰寫公共藝術完成報告書，記錄公共藝術興辦之過程。,,科技部南部科學園區管理局
新竹科學園區管理局有效核准園區事業家數,41271,年/月份，各園區：新竹園區、竹南園區、龍潭園區、銅鑼園區、新竹生醫園區、宜蘭園區，各園區有效核准園區事業家數,,科技部新竹科學園區管理局
新竹科學園區從業員工數,41272,年/月份，各園區：新竹園區、竹南園區、龍潭園區、銅鑼園區、新竹生醫園區、宜蘭園區，各園區從業員工數(人),,科技部新竹科學園區管理局
南部科學園區管理局台南園區第一期第二階段公共藝術完成報告書,41273,公共藝術設置完成後，依公共藝術設置辦法第16條規定撰寫公共藝術完成報告書，記錄公共藝術興辦之過程。,,科技部南部科學園區管理局
新竹科學園區管理局園區總電力尖峰負載量,41274,年/月份、各園區：新竹園區、竹南園區、龍潭園區、銅鑼園區、新竹生醫園區、宜蘭園區，各園區總電力尖峰負載量(萬千瓦),,科技部新竹科學園區管理局
