歲入類平衡表,歲入類平衡表,20383,本會104年度10月份歲入類平衡表，已同步登載於https://data.gov.tw/dataset/20840,名稱;資料資源網址,大陸委員會
歲入類現金出納表,歲入類現金出納表,20384,本會104年度10月份歲入類現金出納表，已同步登載於https://data.gov.tw/dataset/20840,名稱;資料資源網址,大陸委員會
歲出按職能及經濟性綜合分類表,歲出按職能及經濟性綜合分類表,12933,本會相關預算資料,項目;資料資源網址,大陸委員會
歲出用途別科目分析表,歲出用途別科目分析表,12932,本會相關預算資料,名稱;資料資源網址,大陸委員會
歲出計畫提要及分支計畫概況表,歲出計畫提要及分支計畫概況表,12934,本會相關預算資料,項目;資料資源網址,大陸委員會
歲出預算表,歲出機關別預算表,12935,本會相關預算資料,項目;資料資源網址,大陸委員會
民眾對兩岸交流速度的看法民調,民眾對兩岸交流速度的看法民調,79344,民眾對兩岸交流速度的看法民調,調查時間;太快;太慢;剛剛好;不知道/無意見,大陸委員會
民眾對兩岸相關議題之看法民調,民眾對兩岸相關議題之看法民調,58659,民眾對兩岸相關議題之看法,題目;非常支持/非常贊成/非常同意/非常適當/非常合理;支持/贊成/同意/適當/合理;不支持/不贊成不同意/不適當/不合理;非常不支持/非常不贊成/非常不同意/非常不適當/非常不合理;不知道/無意見,大陸委員會
民眾對統1、獨立或維持現狀的看法民調,民眾對統一、獨立或維持現狀的看法民調,79342,民眾對統一、獨立或維持現狀的看法民調,調查時間;儘快統一;維持現狀，以後走向統一;維持現狀，看情形再決定獨立或統一;永遠維持現狀;維持現狀，以後走向獨立;儘快宣布獨立;不知道/無意見,大陸委員會
民眾對總統國慶演說及兩岸相關議題之看法民調,民眾對總統國慶演說及兩岸相關議題之看法民調,42537,民眾對總統國慶演說及兩岸相關議題之看法,題目;非常支持/非常贊成/非常同意;支持/贊成/應該/同意;不支持/不贊成/不應該/不同意;非常不支持/非常不贊成/非常不同意;不知道/無意見,大陸委員會
民眾對總統就職演說及兩岸相關議題之看法民調,民眾對總統就職演說及兩岸相關議題之看法民調,42536,民眾對總統就職演說及兩岸相關議題之看法,題目;非常贊同/非常支持/非常信心;贊同/支持/信心;不贊同/不支持/不信心;非常不贊同/非常不支持/非常不信心;不知道/無意見,大陸委員會
民眾認知大陸政府對我政府不友善態度民調,民眾認知大陸政府對我政府不友善態度民調,79347,民眾認知大陸政府對我政府不友善態度民調,調查時間;非常友善;友善;不友善;非常不友善;不知道/無意見,大陸委員會
民眾認知大陸政府對臺灣人民友善或不友善態度民調,民眾認知大陸政府對臺灣人民友善或不友善態度民調,79348,民眾認知大陸政府對臺灣人民友善或不友善態度民調,調查時間;非常友善;友善;不友善;非常不友善;不知道/無意見,大陸委員會
民眾認知維護兩岸良性互動是兩岸雙方共同的責任，不應有非和平或恫嚇性的言論或作為民調,民眾認知維護兩岸良性互動是兩岸雙方共同的責任，不應有非和平或恫嚇性的言論或作為民調,79349,民眾認知維護兩岸良性互動是兩岸雙方共同的責任，不應有非和平或恫嚇性的言論或作為民調,調查時間;非常贊成;贊成;不贊成;非常不贊成;不知道/無意見,大陸委員會
派員出國計畫預算總表,派員出國計畫預算總表,12924,本會相關預算資料,項目;資料資源網址,大陸委員會
派員出國計畫類別表-考察,派員出國計畫類別表-考察,12925,本會相關預算資料,項目;資料資源網址,大陸委員會
派員出國計畫類別表-進修,派員出國計畫類別表-進修,12926,本會相關預算資料,項目;資料資源網址,大陸委員會
派員出國計畫類別表-開會,派員出國計畫類別表-開會,12927,本會相關預算資料,項目;資料資源網址,大陸委員會
派員赴大陸計畫預算表,派員赴大陸計畫預算表,12928,本會相關預算資料,項目;資料資源網址,大陸委員會
海基會兩岸人民急難服務中心服務案件數,海基會兩岸人民急難服務中心服務案件數,97669,呈現海基會兩岸人民急難服務中心服務案件數量統計,統計期間;現場件數;人身安全服務;一般諮詢,大陸委員會
海基會兩岸婚姻親子關懷專線統計表,海基會兩岸婚姻親子關懷專線統計表,59278,親子關懷專線統計,日期;婚姻;出生;家暴;繼承;收養;居留停留;來台生活適應;工作;醫療保健;教育;子女問題;急難救助;文書驗證;探親;其他;合計,大陸委員會
海基會協處台商人身安全案件統計表,海基會協處台商人身安全案件統計表,97667,呈現海基會協處台商人身安全案件數,年度;遭殺害;意外或因病身亡;意外傷害因病住院;遭搶.傷害.恐嚇勒索;遭綁架.非法拘禁;因案限制人身自由;失蹤;其他,大陸委員會
海基會收受中國大陸公證書分類統計,海基會收受中國大陸公證書分類統計,97668,呈現海基會收受中國大陸公證書分類統計,年度;繼承;收養;婚姻;出生;死亡;委託;學歷;定居;扶養親屬;財產權利證明;稅務;病歷;經歷;專業證明;其他,大陸委員會
海基會服務電話資訊,海基會服務電話資訊,59265,海基會服務電話資訊,項次;服務功能;電話號碼,大陸委員會
海基會為民服務案件數,海基會為民服務案件數,59267,為民服務案件,年度;件數,大陸委員會
海基會緊急服務專線接聽數,海基會緊急服務專線接聽數,59266,緊急服務專線接聽數量統計,年度;接聽數;人身安全服務;一般諮詢,大陸委員會
海基會董監事名單,海基會董監事名單,59268,董監事名單,職稱;姓名;職銜,大陸委員會
海基會辦理文書驗證統計表,海基會辦理文書驗證統計表,59269,文書驗證統計,期間;當事人申請;大陸寄送副本;完成驗證,大陸委員會
海外臺灣學校及大陸地區臺商學校典範教師獎實施要點,海外臺灣學校及大陸地區臺商學校典範教師獎實施要點,58011,實施要點,項目;內容,大陸委員會
海峽兩岸共同打擊犯罪及司法互助協議,海峽兩岸共同打擊犯罪及司法互助協議,9072,呈現共同打擊犯罪及司法互助協議執行成效,項次;內容,大陸委員會
海峽兩岸共同打擊犯罪及司法互助協議案件統計總表,海峽兩岸共同打擊犯罪及司法互助協議案件統計總表,97672,呈現兩岸共同打擊犯罪及司法互助協議執行情形相關統計資料,項次;協助事項;我方（請求、邀請、主動提供）;陸方（回復）- 完成;陸方（回復）- 瑕疵、補正;陸方（回復）- 進行中;陸方（請求、邀請、主動提供）;我方（回復）- 完成;我方（回復）- 瑕疵、補正;我方（回復）- 進行中,大陸委員會
海峽兩岸智慧財產權保護合作協議,海峽兩岸智慧財產權保護合作協議,9073,呈現共同兩岸智慧財產權協議執行成效,項目;內容,大陸委員會
海峽兩岸醫藥衛生合作協議,海峽兩岸醫藥衛生合作協議,9074,呈現兩岸醫藥衛生合作協議執行成效,項目;內容,大陸委員會
海峽兩岸食品安全協議,海峽兩岸食品安全協議,9071,呈現海峽兩岸食品安全協議執行成效,項目;內容,大陸委員會
港澳事務法規,港澳事務法規,9090,港澳事務法規一覽,港澳事務法規;,大陸委員會
港澳季報,港澳季報,55218,每季編輯有關香港情勢、澳門情勢、臺港澳關係、陸港澳關係之發展情況與相關統計資料。,期數;網址;關鍵字;摘要,大陸委員會
港澳學生來臺就學法規,港澳學生來臺就學法規,55223,說明有關港澳學生來臺就學之相關法規。,名稱;網址;關鍵字;備註,大陸委員會
港澳學生來臺就學網站,港澳學生來臺就學網站,55224,說明有關港澳學生來臺就學之相關網站。,名稱;網址;關鍵字;摘要,大陸委員會
港澳專科以上學校認可名冊,港澳專科以上學校認可名冊,97678,港澳專科以上學校認可名冊,名稱;網址,大陸委員會
港澳居民來臺統計表,港澳居民來臺統計表,7890,彙集港澳居民訪臺、居留及定居之各年度總人數(港澳合計)資料。,表九、港澳居民來臺統計表(1991年-2015年)<br>單位 :人次;,大陸委員會
港澳旅遊資訊,港澳旅遊資訊,9092,港澳旅遊資訊一覽,說明;連結網址,大陸委員會
港澳留臺學生在臺工作法規,港澳留臺學生在臺工作法規,55225,說明有關港澳留臺學生在臺工作之相關法規。,名稱;網址;關鍵字;備註,大陸委員會
港澳留臺學生在臺工作網站,港澳留臺學生在臺工作網站,55226,說明有關港澳留臺學生在臺工作之相關網站。,名稱;網址;關鍵字;摘要,大陸委員會
澳門事務處最新消息一覽表,澳門事務處最新消息一覽表,52574,澳門事務處最新消息一覽表,編號;日期;標題;連結,大陸委員會
澳門居民來臺居留、定居人數統計表,澳門居民來臺居留、定居人數統計表,97674,統計澳門居民來臺居留、定居人數資料。,年份;澳門居留許可人數;澳門定居許可人數,大陸委員會
澳門情勢資料庫,澳門情勢資料庫,55216,每年就澳門移交中國大陸後之政治、經濟、社會、國際，以及臺澳關係進行研析。,報告名稱;網址;關鍵字;報告摘要,大陸委員會
用電資訊,大陸委員會用電資訊,58828,大陸委員會用電資訊,年度;實際總用電度數(kWh);電號樓地板面積(平方公尺);電號數量(只);本會EUI(a);法定EUI(b);達成(a＜b),大陸委員會
發布旅遊警示事由相關業務協處分工,大陸委員會發布旅遊警示事由相關業務協處分工,59270,發布旅遊警示分工,警示事由類別;相關業務處;相關機關;相關兩岸協議,大陸委員會
發文代字表,大陸委員會發文代字表,59603,大陸委員會發文代字表,承辦單位;代擬代判及代擬不代判院函發文;本會發文;室發文;備考,大陸委員會
社會交流法規彙編,社會交流法規彙編,9088,社會交流法規彙編一覽,,大陸委員會
科技部補助兩岸科技學術研討會作業要點,科技部補助兩岸科技學術研討會作業要點,42589,科技部補助兩岸科技學術研討會作業要點,中央部會名稱;補助或獎勵相關辦法;連結網址,大陸委員會
科技部補助延攬客座科技人才作業要點,科技部補助延攬客座科技人才作業要點,42586,科技部補助延攬客座科技人才作業要點,中央部會名稱;補助或獎勵相關辦法;連結網址,大陸委員會
科技部補助邀請大陸地區暨香港澳門科技人士來臺短期訪問作業要點,科技部補助邀請大陸地區暨香港澳門科技人士來臺短期訪問作業要點,42588,科技部補助邀請大陸地區暨香港澳門科技人士來臺短期訪問作業要點,中央部會名稱;補助或獎勵相關辦法;連結網址,大陸委員會
經費累計表,經費累計表,20385,本會104年度10月份經費累計表，已同步登載於https://data.gov.tw/dataset/20840,名稱;資料資源網址,大陸委員會
經費類平衡表,經費類平衡表,20386,本會104年度10月份經費類平衡表，已同步登載於https://data.gov.tw/dataset/20840,名稱;資料資源網址,大陸委員會
經費類現金出納表,經費類現金出納表,20387,本會104年度10月份經費類現金出納表，已同步登載於https://data.gov.tw/dataset/20840,名稱;資料資源網址,大陸委員會
綠色採購總金額及比率,大陸委員會綠色採購總金額及比率,58827,大陸委員會綠色採購總金額及比率,年度;評核成績%;等第;總綠色採購金額;非環保產品,大陸委員會
總統大陸政策談話,總統大陸政策談話,42540,總統大陸政策談話,標題;日期;連結網址,大陸委員會
總統港澳工作談話,總統港澳工作談話,9089,總統港澳工作談話一覽,總統港澳工作談話;,大陸委員會
自起發布中國大陸及香港、澳門旅遊警示資料,大陸委員會自103年9月1日起發布中國大陸及香港、澳門旅遊警示資料,42627,行政院大陸委員會自103年9月1日起發布中國大陸及香港、澳門旅遊警示資料,發布區域;發布時間;發布原因;解除時間;備註(旅遊警示發布新聞稿超連結);備註(旅遊警示解除新聞稿超連結),大陸委員會
臺商實用資訊,臺商實用資訊,119365,臺商服務相關資訊,項目;內容,大陸委員會
臺商對中國大陸投資金額統計,臺商對中國大陸投資金額統計,7473,呈現臺商對中國大陸投資金額統計資料,期間;臺商對中國大陸投資-經濟部核准件數;臺商對中國大陸投資-經濟部核准金額(億美元);臺商對中國大陸投資-經濟部核准平均每件金額(億美元);臺商對中國大陸投資-中國大陸對外公布項目數;臺商對中國大陸投資-中國大陸對外公布實際金額(億美元),大陸委員會
臺商張老師月刊諮詢解答,臺商張老師月刊諮詢解答,119364,臺商諮詢問題與解答,期數;臺商諮詢問題;臺商張老師諮詢解答;撰寫人,大陸委員會
臺港澳交流各項業務主管機關,臺港澳交流各項業務主管機關,9091,臺港澳交流各項業務主管機關一覽,各項業務事項;主管機關;洽詢電話;網址/地址,大陸委員會
臺港澳交流答客問,臺港澳交流答客問,55220,有關臺港澳關係、入出境與居留定居、就業、就學、經貿交通與文化交流等之答客問內容。,名稱;網址;關鍵字;摘要,大陸委員會
臺港澳關係相關網站,臺港澳關係相關網站,55227,說明有關臺灣與港澳互動之相關網站。,名稱;網址;關鍵字;摘要,大陸委員會
臺港澳青年交流,臺港澳青年交流,55219,說明每年辦理之重要青年交流活動，例如港澳青年臺灣知性之旅及港澳學生金門體驗營等活動。,年度;網址;關鍵字;摘要,大陸委員會
臺港相互投資金額統計表,臺港相互投資金額統計表,7462,彙集臺港相互投資數值,表五、臺港相互投資金額統計表<br>單位:百萬美元;,大陸委員會
臺澳相互投資金額統計表,臺澳相互投資金額統計表,7463,彙集臺澳相互投資數值,表六、臺澳相互投資金額統計表<br>單位:百萬美元;,大陸委員會
臺灣及中國大陸利率及匯率之比較,臺灣及中國大陸利率及匯率之比較,7496,呈現臺灣及中國大陸利率及匯率之比較資料,期　間;臺灣一年期存款利率;臺灣基準放款利率;中國大陸一年期存款利率;中國大陸一年期貸款利率;新臺幣／美元;人民幣中間價／美元,大陸委員會
臺灣及中國大陸對南韓之貿易統計,臺灣及中國大陸對南韓之貿易統計,7491,呈現臺灣及中國大陸對南韓之貿易統計資料,期間;臺灣對南韓出口(億美元);臺灣對南韓出口年增率;臺灣自南韓進口(億美元);臺灣自南韓進口年增率;臺灣對南韓貿易總額(億美元);臺灣對南韓貿易總額年增率;中國大陸對南韓出口(億美元);中國大陸對南韓出口年增率;中國大陸自南韓進口(億美元);中國大陸自南韓進口年增率;中國大陸對南韓貿易總額(億美元);中國大陸對南韓貿易總額年增率,大陸委員會
臺灣及中國大陸對日本之貿易統計,臺灣及中國大陸對日本之貿易統計,7488,呈現臺灣及中國大陸對日本之貿易統計資料,期間;臺灣對日本出口(我國海關統計)(億美元);臺灣對日本出口年增率(我國海關統計);臺灣自日本進口-我國海關統計統計(億美元);臺灣自日本進口年增率-我國海關統計統計;臺灣對日本貿易總額-我國海關統計統計(億美元);臺灣對日本貿易總額年增率-我國海關統計統計;臺灣對日本出口-日本海關統計統計(億美元);臺灣對日本出口年增率-日本海關統計統計;臺灣自日本進口-日本海關統計統計(億美元);臺灣自日本進口年增率-日本海關統計統計;臺灣對日本貿易總額(日本海關統計)(億美元);臺灣對日本貿易總額年增率(日本海關統計);中國大陸對日本出口(中國大陸海關統計)(億美元);中國大陸對日本出口年增率(中國大陸海關統計);中國大陸自日本進口(中國大陸海關統計)(億美元);中國大陸自日本進口年增率(中國大陸海關統計);中國大陸對日本貿易總額(中國大陸海關統計)(億美元);中國大陸對日本貿易總額年增率(中國大陸海關統計);中國大陸對日本出口(日本海關統計)(億美元);中國大陸對日本出口年增率(日本海關統計);中國大陸自日本進口(日本海關統計)(億美元);中國大陸自日本進口年增率(日本海關統計);中國大陸對日本貿易總額(日本海關統計)(億美元);中國大陸對日本貿易總額年增率(日本海關統計),大陸委員會
臺灣及中國大陸對東協10國之貿易統計,臺灣及中國大陸對東協10國之貿易統計,7490,呈現臺灣及中國大陸對東協之貿易統計資料,期間;臺灣對東協10國出口(億美元);臺灣對東協10國出口年增率;臺灣自東協10國進口(億美元);臺灣自東協10國進口年增率;臺灣對東協10國貿易總額(億美元);臺灣對東協10國貿易總額年增率;中國大陸對東協10國出口(億美元);中國大陸對東協10國出口年增率;中國大陸自東協10國進口(億美元);中國大陸自東協10國進口年增率;中國大陸對東協10國貿易總額(億美元);中國大陸對東協10國貿易總額年增率,大陸委員會
臺灣及中國大陸對歐盟之貿易統計,臺灣及中國大陸對歐盟之貿易統計,7489,呈現臺灣及中國大陸對歐盟之貿易統計資料,期間;臺灣對歐盟出口(億美元);臺灣對歐盟出口年增率;臺灣自歐盟進口(億美元);臺灣自歐盟進口年增率;臺灣對歐盟貿易總額(億美元);臺灣對歐盟貿易總額年增率;中國大陸對歐盟出口(億美元);中國大陸對歐盟出口年增率;中國大陸自歐盟進口(億美元);中國大陸自歐盟進口年增率;中國大陸對歐盟貿易總額(億美元);中國大陸對歐盟貿易總額年增率,大陸委員會
臺灣及中國大陸對美國之貿易統計,臺灣及中國大陸對美國之貿易統計,7487,呈現臺灣及中國大陸對美國之貿易統計資料,期間;臺灣對美國出口(我國海關統計)(億美元);臺灣對美國出口年增率(我國海關統計);臺灣自美國進口(我國海關統計)(億美元);臺灣自美國進口年增率(我國海關統計);臺灣對美國貿易總額(我國海關統計)(億美元);臺灣對美國貿易總額年增率(我國海關統計);臺灣對美國出口(美國海關統計)(億美元);臺灣對美國出口年增率(美國海關統計);臺灣自美國進口(美國海關統計)(億美元);臺灣自美國進口年增率(美國海關統計);臺灣對美國貿易總額(美國海關統計)(億美元);臺灣對美國貿易總額年增率(美國海關統計);中國大陸對美國出口(中國大陸海關統計)(億美元);中國大陸對美國出口年增率(中國大陸海關統計);中國大陸自美國進口(中國大陸海關統計)(億美元);中國大陸自美國進口年增率(中國大陸海關統計);中國大陸對美國貿易總額(中國大陸海關統計)(億美元);中國大陸對美國貿易總額年增率(中國大陸海關統計);中國大陸對美國出口(美國海關統計)(億美元);中國大陸對美國出口年增率(美國海關統計);中國大陸自美國進口(美國海關統計)(億美元);中國大陸自美國進口年增率(美國海關統計);中國大陸對美國貿易總額(美國海關統計)(億美元);中國大陸對美國貿易總額年增率(美國海關統計),大陸委員會
臺灣及中國大陸對香港之貿易統計,臺灣及中國大陸對香港之貿易統計,7469,呈現臺灣及中國大陸對香港之貿易統計，包含出口Exports、 進口Imports 、貿易總額Total等重要資料,期間;臺灣對香港出口(我國海關統計)(億美元);臺灣對香港出口(我國海關統計)(年增率);臺灣自香港進口(我國海關統計)(億美元);臺灣自香港進口(我國海關統計)(年增率);臺灣對香港貿易總額(我國海關統計)(億美元);臺灣對香港貿易總額(我國海關統計)(年增率);臺灣對香港出口(香港海關統計)(億美元);臺灣對香港出口(香港海關統計)(年增率);臺灣自香港進口(香港海關統計)(億美元);臺灣自香港進口(香港海關統計)(年增率);臺灣對香港貿易總額(香港海關統計)(億美元);臺灣對香港貿易總額(香港海關統計)(年增率);中國大陸對香港出口(中國大陸海關統計)(億美元);中國大陸對香港出口(中國大陸海關統計)(年增率);中國大陸自香港進口(中國大陸海關統計)(億美元);中國大陸自香港進口(中國大陸海關統計)(年增率);中國大陸對香港貿易總額(中國大陸海關統計)(億美元);中國大陸對香港貿易總額(中國大陸海關統計)(年增率);中國大陸對香港出口(香港海關統計)(億美元);中國大陸對香港出口(香港海關統計)(年增率);中國大陸自香港進口(香港海關統計)(億美元);中國大陸自香港進口(香港海關統計)(年增率);中國大陸對香港貿易總額(香港海關統計)(億美元);中國大陸對香港貿易總額(香港海關統計)(年增率),大陸委員會
臺灣及中國大陸貿易統計,臺灣及中國大陸貿易統計,7485,呈現臺灣及中國大陸貿易統計資料,期間;臺灣出口(億美元);臺灣出口年增率;臺灣進口(億美元);臺灣進口年增率;臺灣貿易差額(億美元);臺灣貿易差額年增率;臺灣貿易總額(億美元);臺灣貿易總額年增率;中國大陸出口(億美元);中國大陸出口年增率;中國大陸進口(億美元);中國大陸進口年增率;中國大陸貿易差額(億美元);中國大陸貿易差額年增率;中國大陸貿易總額(億美元);中國大陸貿易總額年增率,大陸委員會
臺灣及中國大陸輸往東協10國產品市場比較,臺灣及中國大陸輸往東協10國產品市場比較,7495,呈現臺灣及中國大陸輸往東協10國產品市場比較資料,期 間;臺灣輸往東協10國產品金額(億美元);臺灣輸往東協10國產品年增率;臺灣輸往東協10國產品市占率;中國大陸輸往東協10國產品金額(億美元);中國大陸輸往東協10國產品年增率;中國大陸輸往東協10國產品市占率,大陸委員會
臺灣地區民間團體對大陸地區捐贈獎助學金審查要點,臺灣地區民間團體對大陸地區捐贈獎助學金審查要點,97697,臺灣地區民間團體對大陸地區捐贈獎助學金審查要點,中央部會名稱;補助或獎勵相關辦法;連結網址,大陸委員會
臺灣地區與大陸地區人民關係條例暨兩岸歷次協議(含香港澳門關係條例),臺灣地區與大陸地區人民關係條例暨兩岸歷次協議（含香港澳門關係條例）,59273,兩岸條例暨歷次協議,公開資料名稱;日期;版次;關鍵字;公開網址,大陸委員會
臺灣地區與大陸地區人民關係條例暨施行細則解釋彙編,臺灣地區與大陸地區人民關係條例暨施行細則解釋彙編,59275,臺灣地區與大陸地區人民關係條例暨施行細則解釋彙編,公開資料名稱;日期;版次;關鍵字;公開網址,大陸委員會
臺灣對中國大陸、香港順差統計,臺灣對中國大陸、香港順差統計,7472,呈現臺灣對中國大陸、香港順差統計資料,期 間;臺灣對中國大陸貿易順差-金額(百萬美元);臺灣對中國大陸貿易順差-比重;臺灣對香港貿易順差-金額(百萬美元);臺灣對香港貿易順差-比重;臺灣對全球貿易順差-金額(百萬美元),大陸委員會
臺灣對中國大陸及香港出口主要產品,臺灣對中國大陸及香港出口主要產品,7470,說明臺灣對中國大陸及香港出口主要產品,,大陸委員會
臺灣對澳門貿易統計表,臺灣對澳門貿易統計表,7083,彙集臺灣對澳門貿易統計逐年總值,表二、臺灣對澳門貿易統計表<br>單位:百萬美元;,大陸委員會
臺灣對香港貿易統計表,臺灣對香港貿易統計表,7459,彙集臺灣對香港的貿易數值,表一、臺灣對香港貿易統計表<br>單位:百萬美元;,大陸委員會
臺灣自中國大陸及香港進口主要產品,臺灣自中國大陸及香港進口主要產品,7471,列式臺灣自中國大陸及香港進口主要產品,,大陸委員會
