資料集名稱,資料集識別碼,資料集描述,主要欄位說明,提供機關
105年度學產基金附屬單位預算案,20691,提供105年度學產基金附屬單位預案之主要表XML檔，包含(一)基金來源、用途及餘絀預計表，(二)現金流量預計表。,,教育部會計處
105年度國立社教機構作業基金附屬單位法定預算,20692,提供教育部主管國立社教機構作業基金預算主要表之XML，包含(一)收支預計表(二)餘絀撥補預計表(三)現金流量預計表,,教育部會計處
106年度教育部運動發展基金附屬單位預算,20798,106年度教育部運動發展基金附屬單位預算,SEQNO;LEVEL;BOLD;前年度決算數;項目;本年度預算數;上年度預算數;比較增減;預算數;說明;科目及業務項目;單位;預算數-數量;預算數-利率;預算數-金額;業務計畫及用途別科目;計畫內容說明;計畫別;單位成本或平均利率;數量;民國104年12月31日實際數;科目;民國106年12月31日預計數;民國105年12月31日預計數;年度及項目;上年度最高可進用員額數;本年度增減數;本年度最高可進用員額數;正式員額薪資;聘僱人員薪資;超時工作報酬;津貼;獎金-年終獎金;獎金-考績獎金;獎金-其他;退休及卹償金-退休金;退休及卹償金-卹償金;資遣費;福利費-分擔保險費;福利費-傷病醫藥費;福利費-提撥福利金;福利費-其他;提繳費;合計;兼任人員用人費用;總計;科目名稱;一般行政管理計畫;培訓體育運動人才及運動訓練環境改善計畫;健全體育運動人才培育之運動產業環境改善支出計畫;辦理大型國際體育運動交流活動計畫;非亞奧運及基層運動人才培育計畫;輔助國民小學及國民中學運動代表隊計畫,教育部體育署
我國籍人士擔任國際體育運動組織重要職務類別及席次概況,20799,我國籍人士擔任國際體育運動組織重要職務概況,年度;類別;席次;百分比(%),教育部體育署
國內體育運動團體人員出國類別次數,20807,國內體育運動團體人員出國類別次數,年度;臺灣赴大陸(人次);大陸來臺灣(人次),教育部體育署
教育部體育署104年運動發展基金會計月報,20849,教育部體育署104年運動發展基金會計月報,SEQNO;LEVEL;BOLD;科目-名稱;科目-編號;以前年度保留數;本年度法定預算數;本年度奉准先行辦理數;合計;本月份實際數;本月份預算數;本月份比較增減;本月份比較增減-百分比;本年度截至本月份累計實際數;本年度截至本月份累計預算數;本年度截至本月份累計比較增減;本年度截至本月份累計比較增減-百分比;項目;金額;百分比,教育部體育署
教育部體育署104年公務會計月報,20884,教育部體育署104年公務會計月報相關表格及資料,會計年度;月份;款;項;目;節;預算年度;預算科目編號;預算科目名稱;細目編號;細目名稱;原預算數;追加減數;截至本月止累計分配數_1;本月實現數;截至本月止累計實現數_2;應收收入數_3;分配數預算餘額_4;分支計畫編號;分支計畫名稱;用途別編號;用途別名稱;第一預備金;第二預備金;經費流用數;預算調整數;應付數;已分配尚未執行數;備註_預暫付數;以前年度轉入數;應收數;保留數;減免;截至本月止累計實現數;調整數;尚未執行數;基金別;會計分類;使用機關別;科目分類;會計科目編號;會計科目名稱;金額;科目名稱;取得成本;以前年度累計折舊_長期投資評價;本年度資本資產成本變動_增加數;本年度資本資產成本變動_減少數;本年度累計折舊_長期投資評價變動數;期末帳面金額;備註;業務計畫或工作計畫;經資門;執行數;項目;收入實現數;減項_收入待納庫數;加項_以前年度待納庫繳庫數;加項_以前年度撥款於本年度繳還數_材料;加項_以前年度撥款於本年度繳還數_存出保證金;加項_以前年度撥款於本年度繳還數_其他應收款;加項_預收款;加項_剔除經費;繳付公庫數;一級用途別編號;一級用途別名稱;支出實現數;加項_預付款;加項_材料;加項_存出保證金;加項_零用金;加項_退還收入預收款;加項_其他應收款;減項_以前年度撥款於本年度實現數;公庫撥入數;公庫分配數餘額;金額_本月數;金額_累計數;年度預算數,教育部體育署
104年度學產基金附屬單位預算會計月報,20972,提供教育部主管學產基金月報主要表及其他表之XML檔，主要表包含(一)基金來源用途及餘絀表，(二)購建固定資產計畫執行情形明細表，(三)平衡表,SEQNO;LEVEL;BOLD;科目-名稱;科目-編號;以前年度保留數;本年度可用預算數;本年度奉准先行辦理數;合計;本月份實際數;本月份預算數;本月份比較增減;本月份比較增減-百分比;本年度截至本月份累計實際數;本年度截至本月份累計預算數;本年度截至本月份累計比較增減;本年度截至本月份累計比較增減-百分比;項目;金額;百分比;本年度法定預算數;累計預算分配數;實際執行數-實支數;實際執行數-應付未付數;實際執行數;實際執行數-百分比;比較增減;比較增減-百分比;契約責任數;結餘款;累計工程進度-預估;累計工程進度-實際,教育部會計處
103年度學產基金附屬單位決算(審定本),20997,提供教育部主管學產基金決算書主要表及總說明之XML檔，主要表包含：(一)基金來源用途及餘絀表，(二)現金流量決算表，(三)平衡表。,SEQNO;LEVEL;BOLD;項目;本年度預算數-金額;本年度預算數-百分比;本年度決算數-金額;本年度決算數-百分比;比較增減-金額;比較增減-百分比;上年度決算數-金額;上年度決算數-百分比;預算數;決算數,教育部會計處
國家圖書館103年度單位決算,21089,公告國家圖書館單位決算相關書表,go_ordinary;budgetyear;expid;budgetno7;samt9;samt10;samt11;samt12;samt15;samt16;samt17;samt18;samt19;samt20;subp1;subp2;useno;agenitemserialno1;agenitemserialno2;agenitemserialno3;agenitemserialno4;budgetnochk;budgetname;objectname;subprojectname;subp2_name;go_level;sort1;go_memo;f1;f2;f3;f4;samt13;samt21;samt22;samt23,國家圖書館
國立海洋科技博物館107年度法定預算,21103,收支預計表、現金流量預計表、餘絀撥補預計表等,SEQNO;LEVEL;BOLD;前年度決算數-金額;前年度決算數-百分比;科目;本年度預算數-金額;本年度預算數-百分比;上年度預算數-金額;上年度預算數-百分比;比較增減-金額;比較增減-百分比;項目;說明;預算數,國立海洋科技博物館
105年度教育部青年發展署單位預算,21157,105年度教育部青年發展署單位預算_人事費彙計表、公務車輛明細表、各項費用彙計表、委辦經費分析表、派員出國計畫預算總表、派員出國計畫類別表-考察、派員出國計畫類別表-開會、捐助經費分析表、歲入來源別預算表、歲入項目說明提要表、歲出用途別科目分析表、歲出按職能及經濟性綜合分類表、歲出計畫提要及分支計畫概況表、歲出機關別預算表、補助經費分析表、資本支出分析表、預算員額明細表、辦公房舍明細表,款;項;目;節;科目名稱;預算科目編號;人事費;業務費_經;奬補助費_經;債務費;預備金_經;經常支出小計;業務費_資;設備及投資;奬補助費_資;預備金_資;資本支出小計;合計;職能別分類經濟性分類;消費支出_經;債務利息_經;補助地方_經;移轉民間_經;小計_經;資本形成_資;土地購入_資;增資_資;補助地方_資;移轉民間_資;小計_資;總計,教育部青年發展署
國立科學工藝博物館105年度預算案,21166,國立科學工藝博物館105年度預算案,,國立科學工藝博物館
教育部體育署補助興（整）建運動場館與設施數,21210,教育部體育署補助興（整）建運動場館與設施數,年度;縣市立運動場館;鄉鎮市區運動場館;鄉鎮市區游泳池;鄉鎮市區運動公園;社區簡易運動場所;運動場館夜間照明設備;自行車道;其他類,教育部體育署
國立高級中等學校校務基金103年度決算,21302,國立高級中等學校校務基金103年度決算,SEQNO;LEVEL;BOLD;科目;本年度預算數-金額;本年度預算數-百分比;本年度決算數-金額;本年度決算數-百分比;比較增減-金額;比較增減-百分比;上年度決算數-金額;上年度決算數-百分比;項目;預算數;決算數,教育部國民及學前教育署
105年度教育部單位預算案,21305,歲入來源別預算表、歲出機關別預算表、歲入項目說明提要表、歲出計畫提要及分支計畫概況表、各項費用彙計表、歲出用途別科目分析表、資本支出分析表、人事費用分析表、預算員額明細表、公務車輛明細表、辦公房舍明細表、補助經費分析表、捐助經費分析表、派員出國計畫預算總表、派員出國計畫類別表-開會、派員出國計畫類別表-進修、派員赴大陸計畫預算表、歲出按職能及經濟性綜合分類表、跨年期計畫概況表、委辦經費分析表。,,教育部會計處
國立高級中等學校校務基金104年度會計月報,21338,國立高級中等學校校務基金104年度會計月報,明細項目;以前年度保留數;本年度法定預算數;本年度奉准先行辦理數;調整數;本年度可用預算數;累計預算分配數;實際執行數-實支數;實際執行數-應付未付數;實際執行數;實際執行數-百分比;比較增減;比較增減-百分比;契約責任數;結餘款;累計工程進度-預估;累計工程進度-實際,教育部國民及學前教育署
國立高級中等學校校務基金104年度預算,21339,國立高級中等學校校務基金104年度預算,SEQNO;LEVEL;BOLD;前年度決算數-金額;前年度決算數-百分比;科目;本年度預算數-金額;本年度預算數-百分比;上年度預算數-金額;上年度預算數-百分比;比較增減-金額;比較增減-百分比;項目;說明;預算數,教育部國民及學前教育署
國立高級中等學校校務基金105年度預算,21340,國立高級中等學校校務基金105年度預算,SEQNO;LEVEL;BOLD;前年度決算數-金額;前年度決算數-百分比;科目;本年度預算數-金額;本年度預算數-百分比;上年度預算數-金額;上年度預算數-百分比;比較增減-金額;比較增減-百分比;項目;說明;預算數,教育部國民及學前教育署
教育部國民及學前教育署105年度法定預算,21341,教育部國民及學前教育署105年度法定預算,,教育部國民及學前教育署
國立公共資訊圖書館會計報告,21382,公告國立公共資訊圖書館會計報告相關書表,檔案名稱;檔案聯結,國立公共資訊圖書館
教育部校園食材登錄平臺-107年度調味料及供應商資料集,21618,提供每月全國高級中等以下學校調味料及供應商與供應商等資料，了解學生午餐食材來源資訊。,縣市名稱;區域名稱;學校名稱;開始使用日期;結束使用日期;供餐業者;供餐業者統一編號;調味料供應商名稱;調味料名稱;認證標章;認證編號,教育部國民及學前教育署
國立海洋生物博物館105年度預算,21645,國立海洋生物博物館105年度附屬單位預算分預算,SEQNO;LEVEL;BOLD;項目;合計-金額;合計-百分比;合計,國立海洋生物博物館
國家圖書館客家研究文獻書目資訊,22092,客家研究文獻資源,題名;著者;出版者;出版年;ISBN;ISSN;頁數;系所名稱;學位類別;刊名;卷期;主題;地點;關鍵詞;資料類型;目次;內容摘要;語文,國家圖書館
臺灣民間傳說文獻資料書目,22093,臺灣各縣市民間地方、人物、史事、習俗、神鬼等傳說相關圖書、期刊、學位論文、視聽資料、單篇文獻、會議論文等文獻資料。,序號;題名;作者;出版項;版本;ISBN;類型,國家圖書館
臺灣戲劇與美術文獻資料書目,22094,臺灣戲劇、美術等相關圖書、期刊、學位論文、視聽資料、單篇文獻、會議論文等文獻資料。主題收錄範圍包括純美術和工藝美術兩類。臺灣戲劇包括南管戲、北管戲、歌仔戲、客家大戲、新劇及布袋戲及現代戲劇等。,序號;題名;作者;出版項;版本;ISBN;類型,國家圖書館
105年度國家圖書館單位預算案,22171,本資料集提供國家圖書館年度施政目標重點及歲入歲出預算編列情形,,國家圖書館
直轄市、各地區縣市、離島縣市體育運動經費比較表,22216,直轄市、各地區縣市、離島縣市體育運動經費比較表,年度;直轄市;北部地區;中部地區;南部地區;東部地區;離島地區,教育部體育署
國立自然科學博物館博物館學季刊,22325,本資料集主要提供國立自然科學博物館出版之博物館學季刊論文資料，為博物館專業人員及博物館學界開創一個理論探討、實務經驗分享及論壇的園地，以提昇博物館人的專業知能，並促進博物館學與博物館專業技術的研究與推廣。,category;author;title;page-start;file,國立自然科學博物館
國立自然科學博物館蒐藏與研究期刊,22332,本資料集主要提供國立自然科學博物館出版之蒐藏與研究期刊論文資料，內容涵蓋領域包含：動物學、植物學、地質學與人類學。,author;title;page-start;file,國立自然科學博物館
國立自然科學博物館自然科學專書,22333,本資料集主要提供國立自然科學博物館出版之自然科學專書資料。,category;author;title;intro;thumbnail,國立自然科學博物館
全國運動場館資訊,22849,提供民眾查詢運動場館資訊,場館編號;設施項目;場館名稱;所在地址;場館連絡電話;場館官方網站;場館停車場類型;館啟用年;場館簡介;曾舉辦過賽事類型;曾舉辦過賽事詳細資訊;場館所在位置緯度;場館所在位置經度;場館外部照片;場館內部照片;無障礙電梯數量;無障礙電梯照片;無障礙停車位數量;無障礙停車位照片;無障礙淋浴間;無障礙淋浴間照片;無障礙廁所數量;無障礙廁所照片;無障礙坡道數量;無障礙坡道照片;輪椅觀眾席數量;輪椅觀眾席照片;交通資訊;公告;公告相關網址;平均評分;評分個數;所含設施,教育部體育署
打造運動島核定活動場次數,22863,各縣市辦理打造運動島計畫活動數,編號;縣市別;地方特色;運動地圖;小聯盟;社區聯誼賽;水域;單車;原住民;身心障礙;合計,教育部體育署
國立臺灣科學教育館104年度法定預算,23094,國立臺灣科學教育館104年度法定預算財務報表(含收支預計表、餘絀撥補預計表、現金流量預計表),SEQNO;LEVEL;BOLD;前年度決算數-金額;前年度決算數-百分比;科目;本年度預算數-金額;本年度預算數-百分比;上年度預算數-金額;上年度預算數-百分比;比較增減-金額;比較增減-百分比;項目;說明;預算數,國立臺灣科學教育館
教育部政府資料開放諮詢小組會議紀錄,23122,提供教育部政府資料開放諮詢小組會議紀錄,會議名稱;時間;地點;主席;出席委員;網址;會議資料網址,教育部資訊及科技教育司
國立公共資訊圖書館研究報告,23946,公告國立公共資訊圖書館歷年研究報告連結,研究報告名稱;年代;執行單位;計畫主持人;連結,國立公共資訊圖書館
國立公共資訊圖書館各場地開放使用時間及收費基準,23959,公告國立公共資訊圖書館場地租借資訊,場地名稱;館別樓層;容納人數;設備及器材;每時段使用時間;場地使用費;管理單位;連結,國立公共資訊圖書館
國立公共資訊圖書館數位資源一覽表,23967,公告國立公共資訊圖書館購置數位資源一覽表,編號;資料庫名稱;內容簡介;資料類型;適用對象,國立公共資訊圖書館
國立臺灣藝術教育館藝拍即合最新消息,23985,提供藝拍即合網站之相關媒合及藝文最新資訊,title;author;link;pubDate;description,國立臺灣藝術教育館
國立臺灣圖書館105年度法定預算,24055,國立臺灣圖書館105年度預算案,會計科目編號;營運業務項目編號;用途別編號;人員類別;本年度預算數;上年度預算數;前年度決算數;說明,國立臺灣圖書館
獎勵運動產業專題研究,24063,瞭解目前產業趨勢及學校針對運動產業的發展研究，進行推廣運動相關研究目標對象設定。,申請年度;申請單位;計畫主持人;研究專題名稱;獎勵金額,教育部體育署
專任運動教練資格審定名單,24351,專任運動教練資格審定名單,年度;報名流水號;運動種類;等級;姓名,教育部體育署
教育部學術網路(TANet)各縣巿網路流量即時狀況,24374,提供TANet各縣巿網路中心即時流量統計資料，內容包含日、週、月、年等四種流量圖表,縣巿別;線路類別;使用頻寬;每日網路流量變化圖;檢測時間,教育部資訊及科技教育司
運動城市調查各縣市規律運動現況,24375,各縣市規律運動現況。,年度;縣市;樣本數;7333運動人口;7330運動人口;7230運動人口;7100運動人口,教育部體育署
大專附設高級中等進修學校名錄,24393,全臺灣大專附設高級中等進修學校通訊資料,代碼;學校名稱;縣市名稱;地址;電話;網址;公/私立;公私立;備註,教育部統計處
國立科學工藝博物館典藏品清單,24408,本館典藏品清單，提供民眾即時了解本館典藏項目，名稱、類型，以提供其研究、學習。,類型;名稱;英文名稱;製造年代;材質,國立科學工藝博物館
各年度與各國學術交流統計,24573,統計數據類別： 1. 各年各國總簽約數 2. 各年各國與本國學校簽約之校數 3. 各年與各國學校簽約之校數,年度;國別（英文）;國別（中文）;總數;國內學校數;該國學校數,教育部國際及兩岸教育司
學術交流統計總表,24574,統計數據類別：各年我國學校與各國學校簽約數(含協約名稱)及調查交換教師、交換學生、學術研究、姐妹校締結、短期課程及雙聯學制(雙學位)交流情形,簽約日期;國內學校名稱;國別;國外學校名稱;協約名稱;交換教師;交換學生;學術研究;締結姊妹校;短期課程;雙聯學制,教育部國際及兩岸教育司
1966年至2016年學術交流概況,24575,統計國內有簽約的學校總數、簽約國家總數、簽約國外學校總數及協約總數,國內締約學校總數;外國締約學校總數;締約國家總數;協約總數,教育部國際及兩岸教育司
我國與國外大學學術交流統計,24576,統計數據類別： 1. 各年簽約總數 2. 各年國內學校總數 3. 各年國外學校總數 4. 各年姐妹校數,年度;締約總數;國內學校簽約數;國外學校簽約數;姊妹校簽約數,教育部國際及兩岸教育司
1966年至2016年與各國學術交流統計,24577,統計數據類別： 1. 1966年至2016年各國總簽約數 2. 1966年至2016年各國與本國學校簽約之校數 3. 1966年至2016年與各國學校簽約之校數,國別 ( 中文 );國別 ( 英文 );締約數;締約國內學校數;締約國外學校數,教育部國際及兩岸教育司
大專校院修讀校際選課人次,24720,1.提供大專校院各學系、各學制之學生修讀校際選課人次。 2.與大專校院校務資訊公開平臺之「學6.修讀校際選課人次-以『系(所)』統計」資料相同。,學年度;學期;設立別;學校類別;學校統計處代碼;學校名稱;系所代碼;系所名稱;學制班別(日間);修讀校際選課人次小計;修讀校際選課人次男;修讀校際選課人次女,教育部高等教育司
大專校院修讀輔系人次,24724,1.提供大專校院各學系、各學制之學生修讀輔系人次。 2.與大專校院校務資訊公開平臺之「學7.修讀輔系人次-以『系(所)』統計」資料相同。,學年度;學期;設立別;學校類別;學校統計處代碼;學校名稱;系所代碼;系所名稱;學制班別;修讀輔系人次小計;修讀輔系人次男;修讀輔系人次女,教育部高等教育司
大專校院修讀雙主修人次,24725,1.提供大專校院各系所、學制之學生雙主修人次。 2.與大專校院校務資訊公開平臺之「學8.修讀雙主修人次-以『系(所)』統計」資料相同。,學年度;學期;設立別;學校類別;學校統計處代碼;學校名稱;系所代碼;系所名稱;學制班別;修讀雙主修人次小計;修讀雙主修人次男;修讀雙主修人次女,教育部高等教育司
大專校院學雜費收費基準,24726,1.提供大學校院各學院(系) 日間學制學士班學雜費收費基準。 2.與大專校院校務資訊公開平臺之「校1-2.日間學士班以下學費、雜費收費基準-以『學院』統計」資料相同。,學年度;設立別;學校類別;學校統計處代碼;學校名稱;日間學制學士班學雜費收費基準(單位：元)-醫學系;日間學制學士班學雜費收費基準(單位：元)-牙醫學系;日間學制學士班學雜費收費基準(單位：元)-醫學院;日間學制學士班學雜費收費基準(單位：元)-工學院;日間學制學士班學雜費收費基準(單位：元)-理農學院;日間學制學士班學雜費收費基準(單位：元)-商學院;日間學制學士班學雜費收費基準(單位：元)-文法學院;日間學制學士班學雜費收費基準(單位：元)-其他;日間學制副學士學雜費收費基準(五專後2年、二專)(單位：元)-工業類;日間學制副學士學雜費收費基準(五專後2年、二專)(單位：元)-商管類;日間學制副學士學雜費收費基準(五專後2年、二專)(單位：元)-醫護類;日間學制副學士學雜費收費基準(五專後2年、二專)(單位：元)-其他,教育部高等教育司
大專校院學雜費減免人數,24727,1.提供大專校院低收入戶學生、中低收入戶學生、身心障礙學生及身心障礙人士子女、特殊境遇家庭之子女及原住民學生之學雜費減免人數。 2.與大專校院校務資訊公開平臺之「校12.學雜費減免人數-以『校』統計」資料相同。,學年度;學期;設立別;學校類別;學校統計處代碼;學校名稱;小計;低收入戶學生;中低收入戶學生;身心障礙學生及身心障礙人士子女;特殊境遇家庭之子女;原住民學生,教育部高等教育司
大專校院弱勢學生助學計畫助學金學生數,24728,1.提供大專校院弱勢學生助學計畫受惠學生人數。 2.與大專校院校務資訊公開平臺之「校10.獲弱勢學生助學計畫補助之受惠學生人數及其比率-以『校』統計」資料來源相同。,學年度;設立別;學校類別;學校統計處代碼;學校名稱;在學學生數-小計;在學學生數-男;在學學生數-女;獲弱勢學生助學計畫補助之受惠學生人數-小計;獲弱勢學生助學計畫補助之受惠學生人數-男;獲弱勢學生助學計畫補助之受惠學生人數-女;每千名學生獲弱勢學生助學計畫補助之受惠學生人數比率(%),教育部高等教育司
大專校院建立跨國學位合作(雙聯學制)校數,24729,1.提供大專校院與國外大學建立跨國（境）學合作（雙聯學制）校數統計。 2.與大專校院校務資訊公開平臺之「學11.學校建立跨國學位合作（雙聯學制）之校數-以『校』統計」資料相同。,學年度;設立別;學校類別;學校統計處代碼;學校名稱;合作學校國家(地區)別;合作學校國家(地區)區域別;與國外及兩岸學校建立姊妹校數(109.02新增);建立跨國(境)學位合作(雙聯學制)學校數;與國外及兩岸學校進行學術合作交流計畫之件數(109.02新增),教育部高等教育司
大專校院本國學生出國進修交流數,24730,提供大專校院各學系、各學制學生出國進修、交流人數。,學年度;學期;設立別;學校類別;學校統計處代碼;學校名稱;系所代碼;系所名稱;學制班別(日間);進修交流國家(地區)別;進修交流國家(地區)區域別;本國學生出國進修交流至少1學期(修讀學分)以上人數小計;本國學生出國進修交流至少1學期(修讀學分)以上人數男;本國學生出國進修交流至少1學期(修讀學分)以上人數女;本國學生出國進修交流未滿1學期(修讀學分)人數小計;本國學生出國進修交流未滿1學期(修讀學分)人數男;本國學生出國進修交流未滿1學期(修讀學分)人數女,教育部高等教育司
教育部獎勵私立大學校院務發展計畫之各校核定經費,24739,公布教育部獎勵私立大學校院發展計畫各校核定經費,學校名稱;103年度獎補助經費;104年度獎補助經費;105年度獎補助經費;106年度獎補助經費;107年度獎補助經費;108年度獎補助經費,教育部高等教育司
國立自然科學博物館104年度法定預算,24879,國立自然科學博物館104年度法定預算主要表(含收支預計表、餘絀撥補預計表及現金流量預計表),SEQNO;LEVEL;BOLD;前年度決算數-金額;前年度決算數-百分比;科目;本年度預算數-金額;本年度預算數-百分比;上年度預算數-金額;上年度預算數-百分比;比較增減-金額;比較增減-百分比;項目;預算數;說明,國立自然科學博物館
