資料集名稱,資料集識別碼,資料集描述,主要欄位說明,提供機關
中部科學園區管理局及所屬單位預算預算表(預算案),12136,歲入來源別預算表、歲出機關別預算表、歲入項目說明提要表、歲出計畫提要及分支計畫概況表、各項費用彙計表、歲出一級用途別科目分析表、資本支出分析表、人事費分析表、預算員額明細表、公務車輛明細表、現有辦公房舍明細表、補助經費分析表、捐助經費分析表、派員出國計畫預算總表、派員出國計畫預算類別表－開會、派員赴大陸計畫預算類別表、歲出按職能及經濟性綜合分類表、跨年期計畫概況表、委辦經費分析表,,科技部中部科學園區管理局
中部科學園區管理局及所屬單位預算預算表(法定),12230,歲入來源別預算表、歲出機關別預算表、歲入項目說明提要表、歲出計畫提要及分支計畫概況表、各項費用彙計表、歲出一級用途別科目分析表、資本支出分析表、人事費分析表、預算員額明細表、公務車輛明細表、現有辦公房舍明細表、補助經費分析表、捐助經費分析表、派員出國計畫預算總表、派員出國計畫預算類別表－開會、派員赴大陸計畫預算類別表、歲出按職能及經濟性綜合分類表、跨年期計畫概況表、委辦經費分析表,,科技部中部科學園區管理局
科技部新竹科學園區管理局單位預算(預算案),12419,科技部新竹科學園區管理局單位預算表,,科技部新竹科學園區管理局
科學園區管理局作業基金附屬單位預算(預算案),12452,科學園區管理局作業基金附屬單位預算(預算案),,科技部新竹科學園區管理局
科技部單位預算及科發基金附屬單位預算表(預算案),12623,科技部單位預算：歲入來源別預算表、歲出機關別預算表、歲入項目說明提要表、歲出計畫提要及分支計畫概況表、各項費用彙計表、歲出一級用途別科目分析表、資本支出分析表、人事費分析表、預算員額明細表、公務車輛明細表、現有辦公房舍明細表、捐助經費分析表、派員出國計畫預算總表、派員出國計畫預算類別表－開會、歲出按職能及經濟性綜合分類表、跨年期計畫概況表、委辦經費分析表。科發基金附屬單位預算：基金來源、用途及餘絀預計表、現金流量預計表,,科技部
科技部單位預算及科發基金附屬單位預算表(法定預算),12624,科技部單位預算：歲入來源別預算表、歲出機關別預算表、歲入項目說明提要表、歲出計畫提要及分支計畫概況表、各項費用彙計表、歲出一級用途別科目分析表、資本支出分析表、人事費分析表、預算員額明細表、公務車輛明細表、現有辦公房舍明細表、捐助經費分析表、派員出國計畫預算總表、派員出國計畫預算類別表－開會、歲出按職能及經濟性綜合分類表、跨年期計畫概況表、委辦經費分析表。科發基金附屬單位預算：基金來源、用途及餘絀預計表、現金流量預計表,,科技部
南部科學園區管理局單位預算(預算案),13215,歲入來源別預算表、歲出機關別預算表、歲入項目說明提要表、歲出計畫提要及分支計畫概況表、各項費用彙計表、歲出一級用途別科目分析表、資本支出分析表、人事費分析表、預算員額明細表、公務車輛明細表、現有辦公房舍明細表、補助經費分析表、捐助經費分析表、派員出國計畫預算總表、派員出國計畫預算類別表－開會、派員赴大陸計畫預算類別表、歲出按職能及經濟性綜合分類表、跨年期計畫概況表、委辦經費分析表,,科技部南部科學園區管理局
中部科學園區管理局及所屬單位預算會計報告,18617,歲入累計表、經費累計表、以前年度歲入轉入數累計表、以前年度歲出轉入數累計表、平衡表,,科技部中部科學園區管理局
政府研究資訊系統(GRB)資料目錄集,18707,"(1) 政府研究資訊系統(Government Research Bulletin, 簡稱 GRB)收錄82年迄今行政院所屬各機關研究計畫資料，並就可公開之研究計畫資料提供查詢、瀏覽及全文下載。 (2) 所收錄之研究報告，智慧財產均屬研究計畫所屬機關或計畫主持人，如欲進一步瞭解報告內容或提供改進意見，請直接連絡計畫主辦機關或計畫主持人。 主要欄位說明︰系統編號、計畫編號、計畫中文名稱、計畫英文名稱、執行單位名稱、年度、計畫主管機關、研究方式、研究性質、研究領域、本期研究期間、本期經費(千元)、計畫主持人、研究人員、中文關鍵詞、英文關鍵詞、中文摘要URL、英文摘要URL",,科技部
科學園區管理局作業基金會計月報,18738,收支餘絀表、平衡表、購建固定資產計畫執行情形明細表,,科技部新竹科學園區管理局
南部科學園區管理局單位預算會計報告,18740,歲入（經費）累計表、以前年度歲入（出）轉入數累計表、歲出用途別累計表、繳付公庫數分析表、公庫撥入數分析表、包括平衡表、收入支出表、長期投資、固定資產、遞耗資產及無形資產變動表、預算執行與會計收支對照表,,科技部南部科學園區管理局
新竹科學園區管理局員工職務資訊,18743,提供管理局在職員工職務資料,組室;職稱;姓名;業務職掌;電話,科技部新竹科學園區管理局
科學園區管理局作業基金附屬單位決算（審定）,18744,納有收支餘絀決算表、平衡表、固定資產建設改良擴充計畫預算與實際進度比較表,SEQNO;LEVEL;BOLD;科目;本年度預算數-金額;本年度預算數-百分比;本年度決算數-金額;本年度決算數-百分比;比較增減-金額;比較增減-百分比;上年度決算數-金額;上年度決算數-百分比;項目;預算數;決算數;計畫名稱;全部計畫;全部計畫-目標能量;全部計畫-進度起訖年月;可用預算數-以前年度保留數;可用預算數-本年度預算數;可用預算數-本年度奉准先行辦理數;可用預算數-調整數;可用預算數-合計;可用預算數-占全部計畫百分比;截至本年度累計數;截至本年度累計數-占全部計畫百分比;決算數-本年度金額;決算數-本年度金額占可用預算數百分比;決算數-截至本年度累計數金額;截至本年度累計決算數占累計預算數百分比;未達成或超過預算之原因,科技部新竹科學園區管理局
科學園區管理局作業基金附屬單位預算（法定）,18746,納有收支預計表、餘絀撥補預計表、現金流量預計表,,科技部新竹科學園區管理局
新竹科學園區管理局單位決算(審定),18747,納有歲入來源別決算表、歲出政事別決算表、歲出機關別決算表、以前年度歲入來源別轉入數決算表、以前年度歲出政事別轉入數決算表、以前年度歲出機關別轉入數決算表、平衡表、資本資產表、現金出納表等,會計年度;款;項;目;節;預算科目編號;預算科目名稱;細目編號;細目名稱;預算數_原預算數;預算數_預算增減數;預算數_合計1;決算數_實現數;決算數_應收數;決算數_保留數;決算數_合計2;預決算比較增減數;決算數占預算數之比率;分計畫編號;分計畫名稱;用途別編號;用途別名稱;原預算數;預算追加減數;動支第一預備金數;動支第二預備金數;經費流用數;預算調整數;預算增減數小計;預算數合計1;實現數;應付數;保留數;決算數合計2;預算年度;以前年度轉入數_應收數;以前年度轉入數_保留數;本年度減免註銷數_應收數;本年度減免註銷數_保留數;本年度實現數_應收數;本年度實現數_保留數;本年度調整數_應收數;本年度調整數_保留數;本年度未結清數_應收數;本年度未結清數_保留數;以前年度轉入數_應付數;本年度減免註銷數_應付數;本年度實現數_應付數;本年度調整數_應付數;本年度未結清數_應付數;月份;基金別;會計分類;使用機關別;科目分類;會計科目編號;會計科目名稱;本年度金額;上年度金額,科技部新竹科學園區管理局
新竹科學園區管理局及所屬單位會計月報,18816,歲入累計表、經費累計表、以前年度歲入轉入數累計表、以前年度歲出轉入數累計表、平衡表,,科技部新竹科學園區管理局
南部科學園區管理局單位決算,18836,南部科學園區管理局單位決算,,科技部南部科學園區管理局
科技部單位預算會計報告,19875,經費類平衡表、經費類現金出納表、經費累計表、以前年度歲出保留數餘額表、歲入類平衡表、歲入類現金出納表、歲入累計表等,,科技部
科技部單位決算,19878,歲入來源別決算表、歲出政事別決算表、歲出機關別決算表、以前年度歲出政事別轉入數決算表、以前年度歲出機關別轉入數決算表、歲入類平衡表、經費類平衡表等,,科技部
中部科學園區管理局及所屬單位決算,20024,納有歲入來源別決算表、歲出政事別決算表、歲出機關別決算表、以前年度歲入來源別轉入數決算表、以前年度歲出政事別轉入數決算表、以前年度歲出機關別轉入數決算表、歲入類平衡表、經費類平衡表等,,科技部中部科學園區管理局
科發基金附屬單位決算,20473,基金來源、用途及餘絀決算表、現金流量決算表、平衡表,,科技部
科發基金附屬單位預算會計報告,20488,平衡表、基金來源、用途及餘絀表,,科技部
科技部政府資料開放諮詢小組會議紀錄,26945,配合政府資料開放政策，設立政府資料開放諮詢小組，召開會議作成紀錄，以達施政便民及公開透明之目的。,資料集名稱;下載連結,科技部
科技部政府資料開放行動策略,27920,配合政府資料開放政策，擬定科技部政府資料開放行動策略，落實政府資料開放。,資料集名稱;下載連結,科技部
南部科學園區管理局設施維護維修資訊,30680,南部科學園區管理局設施維護維修資訊,項次;園區;標案名稱;通報日期;完工日期;維修地點;實作內容,科技部南部科學園區管理局
南部科學園區工商服務業廠商資訊,30684,南部科學園區工商服務業廠商資訊,,科技部南部科學園區管理局
科技部生農環境與多樣性學門專題計畫補助清冊,34722,科技部生農環境與多樣性學門專題計畫補助清冊,,科技部
科技部農產資源科學學門專題計畫補助清冊,34723,科技部農產資源科學學門專題計畫補助清冊,,科技部
科技部生物科學學門專題計畫補助清冊,34724,科技部生物科學學門專題計畫補助清冊,,科技部
科技部形態及生理醫學學門專題計畫補助清冊,34730,科技部形態及生理醫學學門專題計畫補助清冊,年度;學門;計畫名稱;執行機關;執行期限(起);執行期限(迄),科技部
科技部生化及藥理醫學學門專題計畫補助清冊,35093,科技部生化及藥理醫學學門專題計畫補助清冊,,科技部
科技部微免及檢驗醫學學門專題計畫補助清冊,35211,科技部微免及檢驗醫學學門專題計畫補助清冊,,科技部
科技部藥學及中醫藥學學門專題計畫補助清冊,35212,科技部藥學及中醫藥學學門專題計畫補助清冊,,科技部
科技部食品與營養保健學門專題計畫補助清冊,35213,科技部食品與營養保健學門專題計畫補助清冊,,科技部
科技部社會醫學學門專題計畫補助清冊,35214,科技部社會醫學學門專題計畫補助清冊,,科技部
科技部工程醫學學門專題計畫補助清冊,35216,科技部工程醫學學門專題計畫補助清冊,年度;學門;計畫名稱;機關代碼;執行期限(起);執行期限(訖),科技部
科技部消化醫學學門專題計畫補助清冊,35250,科技部消化醫學學門專題計畫補助清冊,,科技部
科技部心臟醫學學門專題計畫補助清冊,35427,科技部心臟醫學學門專題計畫補助清冊,,科技部
科技部胸腔醫學學門專題計畫補助清冊,39374,科技部胸腔醫學學門專題計畫補助清冊,,科技部
科技部神經醫學學門專題計畫補助清冊,39375,科技部神經醫學學門專題計畫補助清冊,,科技部
科技部婦幼醫學學門專題計畫補助清冊,39378,科技部婦幼醫學學門專題計畫補助清冊,,科技部
科技部血液、腫瘤、免疫及感染醫學學門專題計畫補助清冊,39379,公共資訊: 係指各種財政統計報表、政策新聞、資訊服務、法律等相關資料集,,科技部
科技部腎臟泌尿及內分泌醫學學門專題計畫補助清冊,39380,公共資訊: 係指各種財政統計報表、政策新聞、資訊服務、法律等相關資料集,,科技部
科技部感官系統醫學學門專題計畫補助清冊,39382,公共資訊: 係指各種財政統計報表、政策新聞、資訊服務、法律等相關資料集,,科技部
科技部生技類核心設施平台維運計畫清單,39383,科技部生技類核心設施平台維運計畫清單,年度;學門;計畫名稱;執行機構;執行期限(起);執行期限(迄),科技部
科技部施政計畫,39384,科技部年度施政計畫，包括計畫名稱及計畫內容,計畫名稱;計畫內容,科技部
科技部施政績效,39386,科技部年度施政績效之報告及評核結果，包括報告及評核結果、連結網址,報告及評核結果;連結網址,科技部
科技部性別統計專區,39387,科技部辦理性別主流化專案之統計表報、國際指標及研究報告等,資料名稱;連結網址,科技部
科技部科技行政研究報告,39388,科技部同仁之科技行政研究報告之連結網址,資料名稱;連結網址,科技部
科技部傑出特約研究員獎統計資料集,39389,科技部辦理傑出特約研究員獎之獲獎人數統計資料,獲獎年度;機關類別;機關名稱;獲獎人數,科技部
科技部吳大猷先生紀念獎統計資料集,39390,科技部辦理吳大猷先生紀念獎之獲獎人數統計資料,獲獎年度;機關類別;機關名稱;性別;學術司處;獲獎人數,科技部
科技部專題研究計畫(研究案)申請及核定統計資料集,39392,科技部補助專題研究計畫(研究案)以機關為單位之申請及核定統計資料，包括機構類別、機關名稱、申請件數、核定件數、申請金額、核定金額、申請案主持人男性、女性人次、核定計畫主持人男性、女性人次,,科技部
科技部專題研究計畫(補助案)申請及核定統計資料集,39393,科技部補助專題研究計畫(補助案)以機關為單位之申請及核定統計資料，包括機構類別、機關名稱、申請件數、核定件數、申請金額、核定金額、申請案主持人男性、女性人次、核定計畫主持人男性、女性人次,,科技部
科技部專題研究計畫(研究案)申請計畫主持人統計資料集,39395,科技部補助專題研究計畫(研究案)以機關為單位之申請計畫主持人統計資料，包括性別、學歷、申請人數,,科技部
科技部專題研究計畫(研究案)核定計畫主持人統計資料集,39396,公共資訊: 係指各種財政統計報表、政策新聞、資訊服務、法律等相關資料集,,科技部
科技部專題研究計畫(補助案)申請計畫主持人統計資料集,39397,科技部補助專題研究計畫(補助案)以機關為單位之申請計畫主持人統計資料，包括性別、學歷、申請人數,,科技部
科技部專題研究計畫(補助案)核定計畫主持人統計資料集,39398,科技部補助專題研究計畫(補助案)以機關為單位之核定計畫主持人統計資料，包括性別、學歷、核定人數,,科技部
科技部大專學生研究計畫申請及核定計畫(依學生就讀學校)統計資料集,39399,科技部補助大專學生研究計畫以學生就讀學校為單位之申請及核定統計資料，包括機關類別、機關名稱、申請件數、核定件數、申請金額、核定金額、申請計畫學生男性、女性人數、核定計畫學生男性、女性人數,,科技部
科技部大專學生研究計畫申請及核定計畫(依指導教授任職機構)統計資料集,39400,科技部補助大專學生研究計畫以指導教授任職機關為單位之申請及核定統計資料，包括機關類別、機關名稱、申請件數、核定件數、申請金額、核定金額、申請計畫學生男性、女性人數、核定計畫學生男性、女性人數,,科技部
科發基金半年結算報告,39543,基金來源、用途及餘絀結算表、平衡表,,科技部
科技部國家賠償事件處理情形統計表,39544,科技部歷次受理之國賠案件處理情形統計表,107年度辦理國家賠償事件處理情形統計表;,科技部
科技部採購作業參考手冊,39545,蒐集類案採購(標的)統整建立之參考作業手冊，提供辦理參考,資料集名稱;下載連結,科技部
科技部檔案及政府資訊開放應用作業要點,39546,科技部檔案及政府資訊開放應用作業要點及附件,資料集名稱;下載連結,科技部
科技部傑出研究獎統計資料集,39588,科技部辦理傑出研究獎之申請及獲獎人數統計資料,獲獎年度;機關類別;機關名稱;性別;學術司處;申請人數;獲獎人數,科技部
科技部統計學門專題計畫補助清冊,39591,科技部統計學門專題計畫補助清冊,序號;年度;學門子領域;計畫名稱;機構;執行起始日;執行訖止日,科技部
科技部數學學門專題計畫補助清冊,39603,科技部數學學門專題計畫補助清冊,序號;年度;學門子領域;計畫名稱;機構;執行起始日;執行訖止日,科技部
科技部物理學門專題計畫補助清冊,39604,科技部物理學門專題計畫補助清冊,序號;年度;學門子領域;計畫名稱;機構;執行起始日;執行訖止日,科技部
科技部化學學門專題計畫補助清冊,39605,科技部化學學門專題計畫補助清冊,序號;年度;學門子領域;計畫名稱;機構;執行起始日;執行訖止日,科技部
科技部地球科學學門專題計畫補助清冊,39606,科技部地球科學學門專題計畫補助清冊,序號;年度;學門子領域;計畫名稱;機構;執行起始日;執行訖止日,科技部
科技部大氣學門專題計畫補助清冊,39607,科技部大氣學門專題計畫補助清冊,序號;年度;學門子領域;計畫名稱;機構;執行起始日;執行訖止日,科技部
科技部海洋學門專題計畫補助清冊,39608,科技部海洋學門專題計畫補助清冊,序號;年度;學門子領域;計畫名稱;機構;執行起始日;執行訖止日,科技部
科技部防災學門專題計畫補助清冊,39609,科技部防災學門專題計畫補助清冊,序號;年度;學門子領域;計畫名稱;機構;執行起始日;執行訖止日,科技部
科技部永續學門專題計畫補助清冊,39610,科技部永續學門專題計畫補助清冊,序號;年度;學門子領域;計畫名稱;機構;執行起始日;執行訖止日,科技部
科技部空間資訊學門專題計畫補助清冊,39611,科技部空間資訊學門專題計畫補助清冊,序號;年度;學門子領域;計畫名稱;機構;執行起始日;執行訖止日,科技部
科技部主管預算表(預算案),40037,歲入來源別預算表、歲出政事別預算表、歲出機關別預算表,,科技部
科技部主管預算表(法定預算),40038,歲入來源別預算表、歲出政事別預算表、歲出機關別預算表,,科技部
科技部主管預算半年結算報告,40039,歲入來源別結算表、歲出機關別結算表,,科技部
科技部主管決算,40040,歲入來源別決算表、歲出政事別決算表、歲出機關別決算表,,科技部
科技部年度訴願案件收辦統計表,40192,科技部歷次受理之訴願案件收辦統計表,,科技部
科技部年度訴願決定經行政法院裁判結果統計表,40193,科技部年度訴願決定經行政法院裁判結果統計表,年別;訴願案經高等行政法院裁判件數合計;裁判駁回上訴件數;裁判撤銷原處分件數,科技部
ICT產業研發經費,40194,1.為便於瞭解及掌握我國科技研究發展狀況，進而建立科技指標，並與他國作客觀比較作為國家制定科技發展政策之參考，科技部每年定期辦理「全國研發狀況調查」。本資料集為「全國研發狀況調查」之統計結果之一。 2.“..”係指無任何數值。,年;產業別;研發經費總計,科技部
ICT產業研發人力_全時約當數,40195,"1.為便於瞭解及掌握我國科技研究發展狀況，進而建立科技指標，並與他國作客觀比較作為國家制定科技發展政策之參考，科技部每年定期辦理「全國研發狀況調查」。本資料集為「全國研發狀況調查」之統計結果之一。 2.全時約當數(Full-time Equivalent, FTE)係指從事某項研發工作的人數，經折算為全時間從事該項工作的人數。例如某一研究人員全年花一半的工作時間從事教學工作，一半的工作時間做研發，則此一研究人員相當於0.5個「全時約當數」(或0.5人年)；若全時間從事(每年250個工作日計)研究，則相當於1個「全時約當數」。出處：法城手冊(OECD) 3.“..”係指無數值。 4.“0”係指不及一單位。",年;產業別;類別;研發人力;研究人員;技術人員;支援人員,科技部
"製造業(ISIC, Rev.3.1)研發經費－依技術密集度區分",40196,1.為便於瞭解及掌握我國科技研究發展狀況，進而建立科技指標，並與他國作客觀比較作為國家制定科技發展政策之參考，科技部每年定期辦理「全國研發狀況調查」。本資料集為「全國研發狀況調查」之統計結果之一。 2.OECD對於技術密集產業分類定義係以國際標準行業分類(第3.1版)為基礎。 3.“..”係指無任何數值。,年;產業別;研發經費總計,科技部
"製造業(ISIC, Rev.3.1)研發人力全時約當數－依技術密集度區分",40197,"1.為便於瞭解及掌握我國科技研究發展狀況，進而建立科技指標，並與他國作客觀比較作為國家制定科技發展政策之參考，科技部每年定期辦理「全國研發狀況調查」。本資料集為「全國研發狀況調查」之統計結果之一。 2.OECD對於技術密集產業分類定義係以國際標準行業分類(第3.1版)為基礎。 3.全時約當數(Full-time Equivalent, FTE)係指從事某項研發工作的人數，經折算為全時間從事該項工作的人數。例如某一研究人員全年花一半的工作時間從事教學工作，一半的工作時間做研發，則此一研究人員相當於0.5個「全時約當數」(或0.5人年)；若全時間從事(每年250個工作日計)研究，則相當於1個「全時約當數」。出處：法城手冊(OECD) 4.“..”係指無數值。 5.“0”係指不及一單位。",,科技部
國家科學技術發展計畫(民國102年至105年),40198,國家科學技術發展計畫(民國102年至105年)、重要措施分工及列管、附錄、English Version,本文;https://www.most.gov.tw/most/attachments/6fdbc974-f8ec-466e-ae8f-13fd0e283e92,科技部
中華民國科學技術白皮書(民國104年至107年),40199,中華民國科學技術白皮書(民國104年至107年)、附錄、摘要、English Version,本文;https://www.most.gov.tw/most/attachments/03791ce9-0299-48f6-8c2c-b5d9d9c522f7,科技部
科技部科學園區開發情形表,40474,科技部科學園區開發情形表,,科技部
科技部研究計畫受補助單位名單資料集,40477,條列科技部研究計畫受補助單位名單,1;國立臺灣大學,科技部
科技部補助全國性學術團體辦理學術推廣業務Q&A問答資料集,40478,條列科技部補助全國性學術團體辦理學術推廣業務有關Q&A問答集。,張貼日期;問題內容;回覆內容,科技部
科技部貴重儀器開放共同管理平台(跨部會),40479,科技部貴重儀器開放共同管理平台(跨部會),編號;儀器補助部會;儀器營運單位;中文儀器名稱;英文儀器名稱;應用領域;放置地點;儀器負責人;儀器負責人連絡電話;管理技術人員;管理技術人員連絡電話;儀器購置年分;單位公務用上年度全年使用時數;對外服務上年度全年使用時數;每周可對外時數;是否對外提供服務;儀器設備功能簡介;服務規則;該儀器之連結網址;備註;儀器型號,科技部
科技部科學園區土地規劃情形表,40482,科技部科學園區土地規劃情形表,,科技部
科技部科學園區開發經費統計,40488,科技部科學園區開發經費統計,,科技部
科技部科學園區新投資案核准情形,40490,科技部科學園區新投資案核准情形,,科技部
科技部科學園區性別與外籍員工統計,40502,科技部科學園區性別與外籍員工統計,,科技部
科技部科學園區廠商研發經費投入情形,40503,科技部科學園區廠商研發經費投入情形,,科技部
科技部科學園區專利數,40504,科技部科學園區專利數,,科技部
科技部文學一學門專題計畫補助清冊,40519,科技部文學一學門專題計畫補助清冊,(核定)年度;學門(3碼);學門;計畫名稱;執行機關;執行期限(起);執行期限(迄),科技部
科技部文學二學門專題計畫補助清冊,40520,科技部文學二學門專題計畫補助清冊,執行年度;學門;機關名稱;計畫中文名稱;執行期限(起);執行期限(迄),科技部
