資料集名稱,資料集識別碼,資料集描述,主要欄位說明,提供機關
南投縣政府消防局防焰制度執行情形,78398,南投縣政府消防局防焰制度執行情形,105年第4季防燄規制執行情形-設置防焰物品場所,南投縣政府
南投縣使用牌照稅徵績,78399,根據資料倉儲管理系統(LDW)產製，於每年4月及10月開徵,種類;查定數輛數;查定數稅額;徵起數輛數;徵起數稅額;徵績輛數(%);徵績稅額(%),南投縣政府
南投縣政府綜合大樓親子放映室播放影片節目表,78401,南投縣政府綜合大樓播放影片節目表(107年),影片名稱;放映日期;電話;時間;聯絡人;放映地點,南投縣政府
南投縣火災次數分類及時間月報,78402,南投縣火災次數分類及時間月報,105年12月份火災次數分類及時間,南投縣政府
南投縣政府專戶存款支票兌付地點,78404,南投縣政府專戶存款支票兌付地點,南投縣政府專戶存款支票兌付地點,南投縣政府
南投縣房屋稅徵績,78405,根據資料倉儲管理系統(LDW)產製,查定數-戶件數;查定數-本稅;徵起數-戶件數;徵起數-本稅;徵績-戶件數;徵績-本稅,南投縣政府
南投縣政府稅務局歲出機關別決算表,78406,提供預算數、決算數之實現數、預付數、尚未支付數、應付數、保留數等比較及剔除經費繳庫數,科目-款;科目-項;科目-目;科目-節;科目-名稱及編號;預算數-原預算數;預算數-預算增減數;預算數-合計;決算數-實現數;決算數-應收數;決算數-保留數;決算數-合計;比較增減數;決算數占預算數之比率;預算數-本年度預算數;決算數-應付數-已預付之數;決算數-應付數-尚未支付數;決算數-應付數-小計;決算數-保留數-已預付之數;決算數-保留數-尚未支付數;決算數-保留數-小計;剔除經費繳庫數;說明;預算數-預算增減數-預算追加減數;預算數-預算增減數-動支第二預備金數;預算數-預算增減數-預算調整數;預算數-預算增減數-動支第一預備金數;預算數-預算增減數-經費流用數;預算數-預算增減數-小計;決算數-應付數;預決算比較增減數,南投縣政府
南投縣政府消防局檢修申報執行統計,78408,南投縣政府消防局檢修申報執行統計,105年下半年消防安全設備檢修申報,南投縣政府
臺灣銀行股份有限公司南投分公司擬轉委託代理縣分庫暨代收稅款處之金融機構一覽表<br>(106.3.17版),78409,臺灣銀行股份有限公司南投分公司擬轉委託代理縣分庫暨代收稅款處之金融機構一覽表 (106.3.17版),鄉/鎮/市;代理縣分庫;代收稅款處<br>,南投縣政府
南投縣政府消防局燃氣熱水器承裝業及其技術士合格名冊,78410,南投縣政府消防局燃氣熱水器承裝業及其技術士合格名冊,106年1月南投縣政府消防局燃氣熱水器承裝業及其技術士合格名冊,南投縣政府
南投縣政府消防局消防安全列管數量統計,78412,南投縣政府消防局消防安全列管數量統計,105年下半年消防安全檢查列管數量統計,南投縣政府
南投縣政府稅務局歲入來源別決算表,78473,提供預算數、決算數、保留數之增減及比例,科目-款;科目-項;科目-目;科目-節;科目-名稱及編號;預算數-本年度預算數;預算數-預算增減數;預算數-合計;決算數-實現數;決算數-應收數-已預收之數;決算數-應收數-尚未收入數;決算數-應收數-小計;決算數-保留數;決算數-合計;比較增減數;說明;預算數-原預算數;決算數-應收數;決算數占預算數之比率,南投縣政府
南投縣電梯設備工程費概算表,78634,一、電梯設備工程超過「電梯設備工程費概算表」內所列規格者，其工程費之計算，比照「南投縣簡化評定房屋標準價格及房屋現值作業要點」第七點房屋總層數超過「房屋標準單價表」內所列總層數者，其標準單價，按最高層次與次高層之差額逐層遞增計算之規定，載客人數以每增二人為一級距，按表內23人與21人之價格差額逐層遞增計算；速度以每分鐘增加15公尺為一級距，按表內速度每分鐘135公尺與120公尺之價格差額逐級遞增計算。 二、電梯設備工程在「電梯設備工程費概算表」內未列規格者，如其規格在上一級與次一級之間者，其工程費之計算按次一級之單價計算，即：載客人數為14人適用表內13人之工程費。 三、電梯設備工程中未載明載客人數，則依電梯載重量，按每人67公斤估算載客人數，未達1人者不計。 四、如納稅義務人購買電梯設備價格低於本縣訂定標準，得提示相關證明文件，按其實際價格認定。,載客人數-停階數;速度每分15M;速度每分30M;速度每分45M;速度每分60M;速度每分75M;速度每分90M;速度每分105M;速度每分120M;速度每分135M,南投縣政府
南投縣房屋地段等級評定表,78635,提供各鄉鎮市地段等級及調整率,鄉鎮市別;實施範圍;等級;調整率,南投縣政府
南投縣道路交通事故資料統計表,78636,南投縣政府警察局統計道路交通事故資料(A1、A2、A3),管轄單位;A1件數;A1死亡;A1受傷;A2件數;A2受傷;A3件數;總計件數;總計死亡;總計受傷;<br>,南投縣政府
南投縣房屋標準單價表,78637,105年12月31日以前核發使用執照及建築完成之新建、增建、改建房屋，適用「南投縣房屋標準單價表-105」；106年1月1日起核發使用執照及建築完成之新建、增建、改建房屋，適用「南投縣房屋標準單價表-106」。,總層數;鋼骨造-第一類;鋼骨混凝土造-第一類;鋼骨鋼筋混凝土造-第一類;鋼骨造-第二類;鋼骨混凝土造-第二類;鋼骨鋼筋混凝土造-第二類;鋼骨造-第三類;鋼骨混凝土造-第三類;鋼骨鋼筋混凝土造-第三類;鋼骨造-第四類;鋼骨混凝土造-第四類;鋼骨鋼筋混凝土造-第四類;鋼筋混凝土造-第一類;預鑄混凝土造-第一類;鋼筋混凝土造-第二類;預鑄混凝土造-第二類;鋼筋混凝土造-第三類;預鑄混凝土造-第三類;鋼筋混凝土造-第四類;預鑄混凝土造-第四類;加強磚造-第一類;加強磚造-第二類;加強磚造-第三類;加強磚造-第四類;鋼鐵造-未達200㎡-各種用途;鋼鐵造-200㎡以上-各種用途;木造-各種用途;石造-各種用途;磚造-各種用途;土造-各種用途;竹造-各種用途,南投縣政府
南投縣政府警察局違規車輛保管場,78638,拖吊場地址及電話,名稱;設置位置;電話;<br>,南投縣政府
南投縣各類房屋折舊率及耐用年數標準表,78639,105年12月31日以前新建、增建、改建完成房屋，適用「南投縣各類房屋折舊率及耐用年數標準表-105」；106年1月1日以後新建、增建、改建完成房屋，適用「南投縣各類房屋折舊率及耐用年數標準表-106」。,構造別;代號;折舊率;耐用年數;殘值率,南投縣政府
南投縣政府警察局警光山莊,78640,警光山莊地址及電話,名稱;地址;電話;<br>,南投縣政府
南投縣防空避難設備統計表,78641,南投縣防空避難設備數量,區域別(防空避難設備所屬轄區分局);數量(防空避難設備數量);容量(防空避難設備容納總人數)<br>;容量(防空避難設備容納總人數),南投縣政府
105年金融財稅統計年報,78642,南投縣105年度金融財稅資料,包含欄位：「營業基金」;「非營業特種基金」;「作業基金」;「特別收入基金」...等預算和決算資料;包含欄位：「年底別及鄉鎮市別」;「總計」;「本國銀行」;「農會信用部」;「本國壽險公司」;「本國產險公司」...等;包含欄位：「年度別」;「稅課收入」;「工程受益費及信託管理收入」;「罰款及賠償收入」;「規費收入」;「財產收入」;「營業盈餘及事業收入」...等;包含欄位：「年(月)底別」;「本國銀行存款」;「外國銀行在華分行存款」;「基層金融機構存款」;「中華郵政公司存款」;「本國銀行放款」;「外國銀行在華分行放... 等;「福利服務支出」;「國民就業支出」;「醫療保健支出」;「社區發展支出」;「環境保護支出」...等;「融資調度需求」;「融資調度財源」;「自有財源比率」;「賦稅依存度」;「補助依存度」;「債務未償餘額」等;「印花稅」;「使用牌照稅」;「土石採取景觀維護特別稅」;「地價稅」;「土地增值稅」;「房屋稅」;「娛樂稅」;「契稅」...等;包含欄位：「年度及稅目別」;「實徵數」;「納庫數」;「未納庫數」...等;包含欄位：「年度及月別」;「警政支出」;「債務支出」;「協助及補助支出」;「其他支出」;「以前年度支出」;「預算外支出」...等;「本年度收入」;「一般政務支出」;「教育科學文化支出」;「經濟發展支出」;「社會福利支出」...等;包含欄位：「稅課收入」;「工程受益收入」;「罰款及規費收入」;「信託管理收入」;「營業盈餘及事業收入」...等預算和決算資料;包含欄位：「政權行使支出」;「行政支出」;「民政支出」;「財務支出」;「教育支出」...等預算和決算資料,南投縣政府
南投縣失蹤人口統計,78643,南投縣內失蹤人口受理件數及查獲件數,月份(1至12月);受理件數(受理失蹤人口件數);查獲件數(查獲失蹤人口件數) ;查獲件數(查獲失蹤人口件數),南投縣政府
南投縣合法保全公司,78644,南投縣政府警察局轄區保全公司,公司名稱(保全公司名稱);管轄分局(本局所屬分局)<br>,南投縣政府
南投縣信義鄉防災避難地圖,87332,南投縣信義鄉防災避難地圖,信義鄉避難地圖,南投縣政府
南投縣鹿谷鄉防災避難地圖,87333,南投縣鹿谷鄉防災避難地圖,鹿谷鄉避難地圖,南投縣政府
南投縣仁愛鄉防災避難地圖,87334,南投縣仁愛鄉防災避難地圖,仁愛鄉避難地圖,南投縣政府
南投縣中寮鄉防災避難地圖,87335,南投縣中寮鄉防災避難地圖,中寮鄉避難地圖,南投縣政府
南投縣名間鄉防災避難地圖,87336,南投縣名間鄉防災避難地圖,名間鄉避難地圖,南投縣政府
南投縣國姓鄉防災避難地圖,87337,南投縣國姓鄉防災避難地圖,國姓鄉避難地圖,南投縣政府
南投縣草屯鎮防災避難地圖,87338,南投縣草屯鎮防災避難地圖,草屯鎮避難地圖,南投縣政府
南投縣魚池鄉防災避難地圖,87339,南投縣魚池鄉防災避難地圖,魚池鄉避難地圖,南投縣政府
南投縣竹山鎮防災避難地圖,87340,南投縣竹山鎮防災避難地圖,竹山鎮避難地圖,南投縣政府
南投縣水里鄉防災避難地圖,87341,南投縣水里鄉防災避難地圖,水里鄉避難地圖,南投縣政府
南投縣埔里鎮防災避難地圖,87342,南投縣埔里鎮防災避難地圖,埔里鎮避難地圖,南投縣政府
南投縣集集鎮防災避難地圖,87343,南投縣集集鎮防災避難地圖,集集鎮避難地圖,南投縣政府
南投縣公私協力及私立托嬰中心,91653,依據兒童及少年福利與權益保障法第23條及第75條辦理公私協力及私立托嬰中心，提供0-2歲兒童托育服務。,性質;資源彙整機關;辦理單位;成立日期;立案文號;負責人;連絡電話;傳真;電子郵件;地址;核定收托人數;相關網址;X坐標;Y坐標;備註;最後更新時間<br>;最後更新時間,南投縣政府
南投縣兒童及少年安置教養機構,91977,依據兒童及少年福利與權益保障法第 75 條辦理「兒童及少年安置及教養機構」。,性質;資源彙整機關;辦理單位;成立日期;立案文號;負責人;連絡電話;傳真;電子郵件;地址;核准收托或安置人數;相關網址;X坐標;Y坐標;備註;最後更新時間<br>,南投縣政府
106年各鄉鎮市歲入預決算(按來源別分),91978,包含欄位：「年度及鄉鎮市別」、「稅課收入」、「工程受益費收入」、「罰款及賠償收入」、「規費收入」、「財產收入」、「營業盈餘及事業收入」...等預算和決算資料,包含欄位：「年度及鄉鎮市別」;「稅課收入」;「工程受益費收入」;「罰款及賠償收入」;「規費收入」;「財產收入」;「營業盈餘及事業收入」...等預算和決算資料,南投縣政府
南投縣兒童及少年福利服務中心,91979,兒童及少年福利服務中心,性質;資源彙整機關;辦理單位;成立日期; 立案文號;負責人;連絡電話;傳真;電子郵件;地址; 相關網址;X坐標; Y坐標;備註; 最後更新時間,南投縣政府
106年歲出預決算(按政事別分),91980,包含欄位：「年度別」、「政權行使支出」、「行政支出」、「民政支出」、「財務支出」、「教育支出」...等預算和決算資料,包含欄位：「年度別」;「政權行使支出」;「行政支出」;「民政支出」;「財務支出」;「教育支出」...等預算和決算資料,南投縣政府
南投縣早期療育服務個案管理中心,91981,早期療育服務個案管理中心,性質;資源彙整機關;辦理單位;成立日期; 立案文號;負責人;連絡電話;傳真;電子郵件;地址; 相關網址;X坐標; Y坐標;備註; 最後更新時間,南投縣政府
106年縣公庫收支,91982,包含欄位：「年度別」、「本年度收入」、「以前年度收入」、「預算外收入」、「本年度支出」、「以前年度支出」、「預算外支出」、「公庫結存」...等,包含欄位：「年度別」;「本年度收入」;「以前年度收入」;「預算外收入」;「本年度支出」;「以前年度支出」;「預算外支出」;「公庫結存」...等,南投縣政府
106年鄉鎮市公庫收支,91983,包含欄位：「年度別」、「本年度收入」、「以前年度收入」、「預算外收入」、「本年度支出」、「以前年度支出」、「預算外支出」、「公庫結存」...等,包含欄位：「年度別」;「本年度收入」;「以前年度收入」;「預算外收入」;「本年度支出」;「以前年度支出」;「預算外支出」;「公庫結存」...等,南投縣政府
106年金融機構分布,91984,包含欄位：「年底及鄉鎮市別」、「總計」、「本國銀行」、「農會信用部」、「本國壽險公司」、「本國產險公司」...等,包含欄位：「年底別及鄉鎮市別」;「總計」;「本國銀行」;「農會信用部」;「本國壽險公司」;「本國產險公司」...等,南投縣政府
106年各項稅捐納庫數,91985,包含欄位：「年度及稅目別」、「實徵數」、「納庫數」、「未納庫數」...等,包含欄位：「年度及稅目別」;「實徵數」;「納庫數」;「未納庫數」...等,南投縣政府
106年金融機構存放、款餘額,91986,包含欄位：「年底別」、「本國銀行存款」、「外國銀行在臺分行存款」、「信用合作社存款」、「郵政儲金匯業局存款」、「本國銀行放款」、「外國銀行在臺分行放款」... 等,包含欄位：「年底別」;「本國銀行存款」;「外國銀行在臺分行存款」;「信用合作社存款」;「郵政儲金匯業局存款」;「本國銀行放款」;「外國銀行在臺分行放款」... 等,南投縣政府
106年營業基金及非營業特種基金盈虧（餘絀）,91987,包含欄位：「年度別」、「營業基金」、「非營業特種基金」...等,包含欄位：「年度別」;「營業基金」;「非營業特種基金」...等,南投縣政府
106年歲入預決算(按來源別分),91988,包含欄位：「年度別」、「總計」、「稅課收入」、「罰款及賠償收入」、「規費收入」、「財產收入」、「營業盈餘及事業收入」...等預算和決算資料,包含欄位：「年度別」;「總計」;「稅課收入」;「罰款及賠償收入」;「規費收入」;「財產收入」;「營業盈餘及事業收入」...等預算和決算資料,南投縣政府
106年各項稅捐實徵數,91989,包含欄位：「年度別」、「總計」、「國稅」、「縣稅」、「教育捐」、「罰鍰」...等,包含欄位：「年度別」;「總計」;「國稅」;「縣稅」;「教育捐」;「罰鍰」...等,南投縣政府
南投縣早期療育服務通報轉介中心,91990,依據兒童及少年福利與權益保障法第4條、第23條及第32條提供發展遲緩兒童通報轉介服務。,性質;資源彙整機關;辦理單位;成立日期;立案文號;負責人;連絡電話;傳真;電子郵件;地址; 相關網址;X坐標; Y坐標;備註; 最後更新時間,南投縣政府
106年歷年財政狀況,91991,包含欄位：「年度別」、「融資調度需求」、「融資調度財源」、「自籌財源比率」、「賦稅依存度」、「補助及協助依存度」、「債務未償餘額」等,包含欄位：「年度別」;「融資調度需求」;「融資調度財源」;「自籌財源比率」;「賦稅依存度」;「補助及協助依存度」;「債務未償餘額」等,南投縣政府
南投縣公私協力托育資源中心,91992,依據「公私協力托育資源中心推廣及服務品質提升計畫」辦理公私協力托育資源中心。,資源彙整機關;辦理單位;成立日期;連絡電話; 傳真;電子郵件;地址; 相關網址;X坐標;Y坐標;備註;最後更新時間,南投縣政府
106年各鄉鎮市歲出預決算(按政事別分),91993,包含欄位：「年度及鄉鎮市別」、「政權行使支出」、「行政支出」、「民政支出」、「財務支出」、「教育支出」...等預算和決算資料,包含欄位：「年度及鄉鎮市別」;「政權行使支出」;「行政支出」;「民政支出」;「財務支出」;「教育支出」...等預算和決算資料,南投縣政府
108年南投縣政府縣庫支付年報表,92207,此項資料提供南投縣政府集中支付預算科目代號支付數、支出收回數及支付淨額等相關數據。,此項資料係提供南投縣政府集中支付作業情形，相關內容分為七項。一;簽發縣支票情形。二;支票自領情形。三;受理申訴案件分析。四;兌付支票﹝e企﹞回籠銷號。五;空白縣庫支票領發情形。六;憑單收辦及費款支付情形。七;支付費款分析。,南投縣政府
106年南投縣政府財產量值總目錄,92208,106年南投縣政府財產量值總目錄,,南投縣政府
南投縣最近五年地價稅稅源統計表,92244,資料來源：依據南投縣政府稅務局地價稅查定報告表。 所屬期間：每年 1月1日至 12月31日 備註：空地係指依平均地權條例第26條第1項及土地稅法第21條規定課徵空地稅之土地,年度別;總計戶數;總計面積;總計地價;總計查定稅額;一般用地戶數;一般用地面積;一般用地地價;一般用地查定稅額;自用住宅用地戶數;自用住宅用地面積;自用住宅用地地價;自用住宅用地查定稅額;勞工宿舍用地戶數;勞工宿舍用地面積;勞工宿舍用地地價;勞工宿舍用地查定稅額;事業直接使用土地戶數;事業直接使用土地面積;事業直接使用土地地價;事業直接使用土地查定稅額;公共設施保留地戶數;公共設施保留地面積;公共設施保留地地價;公共設施保留地查定稅額;空地戶數;空地面積;空地地價;空地查定稅額,南投縣政府
南投縣最近五年契稅綜合統計表,92245,資料來源：依據CHT708X稅源統計作業系統填表。 所屬期間：每年1月1日至12月31日。 單位：件；新臺幣千元。,年度別;應稅件數;免稅件數;應稅契價;免稅契價;應稅稅額;免稅稅額,南投縣政府
南投縣最近五年土地增值稅稅源統計表,92246,資料來源：依據稅源統計表。 資料所屬期間：每年 1月1日至12月31日。 單位：平方公尺、新臺幣千元。,年度別;稅種;筆數;面積;移轉現值;調整後原地價;改良土地費用;漲價總數額;長期持有減徵;查定稅額;增繳地價抵繳;重劃減徵;徵收減徵;其他減徵;應納稅額,南投縣政府
南投縣最近五年房屋稅綜合統計表,92247,資料來源：依據每年房屋稅查定表編制 所屬期間：自前一年7月1日至當年6月30日 單位：戶；平方公尺；新臺幣千元,年度別;戶數合計;戶數應稅;戶數免稅;面積應稅;面積免稅;現值應稅;現值免稅;稅額合計;稅額本稅,南投縣政府
南投縣單親家庭服務提供單位,94232,提供單親家庭及其子女個別家庭服務(諮詢、會談、諮商、輔導)、法律及社會福利諮詢、親職成長活動(親子教養、喘息等)、教育訓練、講座、工作坊、心理諮商與輔導服務、單親家庭課後輔導與照顧等服務。,資源彙整機關;中心名稱;辦理單位;連絡電話;傳真;電子郵件;地址;服務區域;相關網址;X坐標;Y坐標;備註;最後更新時間<br>;最後更新時間,南投縣政府
南投縣高風險家庭關懷輔導處遇服務提供單位,94233,依兒童及少年高風險家庭關懷輔導處遇實施計畫，經地方政府規劃之機構或團體,資源彙整機關;辦理單位;成立日期;立案文號;負責人;連絡電話;傳真;電子郵件;地址;相關網址;X坐標;Y坐標;備註;最後更新時間 ;最後更新時間<br>,南投縣政府
南投縣居家托育服務單位,94234,原社區保母系統,性質;資源彙整機關;中心名稱;辦理單位;連絡電話;傳真;電子郵件;地址;服務區域;服務時間;相關網址;X坐標;Y坐標;備註;最後更新時間 ;最後更新時間<br>,南投縣政府
南投縣家庭/社會福利服務中心,94235,係社會局（處）分區設置以特定服務區域轄內社區、家庭、家庭成員與弱勢及一般民眾以為服務對象，提供綜融性福利服務之公私立福利單位、設施（不含庇護基金會、協會、收容機構、家暴中心）,資源彙整機關;辦理單位;成立日期;立案文號;負責人;連絡電話;傳真;電子郵件;地址;相關網址;X坐標;Y坐標;備註;最後更新時間;最後更新時間,南投縣政府
南投縣政府原始捐贈之財團法人一覽表,94609,名稱、地址、立案時間,名稱;地址;立案時間,南投縣政府
南投縣農產品產期,94792,南投縣農產品產期,type;month;crop;variety;county;town;<br>,南投縣政府
南投縣加工產品,94793,id、經營業者(producter)、聯絡人(contact)、產品類別(class)、產品名稱(product)、所在縣市(county)、標章類別(mark)、電話(tel)、郵件(email),id;經營業者;聯絡人;產品類別;產品名稱;所在縣市;標章類別;電話;郵件;<br>,南投縣政府
南投縣農村再生社區,94794,id、name(社區名稱)、township(鄉鎮)、city(縣市)、people_num(社區人口數)、households_num(社區戶數)、area_total(總面積)、major_industries(主要產業)、resource(特色資源)、class(農村類型)、terrain(地形分區)、race(族群)、features(特色)、vision(願景)、development_zone(重點發展區)、Industrial_development(相關投入資源),id;name;township;city;people_num;households_num;area_total;major_industries;resource;class;terrain;race;features;vision;development_zone;Industrial_development;<br>,南投縣政府
南投縣農特商家介紹(茶葉博覽館),94795,商家名稱(name)、商品名稱(product)、四章一Q認證號(mark)、規格(format)、市價(market price)、售價(price)、備貨數量(stock)、已售數量(sold)、數量(num)上架日期(date)、分類(type),商家名稱;商品名稱;四章一Q認證號;規格;市價;售價;備貨數量;已售數量;數量;上架日期;分類;<br><br>,南投縣政府
南投縣農特商家介紹(伴手禮盒館),94796,商家名稱(name)、商品名稱(product)、四章一Q認證號(mark)、規格(format)、市價(market price)、售價(price)、備貨數量(stock)、已售數量(sold)、數量(num)上架日期(date)、分類(type),商家名稱;商品名稱;四章一Q認證號;規格;市價;售價;備貨數量;已售數量;數量;上架日期;分類;<br>,南投縣政府
南投縣農場,94797,南投縣農場名單,name;address;tel;<br>,南投縣政府
南投縣各鄉鎮農產品,94798,南投縣各鄉鎮農產品,type;month;crop;variety;county;town;<br>,南投縣政府
南投縣休閒農場,94799,name(農場名稱)、tel(農場電話)、address(農場地址),name;tel;address;<br>,南投縣政府
衛生安全製茶場名單,94800,id、鄉鎮(town)、登陸編號(number)、名稱(name)、負責人(producter)、衛生安全評鑑等級(level),id;鄉鎮;登陸編號;名稱;負責人;衛生安全評鑑等級;<br><br>,南投縣政府
南投縣農會產銷班概況,94801,縣市(county)、鄉鎮(town)、產銷班班名(class name)、產業類別(class)、輔導單位(coach)、班員數(num)、經營面積(area)、主要產品(main product),縣市;鄉鎮;產銷班班名;產業類別;輔導單位;班員數;經營面積;主要產品;<br>,南投縣政府
南投縣農民概況,94802,南投縣農民概況,id;產品分類;生產者;產品名稱;安全等級;月供貨量;產季;最小出貨量;<br>,南投縣政府
南投縣有機農場,94803,id、經營業者名稱(name)、應證機構/應證字號(CB/NO)、產品品項(crop)驗證場所地址(address),id;經營業者名稱;應證機構/應證字號;產品品項;驗證場所地址;<br>,南投縣政府
