我國對外投資統計-國家(地區)別,我國對外投資統計-國家(地區)別,7476,以國家別的視角呈現我國對外投資統計資料,地區;核准臺商對外投資─件數(2019年5月);核准臺商對外投資─金額(百萬美元)(2019年5月);核准臺商對外投資─金額比重(2019年5月);核准臺商對外投資─件數(2019年6月);核准臺商對外投資─金額(百萬美元)(2019年6月);核准臺商對外投資─金額比重(2019年6月);核准臺商對外投資─件數(2019年1-6月);核准臺商對外投資─金額(百萬美元)(2019年1-6月);核准臺商對外投資─金額比重(2019年1-6月);核准臺商對外投資─件數(1991-2019年6月累計);核准臺商對外投資─金額(百萬美元)(1991-2019年6月累計);核准臺商對外投資─金額比重(1991-2019年6月累計);核准臺商對外投資─件數(2019年7月);核准臺商對外投資─金額(百萬美元)(2019年7月);核准臺商對外投資─金額比重(2019年7月);核准臺商對外投資─件數(2019年1-7月);核准臺商對外投資─金額(百萬美元)(2019年1-7月);核准臺商對外投資─金額比重(2019年1-7月);核准臺商對外投資─件數(1991-2019年7月累計);核准臺商對外投資─金額(百萬美元)(1991-2019年7月累計);核准臺商對外投資─金額比重(1991-2019年7月累計);核准臺商對外投資─件數(2019年8月);核准臺商對外投資─金額(百萬美元)(2019年8月);核准臺商對外投資─金額比重(2019年8月);核准臺商對外投資─件數(2019年1-8月);核准臺商對外投資─金額(百萬美元)(2019年1-8月);核准臺商對外投資─金額比重(2019年1-8月);核准臺商對外投資─件數(1991-2019年8月累計);核准臺商對外投資─金額(百萬美元)(1991-2019年8月累計);核准臺商對外投資─金額比重(1991-2019年8月累計);核准臺商對外投資─件數(2019年9月);核准臺商對外投資─金額(百萬美元)(2019年9月);核准臺商對外投資─金額比重(2019年9月);核准臺商對外投資─件數(2019年1-9月);核准臺商對外投資─金額(百萬美元)(2019年1-9月);核准臺商對外投資─金額比重(2019年1-9月);核准臺商對外投資─件數(1991-2019年9月累計);核准臺商對外投資─金額(百萬美元)(1991-2019年9月累計);核准臺商對外投資─金額比重(1991-2019年9月累計);核准臺商對外投資─件數(2019年10月);核准臺商對外投資─金額(百萬美元)(2019年10月);核准臺商對外投資─金額比重(2019年10月);核准臺商對外投資─件數(2019年1-10月);核准臺商對外投資─金額(百萬美元)(2019年1-10月);核准臺商對外投資─金額比重(2019年1-10月);核准臺商對外投資─件數(1991-2019年10月累計);核准臺商對外投資─金額(百萬美元)(1991-2019年10月累計);核准臺商對外投資─金額比重(1991-2019年10月累計);核准臺商對外投資─件數(2019年11月);核准臺商對外投資─金額(百萬美元)(2019年11月);核准臺商對外投資─金額比重(2019年11月);核准臺商對外投資─件數(2019年1-11月);核准臺商對外投資─金額(百萬美元)(2019年1-11月);核准臺商對外投資─金額比重(2019年1-11月);核准臺商對外投資─件數(1991-2019年11月累計);核准臺商對外投資─金額(百萬美元)(1991-2019年11月累計);核准臺商對外投資─金額比重(1991-2019年11月累計);核准臺商對外投資─件數(2019年12月);核准臺商對外投資─金額(百萬美元)(2019年12月);核准臺商對外投資─金額比重(2019年12月);核准臺商對外投資─件數(2019年1-12月);核准臺商對外投資─金額(百萬美元)(2019年1-12月);核准臺商對外投資─金額比重(2019年1-12月);核准臺商對外投資─件數(1991-2019年12月累計);核准臺商對外投資─金額(百萬美元)(1991-2019年12月累計);核准臺商對外投資─金額比重(1991-2019年12月累計);核准臺商對外投資─件數(2020年1月);核准臺商對外投資─金額(百萬美元)(2020年1月);核准臺商對外投資─金額比重(2020年1月);核准臺商對外投資─件數(2020年1-1月);核准臺商對外投資─金額(百萬美元)(2020年1-1月);核准臺商對外投資─金額比重(2020年1-1月);核准臺商對外投資─件數(1991-2020年1月累計);核准臺商對外投資─金額(百萬美元)(1991-2020年1月累計);核准臺商對外投資─金額比重(1991-2020年1月累計);核准臺商對外投資─件數(2020年2月);核准臺商對外投資─金額(百萬美元)(2020年2月);核准臺商對外投資─金額比重(2020年2月);核准臺商對外投資─件數(2020年1-2月);核准臺商對外投資─金額(百萬美元)(2020年1-2月);核准臺商對外投資─金額比重(2020年1-2月);核准臺商對外投資─件數(1991-2020年2月累計);核准臺商對外投資─金額(百萬美元)(1991-2020年2月累計);核准臺商對外投資─金額比重(1991-2020年2月累計);核准臺商對外投資─件數(2020年3月);核准臺商對外投資─金額(百萬美元)(2020年3月);核准臺商對外投資─金額比重(2020年3月);核准臺商對外投資─件數(2020年1-3月);核准臺商對外投資─金額(百萬美元)(2020年1-3月);核准臺商對外投資─金額比重(2020年1-3月);核准臺商對外投資─件數(1991-2020年3月累計);核准臺商對外投資─金額(百萬美元)(1991-2020年3月累計);核准臺商對外投資─金額比重(1991-2020年3月累計),大陸委員會
我國廠商擴大運用早期收穫計畫-ECFA原產地證明書核發情形,我國廠商擴大運用早期收穫計畫-ECFA原產地證明書核發情形,43126,我國廠商擴大運用早期收穫計畫-ECFA原產地證明書核發情形,項目;核發件數;核發金額,大陸委員會
捐助經費分析表,捐助經費分析表,12929,本會相關預算資料,項目;資料資源網址,大陸委員會
政府兩岸政策重要文件(中、英文),政府兩岸政策重要文件(中、英文),58947,本會印製之政府兩岸政策重要文件(中、英文版)，含總統重要談話文件及陸委會有關兩岸政策相關說明,時間;連結網址,大陸委員會
教育部補助大陸地區臺商學校實施要點,教育部補助大陸地區臺商學校實施要點,58012,實施要點,中央部會名稱;補助或獎勵相關辦法;連結網址,大陸委員會
教育部補助辦理兩岸(含港澳)學術教育交流活動實施要點,教育部補助辦理兩岸（含港澳）學術教育交流活動實施要點,42585,教育部補助辦理兩岸（含港澳）學術教育交流活動實施要點,中央部會名稱;補助或獎勵相關辦法;連結網址,大陸委員會
教育部體育署全國性民間體育活動團體經費補助辦法,教育部體育署全國性民間體育活動團體經費補助辦法,42597,教育部體育署全國性民間體育活動團體經費補助辦法,中央部會名稱;補助或獎勵相關辦法;連結網址,大陸委員會
教育部體育署國際體育交流活動推動及補助辦法,教育部體育署國際體育交流活動推動及補助辦法,42598,教育部體育署國際體育交流活動推動及補助辦法,中央部會名稱;補助或獎勵相關辦法;連結網址,大陸委員會
文化部補助國內表演藝術經典作品大陸巡演作業要點,文化部補助國內表演藝術經典作品大陸巡演作業要點,42590,文化部補助國內表演藝術經典作品大陸巡演作業要點,中央部會名稱;補助或獎勵相關辦法;連結網址,大陸委員會
文化部補助文化團體及個人參與多面向拓展文化交流處理要點,文化部補助文化團體及個人參與多面向拓展文化交流處理要點,42591,文化部補助文化團體及個人參與多面向拓展文化交流處理要點,中央部會名稱;補助或獎勵相關辦法;連結網址,大陸委員會
文化部補助民間團體辦理兩岸傳播或新聞交流活動作業要點,文化部補助民間團體辦理兩岸傳播或新聞交流活動作業要點,42592,文化部補助民間團體辦理兩岸傳播或新聞交流活動作業要點,中央部會名稱;補助或獎勵相關辦法;連結網址,大陸委員會
文化部補助視覺藝術產業辦理或參加國際藝術展會作業要點,文化部補助視覺藝術產業辦理或參加國際藝術展會作業要點,42594,文化部補助視覺藝術產業辦理或參加國際藝術展會作業要點,中央部會名稱;補助或獎勵相關辦法;連結網址,大陸委員會
施政績效,大陸委員會施政績效,58085,大陸委員會施政績效,項目;次項;內容;績效;,大陸委員會
書面之公共工程及採購契約目錄,書面之公共工程及採購契約目錄,13198,列舉本會採購契約之目錄，自103年起轉請至政府電子採購網查詢。,序號;標的名稱,大陸委員會
書面業務報告,大陸委員會書面業務報告,58093,大陸委員會書面業務報告,會期;報告人;內容,大陸委員會
會計報告,大陸委員會會計報告,20840,本會會計報告內容,會計年度;月份;款;項;目;節;預算年度;預算科目編號;預算科目名稱;細目編號;細目名稱;原預算數;追加減數;截至本月止累計分配數_1;本月實現數;截至本月止累計實現數_2;應收收入數_3;分配數預算餘額_4;分支計畫編號;分支計畫名稱;用途別編號;用途別名稱;第一預備金;第二預備金;經費流用數;預算調整數;應付數;已分配尚未執行數;備註_預暫付數;以前年度轉入數;保留數;減免;截至本月止累計實現數;調整數;尚未執行數;基金別;會計分類;使用機關別;科目分類;會計科目編號;會計科目名稱;金額;科目名稱;取得成本;以前年度累計折舊_長期投資評價;本年度資本資產成本變動_增加數;本年度資本資產成本變動_減少數;本年度累計折舊_長期投資評價變動數;期末帳面金額;備註;業務計畫或工作計畫;經資門;執行數;項目;收入實現數;減項_收入待納庫數;加項_以前年度待納庫繳庫數;加項_以前年度撥款於本年度繳還數_材料;加項_以前年度撥款於本年度繳還數_存出保證金;加項_以前年度撥款於本年度繳還數_其他應收款;加項_預收款;加項_剔除經費;繳付公庫數;一級用途別編號;一級用途別名稱;支出實現數;加項_預付款;加項_材料;加項_存出保證金;加項_零用金;加項_退還收入預收款;加項_其他應收款;減項_以前年度撥款於本年度實現數;公庫撥入數;公庫分配數餘額;金額_本月數;金額_累計數,大陸委員會
有關中國大陸對臺灣威嚇打壓的看法,有關中國大陸對臺灣威嚇打壓的看法,97665,有關中國大陸對臺灣威嚇打壓的看法,調查日期;題目;非常友善/非常同意/非常贊成/非常有幫助/非常支持;友善/同意/贊成/有幫助/支持;不友善/不同意/不贊成/沒有幫助/不支持;非常不友善/非常不同意/非常不贊成/完全沒幫助/非常不支持;不知道/無意見,大陸委員會
有關民眾對中國大陸阻擾我國際參與的看法,有關民眾對中國大陸阻擾我國際參與的看法,97661,有關民眾對中國大陸阻擾我國際參與的看法,調查日期;題目;非常友善/非常同意/非常贊成/非常有幫助/非常支持;友善/同意/贊成/有幫助/支持;不友善/不同意/不贊成/沒有幫助/不支持;非常不友善/非常不同意/非常不贊成/完全沒幫助/非常不支持;不知道/無意見,大陸委員會
有關民眾對兩岸溝通協商的看法,有關民眾對兩岸溝通協商的看法,97660,有關民眾對兩岸溝通協商的看法,調查日期;題目;非常友善/非常同意/非常贊成/非常有幫助/非常支持;友善/同意/贊成/有幫助/支持;不友善/不同意/不贊成/沒有幫助/不支持;非常不友善/非常不同意/非常不贊成/完全沒幫助/非常不支持;不知道/無意見,大陸委員會
有關民眾對臺灣的未來及兩岸關係發展的看法,有關民眾對臺灣的未來及兩岸關係發展的看法,97664,有關民眾對臺灣的未來及兩岸關係發展的看法,調查日期;題目;非常友善/非常同意/非常贊成/非常有幫助/非常支持;友善/同意/贊成/有幫助/支持;不友善/不同意/不贊成/沒有幫助/不支持;非常不友善/非常不同意/非常不贊成/完全沒幫助/非常不支持;不知道/無意見,大陸委員會
本國銀行在中國大陸現況統計表,本國銀行在中國大陸現況統計表,43113,本國銀行在中國大陸現況統計表,銀行;分支行子行已開業;分支行子行申請案已獲核准;辦事處,大陸委員會
本會出版品,本會出版品,9079,本會出版品一覽表,編號;書名;出版日期,大陸委員會
本會協處之臺港澳交流統計表,本會協處之臺港澳交流統計表,97676,港澳各界人士來臺參訪及我相關團體赴港澳交流之團數及人數統計,年度;團數;人數,大陸委員會
本會委託研究,本會委託研究,9080,本會委託研究一覽,完成之研究;完成時間,大陸委員會
本會民意調查,本會民意調查,9078,呈現民意調查結果,,大陸委員會
本會立院報告,本會立院報告,42539,本會立院報告,會期;委員會會議;標題;日期;連結網址,大陸委員會
本會長官公開講稿,本會長官公開講稿,42538,本會長官公開講稿,標題;日期;連結網址,大陸委員會
核准臺商對中國大陸投資統計-地區別,核准臺商對中國大陸投資統計-地區別,7474,呈現核准臺商對中國大陸投資統計以地區別的維度視角,地區;核准臺商對中國大陸投資─件數(2019年5月);核准臺商對中國大陸投資─金額(百萬美元)(2019年5月);核准臺商對中國大陸投資─金額比重(2019年5月);核准臺商對中國大陸投資─件數(2019年6月);核准臺商對中國大陸投資─金額(百萬美元)(2019年6月);核准臺商對中國大陸投資─金額比重(2019年6月);核准臺商對中國大陸投資─件數(2019年1-6月);核准臺商對中國大陸投資─金額(百萬美元)(2019年1-6月);核准臺商對中國大陸投資─金額比重(2019年1-6月);核准臺商對中國大陸投資─件數(1991-2019年6月累計);核准臺商對中國大陸投資─金額(百萬美元)(1991-2019年6月累計);核准臺商對中國大陸投資─金額比重(1991-2019年6月累計);核准臺商對中國大陸投資─件數(2019年7月);核准臺商對中國大陸投資─金額(百萬美元)(2019年7月);核准臺商對中國大陸投資─金額比重(2019年7月);核准臺商對中國大陸投資─件數(2019年1-7月);核准臺商對中國大陸投資─金額(百萬美元)(2019年1-7月);核准臺商對中國大陸投資─金額比重(2019年1-7月);核准臺商對中國大陸投資─件數(1991-2019年7月累計);核准臺商對中國大陸投資─金額(百萬美元)(1991-2019年7月累計);核准臺商對中國大陸投資─金額比重(1991-2019年7月累計);核准臺商對中國大陸投資─件數(2019年8月);核准臺商對中國大陸投資─金額(百萬美元)(2019年8月);核准臺商對中國大陸投資─金額比重(2019年8月);核准臺商對中國大陸投資─件數(2019年1-8月);核准臺商對中國大陸投資─金額(百萬美元)(2019年1-8月);核准臺商對中國大陸投資─金額比重(2019年1-8月);核准臺商對中國大陸投資─件數(1991-2019年8月累計);核准臺商對中國大陸投資─金額(百萬美元)(1991-2019年8月累計);核准臺商對中國大陸投資─金額比重(1991-2019年8月累計);核准臺商對中國大陸投資─件數(2019年9月);核准臺商對中國大陸投資─金額(百萬美元)(2019年9月);核准臺商對中國大陸投資─金額比重(2019年9月);核准臺商對中國大陸投資─件數(2019年1-9月);核准臺商對中國大陸投資─金額(百萬美元)(2019年1-9月);核准臺商對中國大陸投資─金額比重(2019年1-9月);核准臺商對中國大陸投資─件數(1991-2019年9月累計);核准臺商對中國大陸投資─金額(百萬美元)(1991-2019年9月累計);核准臺商對中國大陸投資─金額比重(1991-2019年9月累計);核准臺商對中國大陸投資─件數(2019年10月);核准臺商對中國大陸投資─金額(百萬美元)(2019年10月);核准臺商對中國大陸投資─金額比重(2019年10月);核准臺商對中國大陸投資─件數(2019年1-10月);核准臺商對中國大陸投資─金額(百萬美元)(2019年1-10月);核准臺商對中國大陸投資─金額比重(2019年1-10月);核准臺商對中國大陸投資─件數(1991-2019年10月累計);核准臺商對中國大陸投資─金額(百萬美元)(1991-2019年10月累計);核准臺商對中國大陸投資─金額比重(1991-2019年10月累計);核准臺商對中國大陸投資─件數(2019年11月);核准臺商對中國大陸投資─金額(百萬美元)(2019年11月);核准臺商對中國大陸投資─金額比重(2019年11月);核准臺商對中國大陸投資─件數(2019年1-11月);核准臺商對中國大陸投資─金額(百萬美元)(2019年1-11月);核准臺商對中國大陸投資─金額比重(2019年1-11月);核准臺商對中國大陸投資─件數(1991-2019年11月累計);核准臺商對中國大陸投資─金額(百萬美元)(1991-2019年11月累計);核准臺商對中國大陸投資─金額比重(1991-2019年11月累計);核准臺商對中國大陸投資─件數(2019年12月);核准臺商對中國大陸投資─金額(百萬美元)(2019年12月);核准臺商對中國大陸投資─金額比重(2019年12月);核准臺商對中國大陸投資─件數(2019年1-12月);核准臺商對中國大陸投資─金額(百萬美元)(2019年1-12月);核准臺商對中國大陸投資─金額比重(2019年1-12月);核准臺商對中國大陸投資─件數(1991-2019年12月累計);核准臺商對中國大陸投資─金額(百萬美元)(1991-2019年12月累計);核准臺商對中國大陸投資─金額比重(1991-2019年12月累計);核准臺商對中國大陸投資─件數(2020年1月);核准臺商對中國大陸投資─金額(百萬美元)(2020年1月);核准臺商對中國大陸投資─金額比重(2020年1月);核准臺商對中國大陸投資─件數(2020年1-1月);核准臺商對中國大陸投資─金額(百萬美元)(2020年1-1月);核准臺商對中國大陸投資─金額比重(2020年1-1月);核准臺商對中國大陸投資─件數(1991-2020年1月累計);核准臺商對中國大陸投資─金額(百萬美元)(1991-2020年1月累計);核准臺商對中國大陸投資─金額比重(1991-2020年1月累計);核准臺商對中國大陸投資─件數(2020年2月);核准臺商對中國大陸投資─金額(百萬美元)(2020年2月);核准臺商對中國大陸投資─金額比重(2020年2月);核准臺商對中國大陸投資─件數(2020年1-2月);核准臺商對中國大陸投資─金額(百萬美元)(2020年1-2月);核准臺商對中國大陸投資─金額比重(2020年1-2月);核准臺商對中國大陸投資─件數(1991-2020年2月累計);核准臺商對中國大陸投資─金額(百萬美元)(1991-2020年2月累計);核准臺商對中國大陸投資─金額比重(1991-2020年2月累計),大陸委員會
核准臺商對中國大陸投資統計-行業別,核准臺商對中國大陸投資統計-行業別,7475,以行業別的視角呈現核准臺商對中國大陸投資統計資料,行業別;核准臺商對中國大陸投資─件數(2019年5月);核准臺商對中國大陸投資─金額(百萬美元)(2019年5月);核准臺商對中國大陸投資─金額比重(2019年5月);核准臺商對中國大陸投資─件數(2019年6月);核准臺商對中國大陸投資─金額(百萬美元)(2019年6月);核准臺商對中國大陸投資─金額比重(2019年6月);核准臺商對中國大陸投資─件數(2019年1-6月);核准臺商對中國大陸投資─金額(百萬美元)(2019年1-6月);核准臺商對中國大陸投資─金額比重(2019年1-6月);核准臺商對中國大陸投資─件數(1991-2019年6月累計);核准臺商對中國大陸投資─金額(百萬美元)(1991-2019年6月累計);核准臺商對中國大陸投資─金額比重(1991-2019年6月累計);;核准臺商對中國大陸投資─件數(2019年7月);核准臺商對中國大陸投資─金額(百萬美元)(2019年7月);核准臺商對中國大陸投資─金額比重(2019年7月);核准臺商對中國大陸投資─件數(2019年1-7月);核准臺商對中國大陸投資─金額(百萬美元)(2019年1-7月);核准臺商對中國大陸投資─金額比重(2019年1-7月);核准臺商對中國大陸投資─件數(1991-2019年7月累計);核准臺商對中國大陸投資─金額(百萬美元)(1991-2019年7月累計);核准臺商對中國大陸投資─金額比重(1991-2019年7月累計);核准臺商對中國大陸投資─件數(2019年8月);核准臺商對中國大陸投資─金額(百萬美元)(2019年8月);核准臺商對中國大陸投資─金額比重(2019年8月);核准臺商對中國大陸投資─件數(2019年1-8月);核准臺商對中國大陸投資─金額(百萬美元)(2019年1-8月);核准臺商對中國大陸投資─金額比重(2019年1-8月);核准臺商對中國大陸投資─件數(1991-2019年8月累計);核准臺商對中國大陸投資─金額(百萬美元)(1991-2019年8月累計);核准臺商對中國大陸投資─金額比重(1991-2019年8月累計);核准臺商對中國大陸投資─件數(2019年9月);核准臺商對中國大陸投資─金額(百萬美元)(2019年9月);核准臺商對中國大陸投資─金額比重(2019年9月);核准臺商對中國大陸投資─件數(2019年1-9月);核准臺商對中國大陸投資─金額(百萬美元)(2019年1-9月);核准臺商對中國大陸投資─金額比重(2019年1-9月);核准臺商對中國大陸投資─件數(1991-2019年9月累計);核准臺商對中國大陸投資─金額(百萬美元)(1991-2019年9月累計);核准臺商對中國大陸投資─金額比重(1991-2019年9月累計);核准臺商對中國大陸投資─件數(2019年10月);核准臺商對中國大陸投資─金額(百萬美元)(2019年10月);核准臺商對中國大陸投資─金額比重(2019年10月);核准臺商對中國大陸投資─件數(2019年1-10月);核准臺商對中國大陸投資─金額(百萬美元)(2019年1-10月);核准臺商對中國大陸投資─金額比重(2019年1-10月);核准臺商對中國大陸投資─件數(1991-2019年10月累計);核准臺商對中國大陸投資─金額(百萬美元)(1991-2019年10月累計);核准臺商對中國大陸投資─金額比重(1991-2019年10月累計);核准臺商對中國大陸投資─件數(2019年11月);核准臺商對中國大陸投資─金額(百萬美元)(2019年11月);核准臺商對中國大陸投資─金額比重(2019年11月);核准臺商對中國大陸投資─件數(2019年1-11月);核准臺商對中國大陸投資─金額(百萬美元)(2019年1-11月);核准臺商對中國大陸投資─金額比重(2019年1-11月);核准臺商對中國大陸投資─件數(1991-2019年11月累計);核准臺商對中國大陸投資─金額(百萬美元)(1991-2019年11月累計);核准臺商對中國大陸投資─金額比重(1991-2019年11月累計);核准臺商對中國大陸投資─件數(2019年12月);核准臺商對中國大陸投資─金額(百萬美元)(2019年12月);核准臺商對中國大陸投資─金額比重(2019年12月);核准臺商對中國大陸投資─件數(2019年1-12月);核准臺商對中國大陸投資─金額(百萬美元)(2019年1-12月);核准臺商對中國大陸投資─金額比重(2019年1-12月);核准臺商對中國大陸投資─件數(1991-2019年12月累計);核准臺商對中國大陸投資─金額(百萬美元)(1991-2019年12月累計);核准臺商對中國大陸投資─金額比重(1991-2019年12月累計);核准臺商對中國大陸投資─件數(2020年1月);核准臺商對中國大陸投資─金額(百萬美元)(2020年1月);核准臺商對中國大陸投資─金額比重(2020年1月);核准臺商對中國大陸投資─件數(2020年1-1月);核准臺商對中國大陸投資─金額(百萬美元)(2020年1-1月);核准臺商對中國大陸投資─金額比重(2020年1-1月);核准臺商對中國大陸投資─件數(1991-2020年1月累計);核准臺商對中國大陸投資─金額(百萬美元)(1991-2020年1月累計);核准臺商對中國大陸投資─金額比重(1991-2020年1月累計);核准臺商對中國大陸投資─件數(2020年2月);核准臺商對中國大陸投資─金額(百萬美元)(2020年2月);核准臺商對中國大陸投資─金額比重(2020年2月);核准臺商對中國大陸投資─件數(2020年1-2月);核准臺商對中國大陸投資─金額(百萬美元)(2020年1-2月);核准臺商對中國大陸投資─金額比重(2020年1-2月);核准臺商對中國大陸投資─件數(1991-2020年2月累計);核准臺商對中國大陸投資─金額(百萬美元)(1991-2020年2月累計);核准臺商對中國大陸投資─金額比重(1991-2020年2月累計),大陸委員會
核准陸資來臺投資統計,核准陸資來臺投資統計,7477,呈現核准陸資來臺投資統計資料,項目;核准陸資來臺投資-件數;核准陸資來臺投資-金額(千美元),大陸委員會
歲入來源別預算表,歲入來源別預算表,12930,本會相關預算資料,項目;資料資源網址,大陸委員會
歲入累計表,歲入累計表,20382,本會104年度10月份歲入累計表，已同步登載於https://data.gov.tw/dataset/20840,名稱;資料資源網址,大陸委員會
歲入項目說明提要表,歲入項目說明提要表,12931,本會相關預算資料,項目;資料資源網址,大陸委員會
