綜合所得稅主要所得占所得總額百分之5十以上戶數各級距申報統計表,['17525']
綜合所得稅主要所得占所得總額百分之5十以上戶數各縣市申報統計表,['17526']
綜合所得稅主要所得占所得總額百分之5十以上戶數單項分配10分位申報統計表,['17532']
綜合所得稅主要所得占所得總額百分之5十以上戶數單項分配20分位申報統計表,['17533']
綜合所得稅主要所得占所得總額百分之5十以上戶數單項分配5分位申報統計表,['17534']
綜合所得稅主要所得占所得總額百分之5十以上戶數單項分配各級距申報統計表,['17535']
綜合所得稅主要所得占所得總額百分之5十以上戶數單項分配各縣市申報統計表,['17536']
綜合所得稅主要所得占所得總額百分之5十以上戶數百分比10分位申報統計表,['17527']
綜合所得稅主要所得占所得總額百分之5十以上戶數百分比20分位申報統計表,['17528']
綜合所得稅主要所得占所得總額百分之5十以上戶數百分比5分位申報統計表,['17529']
綜合所得稅主要所得占所得總額百分之5十以上戶數百分比各級距申報統計表,['17530']
綜合所得稅主要所得占所得總額百分之5十以上戶數百分比各縣市申報統計表,['17531']
綜合所得稅主要所得占所得總額百分之8十以上戶數10分位申報統計表,['17507']
綜合所得稅主要所得占所得總額百分之8十以上戶數20分位申報統計表,['17508']
綜合所得稅主要所得占所得總額百分之8十以上戶數5分位申報統計表,['17509']
綜合所得稅主要所得占所得總額百分之8十以上戶數各級距申報統計表,['17510']
綜合所得稅主要所得占所得總額百分之8十以上戶數各縣市申報統計表,['17511']
綜合所得稅主要所得占所得總額百分之8十以上戶數單項分配10分位申報統計表,['17517']
綜合所得稅主要所得占所得總額百分之8十以上戶數單項分配20分位申報統計表,['17518']
綜合所得稅主要所得占所得總額百分之8十以上戶數單項分配5分位申報統計表,['17519']
綜合所得稅主要所得占所得總額百分之8十以上戶數單項分配各級距申報統計,['17520']
綜合所得稅主要所得占所得總額百分之8十以上戶數單項分配各縣市申報統計表,['17521']
綜合所得稅主要所得占所得總額百分之8十以上戶數百分比10分位申報統計表,['17512']
綜合所得稅主要所得占所得總額百分之8十以上戶數百分比20分位申報統計表,['17513']
綜合所得稅主要所得占所得總額百分之8十以上戶數百分比5分位申報統計表,['17514']
綜合所得稅主要所得占所得總額百分之8十以上戶數百分比各級距申報統計表,['17515']
綜合所得稅主要所得占所得總額百分之8十以上戶數百分比各縣市申報統計表,['17516']
綜合所得稅主要所得占綜合所得總額百分之5十以上戶數所得稅率申報統計表,['17538']
綜合所得稅主要所得占綜合所得總額百分之8十以上戶數所得稅率申報統計表,['17537']
綜合所得稅依2維條碼申報之各項扣除額10分位申報統計表,['17853']
綜合所得稅依2維條碼申報之各項扣除額20分位申報統計表,['17854']
綜合所得稅依2維條碼申報之各項扣除額5分位申報統計表,['17855']
綜合所得稅依2維條碼申報之各項扣除額各級距申報統計表,['17856']
綜合所得稅依2維條碼申報之各項扣除額各縣市申報統計表,['17857']
綜合所得稅依2維條碼申報之各類所得金額10分位申報統計表,['17858']
綜合所得稅依2維條碼申報之各類所得金額20分位申報統計表,['17859']
綜合所得稅依2維條碼申報之各類所得金額5分位申報統計表,['17860']
綜合所得稅依2維條碼申報之各類所得金額各級距申報統計表,['17862']
綜合所得稅依2維條碼申報之各類所得金額各縣市申報統計表,['17863']
綜合所得稅依2維條碼申報與核定之應納與應補退稅戶數金額10分位申報統計表,['17864']
綜合所得稅依2維條碼申報與核定之應納與應補退稅戶數金額20分位申報統計表,['17865']
綜合所得稅依2維條碼申報與核定之應納與應補退稅戶數金額5分位申報統計表,['17866']
綜合所得稅依2維條碼申報與核定之應納與應補退稅戶數金額各級距申報統計表,['17870']
綜合所得稅依2維條碼申報與核定之應納與應補退稅戶數金額各縣市申報統計表,['17871']
綜合所得稅依一般申報之各項扣除額10分位申報統計表,['17838']
綜合所得稅依一般申報之各項扣除額20分位申報統計表,['17839']
綜合所得稅依一般申報之各項扣除額5分位申報統計表,['17840']
綜合所得稅依一般申報之各項扣除額各級距申報統計表,['17841']
綜合所得稅依一般申報之各項扣除額各縣市申報統計表,['17842']
綜合所得稅依一般申報之各類所得金額10分位申報統計表,['17843']
綜合所得稅依一般申報之各類所得金額20分位申報統計表,['17844']
綜合所得稅依一般申報之各類所得金額5分位申報統計表,['17845']
綜合所得稅依一般申報之各類所得金額各級距申報統計表,['17846']
綜合所得稅依一般申報之各類所得金額各縣市申報統計表,['17847']
綜合所得稅依一般申報申報與核定之應納與應補退稅戶數金額10分位申報統計表,['17848']
綜合所得稅依一般申報申報與核定之應納與應補退稅戶數金額20分位申報統計表,['17849']
綜合所得稅依一般申報申報與核定之應納與應補退稅戶數金額5分位申報統計表,['17850']
綜合所得稅依一般申報申報與核定之應納與應補退稅戶數金額各級距申報統計表,['17851']
綜合所得稅依一般申報申報與核定之應納與應補退稅戶數金額各縣市申報統計表,['17852']
綜合所得稅依所得淨額級距之綜合所得總額應納稅額及稅率申報統計表,['17872']
綜合所得稅依稅額試算之各項扣除額10分位申報統計表,['17875']
綜合所得稅依稅額試算之各項扣除額20分位申報統計表,['17876']
綜合所得稅依稅額試算之各項扣除額5分位申報統計表,['17877']
綜合所得稅依稅額試算之各項扣除額各級距申報統計表,['17878']
綜合所得稅依稅額試算之各項扣除額各縣市申報統計表,['17879']
綜合所得稅依稅額試算之各類所得金額10分位申報統計表,['17880']
綜合所得稅依稅額試算之各類所得金額20分位申報統計表,['17881']
綜合所得稅依稅額試算之各類所得金額5分位申報統計表,['17882']
綜合所得稅依稅額試算之各類所得金額各級距申報統計表,['17883']
綜合所得稅依稅額試算之各類所得金額各縣市申報統計表,['17884']
綜合所得稅依稅額試算申報與核定之應納與應補退稅戶數金額10分位申報統計表,['17885']
綜合所得稅依稅額試算申報與核定之應納與應補退稅戶數金額20分位申報統計表,['17886']
綜合所得稅依稅額試算申報與核定之應納與應補退稅戶數金額5分位申報統計表,['17887']
綜合所得稅依稅額試算申報與核定之應納與應補退稅戶數金額各級距申報統計表,['17888']
綜合所得稅依稅額試算申報與核定之應納與應補退稅戶數金額各縣市申報統計表,['17889']
綜合所得稅依簡式申報之各項扣除額10分位申報統計表,['17905']
綜合所得稅依簡式申報之各項扣除額20分位申報統計表,['17906']
綜合所得稅依簡式申報之各項扣除額5分位申報統計表,['17907']
綜合所得稅依簡式申報之各項扣除額各級距申報統計表,['17908']
綜合所得稅依簡式申報之各項扣除額各縣市申報統計表,['17909']
綜合所得稅依簡式申報之各類所得金額10分位申報統計表,['17910']
綜合所得稅依簡式申報之各類所得金額20分位申報統計表,['17911']
綜合所得稅依簡式申報之各類所得金額5分位申報統計表,['17912']
綜合所得稅依簡式申報之各類所得金額各級距申報統計表,['17913']
綜合所得稅依簡式申報之各類所得金額各縣市申報統計表,['17914']
綜合所得稅依簡式申報申報與核定之應納與應補退稅戶數金額10分位申報統計表,['17915']
綜合所得稅依簡式申報申報與核定之應納與應補退稅戶數金額20分位申報統計表,['17916']
綜合所得稅依簡式申報申報與核定之應納與應補退稅戶數金額5分位申報統計表,['17917']
綜合所得稅依簡式申報申報與核定之應納與應補退稅戶數金額各級距申報統計表,['17918']
綜合所得稅依簡式申報申報與核定之應納與應補退稅戶數金額各縣市申報統計表,['17919']
綜合所得稅依納稅義務人家庭狀況區分之應納稅額及稅率申報統計表,['17874']
綜合所得稅依納稅義務人年齡區分之應納稅額及稅率申報統計表,['17873']
綜合所得稅依網路申報之各項扣除額10分位申報統計表,['17890']
綜合所得稅依網路申報之各項扣除額20分位申報統計表,['17891']
綜合所得稅依網路申報之各項扣除額5分位申報統計表,['17892']
綜合所得稅依網路申報之各項扣除額各級距申報統計表,['17893']
綜合所得稅依網路申報之各項扣除額各縣市申報統計表,['17894']
綜合所得稅依網路申報之各類所得金額10分位申報統計表,['17895']
綜合所得稅依網路申報之各類所得金額20分位申報統計表,['17896']
綜合所得稅依網路申報之各類所得金額5分位申報統計表,['17897']
綜合所得稅依網路申報之各類所得金額各級距申報統計表,['17898']
綜合所得稅依網路申報之各類所得金額各縣市申報統計表,['17899']
綜合所得稅依網路申報申報與核定之應納與應補退稅戶數金額10分位申報統計表,['17900']
綜合所得稅依網路申報申報與核定之應納與應補退稅戶數金額20分位申報統計表,['17901']
綜合所得稅依網路申報申報與核定之應納與應補退稅戶數金額5分位申報統計表,['17902']
綜合所得稅依網路申報申報與核定之應納與應補退稅戶數金額各級距申報統計表,['17903']
綜合所得稅依網路申報申報與核定之應納與應補退稅戶數金額各縣市申報統計表,['17904']
綜合所得稅儲蓄特別扣除額級距10分位申報統計表,['18115']
綜合所得稅儲蓄特別扣除額級距20分位申報統計表,['18116']
綜合所得稅儲蓄特別扣除額級距5分位申報統計表,['18117']
綜合所得稅儲蓄特別扣除額級距各級距申報統計表,['18118']
綜合所得稅儲蓄特別扣除額級距各縣市申報級距統計表,['18119']
綜合所得稅列舉扣除細項戶數及平均金額10分位申報統計表,['17591']
綜合所得稅列舉扣除細項戶數及平均金額20分位申報統計表,['17592']
綜合所得稅列舉扣除細項戶數及平均金額5分位申報統計表,['17593']
綜合所得稅列舉扣除細項戶數及平均金額各級距申報統計表,['17594']
綜合所得稅列舉扣除細項戶數及平均金額各縣市申報統計表,['17595']
綜合所得稅列舉扣除細項戶數金額10分位申報統計表,['17596']
綜合所得稅列舉扣除細項戶數金額20分位申報統計表,['17597']
綜合所得稅列舉扣除細項戶數金額5分位申報統計表,['17598']
綜合所得稅列舉扣除細項戶數金額各級距申報統計表,['17599']
綜合所得稅列舉扣除細項戶數金額各縣市申報統計表,['17600']
綜合所得稅列舉扣除細項戶數金額單項分配10分位申報統計表,['17606']
綜合所得稅列舉扣除細項戶數金額單項分配20分位申報統計表,['17607']
綜合所得稅列舉扣除細項戶數金額單項分配5分位申報統計表,['17608']
綜合所得稅列舉扣除細項戶數金額單項分配各級距申報統計表,['17609']
綜合所得稅列舉扣除細項戶數金額單項分配各縣市申報統計表,['17610']
綜合所得稅列舉扣除細項戶數金額百分比10分位申報統計表,['17601']
綜合所得稅列舉扣除細項戶數金額百分比20分位申報統計表,['17602']
綜合所得稅列舉扣除細項戶數金額百分比5分位申報統計表,['17603']
綜合所得稅列舉扣除細項戶數金額百分比各級距申報統計表,['17604']
綜合所得稅列舉扣除細項戶數金額百分比各縣市申報統計表,['17605']
綜合所得稅各種所得及應納稅額單項分配10分位申報統計表,['18200']
綜合所得稅各種所得及應納稅額單項分配20分位申報統計表,['18201']
綜合所得稅各種所得及應納稅額單項分配5分位申報統計表,['18202']
綜合所得稅各種所得及應納稅額單項分配各級距申報統計表,['18203']
綜合所得稅各種所得及應納稅額單項分配各縣市申報統計表,['18204']
綜合所得稅各級距申報統計表,['8391']
綜合所得稅各縣市申報統計表,['8390']
綜合所得稅各項已繳及應補退稅戶數平均金額10分位申報統計表,['17611']
綜合所得稅各項已繳及應補退稅戶數平均金額20分位申報統計表,['17613']
綜合所得稅各項已繳及應補退稅戶數平均金額5分位申報統計表,['17614']
綜合所得稅各項已繳及應補退稅戶數平均金額各縣市申報統計表,['17615']
綜合所得稅各項已繳及應補退稅戶數金額10分位申報統計表,['17616']
綜合所得稅各項已繳及應補退稅戶數金額20分位申報統計表,['17617']
綜合所得稅各項已繳及應補退稅戶數金額5分位申報統計表,['17618']
綜合所得稅各項已繳及應補退稅戶數金額各級距申報統計表,['17619']
綜合所得稅各項已繳及應補退稅戶數金額各級距申報統計表-縣市別：南投縣,['17623']
綜合所得稅各項已繳及應補退稅戶數金額各級距申報統計表-縣市別：嘉義市,['17634']
綜合所得稅各項已繳及應補退稅戶數金額各級距申報統計表-縣市別：嘉義縣,['17635']
綜合所得稅各項已繳及應補退稅戶數金額各級距申報統計表-縣市別：基隆市,['17628']
綜合所得稅各項已繳及應補退稅戶數金額各級距申報統計表-縣市別：宜蘭縣,['17620']
綜合所得稅各項已繳及應補退稅戶數金額各級距申報統計表-縣市別：屏東縣,['17624']
綜合所得稅各項已繳及應補退稅戶數金額各級距申報統計表-縣市別：彰化縣,['17636']
綜合所得稅各項已繳及應補退稅戶數金額各級距申報統計表-縣市別：新北市,['17631']
綜合所得稅各項已繳及應補退稅戶數金額各級距申報統計表-縣市別：新竹市,['17632']
綜合所得稅各項已繳及應補退稅戶數金額各級距申報統計表-縣市別：新竹縣,['17633']
綜合所得稅各項已繳及應補退稅戶數金額各級距申報統計表-縣市別：桃園縣,['17626']
綜合所得稅各項已繳及應補退稅戶數金額各級距申報統計表-縣市別：澎湖縣,['17641']
綜合所得稅各項已繳及應補退稅戶數金額各級距申報統計表-縣市別：臺中市,['17637']
綜合所得稅各項已繳及應補退稅戶數金額各級距申報統計表-縣市別：臺北市,['17638']
綜合所得稅各項已繳及應補退稅戶數金額各級距申報統計表-縣市別：臺南市,['17640']
綜合所得稅各項已繳及應補退稅戶數金額各級距申報統計表-縣市別：臺東縣,['17639']
綜合所得稅各項已繳及應補退稅戶數金額各級距申報統計表-縣市別：花蓮縣,['17621']
綜合所得稅各項已繳及應補退稅戶數金額各級距申報統計表-縣市別：苗栗縣,['17625']
綜合所得稅各項已繳及應補退稅戶數金額各級距申報統計表-縣市別：連江縣,['17629']
綜合所得稅各項已繳及應補退稅戶數金額各級距申報統計表-縣市別：金門縣,['17622']
綜合所得稅各項已繳及應補退稅戶數金額各級距申報統計表-縣市別：雲林縣,['17630']
綜合所得稅各項已繳及應補退稅戶數金額各級距申報統計表-縣市別：高雄市,['17627']
綜合所得稅各項已繳及應補退稅戶數金額各縣市申報統計表,['17642']
綜合所得稅各項已繳及應補退稅金額占應納總額10分位申報統計表,['17648']
綜合所得稅各項已繳及應補退稅金額占應納總額20分位申報統計表,['17649']
綜合所得稅各項已繳及應補退稅金額占應納總額5分位申報統計表,['17650']
綜合所得稅各項已繳及應補退稅金額占應納總額各級距申報統計表,['17651']
綜合所得稅各項已繳及應補退稅金額占應納總額各縣市申報統計表,['17652']
綜合所得稅各項已繳及應補退稅金額戶數金額單項分配10分位申報統計表,['17643']
綜合所得稅各項已繳及應補退稅金額戶數金額單項分配20分位申報統計表,['17644']
綜合所得稅各項已繳及應補退稅金額戶數金額單項分配5分位申報統計表,['17645']
綜合所得稅各項已繳及應補退稅金額戶數金額單項分配各級距申報統計表,['17646']
綜合所得稅各項已繳及應補退稅金額戶數金額單項分配各縣市申報統計表,['17647']
綜合所得稅各項已繳及應補退稅金額戶數金額單項分配百分比各級距申報統計表,['18179']
綜合所得稅各項扣除額10分位申報統計表,['17653']
綜合所得稅各項扣除額20分位申報統計表,['17654']
綜合所得稅各項扣除額5分位申報統計表,['17655']
綜合所得稅各項扣除額之戶數平均金額10分位申報統計表,['17656']
綜合所得稅各項扣除額之戶數平均金額20分位申報統計表,['17657']
綜合所得稅各項扣除額之戶數平均金額5分位申報統計表,['17658']
綜合所得稅各項扣除額之戶數平均金額各級距申報統計表,['17659']
綜合所得稅各項扣除額之戶數平均金額各縣市申報統計表,['17660']
綜合所得稅各項扣除額占所得總額百分比10分位申報統計表,['17661']
綜合所得稅各項扣除額占所得總額百分比20分位申報統計表,['17662']
綜合所得稅各項扣除額占所得總額百分比5分位申報統計表,['17663']
綜合所得稅各項扣除額占所得總額百分比各級距申報統計表,['17664']
綜合所得稅各項扣除額占所得總額百分比各縣市申報統計表,['17665']
綜合所得稅各項扣除額各級距申報統計表,['8867']
綜合所得稅各項扣除額各級距申報統計表-縣市別：南投縣,['17669']
綜合所得稅各項扣除額各級距申報統計表-縣市別：嘉義市,['17680']
綜合所得稅各項扣除額各級距申報統計表-縣市別：嘉義縣,['17681']
綜合所得稅各項扣除額各級距申報統計表-縣市別：基隆市,['17674']
綜合所得稅各項扣除額各級距申報統計表-縣市別：宜蘭縣,['17666']
綜合所得稅各項扣除額各級距申報統計表-縣市別：屏東縣,['17670']
綜合所得稅各項扣除額各級距申報統計表-縣市別：彰化縣,['17682']
綜合所得稅各項扣除額各級距申報統計表-縣市別：新北市,['17677']
綜合所得稅各項扣除額各級距申報統計表-縣市別：新竹市,['17678']
綜合所得稅各項扣除額各級距申報統計表-縣市別：新竹縣,['17679']
綜合所得稅各項扣除額各級距申報統計表-縣市別：桃園縣,['17672']
綜合所得稅各項扣除額各級距申報統計表-縣市別：澎湖縣,['18184']
綜合所得稅各項扣除額各級距申報統計表-縣市別：臺中市,['18180']
綜合所得稅各項扣除額各級距申報統計表-縣市別：臺北市,['18181']
綜合所得稅各項扣除額各級距申報統計表-縣市別：臺南市,['18183']
綜合所得稅各項扣除額各級距申報統計表-縣市別：臺東縣,['18182']
綜合所得稅各項扣除額各級距申報統計表-縣市別：花蓮縣,['17667']
綜合所得稅各項扣除額各級距申報統計表-縣市別：苗栗縣,['17671']
綜合所得稅各項扣除額各級距申報統計表-縣市別：連江縣,['17675']
綜合所得稅各項扣除額各級距申報統計表-縣市別：金門縣,['17668']
綜合所得稅各項扣除額各級距申報統計表-縣市別：雲林縣,['17676']
綜合所得稅各項扣除額各級距申報統計表-縣市別：高雄市,['17673']
綜合所得稅各項扣除額各縣市申報統計表,['8866']
綜合所得稅各項扣除額單項分配10分位申報統計表,['18185']
綜合所得稅各項扣除額單項分配20分位申報統計表,['18186']
綜合所得稅各項扣除額單項分配5分位申報統計表,['18187']
綜合所得稅各項扣除額單項分配各級距申報統計表,['18188']
綜合所得稅各項扣除額單項分配各縣市申報統計表,['18189']
綜合所得稅各項扣除額與應納稅額減徵10分位申報統計表,['18190']
綜合所得稅各項扣除額與應納稅額減徵20分位申報統計表,['18191']
綜合所得稅各項扣除額與應納稅額減徵5分位申報統計表,['18192']
綜合所得稅各項扣除額與應納稅額減徵各級距申報統計表,['18193']
綜合所得稅各項扣除額與應納稅額減徵各縣市申報統計表,['18194']
綜合所得稅各項核定申報歸戶比較10分位申報統計表,['18195']
綜合所得稅各項核定申報歸戶比較20分位申報統計表,['18196']
綜合所得稅各項核定申報歸戶比較5分位申報統計表,['18197']
綜合所得稅各項核定申報歸戶比較各級距申報統計表,['18198']
綜合所得稅各項核定申報歸戶比較各縣市申報統計表,['18199']
綜合所得稅各類所得件數10分位申報統計表,['17683']
綜合所得稅各類所得件數20分位申報統計表,['17684']
綜合所得稅各類所得件數5分位申報統計表,['17685']
綜合所得稅各類所得件數各級距申報統計表,['17686']
綜合所得稅各類所得件數各級距申報統計表-縣市別：南投縣,['17690']
綜合所得稅各類所得件數各級距申報統計表-縣市別：嘉義市,['17701']
綜合所得稅各類所得件數各級距申報統計表-縣市別：嘉義縣,['17702']
綜合所得稅各類所得件數各級距申報統計表-縣市別：基隆市,['17695']
綜合所得稅各類所得件數各級距申報統計表-縣市別：宜蘭縣,['17687']
綜合所得稅各類所得件數各級距申報統計表-縣市別：屏東縣,['17691']
綜合所得稅各類所得件數各級距申報統計表-縣市別：彰化縣,['17703']
綜合所得稅各類所得件數各級距申報統計表-縣市別：新北市,['17698']
綜合所得稅各類所得件數各級距申報統計表-縣市別：新竹市,['17699']
綜合所得稅各類所得件數各級距申報統計表-縣市別：新竹縣,['17700']
綜合所得稅各類所得件數各級距申報統計表-縣市別：桃園縣,['17693']
綜合所得稅各類所得件數各級距申報統計表-縣市別：澎湖縣,['17708']
綜合所得稅各類所得件數各級距申報統計表-縣市別：臺中市,['17704']
綜合所得稅各類所得件數各級距申報統計表-縣市別：臺北市,['17705']
綜合所得稅各類所得件數各級距申報統計表-縣市別：臺南市,['17707']
綜合所得稅各類所得件數各級距申報統計表-縣市別：臺東縣,['17706']
綜合所得稅各類所得件數各級距申報統計表-縣市別：花蓮縣,['17688']
綜合所得稅各類所得件數各級距申報統計表-縣市別：苗栗縣,['17692']
綜合所得稅各類所得件數各級距申報統計表-縣市別：連江縣,['17696']
綜合所得稅各類所得件數各級距申報統計表-縣市別：金門縣,['17689']
綜合所得稅各類所得件數各級距申報統計表-縣市別：雲林縣,['17697']
綜合所得稅各類所得件數各級距申報統計表-縣市別：高雄市,['17694']
綜合所得稅各類所得件數各縣市申報統計表,['17709']
綜合所得稅各類所得件數單項分配10分位申報統計表,['17730']
綜合所得稅各類所得件數單項分配20分位申報統計表,['17731']
綜合所得稅各類所得件數單項分配5分位申報統計表,['17732']
綜合所得稅各類所得件數單項分配各級距申報統計表,['17733']
綜合所得稅各類所得件數單項分配各縣市申報統計表,['17734']
綜合所得稅各類所得件數百分比10分位申報統計表,['17710']
綜合所得稅各類所得件數百分比20分位申報統計表,['17711']
綜合所得稅各類所得件數百分比5分位申報統計表,['17712']
綜合所得稅各類所得件數百分比各級距申報統計表,['17713']
綜合所得稅各類所得件數百分比各縣市申報統計表,['17714']
綜合所得稅各類所得件數金額資料別10分位申報統計表,['17715']
綜合所得稅各類所得件數金額資料別20分位申報統計表,['17716']
綜合所得稅各類所得件數金額資料別5分位申報統計表,['17717']
綜合所得稅各類所得件數金額資料別各級距申報統計表,['17718']
綜合所得稅各類所得件數金額資料別各縣市申報統計表,['17719']
綜合所得稅各類所得件數金額資料別單項分配10分位申報統計表,['17725']
綜合所得稅各類所得件數金額資料別單項分配20分位申報統計表,['17726']
綜合所得稅各類所得件數金額資料別單項分配5分位申報統計表,['17727']
綜合所得稅各類所得件數金額資料別單項分配各級距申報統計表,['17728']
綜合所得稅各類所得件數金額資料別單項分配各縣市申報統計表,['17729']
綜合所得稅各類所得件數金額資料別百分比10分位申報統計表,['17720']
