資料集名稱,資料集識別碼,資料集描述,主要欄位說明,提供機關
澎湖縣最近5年地價稅稅源統計表,113402,澎湖縣最近5年一般用地、自用住宅用地、事業用地、勞工宿舍用地、公共設施保留地等土地地價稅稅源概況,項目年度別;總計戶數;總計面積;總計地價;總計查定稅額;一般用地戶數;一般用地面積;一般用地地價;一般用地查定稅額;自用住宅用地戶數;自用住宅用地面積;自用住宅用地地價;自用住宅用地查定稅額;勞工宿舍用地戶數;勞工宿舍用地面積;勞工宿舍用地地價;勞工宿舍用地查定稅額;事業直接使用土地戶數;事業直接使用土地面積;事業直接使用土地地價;事業直接使用土地查定稅額;公共設施保留地戶數;公共設施保留地面積;公共設施保留地地價;公共設施保留地查定稅額;空地戶數;空地面積;空地地價;空地查定稅額,澎湖縣政府
歷年模範公務人員,113403,榮獲行政院模範公務人員、榮獲澎湖縣模範公務人員,年度;服務機關;姓名;備註,澎湖縣政府
澎湖縣育有未滿二歲兒童育兒津貼申請情形,113404,澎湖縣育有未滿二歲兒童育兒津貼,年度;人次,澎湖縣政府
澎湖縣政府公共車船管理處公車時刻表,113405,依路線別分為上行馬公開及下行往馬公班次時間表,上行班車;馬公往外垵;馬公往通樑;馬公往沙港;馬公往風櫃;馬公往山水;馬公往龍門;馬公往尖山;馬公往青螺;馬公往太武經東衛;馬公往北寮;馬公往烏崁;馬公往前寮往馬公;馬公往光華往馬公;市區零路東;市區零路西,澎湖縣政府
澎湖縣西嶼鄉人口年齡層統計,113434,人口年齡層統計,年度;月份;總計;年齡：０-４歲;年齡：５-９歲;年齡：１０-１４歲;年齡：１５-１９歲;年齡：２０-２４歲;年齡：２５-２９歲;年齡：３０-３４歲;年齡：３５-３９歲;年齡：４０-４４歲;年齡：４５-４９歲;年齡：５０-５４歲;年齡：５５-５９歲;年齡：６０-６４歲;年齡：６５-６９歲;年齡：７０-７４歲;年齡：７５-７９歲;年齡：８０-８４歲;年齡：８５-８９歲;年齡：９０-９４歲;年齡：９５-９９歲;年齡：100歲以上,澎湖縣政府
澎湖縣107學年度第2學期國民小學辦理兒童課後照顧服務班學校清單,113443,澎湖縣107學年度第2學期國民小學辦理兒童課後照顧服務班學校清單,編號;學校名稱,澎湖縣政府
澎湖縣馬公市108年各里現住人口數按性別及原住民身分分,113482,澎湖縣馬公市108年各里現住人口數按性別及原住民身分分,年度;月份;區域別;性別;總計;區域人人口數;原住民合計;平地原住民;山地原住民,澎湖縣政府
澎湖縣馬公市108年人口年齡層統計,113483,澎湖縣馬公市108年0-100歲人口年齡層統計,年度;月份;區域別;性別;年齡：0-4歲;年齡：5-9歲;年齡：10-14歲;年齡：15-19歲;年齡：20-24歲;年齡：25-29歲;年齡：30-34歲;年齡：35-39歲;年齡：40-44歲;年齡：45-49歲;年齡：50-54歲;年齡：55-59歲;年齡：60-64歲;年齡：65-69歲;年齡：70-74歲;年齡：75-79歲;年齡：80-84歲;年齡：85-89歲;年齡：90-94歲;年齡：95-99歲;年齡：100歲以上,澎湖縣政府
澎湖縣望安鄉108年人口年齡層統計,113484,人口年齡層統計,年份;月份;總計;年齡：０歲-４歲; 年齡：５-９歲; 年齡：１０歲-１４歲; 年齡：１５歲-１９歲; 年齡：２０-２４歲; 年齡：２５-２９歲; 年齡：３０-３４歲; 年齡：３５-３９歲; 年齡：４０-４４歲; 年齡：４５-４９歲; 年齡：５０-５４歲; 年齡：５５-５９歲; 年齡：６０-６４歲; 年齡：６５-６９歲; 年齡：７０-７４歲; 年齡：７５-７９歲; 年齡：８０-８４歲; 年齡：８５-８９歲; 年齡：９０-９４歲; 年齡：９５-９９歲; 年齡：１００歲以上,澎湖縣政府
澎湖縣望安鄉108年戶籍動態統計,113485,戶籍動態統計,年度;月份;村別;戶數;人口數;遷入人數;遷出人數;出生總數;死亡人數;結婚對數;離婚對數,澎湖縣政府
澎湖縣林務公園管理所青青草園營造計畫執行年報表,113486,澎湖縣林務公園管理所青青草園營造計畫執行年報表,序號;工作項目;地段;地號;地號數（筆）;預定施作面積（㎡）;執行情形;已執行面積（㎡）,澎湖縣政府
108公園名冊,113487,林務公園管理所轄管公園,序號;鄉市區名稱;公園名稱;公園面積（平方公尺）;土地使用分區;實際使用現況;公園主要出入口位置,澎湖縣政府
澎湖縣67處漁港,113488,澎湖縣67處漁港,市（鄉）;港口數;港口,澎湖縣政府
澎湖縣馬公市108年公告地價暨公告土地現值批次資料,113871,澎湖縣馬公市108年公告地價暨公告土地現值批次資料,鄉市代碼;段別;地號;公告土地現值;公告地價,澎湖縣政府
107年通過餐飲衛生管理分級評核制度名單,113890,107年通過餐飲衛生管理分級評核制度名單,編號;食品業者登錄字號;店名;電話;地址;評核等級,澎湖縣政府
澎湖縣七美鄉109年人口年齡層統計,116125,人口年齡層統計,年份;月份;總計;年齡：０歲-４歲;年齡：５-９歲;年齡：１０歲-１４歲;年齡：１５歲-１９歲;年齡：２０-２４歲;年齡：２５-２９歲;年齡：３０-３４歲;年齡：３５-３９歲;年齡：４０-４４歲;年齡：４５-４９歲;年齡：５０-５４歲;年齡：５５-５９歲;年齡：６０-６４歲;年齡：６５-６９歲;年齡：７０-７４歲;年齡：７５-７９歲;年齡：８０-８４歲;年齡：８５-８９歲;年齡：９０-９４歲;年齡：９５-９９歲;年齡：１００歲以上,澎湖縣政府
澎湖縣七美鄉109年戶籍動態統計,116126,戶籍動態統計,年份;月份;村別;戶數;人口數;遷入人數;遷出人數;嬰兒出生總數;死亡人數;結婚對數;離婚對數,澎湖縣政府
澎湖縣馬公市109年戶籍動態統計,117294,澎湖縣馬公市109年戶籍動態統計,年度;月份;區域別;鄰數;戶數;人口數;遷入人數;遷出人數;出生人數;死亡人數;結婚對數;離婚對數,澎湖縣政府
澎湖縣馬公市109年各里現住人口數按性別及原住民身分分,117295,澎湖縣馬公市109年各里現住人口數按性別及原住民身分分,年度;月份;區域別;性別;總計;區域人人口數;原住民合計;平地原住民;山地原住民,澎湖縣政府
澎湖縣馬公市109年人口年齡層統計,117296,澎湖縣馬公市109年人口年齡層統計,年度;月份;區域別;性別;年齡：0-4歲;年齡：5-9歲;年齡：10-14歲;年齡：15-19歲;年齡：20-24歲;年齡：25-29歲;年齡：30-34歲;年齡：35-39歲;年齡：40-44歲;年齡：45-49歲;年齡：50-54歲;年齡：55-59歲;年齡：60-64歲;年齡：65-69歲;年齡：70-74歲;年齡：75-79歲;年齡：80-84歲;年齡：85-89歲;年齡：90-94歲;年齡：95-99歲;年齡：100歲以上,澎湖縣政府
澎湖縣公民營加油站清冊,117347,至108年1月為止澎湖縣公民營加油站清冊,營業主體;負責人;站名;營業日期;聯絡電話;聯絡地址,澎湖縣政府
澎湖縣最近5年房屋稅綜合統計表,117348,澎湖縣最近5年房屋稅綜合統計表,年度別;合計戶數;應稅戶數;免稅戶數;應稅面積;免稅面積;應稅現值;免稅現值;合計稅額;本稅稅額,澎湖縣政府
澎湖縣七美鄉109年公告地價暨公告土地現值批次資料,117449,澎湖縣七美鄉109年公告地價暨公告土地現值批次資料,鄉市代碼;段別;地號;公告土地現值;公告地價,澎湖縣政府
澎湖縣望安鄉109年公告地價暨公告土地現值批次資料,117450,澎湖縣望安鄉109年公告地價暨公告土地現值批次資料,鄉市代碼;段別;地號;公告土地現值;公告地價,澎湖縣政府
澎湖縣馬公市109年公告地價暨公告土地現值批次資料,117451,澎湖縣馬公市109年公告地價暨公告土地現值批次資料,鄉市代碼;段別;地號;公告土地現值;公告地價,澎湖縣政府
澎湖縣西嶼鄉109年公告地價暨公告土地現值批次資料,117452,澎湖縣西嶼鄉109年公告地價暨公告土地現值批次資料,鄉市代碼;段別;地號;公告土地現值;公告地價,澎湖縣政府
澎湖縣湖西鄉109年公告地價暨公告土地現值批次資料,117453,澎湖縣湖西鄉109年公告地價暨公告土地現值批次資料,鄉市代碼;段別;地號;公告土地現值;公告地價,澎湖縣政府
澎湖縣白沙鄉109年公告地價暨公告土地現值批次資料,117454,澎湖縣白沙鄉109年公告地價暨公告土地現值批次資料,鄉市代碼;段別;地號;公告土地現值;公告地價,澎湖縣政府
澎湖縣108年漁業從業人數,120372,澎湖縣108年各鄉市不同漁業種類的從業人數統計,所屬鄉市;漁業種類;經營模式;人數,澎湖縣政府
澎湖縣現住人口數按性別及年齡分,128711,提供澎湖縣各年齡層人口數,區域別;性別;總計;年齡：0-4歲;年齡：5-9歲;年齡：10-14歲;年齡：15-19歲;年齡：20-24歲;年齡：25-29歲;年齡：30-34歲;年齡：35-39歲;年齡：40-44歲;年齡：45-49歲;年齡：50-54歲;年齡：55-59歲;年齡：60-64歲;年齡：65-69歲;年齡：70-74歲;年齡：75-79歲;年齡：80-84歲;年齡：85-89歲;年齡：90-94歲;年齡：95-99歲;年齡：100歲以上,澎湖縣政府
澎湖縣政府「1999縣民服務專線」每日話務統計報表,128712,澎湖縣政府「1999縣民服務專線」每日話務統計報表,時間;來話數量;要求應答量（1）;應答量（2）;應答率（百分比）;十五秒應答量（3）;十五秒應答率（百分比）等於（3）除（1）;平均通話時間;平均等待時間;最長等時間待;電話外撥量（4）;轉縣府量;電話處理總量等於（2）加（4）,澎湖縣政府
澎湖縣湖西鄉休閒趣處,128713,湖西好鄉,地點;諮詢窗口;電話,澎湖縣政府
馬公市公所最新債務訊息,128714,每月10日公告前1個月之債務資訊,項目;一年以上債務未償餘額（萬元）;短期債務未償餘額（萬元）;平均每人負擔債務（千元）;自償性債務未償餘額（含非營業特種基金）,澎湖縣政府
澎湖縣西嶼鄉公所106年上半年對民間團體補捐助經費明細表(半年報),128715,澎湖縣西嶼鄉公所106年上半年對民間團體補捐助經費明細表(半年報),工作計畫科目名稱;補助事項或用途;補助對象;主辦機關;撥付金額;有無涉及財物或勞務採購;處理方式（如未涉及採購則毋須填列如採公開招標請填列得標廠商）;為除外規定之民間團體;非除外規定之民間團體,澎湖縣政府
澎湖縣西嶼鄉公所106年下半年對民間團體補捐助經費明細表(半年報),128716,澎湖縣西嶼鄉公所106年下半年對民間團體補捐助經費明細表(半年報),工作計畫科目名稱;補助事項或用途;補助對象;主辦機關;撥付金額;有無涉及財物或勞務採購;處理方式（如未涉及採購則毋須填列如採公開招標請填列得標廠商）;為除外規定之民間團體,澎湖縣政府
澎湖縣西嶼鄉公所107年上半年對民間團體補捐助經費明細表(半年報),128717,澎湖縣西嶼鄉公所107年上半年對民間團體補捐助經費明細表(半年報),工作計畫科目名稱;補助事項或用途;補助對象;主辦機關;撥付金額;有無涉及財物或勞務採購;處理方式（如未涉及採購則毋須填列如採公開招標請填列得標廠商）;為除外規定之民間團體;非除外規定之民間團體,澎湖縣政府
澎湖縣馬公市108年戶籍動態統計,128718,澎湖縣馬公市108年戶籍動態統計,年度;月份;區域別;鄰數;戶數;人口數;遷入人數;遷出人數;出生人數;死亡人數;結婚對數;離婚對數,澎湖縣政府
澎湖縣地名譯寫,129942,澎湖縣地名譯寫,類別;地名;譯寫;所屬直轄市-縣;所屬鄉;所屬村,澎湖縣政府
