ECFA早收農產品外銷大陸統計表,['43129']
ECFA服務業早期收穫計畫投資情形-我方赴中國大陸投資統計表,['43128']
ECFA服務業早期收穫計畫投資情形-陸資來臺統計表,['43127']
ECFA貨品貿易早期收穫計畫執行成果-我國對中國大陸出口情形,['43124']
ECFA貨品貿易早期收穫計畫執行成果-我國自中國大陸進口情形,['43125']
「政府資料開放諮詢小組」會議簡報,['31170']
「政府資料開放諮詢小組」會議紀錄,['25668']
「海峽兩岸共同打擊犯罪及司法互助協議」成效表,['43111']
「財團法人海峽交流基金會從業人員薪資處理原則」辦理情形一覽表_海基會,['13204']
不予採認之醫療法所稱醫事人員相關之大陸地區高等學歷名單,['97698']
中國大陸人士來臺(各類交流)人數性別統計表,['97673']
中國大陸人民、無戶籍國民來臺居留、定居人數統計表,['59277']
中國大陸人民來臺人數,['21823']
中國大陸臺校學生人數97-107學年統計,['57982']
中央機關辦理國家賠償事件收結情形表,['13206']
中程施政計畫,['43170']
主管大陸事務財團法人名冊,['9075']
主管港澳事務財團法人名冊,['42649']
人事費彙計表,['12920']
人民申請提供政府資訊案件統計表,['13200']
以前年度歲出保留數餘額表,['20381']
優先採購身心障礙福利機構團體之物品及服務總金額及比率,['58826']
兩岸交流研(修)訂相關法規_文教交流方面,['9077']
兩岸共同打擊犯罪及司法互助聯絡資訊,['9085']
兩岸協議監督條例6版本草案對照表,['59276']
兩岸大事記,['33247']
兩岸海運直航港口開放情形,['7465']
兩岸空運直航客貨運航點開放情形,['7466']
兩岸簽署投資保障和促進協議後我方送陸方協處機制案件統計表,['43130']
兩岸經濟交流統計速報,['7887']
兩岸經貿申訴服務財產法益方面投訴案件,['9084']
兩岸經香港轉口貿易金額統計表,['7460']
兩岸貿易占外貿比重,['7468']
兩岸貿易統計,['7467']
兩岸輸往歐盟產品市場比較,['7494']
兩岸輸日產品市場比較,['7493']
兩岸輸美產品市場比較,['7492']
兩岸重要經濟指標統計速報,['7888']
兩岸駐點記者資訊服務專區,['121037']
公務員赴陸宣導相關規定,['9083']
公務車輛明細表,['12921']
公告「臺灣地區人民、法人、團體或其他機構，禁止擔任大陸地區黨務、軍事、行政或具政治性機關、團體之職務或為其成員」之事項,['9076']
台灣對香港貿易依賴度統計表,['7461']
各處室內部保有及管理個人資料之項目彙整表,['13201']
各項費用彙計表,['12922']
在臺港澳學生交流活動,['97675']
在臺港澳學生統計數據,['97677']
大陸事務法規彙編,['9087']
大陸人士來臺從事文教交流核准數,['6105']
大陸台商經貿網上網統計,['9081']
大陸地區人民來臺(社會交流)相關統計表,['7889']
大陸地區人民來臺就讀專科以上學校辦法,['58015']
大陸地區人民來臺從事文教交流統計,['6104']
大陸地區人民進入臺灣地區(專業商務)人數統計表,['97670']
大陸地區出版品錄影節目進入臺灣地區許可數額,['58019']
大陸地區及香港、澳門旅遊一般警示之發布時機及方式,['59279']
大陸地區及香港、澳門旅遊一般警示之認定參考情況,['59271']
大陸地區古物運入臺灣地區公開陳列展覽許可辦法,['97699']
大陸地區學歷採認辦法,['58016']
大陸地區影視節目得在臺灣地區發行映演播送之數量類別時數,['58018']
大陸地區教育專業人士及學生來臺從事教育活動審查要點,['58013']
大陸地區臺商學校設立及輔導辦法,['57980']
大陸地區高等學校認可名冊-大學部份,['79473']
大陸地區高等學校認可名冊-專科學校部分,['79474']
大陸廣告規範平台相關法令及函釋,['9086']
大陸與兩岸情勢簡報,['42541']
委員會議紀錄(摘錄),['58919']
委託研究計畫作業要點,['58660']
委辦經費分析表,['12923']
學歷統計報表,['62451']
宗教團體申請外籍人士來臺研修宗教教義要點,['97702']
室內空氣品質資訊,['58829']
對中國大陸匯出匯入款統計,['7479']
年度施政計畫,['43169']
年度決算書,['21426']
年齡統計報表,['62452']
建置大陸地區及香港、澳門旅遊警示機制規劃方案,['59272']
我國對外投資統計-國家(地區)別,['7476']
我國廠商擴大運用早期收穫計畫-ECFA原產地證明書核發情形,['43126']
捐助經費分析表,['12929']
政府兩岸政策重要文件(中、英文),['58947']
教育部補助大陸地區臺商學校實施要點,['58012']
教育部補助辦理兩岸(含港澳)學術教育交流活動實施要點,['42585']
教育部體育署全國性民間體育活動團體經費補助辦法,['42597']
教育部體育署國際體育交流活動推動及補助辦法,['42598']
文化部補助國內表演藝術經典作品大陸巡演作業要點,['42590']
文化部補助文化團體及個人參與多面向拓展文化交流處理要點,['42591']
文化部補助民間團體辦理兩岸傳播或新聞交流活動作業要點,['42592']
文化部補助視覺藝術產業辦理或參加國際藝術展會作業要點,['42594']
施政績效,['58085']
書面之公共工程及採購契約目錄,['13198']
書面業務報告,['58093']
會計報告,['20840']
有關中國大陸對臺灣威嚇打壓的看法,['97665']
有關民眾對中國大陸阻擾我國際參與的看法,['97661']
有關民眾對兩岸溝通協商的看法,['97660']
有關民眾對臺灣的未來及兩岸關係發展的看法,['97664']
本國銀行在中國大陸現況統計表,['43113']
本會出版品,['9079']
本會協處之臺港澳交流統計表,['97676']
本會委託研究,['9080']
本會民意調查,['9078']
本會立院報告,['42539']
本會長官公開講稿,['42538']
核准臺商對中國大陸投資統計-地區別,['7474']
核准臺商對中國大陸投資統計-行業別,['7475']
核准陸資來臺投資統計,['7477']
歲入來源別預算表,['12930']
歲入累計表,['20382']
歲入項目說明提要表,['12931']
歲入類平衡表,['20383']
歲入類現金出納表,['20384']
歲出按職能及經濟性綜合分類表,['12933']
歲出用途別科目分析表,['12932']
歲出計畫提要及分支計畫概況表,['12934']
歲出預算表,['12935']
民眾對兩岸交流速度的看法民調,['79344']
民眾對兩岸相關議題之看法民調,['58659']
民眾對統1、獨立或維持現狀的看法民調,['79342']
民眾對總統國慶演說及兩岸相關議題之看法民調,['42537']
民眾對總統就職演說及兩岸相關議題之看法民調,['42536']
民眾認知大陸政府對我政府不友善態度民調,['79347']
民眾認知大陸政府對臺灣人民友善或不友善態度民調,['79348']
民眾認知維護兩岸良性互動是兩岸雙方共同的責任，不應有非和平或恫嚇性的言論或作為民調,['79349']
派員出國計畫預算總表,['12924']
派員出國計畫類別表-考察,['12925']
派員出國計畫類別表-進修,['12926']
派員出國計畫類別表-開會,['12927']
派員赴大陸計畫預算表,['12928']
海基會兩岸人民急難服務中心服務案件數,['97669']
海基會兩岸婚姻親子關懷專線統計表,['59278']
海基會協處台商人身安全案件統計表,['97667']
海基會收受中國大陸公證書分類統計,['97668']
海基會服務電話資訊,['59265']
海基會為民服務案件數,['59267']
海基會緊急服務專線接聽數,['59266']
海基會董監事名單,['59268']
海基會辦理文書驗證統計表,['59269']
海外臺灣學校及大陸地區臺商學校典範教師獎實施要點,['58011']
海峽兩岸共同打擊犯罪及司法互助協議,['9072']
海峽兩岸共同打擊犯罪及司法互助協議案件統計總表,['97672']
海峽兩岸智慧財產權保護合作協議,['9073']
海峽兩岸醫藥衛生合作協議,['9074']
海峽兩岸食品安全協議,['9071']
港澳事務法規,['9090']
港澳季報,['55218']
港澳學生來臺就學法規,['55223']
港澳學生來臺就學網站,['55224']
港澳專科以上學校認可名冊,['97678']
港澳居民來臺統計表,['7890']
港澳旅遊資訊,['9092']
港澳留臺學生在臺工作法規,['55225']
港澳留臺學生在臺工作網站,['55226']
澳門事務處最新消息一覽表,['52574']
澳門居民來臺居留、定居人數統計表,['97674']
澳門情勢資料庫,['55216']
用電資訊,['58828']
發布旅遊警示事由相關業務協處分工,['59270']
發文代字表,['59603']
社會交流法規彙編,['9088']
科技部補助兩岸科技學術研討會作業要點,['42589']
科技部補助延攬客座科技人才作業要點,['42586']
科技部補助邀請大陸地區暨香港澳門科技人士來臺短期訪問作業要點,['42588']
經費累計表,['20385']
經費類平衡表,['20386']
經費類現金出納表,['20387']
綠色採購總金額及比率,['58827']
總統大陸政策談話,['42540']
總統港澳工作談話,['9089']
自起發布中國大陸及香港、澳門旅遊警示資料,['42627']
臺商實用資訊,['119365']
臺商對中國大陸投資金額統計,['7473']
臺商張老師月刊諮詢解答,['119364']
臺港澳交流各項業務主管機關,['9091']
臺港澳交流答客問,['55220']
臺港澳關係相關網站,['55227']
臺港澳青年交流,['55219']
臺港相互投資金額統計表,['7462']
臺澳相互投資金額統計表,['7463']
臺灣及中國大陸利率及匯率之比較,['7496']
臺灣及中國大陸對南韓之貿易統計,['7491']
臺灣及中國大陸對日本之貿易統計,['7488']
臺灣及中國大陸對東協10國之貿易統計,['7490']
臺灣及中國大陸對歐盟之貿易統計,['7489']
臺灣及中國大陸對美國之貿易統計,['7487']
臺灣及中國大陸對香港之貿易統計,['7469']
臺灣及中國大陸貿易統計,['7485']
臺灣及中國大陸輸往東協10國產品市場比較,['7495']
臺灣地區民間團體對大陸地區捐贈獎助學金審查要點,['97697']
臺灣地區與大陸地區人民關係條例暨兩岸歷次協議(含香港澳門關係條例),['59273']
臺灣地區與大陸地區人民關係條例暨施行細則解釋彙編,['59275']
臺灣對中國大陸、香港順差統計,['7472']
臺灣對中國大陸及香港出口主要產品,['7470']
臺灣對澳門貿易統計表,['7083']
臺灣對香港貿易統計表,['7459']
臺灣自中國大陸及香港進口主要產品,['7471']
臺灣與主要國家(地區)貿易金額統計,['7486']
臺灣藝人赴中國大陸表演應注意事項,['97703']
臺灣青年學生赴陸發展應做好的功課：風險評估,['97704']
與縣市政府合辦「大陸事務研習計畫」學員性別統計表,['97659']
行政院及所屬各機關公務人員因公赴香港澳門通報作業要點,['33250']
行政院提供政府資訊收費標準表,['58089']
行政院院長口頭施政報告：有關兩岸關係談話內容,['58664']
行政院院長書面施政報告：有關兩岸關係內容,['58663']
補(捐)助經費一覽表,['13199']
補助大陸地區臺商學校作業要點,['97687']
補助經費分析表,['12936']
補助辦理兩岸民間交流活動作業要點,['58662']
諮詢委員遴聘及集會辦法,['58992']
財團法人海峽交流基金會之政府核派人員資料,['13205']
財團法人臺港經濟文化合作策進會之政府核派人員資料,['33252']
財團法人臺港經濟文化合作策進會董事監察人聯席會議相關數據,['97679']
資料開放盤點表,['33253']
資料開放行動策略,['27749']
資料集摘要索引,['61120']
資本支出分析表,['12937']
赴中國大陸旅遊人數,['7480']
輿論關注大陸涉及人權一覽表：涉及人身、集會自由,['58666']
輿論關注大陸涉及人權一覽表：涉及宗教自由,['58665']
輿論關注大陸涉及人權一覽表：涉及維權人士,['58667']
輿論關注大陸涉及人權一覽表：涉及言論自由,['58668']
辦公房舍明細表,['12939']
辦理政策宣導相關之廣告彙整表,['13203']
近年來大陸地區學生來臺就學/研修人數,['33248']
進口出版品電影片錄影節目及廣播電視節目原產地認定基準,['58017']
金門地區歷年小3通人數統計,['7892']
金馬「小3通」航運往來統計,['7481']
金馬地區歷年小3通人數統計,['7894']
金馬小3通航運人員往來統計月報,['6106']
陸委會兩岸經貿諮詢服務統計,['9082']
陸委會列席國會報告(立法院第9屆第1會期),['57942']
陸委會列席國會報告(立法院第9屆第2會期),['57940']
陸委會列席國會報告(立法院第9屆第3會期),['57938']
陸委會官網流量統計資料,['58834']
陸委會師生拜會統計資料,['61113']
陸委會平面廣告,['59611']
陸委會摺頁文宣,['58949']
陸委會新聞稿,['55229']
陸委會短片列表,['59612']
陸委會赴策進會行政監督實地查核項目紀錄表,['55221']
陸資來臺投資業別統計,['7478']
電視業海外行銷補助要點,['97701']
預算員額明細表,['12938']
香港對大陸地區貿易統計表,['7891']
香港居民來臺居留、定居人數統計表,['33249']
香港情勢資料庫,['42647']
香港澳門政府駐臺辦事處聯繫資訊,['42648']
香港辦事處最新消息一覽表,['43180']
香港辦事處辦理急難救助業務統計一覽表,['79339']
馬祖地區歷年小3通人數統計,['7893']
駐港澳機構洽詢電話表,['33251']
