資料集名稱,資料集識別碼,資料集描述,主要欄位說明,提供機關
南投縣政府產銷履歷清冊,94804,ProductName(產品名稱)、OrgID(組織代碼)、Producer(農業經營業者)、Place(產地)、FarmerName(生產者名稱)、PackDate(包裝日期)、CertificationName(驗證機構)、ValidDate(驗證有效日期)、StoreInfo(通路商資訊)、Tracecode(追蹤碼)、LandSecNO(農產品產地地段地號)、ParentTraceCode(原料追溯碼網址)、TraceCodelist(一籤一碼追溯碼)、Log_UpdateTime(資料更新時間)、OperationDetail(詳細栽種流程)、ResumeDetail(詳細履歷資料)、ProcessDetail(詳細加工流程)、CertificateDetail(其他驗證資訊),ProductName;OrgID;Producer;Place;FarmerName;PackDate;CertificationName;ValidDate;StoreInfo;Tracecode;LandSecNO;ParentTraceCode;TraceCodelist;Log_UpdateTime;OperationDetail;ResumeDetail;ProcessDetail;CertificateDetail,南投縣政府
南投縣避難收容所位置及收容人數,94902,依災害防救法及社會救助法所設立之。,資源彙整機關;收容所編號;收容所名稱;收容所鄉鎮市區;收容所村里;地址;管理人;連絡電話;收容人數;X坐標(經度);Y坐標(緯度);備註;最後更新時間<br>,南投縣政府
南投縣日間照顧中心,94903,依據衛生福利部推展日間照顧中心設置相關原則辦理,性質;資源彙整機關;辦理單位;成立日期;立案文號;負責人;連絡電話;傳真;電子郵件;地址;可服務人數;相關網址;X坐標;Y坐標;備註;最後更新時間 ;最後更新時間<br>,南投縣政府
南投縣急難救助提供單位,94904,提供急難救助服務之基金會或機構,資源彙整機關;辦理單位;連絡電話;傳真;電子郵件;地址;相關網址;X坐標;Y坐標;備註 最後更新時間,南投縣政府
南投縣工會名冊,94905,南投縣工會名冊,資源彙整機關;工會名稱;成立日期;負責人;會務聯絡人;連絡電話;傳真;電子郵件;地址;相關網址;X坐標;Y坐標;備註;最後更新時間 ;最後更新時間<br>,南投縣政府
南投縣社區活動中心,94906,依據社區發展工作綱要所成立之社區活動中心,資源彙整機關;鄉鎮市區;村里;中心名稱;辦理單位;連絡電話;地址;相關網址;X坐標;Y坐標;備註;最後更新時間 ;最後更新時間<br>,南投縣政府
南投縣身心障礙托育養護服務提供單位,94907,提供身心障礙者托育/養護服務之機構,,南投縣政府
南投縣老人餐飲服務提供單位,94908,依長期照顧十年計畫中老人營養餐飲服務之提供單位,資源彙整機關;辦理單位;連絡電話;傳真;電子郵件;地址;服務區域;相關網址;X坐標;Y坐標;備註;最後更新時間<br>,南投縣政府
南投縣輔具服務單位,94909,提供中央及地方輔具中心服務據點資訊。,性質;資源彙整機關;中心名稱;辦理單位;連絡電話;傳真;電子郵件;地址;相關網址;X坐標;Y坐標;備註;最後更新時間<br>;最後更新時間,南投縣政府
南投縣社區發展協會,94910,南投縣社區發展協會,資源彙整機關;鄉鎮市;社區發展協會名稱;成立日期;立案文號;負責人;連絡電話;傳真;電子郵件;地址;服務區域;相關網址;X坐標;Y坐標;備註;最後更新時間<br>;最後更新時間,南投縣政府
南投縣食(實)物銀行,94911,食物銀行服務單位,資源彙整機關;辦理單位;連絡電話;傳真;電子郵件;地址;服務區域;服務時間;相關網址;X坐標;Y坐標;備註;最後更新時間 ;最後更新時間<br>,南投縣政府
南投縣就業服務據點,94912,南投縣就業服務據點,資源彙整機關;據點名稱;辦理單位;連絡電話;傳真;地址;服務區域;服務時間;相關網址;X坐標;Y坐標;備註;最後更新時間 ;最後更新時間<br>,南投縣政府
南投縣老人文康、福利服務中心,94913,依據老人福利機構設立標準第2條所定老人福利機構之分類，涵蓋長期照顧機構及安養機構以外之其他老人福利機構。,資源彙整機關;中心名稱;連絡電話;傳真;電子郵件;地址;相關網址;X坐標;Y坐標;備註;最後更新時間<br>,南投縣政府
南投縣身心障礙日間服務機構,94914,提供經需求評估需參與日間作業活動、技藝陶冶或生活照顧、訓練之身心障礙者日間服務之場所。,,南投縣政府
南投縣青年職涯發展中心暨創客基地,94915,南投縣青年職涯發展中心暨創客基地,資源彙整機關;中心名稱;連絡電話;傳真;電子郵件;地址;服務時間;相關網址;X坐標;Y坐標;備註;最後更新時間 ;最後更新時間<br>,南投縣政府
南投縣居家護理機構,94916,南投縣居家護理機構,資源彙整機關;辦理單位;機構屬性;連絡電話;電子郵件;地址;106年評鑑成績;107年評鑑成績;服務區域;相關網址;X坐標;Y坐標<br><br>,南投縣政府
南投縣婦女福利服務中心,94917,提供婦女自我成長、親職教育、法律諮詢等多元的支持性服務，並透過在地婦女中心。,資源彙整機關;中心名稱;辦理單位;連絡電話;傳真;電子郵件;地址;相關網址;X坐標 ;Y坐標;備註;最後更新時間,南投縣政府
南投縣身心障礙住宿機構,94919,提供經需求評估需二十四小時生活照顧、訓練或夜間照顧服務之身心障礙者住宿服務之場所。,,南投縣政府
南投縣長期照顧管理中心,94920,南投縣長期照顧管理中心,,南投縣政府
南投縣身心障礙餐飲服務提供單位,94921,提供身心障礙餐飲服務單位(如送餐服務),資源彙整機關;辦理單位;連絡電話;傳真;電子郵件;地址;服務區域;相關網址;X坐標;Y坐標;備註;最後更新時間<br>,南投縣政府
南投縣合作社,94922,南投縣合作社,資源彙整機關;合作社名稱;原登記字號;理事主席;監事主席;連絡電話;傳真;電子郵件;地址;相關網址;X坐標;Y坐標;備註;最後更新時間<br>,南投縣政府
南投縣社會福利基金會,94923,南投縣社會福利基金會,性質;資源彙整機關;基金會名稱;成立日期;文案文號;負責人;連絡電話;傳真;電子郵件;地址;相關網址;X坐標;Y坐標;備註;最後更新時間<br>,南投縣政府
南投縣身心障礙鑑定醫院,94924,南投縣身心障礙鑑定醫院,資源彙整機關;醫院名稱;連絡電話;傳真;電子郵件;地址;新制鑑定類別及向度;相關網址;備註,南投縣政府
南投縣新住民家庭服務中心,94925,針對新住民及其家庭成員為對象，提供關懷訪視、個案管理、各項支持性活動及建立資源服務網絡。,,南投縣政府
南投縣長青活力站,94926,南投縣長青活力站,資源彙整機關;站別;辦理單位;連絡電話;傳真;電子郵件;地址;服務時間;相關網址;X坐標;Y坐標;備註;最後更新時間 ;最後更新時間<br>,南投縣政府
南投縣交通接送服務,94927,協助中重度失能者滿足以就醫及使用長期照顧服務為主要目的交通服務需求,資源彙整機關;辦理單位;連絡電話;傳真;電子郵件;地址;服務區域;相關網址;X坐標;Y坐標;備註;最後更新時間<br>;最後更新時間,南投縣政府
南投縣家庭暴力及性侵害防治中心,94928,依據家庭暴力防治法第8條所設立之家庭暴力防治中心並得與性侵害防治中心合併設立。,資源彙整機關;中心名稱 連絡電話;傳真;電子郵件;地址;相關網址;X坐標;Y坐標;備註 最後更新時間,南投縣政府
南投縣老人福利機構,94929,依據老人福利機構設立標準第2條所定老人福利機構之分類，涵蓋「全國長期照顧機構」及「安養機構」。,,南投縣政府
南投縣身心障礙福利服務中心,94930,提供身心障礙者及其家庭支持性服務之場所,性質;資源彙整機關;辦理單位;成立日期;立案文號;負責人;連絡電話;傳真;電子郵件;地址;相關網址;X坐標;Y坐標;備註 最後更新時間,南投縣政府
南投縣農特商家介紹(水果館),95028,商家名稱(name)、商品名稱(product)、四章一Q認證號(mark)、規格(format)、市價(market price)、售價(price)、備貨數量(stock)、已售數量(sold)、數量(num)上架日期(date)、分類(type),商家名稱;商品名稱;四章一Q認證號;規格;市價;售價;備貨數量;已售數量;數量;上架日期;分類;<br>,南投縣政府
消費者來源分析,95029,地址(address)、人數(num)、消費佔比(ratio),地址;人數;消費佔比;<br>,南投縣政府
南投縣十大熱銷農產品,95030,排名(rank)、商品館別(Pavilion)、商品名稱(product)、商品介紹(present)、商家名稱(name)、價格(price)、銷售數量(sold)、上架日期(date),排名;商品館別;商品名稱;商品介紹;商家名稱;價格;銷售數量;上架日期;<br>,南投縣政府
南投縣農特產品介紹(伴手禮盒館),95031,類型(class)、商品型號(model)、商品名稱(product)、四章一Q認證號(mark)、規格(format)、市價(market price)、售價(price)、備貨數量(stock)、已售數量(sold)、數量(num)、商品描述(bewrite)、注意事項(Precautions)、關鍵字(keyword)、上架日期(date)、分類(type),類型;商品型號;商品名稱;四章一Q認證號;規格;市價;售價;備貨數量;已售數量;數量;商品描述;注意事項;關鍵字;上架日期;分類;<br>,南投縣政府
南投縣農特產品介紹(4章1Q農產專區),95032,類型(class)、商品型號(model)、商品名稱(product)、四章一Q認證號(mark)、規格(format)、市價(market price)、售價(price)、備貨數量(stock)、已售數量(sold)、數量(num)、商品描述(bewrite)、注意事項(Precautions)、關鍵字(keyword)、上架日期(date)、分類(type),類型;商品型號;商品名稱;四章一Q認證號;規格;市價;售價;備貨數量;已售數量;數量;商品描述;注意事項;關鍵字;上架日期;分類;<br>,南投縣政府
南投縣十大熱門點閱商品(根莖蔬菜館),95033,排名(rank)、商品館別(Pavilion)、商品名稱(product)、商品介紹(present)、商家名稱(name)、價格(price)、點閱數(click)、上架日期(date),排名;商品館別;商品名稱;商品介紹;商家名稱;價格;點閱數;上架日期;<br>,南投縣政府
南投縣十大熱門點閱商品(茶葉博覽館),95034,排名(rank)、商品館別(Pavilion)、商品名稱(product)、商品介紹(present)、商家名稱(name)、價格(price)、點閱數(click)、上架日期(date),排名;商品館別;商品名稱;商品介紹;商家名稱;價格;點閱數;上架日期;<br>,南投縣政府
南投縣十大熱門點閱商品(水果館),95035,排名(rank)、商品館別(Pavilion)、商品名稱(product)、商品介紹(present)、商家名稱(name)、價格(price)、點閱數(click)、上架日期(date),排名;商品館別;商品名稱;商品介紹;商家名稱;價格;點閱數;上架日期;<br>,南投縣政府
南投縣十大熱門點閱商品(4章1Q農產專區),95036,排名(rank)、商品館別(Pavilion)、商品名稱(product)、商品介紹(present)、商家名稱(name)、價格(price)、點閱數(click)、上架日期(date),排名;商品館別;商品名稱;商品介紹;商家名稱;價格;點閱數;上架日期;<br>,南投縣政府
南投縣農特產品介紹(根莖蔬菜館),95037,類型(class)、商品型號(model)、商品名稱(product)、四章一Q認證號(mark)、規格(format)、市價(market price)、售價(price)、備貨數量(stock)、已售數量(sold)、數量(num)、商品描述(bewrite)、注意事項(Precautions)、關鍵字(keyword)、上架日期(date)、分類(type),類型;商品型號;商品名稱;四章一Q認證號;規格;市價;售價;備貨數量;已售數量;數量;商品描述;注意事項;關鍵字;上架日期;分類;<br>,南投縣政府
南投縣農特產品介紹(水果館),95038,類型(class)、商品型號(model)、商品名稱(product)、四章一Q認證號(mark)、規格(format)、市價(market price)、售價(price)、備貨數量(stock)、已售數量(sold)、數量(num)、商品描述(bewrite)、注意事項(Precautions)、關鍵字(keyword)、上架日期(date)、分類(type),類型;商品型號;商品名稱;四章一Q認證號;規格;市價;售價;備貨數量;已售數量;數量;商品描述;注意事項;關鍵字;上架日期;分類;<br>,南投縣政府
南投縣十大熱門點閱商品(伴手禮盒館),95039,排名(rank)、商品館別(Pavilion)、商品名稱(product)、商品介紹(present)、商家名稱(name)、價格(price)、點閱數(click)、上架日期(date),排名;商品館別;商品名稱;商品介紹;商家名稱;價格;點閱數;上架日期;<br>,南投縣政府
消費者採購價格分析,95040,購買產品館別(pavilion)、購買商品價格區間(price)、日期區間(date),購買產品館別;購買商品價格區間;日期區間;<br><br>,南投縣政府
南投縣農特產品介紹(茶葉博覽館),95041,類型(class)、商品型號(model)、商品名稱(product)、四章一Q認證號(mark)、規格(format)、市價(market price)、售價(price)、備貨數量(stock)、已售數量(sold)、數量(num)、商品描述(bewrite)、注意事項(Precautions)、關鍵字(keyword)、上架日期(date)、分類(type),類型;商品型號;商品名稱;四章一Q認證號;規格;市價;售價;備貨數量;已售數量;數量;商品描述;注意事項;關鍵字;上架日期;分類;前台排序;<br>,南投縣政府
南投縣農特商家介紹(根莖蔬菜館),95042,商家名稱(name)、商品名稱(product)、四章一Q認證號(mark)、規格(format)、市價(market price)、售價(price)、備貨數量(stock)、已售數量(sold)、數量(num)上架日期(date)、分類(type),商家名稱;商品名稱;四章一Q認證號;規格;市價;售價;備貨數量;已售數量;數量;上架日期;分類;<br><br>,南投縣政府
消費者偏好分析,95043,購買產品館別(pavilion)、購買商品名稱(product)、購買商家名稱(name)、日期區間(date),購買產品館別;購買商品名稱;購買商家名稱;日期區間;<br>,南投縣政府
南投縣農特商家介紹(4章1Q農產專區),95044,商家名稱(name)、商品名稱(product)、四章一Q認證號(mark)、規格(format)、市價(market price)、售價(price)、備貨數量(stock)、已售數量(sold)、數量(num)上架日期(date)、分類(type),商家名稱;商品名稱;四章一Q認證號;規格;市價;售價;備貨數量;已售數量;數量;上架日期;分類;<br>,南投縣政府
南投縣108年流感疫苗接種合約院所,95971,南投縣108年流感疫苗接種計畫合約院所名冊,十碼章;醫院名稱;縣市別;行政區;郵遞區號;地址;聯絡電話;座標緯度;座標經度,南投縣政府
南投縣政府稅務局推動高齡者參與志願服務成果統計表,96794,南投縣政府稅務局志工隊,機關名稱;成立高齡志工服務團隊隊數;成立高齡志工服務團隊65歲以上志工人數-合計;成立高齡志工服務團隊65歲以上志工人數-男;成立高齡志工服務團隊65歲以上志工人數-女;規劃高齡志工服務措施-服務措施名稱;規劃高齡志工服務措施-接受服務總人次;規劃高齡志工服務措施-提供服務總時數;規劃高齡志工服務措施-執行起迄日;高齡志工教育訓練人次;高齡志工教育訓練時數;高齡志工新增領取志願服務紀錄冊人數-合計;高齡志工新增領取志願服務紀錄冊人數-男;高齡志工新增領取志願服務紀錄冊人數-女;開發多元高齡訓練教材及訓練型態名稱;辦理促進高齡者參與志願服務之宣導及行銷活動或措施-場次;高齡志工獎勵表揚-人數;推動志工人力銀行參與人數-合計;推動志工人力銀行參與人數-男;推動志工人力銀行參與人數-女,南投縣政府
南投縣政府稅務局全功能服務櫃臺統計表,96795,報表代號： YRQ402R_R2,服務項目;件數;跨機關件數,南投縣政府
南投縣政府稅務局推展志願服務志工人數及服務成果,96796,南投縣政府稅務局志工隊,類別;按性別分;按年齡別分未滿12歲;按年齡別分12－17歲;按年齡別分18－29歲;按年齡別分30－49歲;按年齡別分50－54歲;按年齡別分55－64歲;按年齡別分65歲以上;按教育程度分國中及以下;按教育程度分高中職;按教育程度分大專;按教育程度分研究所;具原住民身分;按服務年資分1年以下;按服務年資分1至未滿3年;按服務年資分3至未滿5年;按服務年資分5至未滿10年;按服務年資分10年以上;按身分別分公教人員現職;按身分別分公教人員已退休;按身分別分非公教人員工商界人士;按身分別分非公教人員退休人員;按身分別分非公教人員家庭管理;按身分別分非公教人員學生;按身分別分非公教人員其他;接受服務總數人次;提供服務時數合計;提供服務時數公教人員時數;提供服務時數非公教人員時數;訓練情形合計人次;訓練情形合計時數;訓練情形基礎訓練人次;訓練情形基礎訓練時數;訓練情形特殊訓練人次;訓練情形特殊訓練時數;訓練情形其他在職訓練人次;訓練情形其他在職訓練時數;聯繫會報場次;獎勵表揚人數;領有紀錄冊人數;志工保險人數,南投縣政府
(南投市名間鄉中寮鄉)109年公告現值公告地價資料,97102,南投縣公告現值及公告地價(係為產製當時之資料，後續因土地分割、合併等致地價變動，可利用南投縣公告土地現值、公告地價查詢系統(http://link.nantou.gov.tw/land/Land.aspx)所提供公告土地現值及公告地價查詢功能，如有土地合併或分割時，該系統會同步更新土地分割或合併後之地價資料；公告現值於每年1月1日公告，公告地價每2年公告1次，必要時得延長。),縣市別;行政區;段小段;地號(00010000地號為1地號;00010001地號為1-1地號);公告土地現值(元/㎡);公告地價(元/㎡),南投縣政府
(埔里鎮魚池鄉)109年公告現值公告地價資料,97186,南投縣公告現值及公告地價(係為產製當時之資料，後續因土地分割、合併等致地價變動，可利用南投縣公告土地現值、公告地價查詢系統(http://link.nantou.gov.tw/land/Land.aspx)所提供公告土地現值及公告地價查詢功能，如有土地合併或分割時，該系統會同步更新土地分割或合併後之地價資料；公告現值於每年1月1日公告，公告地價每2年公告1次，必要時得延長。),縣市別;行政區;段小段;地號(00010000地號為1地號;00010001地號為1-1地號);公告土地現值(元/㎡);公告地價(元/㎡),南投縣政府
(水里鄉集集鎮信義鄉)109年公告現值公告地價資料,97187,南投縣公告現值及公告地價(係為產製當時之資料，後續因土地分割、合併等致地價變動，可利用南投縣公告土地現值、公告地價查詢系統(http://link.nantou.gov.tw/land/Land.aspx)所提供公告土地現值及公告地價查詢功能，如有土地合併或分割時，該系統會同步更新土地分割或合併後之地價資料；公告現值於每年1月1日公告，公告地價每2年公告1次，必要時得延長。),縣市別;行政區;段小段;地號(00010000地號為1地號;00010001地號為1-1地號);公告土地現值(元/㎡);公告地價(元/㎡),南投縣政府
( 竹山鎮鹿谷鄉)109年公告現值公告地價資料,97188,南投縣公告現值及公告地價(係為產製當時之資料，後續因土地分割、合併等致地價變動，可利用南投縣公告土地現值、公告地價查詢系統(http://link.nantou.gov.tw/land/Land.aspx)所提供公告土地現值及公告地價查詢功能，如有土地合併或分割時，該系統會同步更新土地分割或合併後之地價資料；公告現值於每年1月1日公告，公告地價每2年公告1次，必要時得延長。),縣市別;行政區;段小段;地號(00010000地號為1地號;00010001地號為1-1地號);公告土地現值(元/㎡);公告地價(元/㎡),南投縣政府
草屯鎮-109年公告現值公告地價資料,97189,南投縣公告現值及公告地價(係為產製當時之資料，後續因土地分割、合併等致地價變動，可利用南投縣公告土地現值、公告地價查詢系統(http://link.nantou.gov.tw/land/Land.aspx)所提供公告土地現值及公告地價查詢功能，如有土地合併或分割時，該系統會同步更新土地分割或合併後之地價資料；公告現值於每年1月1日公告，公告地價每2年公告1次，必要時得延長。),行政區;段小段;地號(00010000地號為1地號;00010001地號為1-1地號);面積;公告土地現值(元/㎡);公告地價(元/㎡),南投縣政府
南投縣政府108年舉辦大型活動調查表,99528,南投縣政府108年舉辦大型活動調查表,月份;活動名稱;內容摘要;活動時間及地點;主辦單位;創新內容;備註,南投縣政府
南投縣公共圖書館借還書人次、冊數及辦證數統計,100401,南投縣公共圖書館年度借還書人次、冊數及辦證數統計,館名;借閱冊數;借閱人次;年度新辦證數;歷年總辦證數,南投縣政府
96年專用公路路線表,102382,96年專用公路路線表,公路編號;路線名稱;里程(公里);備註,南投縣政府
低收入戶補助項目,108796,低收入戶各項生活扶助、低收入戶婦嬰營養補助、低收入戶者喪葬補助、低收入戶老人公費養護補助,補助流水號;補助名稱;補助對象年齡下限;補助對象年齡上限;設籍條件;居住日數是否需大於183日;身份;收入條件每人每月上限;動產條件每人上限;不動產條件每戶上限;其他條件;應備文件;收件洽辦單位;聯繫方式;詳細資訊,南投縣政府
南投縣無障礙廁所,109933,符合建築物無障礙設施設計規範之公共無障礙廁所,資源彙整機關;鄉鎮市區;村里;無障礙廁所名稱;地址;公廁類型;X坐標;Y坐標;備註;最後更新時間,南投縣政府
國民年金服務據點,110050,國民年金服務據點,資源彙整機關;辦理單位;負責人;連絡電話;傳真;電子郵件;地址;服務時間;相關網址;X坐標;Y坐標;備註;最後更新時間,南投縣政府
法律諮詢服務律師輪值表,110051,法律諮詢服務律師輪值表,日期;星期;服務地點;律師姓名,南投縣政府
身心障礙團體,110052,提供身心障礙者直接、或間接諮詢服務,資源彙整機關;辦理單位;連絡電話;傳真;電子郵件;地址;相關網址;X坐標;Y坐標;備註;最後更新時間,南投縣政府
優先採購身障福利機構團體或庇護工場據點及生產物品及服務,110054,優先採購身障福利機構團體或庇護工場據點及生產物品及服務,資源彙整機關;辦理單位;負責人;連絡電話;傳真;電子郵件;地址;服務時間;相關網址;X坐標;Y坐標;備註;最後更新時間,南投縣政府
青年職涯發展中心暨創客基地,110055,青年職涯發展中心暨創客基地,資源彙整機關;中心名稱;連絡電話;傳真;電子郵件;地址;服務時間;相關網址;X坐標;Y坐標;備註;最後更新時間,南投縣政府
大型復康巴士租借據點,110056,大型復康巴士租借據點,資源彙整機關;辦理單位;連絡電話;傳真;電子郵件;地址;服務區域;相關網址;X坐標;Y坐標;備註;最後更新時間,南投縣政府
公共托育資源中心,110057,公共托育資源中心,性質;資源彙整機關;辦理單位;成立日期;立案文號;負責人;連絡電話;傳真;電子郵件;地址;核定收托人數;相關網址;X坐標;Y坐標;備註;最後更新時間,南投縣政府
法律扶助設置點,110058,法律扶助設置點,資源彙整機關;辦理單位;連絡電話;傳真;電子郵件;地址;相關網址;X坐標;Y坐標;備註;最後更新時間,南投縣政府
南投縣13鄉鎮市衛生所,110059,南投縣13鄉鎮市衛生所,資源彙整機關;鄉鎮市衛生所名稱;連絡電話;地址;相關網址<br><br>,南投縣政府
南投縣鄉鎮市戶政事務所,110060,南投縣鄉鎮市戶政事務所,資源彙整機關;鄉鎮市戶政事務所名稱;連絡電話;傳真;電子郵件;地址;相關網址;X坐標;Y坐標;備註;最後更新時間,南投縣政府
食(實)物銀行各鄉(鄉、市)傳統餐食商店公告名單,110063,食(實)物銀行各鄉(鄉、市)傳統餐食商店公告名單,鄉鎮市別;總家數;類別;殷實餐食商店名稱;住址;聯絡電話;備註,南投縣政府
南投縣社區產業行銷補助單位,110064,南投縣社區產業行銷補助單位,資源彙整機關;鄉鎮市戶政事務所名稱;連絡電話;傳真;電子郵件;地址;相關網址;X坐標;Y坐標;備註;最後更新時間,南投縣政府
視覺障礙者生活重建服務單位,110334,提供視覺障礙者生活重建規劃、輔導或諮詢服務之單位,資源彙整機關;中心名稱;辦理單位;連絡電話;傳真;電子郵件;地址;相關網址;X坐標;Y坐標;備註;最後更新時間,南投縣政府
南投縣0-4歲擴大育兒津貼,110335,南投縣0-4歲擴大育兒津貼,資源彙整機關;辦理單位;連絡電話;傳真;電子郵件;地址;相關網址;X坐標;Y坐標;備註;最後更新時間,南投縣政府
特殊教育學校/服務提供單位,110336,依特殊教育法設立之特殊教育學校及設有特殊教育班之各級學校及提供特殊教育之服務提供單位,資源彙整機關;學校名稱;連絡電話;傳真;地址;設立別;教育階段;相關網址;X坐標;Y坐標;備註;最後更新時間,南投縣政府
二手輔具資源提供單位,110338,提供二手輔具回收、交換、租借或媒合之單位,性質;資源彙整機關;辦理單位;連絡電話;傳真;電子郵件;地址;相關網址;X坐標;Y坐標;備註;最後更新時間,南投縣政府
長期照顧據點,110339,長期照顧據點,資源彙整機關;辦理單位;連絡電話;傳真;電子郵件;地址;相關網址;X坐標;Y坐標;備註;最後更新時間,南投縣政府
