21類貨物出口價值排行統計(按年),['17055']
21類貨物進口價值排行統計(按年),['17054']
3角貿易空運出口統計表,['24152']
3角貿易空運進口統計表,['24151']
5至十年內達成財政收支平衡方案之研擬,['11794']
Customs Administration news and events,['95229']
ECFA早收清單台方對照陸方稅則8位碼對照表,['17061']
ECFA早收清單陸方對照台方稅則8位碼對照表,['17064']
ECFA早期收穫減讓關稅統計表,['6707']
Guide to ROC Taxes,['22861']
HS委員會第54次會議分類決定案例,['38743']
HS委員會第55次會議分類決定案例,['32049']
HS委員會第56次會議分類決定案例,['32050']
HS委員會第57次會議分類決定案例,['38744']
HS版與HS版海關進口稅則新舊稅號對照表,['17056']
「強化國有財產管理及運用效益方案」執行成果考評績優機關頒獎典禮照片目錄,['24082']
「日據時代株式會社台灣銀行海外分行分支機構存款及匯款處理條例」墊還款案統計表,['41140']
「財政改革方案執行成效檢討及落實財政平衡之策略研擬」研究報告,['11420']
一般優質企業名冊,['17077']
不受理報關原因,['8276']
世界主要國家政府債務管理政策之研究,['11491']
中區國稅局人民陳情案件處理情形檢討分析報告,['30105']
中區國稅局使用B2C電子發票營業人清冊,['25446']
中區國稅局使用電子發票績優營業人名冊,['25654']
中區國稅局保有個人資料檔案公開項目彙整表,['29986']
中區國稅局全功能櫃台Easy速利得免下車服務作業要點,['30100']
中區國稅局全功能櫃台作業處理件數統計表,['32915']
中區國稅局公司及獨資合夥工商家數統計表,['118849']
中區國稅局公文保存年限統計表,['62536']
中區國稅局及所屬單位決算,['12648']
中區國稅局及所屬會計報表,['19813']
中區國稅局各項國稅多元繳稅方式統計表,['41164']
中區國稅局員額與素質,['28954']
中區國稅局國稅統計年報,['12652']
中區國稅局土地明細清冊,['32820']
中區國稅局執行業務暨其他所得者申報家數統計表,['119707']
中區國稅局外僑綜合所得稅結算申報案件統計表,['25483']
中區國稅局年度重要施政計畫,['30078']
中區國稅局復查案件處理情形統計表,['32930']
中區國稅局復查決定書案例,['29882']
中區國稅局扣免繳(外僑人工建檔部分)統計表,['46007']
中區國稅局扣免繳申報收件統計表,['32907']
中區國稅局招標及決標資訊,['27954']
中區國稅局提升服務品質執行計畫,['30091']
中區國稅局政風室受理公職人員財產申報人數及抽籤比例統計表,['32931']
中區國稅局暨所屬各分局、稽徵所聯絡方式及服務時間,['30106']
中區國稅局最近國家賠償事件處理情形統計表,['30188']
"中區國稅局期貨商家數統計表 Statistics of the Number of Futures Commission Merchants, National Taxation Bureau of the Central Area (NTBCA), Ministry of Finance",['30050']
中區國稅局業務績效與榮譽,['30079']
中區國稅局業務職掌,['30080']
中區國稅局歷年支付或接受之補助,['12806']
中區國稅局法定預算,['15636']
中區國稅局為民服務意見調查分析報告,['30097']
中區國稅局為民服務白皮書,['30098']
中區國稅局營利事業單位數統計表,['37054']
中區國稅局營利事業所得稅受理災害損失報備情形統計表,['119456']
中區國稅局營利事業按收入級距核定情形統計表,['37059']
中區國稅局營業稅申報家數統計表,['32516']
中區國稅局營業稅籍登記申請收件統計表,['29974']
中區國稅局納稅人申訴中心及申訴熱線電話設置補充事項,['30103']
中區國稅局組織架構,['30081']
中區國稅局綜合所得稅結算申報人工申報案件件數比較表,['122476']
中區國稅局綜合所得稅結算申報人工申報案件統計表,['31759']
中區國稅局線上申辦案件辦理情形統計表,['32916']
中區國稅局臨櫃查詢所得及扣除額件數統計表,['119321']
中區國稅局菸酒稅廠商家數統計表,['32936']
中區國稅局處理人民陳情案件作業要點,['30104']
中區國稅局記帳及報稅代理人名冊,['25515']
中區國稅局記帳及報稅代理人專業訓練單位名冊,['25517']
中區國稅局記帳士名冊,['25513']
中區國稅局訴願以上處理情形統計表,['32932']
"中區國稅局證券商家數統計表 Statistics of the Number of Securities Transaction Tax Applicants, National Taxation Bureau of the Central Area, Ministry of Finance",['30051']
中區國稅局貨物稅申報家數及稅額級距件數統計表,['30065']
中區國稅局贈與稅收件統計表,['25486']
中區國稅局贈與稅核定徵免件數統計表,['36918']
中區國稅局轄區內人口數、工商家數及各項申報統計,['12805']
中區國稅局辦理政策宣導相關廣告費用統計表,['62471']
中區國稅局近年公告採購案件數,['25455']
中區國稅局違章漏稅案件處理情形表,['25630']
中區國稅局遺產稅收件統計表,['25484']
中區國稅局遺產稅核定徵免件數統計表,['32908']
中區國稅局電子公文統計彙總表,['32580']
中區國稅局電子發票服務窗口一覽表,['30140']
中區國稅局預算案,['12632']
中區國稅局首長會見民眾實施要點,['30101']
中國輸出入銀行中小企業單1服務窗口,['93207']
中國輸出入銀行作業風險應計提資本表,['41404']
中國輸出入銀行信用風險抵減表,['41405']
中國輸出入銀行信用風險暴險額與應計提資本表,['41406']
中國輸出入銀行員工學歷分布表,['93204']
中國輸出入銀行對民間團體補(捐)助執行情形,['42528']
中國輸出入銀行市場風險應計提資本表,['41359']
中國輸出入銀行平均服務年資表,['93206']
中國輸出入銀行捐助作業要點,['44882']
中國輸出入銀行會計報表,['38625']
中國輸出入銀行會計報表起,['77040']
中國輸出入銀行理事名單,['40050']
中國輸出入銀行監察人名單,['40648']
中國輸出入銀行總經理副總經理各部門主管名單,['41358']
中國輸出入銀行總行及分行表,['93202']
中國輸出入銀行資本適足率表,['93203']
中國輸出入銀行附屬單位決算,['38890']
中國輸出入銀行附屬單位預算,['38968']
中央各機關經管眷屬宿舍戶數,['30572']
中央政府債務基金會計報表,['20197']
中央政府債務基金決算,"['20420', '28247', '43335']"
中央政府債務基金附屬單位決算,"['77337', '99422', '117698']"
中央政府債務基金附屬單位預算,"['53003', '75064', '98016', '114017', '128330']"
中央政府債務基金附屬單位預算案,"['12621', '90641', '107345', '129809']"
中央政府債務基金預算,"['21328', '21333', '35334', '43212']"
中央政府債務未償餘額占國內生產毛額百分比,['6748']
中央政府公債發行制度之檢討與改進,['13315']
中央政府各年度債務舉借概況,['12131']
中央政府各機關(機構)徵收或購置已逾未完成產權移轉登記土地處理情形彙整統計表,['8322']
中央政府各機關學校公務用及公共用珍貴財產數量價值總表,['46808']
中央政府各機關學校公務用及公共用財產數量價值總表,['46807']
中央政府各機關辦理財產折舊攤銷說明會課程簡報,['24120']
中央政府嚴重特殊傳染性肺炎防治及紓困振興特別預算執行狀況月報表及會計月報,['126767']
中央政府建設公債標售概況表,['8224']
中央政府機關資料集,['44806']
中央政府特別預算庫款支付表,['30953']
中央政府納入集中支付之特種基金及保管款餘額,['41137']
中央政府總預算案近歲入明細表,['25031']
中央政府總預算歲出主管別庫款支付表,['41142']
中央政府總預算歲出庫款支付表,['41143']
中央政府總預算近歲入審決數統計表,['25029']
中央政府總預算近歲入院編決算數明細表,['25033']
中央政府總預算近歲入預算數統計表,['25032']
中央政府總預算近預決算數比較分析表,['25030']
中央政府財政收支狀況,['6940']
中央政府近年投資收益繳庫數,['8229']
中央政府近年營業基金盈餘繳庫數,['8230']
中央政府近年行政及財產收入統計表,['8571']
中央政府近年非營業特種基金賸餘繳庫數,['8228']
中央政府近庫款領取方式統計表,['6941']
中央政府近期公共債務概況表,['12146']
中央政府近總預算財政收支結構分析表,['6745']
中央普通統籌分配稅款(含地方政府統籌分配稅款短少補助)分配金額表,['6746']
中央機關經管單房間職務宿舍戶數,['30571']
中央機關經管單房間職務宿舍統計表,['46812']
中央機關經管多房間職務宿舍戶數,['30570']
中央機關經管多房間職務宿舍統計表,['46811']
中央機關經管宿舍統計表,['46814']
中央機關經管眷屬宿舍統計表,['46813']
中央機關經管首長宿舍戶數,['30569']
中央機關經管首長宿舍統計表,['46810']
中央特別統籌分配稅款撥付明細表(按地區別),['31110']
中央特別統籌分配稅款支出明細,['8223']
中央特別統籌分配稅款支應地方政府招商獎勵金經費明細表,['31113']
中央特別統籌分配稅款支應社會福利津貼調整經費明細表,['31112']
中央特別統籌分配稅款支應重大天災及公共設施復建經費明細表,['31111']
中央統籌分配稅款分配制度改進之研究,['11426']
中央統籌分配稅款實徵情形表,['8332']
中央統籌分配稅款撥付及墊借歸扣情形表,['12147']
中央統籌分配稅款收入情形估測表,['12150']
中央統籌分配稅款收入比較分析表,['31114']
中央統籌分配稅款收支月報表,['12189']
中央財政與預算收支問題及改進之探討,['11559']
中獎落點統計-B2C電子發票統計_依鄉鎮市區-資料集,['24838']
中獎落點統計-中獎電子發票統計_依行業別-資料集,['24839']
中獎落點統計-中獎電子發票統計_依鄉鎮市區-資料集,['24840']
中程施政計畫,['11773']
中華民國財政,['22860']
主管國營事業董事及監事性別統計,['31115']
人民申請使用國有財產業務問答,['24107']
人身保險相關課稅問題之檢討,['11770']
使用牌照稅稅額級距表(依排氣量),['31791']
使用牌照稅稅額級距表(依馬達馬力數),['31792']
促參教育訓練統計表,['45809']
保稅卡車名冊,['8273']
保稅工廠清冊,['8263']
個人出售房屋未申報或已申報而未能提出證明文件之財產交易所得標準,['25480']
健全社會保險財務之研究,['11805']
優質企業安全審查項目及驗證基準,['8279']
優質企業認證合格業者名冊,['17074']
先放後稅申請業者家數,['24047']
免稅商店及離島免稅購物商店業者名冊,['8275']
入境旅客不隨身後送行李(寵物類)就地通關服務窗口案件數,['24049']
入境旅客人數,['38749']
入境旅客攜帶自用農畜水產品菸酒限量表,['6711']
全功能櫃台查詢作業應附證明文件一覽表,['25354']
全功能櫃台申辦作業應附證明文件一覽表,['25355']
全功能櫃台發證作業應附證明文件一覽表,['25353']
全國各級學校統1編號資料集,['75136']
全國營業(稅籍)登記(停業)資料集,['75140']
全國營業(稅籍)登記(停業以外之非營業中)資料集,['75141']
全國營業(稅籍)登記資料集,['9400']
全國財產稅籍持有人數統計表,['6172']
全國財產稅總歸戶財產類別代碼檔,['54261']
全國賦稅收入實徵淨額日曆年別,"['6671', '6741', '6742', '6743']"
全國賦稅收入實徵淨額與預算數之比較,['16910']
全國賦稅預算數,['6740']
全面提升國庫支付作業效能之研究,['11515']
公債發行明細表,['41147']
公債發行計畫表,['25297']
公務人員特種考試關務人員考試錄取及實際報到人數,['32052']
公務行銷成果統計分析,['38706']
公司及獨資合夥工商家數統計表,['102004']
公庫支出,['8474']
公庫支出淨額,['8472']
公庫收入,['8473']
公庫收入淨額,['8471']
公庫結存,['8475']
公營事業機構占用國有非公用土地處理結案彙整表,['30577']
公用事業開立電子發票疑義解答(Q&A),['35487']
公益彩券品牌形象及獎金課稅問題之研究,['11560']
公益彩券回饋金分配情形,['31311']
公益彩券回饋金執行情形,['31312']
公益彩券回饋金收支情形,['31313']
公益彩券回饋金運用計畫,['31324']
公益彩券形象標誌運用之檢討與改進,['11448']
公益彩券營業報告書簡表,['6747']
公益彩券發行及管理制度之研究,['11423']
公益彩券發行及管理制度變革之研究,['11499']
公益彩券發行機構甄選作業之探討,['12016']
公益彩券盈餘分配及銷售量簡表,['6038']
公益彩券盈餘分配辦理社會福利事業情形彙總表,['12190']
公益彩券盈餘管理運用及資訊公開考核情形表,['31108']
公益彩券盈餘運用監督機制及績效評估之檢討與改進,['11492']
公益彩券開獎號碼及各獎項彩金相關資料,['72921']
公股事業概況,['25312']
公股事業機構董監事名單,['12228']
公股銀行承作放款業務及逾期情形,['31190']
公股銀行辦理創業貸款餘額,['31191']
公股銀行辦理青年安心成家貸款,['31189']
出口值,['8380']
出口報單通關流程處理事件代碼,['38731']
出口胚布統計,['80885']
出境旅客人數,['38750']
出版品一覽表,['46830']
加工出口區名冊,['8274']
加強國有不動產活化運用計畫,['24121']
加強國有公用不動產之有效管理,['11771']
加速公營事業民營化對財政影響之研究,['11785']
北區國稅局人民陳情案件檢討分析報告,['28925']
北區國稅局人民陳情案件處理程序及管制作業要點,['28938']
北區國稅局使用B2C電子發票營業人清冊,['25432']
北區國稅局使用電子發票績優營業人名冊,['25431']
北區國稅局保有個人資料檔案公開項目彙整表,['28927']
北區國稅局全功能櫃檯作業處理件數統計表,['33230']
北區國稅局公司及獨資合夥工商家數統計表,['118419']
北區國稅局及所屬會計報表,"['19059', '76690', '99030', '119549']"
北區國稅局各分局、稽徵所及服務處電子發票服務窗口一覽表,['28940']
北區國稅局單位決算書,['12633']
北區國稅局國稅統計年報,['12639']
北區國稅局執行業務暨其他所得者申報家數統計表,['122780']
北區國稅局外僑綜合所得稅結算申報案件統計表,['25577']
北區國稅局局長、分局長及稽徵所主任與民有約實施要點,['28928']
北區國稅局復查案件處理情形統計表,['33232']
北區國稅局復查決定書案例,['28929']
北區國稅局所轄期貨商家數統計表,['28931']
北區國稅局所轄證券商家數統計表,['28930']
北區國稅局扣免繳(外僑人工建檔部分)統計表,['46026']
北區國稅局扣免繳申報收件統計表,"['32779', '33623']"
北區國稅局提升服務執行計畫,['28924']
北區國稅局政風室受理公職人員財產申報人數及抽籤比例統計表,['94130']
北區國稅局施政計畫,['28932']
北區國稅局暨所屬各分局、稽徵所聯絡方式及服務時間,['38110']
北區國稅局最近國家賠償事件處理情形統計表,['12741']
北區國稅局業務績效與獲獎榮譽,['37653']
北區國稅局業務職掌,['37646']
北區國稅局機關沿革,['37650']
北區國稅局歷年支付或接受之補助,['30472']
北區國稅局法定預算,['76935']
北區國稅局為民服務意見調查報告書,['28933']
北區國稅局為民服務手冊及白皮書,['28934']
北區國稅局營所稅受理災害損失報備情形統計表,['118418']
北區國稅局營業稅申報家數統計表,['33233']
北區國稅局稅籍登記申請收件統計表,['28935']
北區國稅局納稅義務人申訴中心及申訴熱線電話設置暨管制作業要點,['28937']
北區國稅局組織架構,['37645']
北區國稅局綜合所得稅結算申報人工申報案件件數比較表,['122474']
北區國稅局綜合所得稅結算申報人工申報案件統計表,['31760']
北區國稅局線上申辦統計表,['37384']
北區國稅局菸酒稅廠商家數統計表,['33235']
北區國稅局記帳及報稅代理業務人名冊,['25461']
北區國稅局記帳士名冊,['25453']
北區國稅局訴願以上處理情形統計表,['33229']
北區國稅局貨物稅申報家數及稅額級距統計表,['28939']
北區國稅局贈與稅收件統計表,['25583']
北區國稅局贈與稅核定徵免件數統計表,['35479']
北區國稅局轄內記帳及報稅代理業務人名冊訓練單位名稱,['25462']
北區國稅局轄區內人口數、工商家數及各項申報統計,['30271']
北區國稅局違章漏稅案件處理情形表,['25485']
北區國稅局遺產稅收件統計表,['25580']
北區國稅局遺產稅核定徵免件數統計表,['33236']
北區國稅局電子公文統計彙總表,['37643']
北區國稅局預算案,['12729']
北區國稅局預約免下車服務相關資訊,['28941']
北區國稅局首長簡介,['37644']
南區國稅局使用B2C電子發票營業人清冊,['25467']
南區國稅局使用電子發票績優營業人名冊,['25466']
南區國稅局保有個人資料檔案公開項目彙整表,['29020']
南區國稅局全功能櫃台作業處理件數統計表,['32756']
南區國稅局公司及獨資合夥工商家數統計表,['118383']
南區國稅局公文電子交換統計表,['32311']
南區國稅局及所屬單位決算,['12735']
南區國稅局及所屬會計報表,['19817']
南區國稅局各分局、稽徵所電子發票服務窗口一覽表,['29001']
南區國稅局各項國稅多元繳稅方式統計表,['38893']
南區國稅局呼速得預約免下車服務申請項目及應備文件一覽表,['29002']
南區國稅局員額與素質相關統計資訊,['29004']
南區國稅局國稅統計年報,['12738']
南區國稅局執行業務暨其他所得者申報家數統計表,['118386']
南區國稅局外僑綜合所得稅結算申報案件收件統計表,['25443']
南區國稅局平面媒體、網路媒體、廣播媒體及電視媒體辦理政策宣導相關廣告費用統計表,['57715']
南區國稅局復查案件處理情形統計表,['32910']
南區國稅局復查決定書案例,['29003']
南區國稅局扣免繳(外僑人工建檔部分)統計表,['46027']
南區國稅局扣免繳申報統計表,['32757']
南區國稅局提升服務品質執行計畫,['29005']
南區國稅局暨其分局、稽徵所服務時間一覽表,['29007']
南區國稅局暨所屬各分局、稽徵所聯絡方式及服務時間,['29006']
南區國稅局最近國家賠償事件處理情形統計表,['28991']
南區國稅局期貨商家數統計表,['28980']
南區國稅局業務績效與榮譽一覽表,['29008']
南區國稅局業務職掌,['29009']
南區國稅局檔案應用常見問答集,['57713']
南區國稅局歷年支付或接受之補助,['29010']
南區國稅局法定預算,['15635']
南區國稅局為民服務意見調查報告,['29011']
南區國稅局為民服務白皮書,['29012']
南區國稅局營利事業單位數統計表,['36817']
南區國稅局營利事業所得稅受理災害損失報備情形統計表,['118388']
南區國稅局營利事業按收入級距核定情形統計表,['36816']
南區國稅局營業稅申報家數統計表,['32758']
南區國稅局當年度重要施政計畫,['29013']
南區國稅局稅籍登記申請收件統計表,['28990']
南區國稅局組織架構,['29014']
南區國稅局組織沿革,['29015']
南區國稅局綜合所得稅結算申報人工申報案件件數比較表,['122478']
南區國稅局綜合所得稅結算申報人工申報案件統計表,['31761']
南區國稅局線上申辦案件辦理情形統計表,['32312']
南區國稅局臨櫃查詢所得及扣除額件數統計表,['118387']
南區國稅局菸酒稅廠商家數統計表,['33668']
南區國稅局處務規程,['37300']
南區國稅局處理人民陳情案件滿意度調查報告,['29000']
南區國稅局處理人民陳情案件要點,['29016']
南區國稅局記帳及報稅代理人名冊,['25468']
南區國稅局記帳及報稅代理人專業訓練單位名冊,['25469']
南區國稅局記帳士名冊,['25470']
南區國稅局訴願以上處理情形統計表,['32760']
南區國稅局證券商家數統計表,['28982']
南區國稅局貨物稅申報家數及稅額級距件數統計表,['29017']
南區國稅局贈與稅收件統計表,['25464']
南區國稅局贈與稅核定徵免件數統計表,['35491']
南區國稅局轄區內人口數、工商家數、各項申報統計,['29018']
南區國稅局近年採購案件目錄,['25208']
南區國稅局違章漏稅案件處理情形表,['25293']
南區國稅局遺產稅收件統計表,['25465']
南區國稅局遺產稅核定徵免件數統計表,['32761']
南區國稅局預算案,['12737']
南區國稅局首長與民有約活動作業規定,['29019']
占用地數量分析統計表(分署表),['30575']
占用地數量分析統計表(署總表),['30574']
印刷廠捐補助明細,['33422']
印刷廠政策宣導,['33424']
印刷廠會計月報,"['27748', '43266', '44949', '105184', '117702']"
印刷廠附屬單位決算,['39168']
印刷廠附屬單位預算,['40446']
印刷會費,['33423']
印花稅及娛樂稅之檢討,['11796']
印花稅行業代碼表,['31608']
及所屬機關依申請提供資料清單,['33717']
取消保留盈餘加徵百分之十營所稅及其配套措施之研究,['11791']
受捐贈機關或團體捐贈碼清單,['31868']
受理電傳退押電話,['8277']
台灣地區綠稅稅制設計之研究,['11784']
各主管機關經管作業基金數量價值統計表,['46809']
各單位暨所屬機關新聞稿,['8372']
各地區國稅局服務稅目簡介,['25593']
各年度國產及進口一般料理酒數量表,['25079']
各年度國產及進口其他酒類數量表,['8199']
各年度國產及進口其他釀造酒類數量表,['12235']
各年度國產及進口再製酒類數量表,['8198']
各年度國產及進口啤酒類數量表,['25066']
各年度國產及進口嚼菸數量表,['25075']
各年度國產及進口威士忌數量表,['12237']
各年度國產及進口料理米酒數量表,['25101']
各年度國產及進口料理酒類數量表,['25103']
各年度國產及進口水果釀造酒類數量表,['8196']
各年度國產及進口白蘭地數量表,['8197']
各年度國產及進口穀類釀造酒類數量表,['25073']
各年度國產及進口紙菸數量表,['25065']
各年度國產及進口菸絲數量表,['25068']
各年度國產及進口葡萄酒數量表,['25069']
各年度國產及進口蒸餾酒類數量表,['25071']
各年度國產及進口酒精類數量表,['12236']
各年度國產及進口雪茄數量表,['25067']
各年度國產及進口鼻菸、嚼菸及其他菸品數量表,['12234']
各年度國產及進口鼻菸數量表,['25072']
各年度申請公益彩券回饋金補助計畫審核結果(主辦部分),['11418']
各年度進口菸酒生產國家別數量表,['6942']
各機關經管國有公用不動產被占用暨處理情形統計表,['8323']
各級政府以上公共債務明細表(實際數),['30955']
各級政府以上公共債務明細表(預算數),['30956']
各級政府公共債務統計表,['25300']
各級政府公庫解繳稅款作業程序之改進研究,['11538']
各級政府機關撥用國有土地統計表(分署總表),['30564']
各級政府機關撥用國有土地統計表(各單位分表),['30565']
各級政府機關撥用國有土地統計表(各縣市分表),['30566']
各級政府機關撥用國有土地統計表(署總表),['30559']
各級政府機關撥用國有非公用土地年度統計表(分署表),['30567']
各級政府歲入歲出淨額、餘絀及融資,['6739']
各級政府歲入淨額,['8469']
各級政府歲出淨額-按分,['8470']
各級政府舉債額度及債務未償餘額情形表,['30954']
各關辦理旅客或隨交通工具服務之人員攜帶外幣入出境申報年度總件數,['24155']
各項國稅多元繳稅方式統計表,['42328']
各項租稅稅基侵蝕之全面檢討,['11797']
各類所得扣繳率標準,['24754']
合理加強各項規費及其他服務性收入之研究,['11798']
合理規劃公債發行之研究,['11799']
合理規劃員工認股權課稅制度之研究,['11800']
啤酒花殘留農藥之背景值調查及衛生標準評估委託研究報告,['11496']
單位決算,['34223']
單位預算(按年),['34225']
單位預算案(按年),['34220']
國內營利事業機關團體及執行業務事務所於結算申報期間查詢所得資料作業疑義,['25588']
國家(地區)出口總值排名前30名(當月及1至當月累積),['39051']
國家(地區)貿易總值排名前30名(當月及1至當月累積),['39052']
國家(地區)進口總值排名前30名(當月及1至當月累積),['39050']
國家賠償統計資料,['7545']
國家金融安定基金每季公告之財務報表、每年之決算書,['24590']
國庫券標售概況表,['7385']
國庫券發行明細表,['41148']
國庫券發行計畫表,['25298']
國庫支出,['8477']
國庫支票簽發作業電子化之研究,['11517']
國庫收入,['8476']
國庫收支應用科目及其代號表,['12010']
國庫經辦行家數統計表,['25027']
國庫經辦行通訊錄一覽表,['12560']
國庫署保有及管理個人資料之項目彙整表,['12007']
國庫署各年度獎補助費,['8177']
國庫署單位會計報表,['20193']
國庫署單位決算書,"['20430', '30269', '44632', '79696', '100795', '118272']"
國庫署單位預算,"['21322', '35328']"
國庫署單位預算書,"['26940', '44060', '78056', '99191', '119189']"
國庫署單位預算案,"['53149', '90921', '107585', '129979']"
國庫資金流通狀況,['8478']
