資料集名稱,資料集識別碼,資料集描述,主要欄位說明,提供機關
幼兒園名錄,6086,全臺灣幼兒園通訊資料,代碼;學校名稱;公/私立;縣市名稱;鄉鎮市區名稱;地址;電話;學校代碼;學校地址;學校電話;鄉鎮市區<br>名稱,教育部統計處
國民小學名錄,6087,全臺灣國民小學通訊資料,代碼;學校名稱;縣市名稱;地址;電話;網址;公/私立;備註,教育部統計處
國民中學名錄,6088,全臺灣國民中學通訊資料,學校代碼;學校名稱;縣市名稱;地址;電話;網址;學校地址;學校電話;學校網址;代碼;公/私立,教育部統計處
一般高級中等學校名錄,6089,全臺灣一般高級中等學校通訊資料,代碼;學校名稱;縣市名稱;地址;電話;網址;備註;公/私立;公私立別;公私立,教育部統計處
獨立高級中等進修學校名錄,6090,全臺灣獨立高級中等進修學校通訊資料,代碼;學校名稱;縣市名稱;地址;電話;網址;公/私立,教育部統計處
大專校院名錄,6091,全臺灣大專校院通訊資料,代碼;學校名稱;縣市名稱;地址;電話;網址;體系別;公/私立,教育部統計處
學生體重平均值(6歲-15歲),6229,本資料集主要提供全臺灣6歲-15歲學生體重平均值。,學年度;年齡;總計;男;女,教育部國民及學前教育署
十二年國民基本教育-適性輔導影片,6230,愛學網之子資料集-適性輔導,名稱;說明;網址,教育部國民及學前教育署
大專院校校別學生數,6231,全臺灣大專校院校別學生數,學校代碼;學校名稱;日間∕進修別;等級別;一年級男生;一年級女生;二年級男生;二年級女生;三年級男生;三年級女生;四年級男生;四年級女生;五年級男生;五年級女生;六年級男生;六年級女生;七年級男生;七年級女生;延修生男生;延修生女生;縣市名稱;體系別;總計;男生計;女生計,教育部統計處
大專院校校別專任教師數,6232,全臺灣大專院校校別專任教師數,學校代碼;學校名稱;日間∕進修別;教授男;教授女;副教授男;副教授女;助理教授男;助理教授女;講師男;講師女;其他男;其他女;助教男;助教女;縣市名稱;體系別;專業技術人員及教師男;專業技術人員及教師女;專案教學人員男*;專案教學人員女*;教官、護理教師及護理實習臨床指導男;教官、護理教師及護理實習臨床指導女;一般教師(含客座及講座)-教授-男;一般教師(含客座及講座)-教授-女;一般教師(含客座及講座)-副教授-男;一般教師(含客座及講座)-副教授-女;一般教師(含客座及講座)-助理教授-男;一般教師(含客座及講座)-助理教授-女;一般教師(含客座及講座)-講師-男;一般教師(含客座及講座)-講師-女;專業技術人員及教師-教授-男;專業技術人員及教師-教授-女;專業技術人員及教師-副教授-男;專業技術人員及教師-副教授-女;專業技術人員及教師-助理教授-男;專業技術人員及教師-助理教授-女;專業技術人員及教師-講師-男;專業技術人員及教師-講師-女;專案教學人員-教授-男;專案教學人員-教授-女;專案教學人員-副教授-男;專案教學人員-副教授-女;專案教學人員-助理教授-男;專案教學人員-助理教授-女;專案教學人員-講師-男;專案教學人員-講師-女;其他教師-教官-男;其他教師-教官-女;其他教師-護理教師-男;其他教師-護理教師-女;其他教師-護理臨床指導教師-男;其他教師-護理臨床指導教師-女;其他教師-運動教練-男;其他教師-運動教練-女;其他教師-助教-男;其他教師-助教-女,教育部統計處
大專校院校別專任教師數－學歷別,6233,全臺灣大專校院校別專任教師數－學歷別,學校代碼;學校名稱;日間∕進修別;教師學歷;教授男;教授女;副教授男;副教授女;助理教授男;助理教授女;講師男;講師女;其他男;其他女;助教男;助教女;縣市名稱;專業技術人員及教師男;專業技術人員及教師女;專案教學人員男*;專案教學人員女*;教官、護理教師及護理實習臨床指導男;教官、護理教師及護理實習臨床指導女;一般教師(含客座及講座)-教授-男;一般教師(含客座及講座)-教授-女;一般教師(含客座及講座)-副教授-男;一般教師(含客座及講座)-副教授-女;一般教師(含客座及講座)-助理教授-男;一般教師(含客座及講座)-助理教授-女;一般教師(含客座及講座)-講師-男;一般教師(含客座及講座)-講師-女;專業技術人員及教師-教授-男;專業技術人員及教師-教授-女;專業技術人員及教師-副教授-男;專業技術人員及教師-副教授-女;專業技術人員及教師-助理教授-男;專業技術人員及教師-助理教授-女;專業技術人員及教師-講師-男;專業技術人員及教師-講師-女;專案教學人員-教授-男;專案教學人員-教授-女;專案教學人員-副教授-男;專案教學人員-副教授-女;專案教學人員-助理教授-男;專案教學人員-助理教授-女;專案教學人員-講師-男;專案教學人員-講師-女;其他教師-教官-男;其他教師-教官-女;其他教師-護理教師-男;其他教師-護理教師-女;其他教師-護理臨床指導教師-男;其他教師-護理臨床指導教師-女;其他教師-運動教練-男;其他教師-運動教練-女;其他教師-助教-男;其他教師-助教-女;體系別,教育部統計處
大專院校校別班級數,6234,全臺灣大專院校校別班級數,學校代碼;學校名稱;日夜別;等級別;一年級;二年級;三年級;四年級;五年級;六年級;七年級;縣市名稱;體系別,教育部統計處
大專校院校別畢業生人數(上學年度),6235,全臺灣大專校院校別畢業生人數,學校代碼;學校名稱;日間_進修別;等級別;上學年畢業生男;上學年畢業生女;縣市名稱;體系別;日間∕進修別,教育部統計處
宗教研修學院概況－按校別分,6236,全臺灣宗教研修學院概況－按校別分,學校代碼;學校名稱;專任教師數男;專任教師數女;職員數男;職員數女;學生數學士;學生數碩士;學生數博士;上學年畢業生數學士;上學年畢業生數碩士;上學年畢業生數博士;縣市別,教育部統計處
空大及大專進修學校概況,6237,全臺灣空大及大專進修學校概況,學校代碼;學校名稱;專任教師(不含助教)男;專任教師(不含助教)女;兼任教師男;兼任教師女;助教男;助教女;職員男;職員女;二專學生數;二技(大學)學生數;二專上學年畢業生數;二技(大學)上學年畢業生數;學制;1年級男;1年級女;2年級男;2年級女;3年級(二技1年級)男;3年級(二技1年級)女;4年級(二技2年級)男;4年級(二技2年級)女;5年級以上(二技3年級)男;5年級以上(二技3年級)女;延修生男;延修生女;上學年畢業生男;上學年畢業生女,教育部統計處
高級中等學校校別資料(含進修部(學校)),6238,全臺灣高級中等學校校別資料(含進修部(學校)),學校代碼;學校名稱;專任教師數男;專任教師數女;兼任教師數男;兼任教師數女;職員數男;職員數女;班級數;學生數男;學生數女;上學年畢業生數男;上學年畢業生數女;縣市代碼;縣市名稱,教育部統計處
國民中學校別資料,6239,全臺灣國民中學校別資料,縣市代碼;縣市名稱;學校代碼;學校名稱;7年級班級數;8年級班級數;9年級班級數;學生數7年級女;7年級女學生數;8年級男學生數;8年級女學生數;9年級男學生數;9年級女學生數;上學年男畢業生;上學年女畢業生;男專任教師;女專任教師;男職員;女職員;班級數7年級;班級數8年級;班級數9年級;學生數7年級男;學生數8年級男;學生數8年級女;學生數9年級男;學生數9年級女,教育部統計處
國民小學校別資料,6240,全臺灣國民小學校別資料,縣市代碼;縣市名稱;學校代碼;學校名稱;1年級班級數;2年級班級數;3年級班級數;4年級班級數;5年級班級數;6年級班級數;1年級男學生數;1年級女學生數;2年級男學生數;2年級女學生數;3年級男學生數;3年級女學生數;4年級男學生數;4年級女學生數;5年級男學生數;5年級女學生數;6年級男學生數;6年級女學生數;上學年男畢業生;上學年女畢業生;男專任教師;女專任教師;男職員;女職員,教育部統計處
補習學校校別資料,6241,全臺灣補習學校校別資料,縣市代碼;縣市名稱;學校代碼;學校名稱;1年級班級數;2年級班級數;3年級班級數;1年級男學生數;1年級女學生數;2年級男學生數;2年級女學生數;3年級男學生數;3年級女學生數;上學年男畢業生;上學年女畢業生;男專任教師;女專任教師;男職員;女職員;班級數;1年級;2年級;3年級;學生數;男學生;女學生;1年級男;1年級女;2年級男;2年級女;3年級男;3年級女;上學年畢業生,教育部統計處
學生身高平均值(6歲-15歲),6283,6歲-15歲學生身高平均值,學年度;年齡;總計;男;女,教育部國民及學前教育署
國小學生體位趨勢,6284,國小學生體位趨勢,類別;性別;年度;百分比,教育部國民及學前教育署
特殊教育學校名錄,6285,本資料集主要提供全臺灣特殊教育學校通訊資料,縣市;學校;地址;電話;網址;傳真,教育部國民及學前教育署
大專校院校別職員.警衛.工友人數,6286,全臺灣大專校院校別職員.警衛.工友人數,學校代碼;學校名稱;職員男;職員女;秘書男;秘書女;教務男;教務女;學務男;學務女;總務男;總務女;會計男;會計女;人事男;人事女;圖書管理男;圖書管理女;體育衛生男;體育衛生女;產學合作(含育成)男;產學合作(含育成)女;國際交流男;國際交流女;資訊男;資訊女;環境安全男;環境安全女;助教男;助教女;其他男;其他女;警衛男;警衛女;工友男;工友女;縣市名稱;體系別,教育部統計處
大專校院校地校舍面積統計,6287,全臺灣大專校院校地校舍面積統計,學校類型;學校代碼;學校名稱;縣市別;學生宿舍床位數<br>(床);教職員宿舍單身床位<br>(床);教職員宿舍有眷戶數<br>(戶);可使用校地-校舍基地<br>(平方公尺);可使用校地-露天運動場地<br>(平方公尺);可使用校地-其他校地<br>(平方公尺);無法使用校地<br>(平方公尺);可使用校地-校舍基地(平方公尺);自有宿舍床位數<br>(床),教育部統計處
大專校院圖書館統計,6288,全臺灣大專校院圖書館統計,項目;公立大學及獨立學院;私立大學及獨立學院;公立專科學校;私立專科學校;學校代碼;學校名稱;中文圖書收藏冊數(冊)-總類;中文圖書收藏冊數(冊)-哲學類;中文圖書收藏冊數(冊)-宗教類;中文圖書收藏冊數(冊)-科學類;中文圖書收藏冊數(冊)-應用科學類;中文圖書收藏冊數(冊)-社會科學類;中文圖書收藏冊數(冊)-史地類;中文圖書收藏冊數(冊)-語言文學類;中文圖書收藏冊數(冊)-藝術類;外文圖書收藏冊數(冊);期刊合訂本(未以圖書編目)(冊);線上資料庫(種);光碟及其他類型資料庫(種);電子期刊(種);電子書(種);視聽資料(件);圖書閱覽座位數(個);全年圖書(含視聽資料及其他館藏)借閱人次(人次);全年圖書(含視聽資料及其他館藏)借閱冊次(冊次);全年線上及光碟資料庫(含電子書及電子期刊)檢索(人次);報紙(種);中.日文期刊(種);西文期刊(種);中文圖書收藏冊數(冊)_總類;中文圖書收藏冊數(冊)_哲學類;中文圖書收藏冊數(冊)_宗教類;中文圖書收藏冊數(冊)_自然科學類;中文圖書收藏冊數(冊)_應用科學類;中文圖書收藏冊數(冊)_社會科學類;中文圖書收藏冊數(冊)_史地類;中文圖書收藏冊數(冊)_語言文學類;中文圖書收藏冊數(冊)_藝術類,教育部統計處
大專校院境外學生人數統計,6289,全臺灣大專校院境外學生人數統計,洲別;國別;學位生-正式修讀學位外國生;學位生-僑生(含港澳);學位生-正式修讀學位陸生;非學位生-外國交換生;非學位生-外國短期研習及個人選讀;非學位生-大專附設華語文中心學生;非學位生-大陸研修生;非學位生-海青班;境外專班;學校類型;學校代碼;學校名稱;學位生_正式修讀學位外國生;學位生_僑生(含港澳);學位生_正式修讀學位陸生;非學位生_外國交換生;非學位生_外國短期研習及個人選讀;非學位生_大專附設華語文中心學生;非學位生_大陸研修生;非學位生_海青班,教育部統計處
大專校院外籍專任教師統計－按校別、性別與職級別分,6290,全臺灣大專校院外籍專任教師統計－按校別、性別與職級別分,學校代號;學校名稱;教授男;教授女;副教授男;副教授女;助理教授男;助理教授女;講師男;講師女;其他男;其他女;縣市名稱,教育部統計處
大專校院外籍專任教師統計－按校別、國別、性別與職級別分,6291,全臺灣大專校院外籍專任教師統計－按校別、國別、性別與職級別分,學校代號;學校名稱;國別代碼;國別名稱;教授男;教授女;副教授男;副教授女;助理教授男;助理教授女;講師男;講師女;其他男;其他女,教育部統計處
奧林匹亞競賽歷年參賽成績,6311,本資料集主要提供奧林匹亞競賽歷年參賽成績等資訊。,年度;類別;主辦國;參加國;屆別;成績;排名,教育部國民及學前教育署
高級中等學校實用技能學程核班情形,6312,本資料集主要提供各學年度高級中等學校實用技能學程核班情形等資訊。,校名;招生科別;上課時段;核定班數;招收學生數;招收人數;班數;招生人數;,教育部國民及學前教育署
建教合作班核班情形,6313,本資料集主要提供各學年度建教合作班核班情形等資訊。,校名;科別;辦理模式;申辦科班;核定招生人數;學校;核定班數;核定人數;申辦科別,教育部國民及學前教育署
十二年國民基本教育-國中活化教學列車影片,6314,本資料集主要提供愛學網之子資料集-活化教學等資訊。,名稱;說明;網址,教育部國民及學前教育署
國民中小學教科書審定通過表,6315,本資料集主要是國民中小學教科書採一綱多本為主，由民間出版業者依據國民中小學九年一貫課程綱要編纂，並交由國家教育研究院審定，通過後發行執照，作為學校選用書之依據。,依據;圖書名稱;冊次;版本別（依筆畫排序）,教育部國民及學前教育署
國家教育研究院專案研究報告,6316,本資料集主要提供本院對外公開之專案研究報告等資訊。,序號;計畫名稱;研究團隊;期程;網址,國家教育研究院
國際教育訊息電子報,6317,本資料集主要提供電子報內容係由教育部駐外單位定期提供19國28個地區當地最新教育訊息，復經本院加以統整與歸類彙編而成，包含各級、各類教育，以引領讀者擴展更寬廣的國際教育視野，以及掌握即時性世界教育趨勢及各國教育脈動等資訊。,期數;名稱;出刊時間;網址,國家教育研究院
愛學網電視館,6318,本資料集主要教育部國中小學習網－「愛學網」係由教育部指導，本院依據國中小學生之需求，整合國內外優質數位學習資源，規劃設立之網站。主要內容分為五大主題區－電視館、學習萬花筒、益智遊樂場、視訊講堂及活動廣場，本院亦定期舉辦網站活動與實體活動，擴大民眾之參與度及網站使用效益，其中電視館有適合親師使用的影音資料與教學資源等資訊，廣受各界好評。,URL;meta_影片名稱*;meta_領域別+;meta_適用對象;meta_媒體種類;meta_片長;meta_內容簡介*;meta_關鍵詞*+;分段點;meta_製作年份;meta_製作者*+;影片檔案路徑*;meta_語文*+;meta_授權範圍*;meta_授權有效日;meta_資料來源,國家教育研究院
教育學學術名詞,6319,本資料集主要提供教育學英中對照名詞等資訊。,英文名稱;中文名稱,國家教育研究院
中央機關一般職稱雙語詞彙,6320,本資料集主要提供中央機關一般職稱之中英對照詞彙等資訊。,一般職稱類別;一般職稱類別細目;一般職稱中文;職等;一般職稱英譯,國家教育研究院
國立教育廣播電臺公告事項,6321,本資料集主要提供本臺各項公告民眾週知的訊息摘要等資訊。,images;pubDate;title;link;description,國立教育廣播電臺
國立教育廣播電臺大事紀要,6322,本資料集主要提供本臺大事紀要資訊。,radio;date;topic;content;picture,國立教育廣播電臺
國立教育廣播電臺文教新聞,6323,本資料集主要提供各種文教新聞訊息摘要等資訊。,pubDate;tag;title;link;description,國立教育廣播電臺
國立教育廣播電臺節目快訊,6324,本資料集主要提供本臺各種節目快訊等資訊。,pubDate;title;link;description,國立教育廣播電臺
國立自然科學博物館展示資源,6423,本資料集主要提供國立自然科學博物館展示資源，用文、圖、語音及影像等效果，將實體展示依主題加以歸類呈現，包括生命科學、地球環境及人類文化等內容。,展廳;標題;網址,國立自然科學博物館
國立自然科學博物館最新消息,6424,本資料集主要提供國立自然科學博物館最新消息，包括新聞、公告、徵才、活動等訊息資料。,category;title;keyword;content;url;dtype;post_date;online;ontop;zone;related_image;related_file;updated,國立自然科學博物館
公共圖書館統計,6425,本資料集主要彙整全國公共圖書館基本資料與統計資訊，由各館定期上網填報資料，以呈現國內公共圖書館的營運狀況，並可作為未來制定圖書館各項政策的參考。資料收集期間為當年度1-3月開放各館填報上一年度1-12月資料(即：2018年收集2017年之全年資料)，如需產生2011-2016年統計資料，請至公共圖書館統計系統使用(https://publibstat.nlpi.edu.tw)。,縣市別;圖書館數 總館(所);分館(所);區館(所);服務轄區人口數;東南亞新移民人口數;專屬社群網站(個);館外服務站 所(個);圖書巡迴車;全年購買圖書資料費-預算(元);圖書;電子書;期刊;報紙;視聽資料;電子資料;其他圖書資料;全年購買圖書資料費-決算(元);圖書(決算);電子書(決算);期刊(決算);報紙(決算);視聽資料(決算);電子資料(決算);其他圖書資料(決算);館舍總面積(平方公尺);供讀者使用的電腦數(台);供讀者使用的平板電腦數(台);編制內總館員數(人);編制內專業人員;編制內行政人員;編制內技術人員;臨時人員;約聘僱人員;工讀生;志工人數;其他;圖書及非書資料收藏數量;一、圖書資料;圖書(冊數);期刊(種數);報紙(種數);其他(決算);二、非書資料;地圖(張);微縮單片(片);微縮捲片(捲);錄音資料(片、捲);錄影資料(片、捲);靜畫資料(幅);其他(件);三、電子資源;線上資料庫(自購或自行建置);光碟資料庫(種);其他類型資料庫(種);電子書(種);四、東南亞圖書及非書資料收藏數量(包含於總館藏量下);閱覽席位數(席);全年圖書資訊借閱人次;全年圖書資訊借閱冊數;全年電子書借閱人次;全年電子書借閱冊數;全年電子資料使用次數;全年推廣活動(場次);一般閱讀推廣活動(場次);幼兒閱讀推廣活動(場次);兒童閱讀推廣活動(場次);青少年閱讀推廣活動(場次);樂齡閱讀推廣活動(場次);新住民閱讀推廣活動(場次);社教藝文活動(場次);地方特色活動(場次);說故事(場次);影片欣賞(場次);其他(場次);全年推廣活動(人次);一般閱讀推廣活動(人次);幼兒閱讀推廣活動(人次);兒童閱讀推廣活動(人次);青少年閱讀推廣活動(人次);樂齡閱讀推廣活動(人次);新住民閱讀推廣活動(人次);社教藝文活動(人次);地方特色活動(人次);說故事(人次);影片欣賞(人次);其他(人次),國立公共資訊圖書館
國立自然科學博物館學習資源,6453,本資料集主要提供國立自然科學博物館科普學習資源，包括「環境變遷」等時事性的熱門議題；同時提供「生物多樣性」、「演化」及「文化社會」等重要主題供探討。,類別;標題;網址,國立自然科學博物館
國立公共資訊圖書館期刊訂閱一覽表,6454,本資料集主要提供本館訂閱期刊雜誌資訊，提供使用者可依語言、筆劃、架號進行瀏覽與查詢。,架號;語文;種類;刊名;刊期,國立公共資訊圖書館
國立公共資訊圖書館獎助博碩士論文,6455,本資料集主要提供本館獎助博碩士論文清單及全文電子檔下載服務。,年度;學位;獎助論文名稱;姓名;學校系所;指導教授;檔案連結,國立公共資訊圖書館
國立公共資訊圖書館聽視障資訊中心館藏目錄清單,6456,本資料集主要收錄本館聽視障資訊中心有聲書、點字書、雙視書等館藏清單，便於使用者查詢使用。,書號;書名;作者;條碼號;索書號;類型,國立公共資訊圖書館
國立科學工藝博物館遺失物資訊,6457,本資料集主要提供科工館遺失物招領資訊,編號;拾獲日期;遺失物名稱;拾獲地點,國立科學工藝博物館
國立科學工藝博物館推廣教育活動訊息,6472,本資料集主要提供科工館辦理之各項推廣教育活動訊息，包含活動系列、期間、名稱、報名費用、名額、地點等資訊。,活動系列;活動期間;活動名稱;報名費用;活動名額;地點,國立科學工藝博物館
歷屆原住民運動會資料,6526,本資料集主要提供自民國83年至108年所舉辦之原住民運動會資料，主要內容係舉辦日期、競賽種類、民俗活動種類、該年舉辦主題及吉祥物、參加人數等資料。,年度;承辦縣市;舉辦日期;競賽項目;競賽種類;民俗活動;參與縣市單位;主題;吉祥物;聖火引燃地點;參加人參加選手,教育部體育署
身心障礙國民運動會歷屆資料,6527,本資料集主要提供自民國83年至105年所舉辦之身心障礙國民運動會資料，主要內容係舉辦日期、競賽種類、聯誼項目、參與縣市單位、民俗競賽種類、該年舉辦主題、吉祥物及參與人數等資料。,年度;承辦單位;舉辦日期;競賽項目;競賽種類;聯誼項目;參與縣市單位;主題;吉祥物;聖火引燃地點;男生人數;女生人數;參加人/參加選手,教育部體育署
國內高爾夫球場,6528,本資料集主要內容係國內高爾夫球場之相關資料。,編號;球場所在縣市;球場名稱;球場所在地;經營主體;核准面積(公頃);洞數;核准開放使用文號;連絡電話;傳真,教育部體育署
青年旅遊卡資訊,6630,本資料集為教育部青年發展署針對15-30歲青年發行免費申辦的青年旅遊卡，持卡青年可享景點門票、住宿、交通、小吃購物、中文學習等優惠。為利青年申辦青年旅遊卡，結合交通部觀光局旅客服務中心、青年志工中心、華語文中心及部分縣市政府、民間團體等計119個服務據點，提供青年旅遊諮詢服務網絡及申辦青年旅遊卡。,地區;序號;旅服中心名稱;服務時間;電話;地址;,教育部青年發展署
亞奧運運動單項協會,6673,本資料集主要內容係亞奧運運動單項協會之聯絡資料。,亞奧運運動單項協會名稱;通訊地址;電話,教育部體育署
各縣市體育會,6674,本資料集主要內容係體育會之聯絡資料。,體育會名稱;通訊地址;電話,教育部體育署
青年工讀、見習及競賽活動訊息,6677,本資料集彙整青年署提供青年工讀、見習及競賽活動訊息。,計畫名稱;活動介紹;活動期程;對象,教育部青年發展署
國立臺灣藝術教育館最新消息,6678,本資料集主要提供本館各種最新消息訊息。,title;description;link,國立臺灣藝術教育館
國立臺灣藝術教育館表演活動,6679,本資料集主要提供本館各種近期表演活動訊息。,title;description;link,國立臺灣藝術教育館
國立臺灣藝術教育館展覽活動,6680,本資料集主要提供本館各種近期展覽訊息。,title;description;link,國立臺灣藝術教育館
國立臺灣藝術教育館競賽活動,6681,本資料集主要提供本館各種競賽訊息。,title;description;link,國立臺灣藝術教育館
國立臺灣藝術教育館研習活動,6729,本資料集主要提供本館各種研習活動訊息。,title;description;link,國立臺灣藝術教育館
臺灣出版新書預告書訊,6730,本資料與全國新書資訊網「書目下載/批次下載」每月同步更新，資料內容係依據圖書出版前，各出版者向國家圖書館國際標準書號中心申請ISBN之新書書目資料。,書名;作者;出版單位;版次;出版年月;標題;適讀對象;類號;ISBN;開數;頁數;得獎紀錄,國家圖書館
國家圖書館最新活動訊息,6838,"國家圖書館辦理之各項最新活動訊息,如講座、教育訓練、影片欣賞、研習活動等",id;subject;content;foruser;date_activity_beg;date_activity_end;date_post_beg;date_post_end;unit;libraryid;type1;type2;type3;county;location;fee;notes;connect;phone;date_entry;refweb;reffile;refpic,國家圖書館
古籍書目資料,6839,書目資料,,國家圖書館
