資料集名稱,資料集識別碼,資料集描述,主要欄位說明,提供機關
南投縣學區劃分表,38292,學區劃分表,鄉鎮名稱;校名;學區劃分(里．鄰別);校別;學區村(里),南投縣政府
南投縣合法私立火化場一覽表,38293,南投縣合法私立火化場資料,包含欄位：「編號」;「公墓名稱」;「負責人」;「地點」;「電話」;「緯度」;「經度」,南投縣政府
南投縣合法私立公墓一覽表,38294,南投縣合法私立公墓資料,包含欄位：「編號」;「公墓名稱」;「負責人」;「地點」;「電話」;「緯度」;「經度」,南投縣政府
廢食用油回收合格清除機構,38295,廢食用油回收合格清除機構,名稱;連絡電話;連絡電話（2）,南投縣政府
南投縣政府警察局業務職掌,38296,提供警察局各單位業務職掌及聯絡方式,單位名稱;聯絡電話;業務職掌,南投縣政府
南投縣政府警察局所屬各單位地址及聯絡方式,38298,南投縣政府警察局所屬各單位地址及聯絡方式,單位名稱(所屬各單位名稱);自動電話(所屬各單位聯絡電話);傳真電話(所屬各單位傳真電話);機關地址(所屬各單位詳細地址);緯度(緯度TWD97);經度(經度TWD97),南投縣政府
南投縣包裝飲用水工廠基本資料表,38299,南投縣包裝飲用水工廠基本資料表,資源彙整機關;廠商名稱;負責人;地址;電話;資本額;水源別;備註,南投縣政府
南投縣餐飲衛生優良店,38301,南投縣餐飲衛生評鑑分級,,南投縣政府
南投縣易發生交通肇事案件資料,38304,提供交通事故易肇事路段,肇事路段;件數;死亡人數;受傷人數,南投縣政府
南投美食資料,38306,南投美食店家資料,包含「Name餐飲店家名稱」;「Description店家簡述」;「Add店家地址」;「Tel預約電話」;「Opentime營業時間」...等，請參考http://gis.taiwan.net.tw/Data/%E8%A7%80%E5%85%89%E8%B3%87%E8%A8%8A%E6%A8%99%E6%BA%96v1%200.pdf,南投縣政府
南投縣補習班,38307,南投縣補習班,南投縣補習班,南投縣政府
南投縣公共圖書館地址、電話表,38349,南投縣公私立圖書館開館時間、地址及電話,名稱;開館時間;連絡電話;地址;公私立別;網址;緯度;經度,南投縣政府
南投縣各地區公廁基本資料,38350,南投縣各地區公廁基本資料,南投縣各地區公廁基本資料,南投縣政府
南投縣公立幼兒園通訊資料,38352,南投縣各行政區公立幼兒園名稱、電話及地址,編號;鄉鎮;幼兒園名稱;負責人/園長;幼兒園電話;傳真;總和班級;核定人數;實際人數;幼兒園住址;幼兒園住址<br>,南投縣政府
南投縣老人機構名冊,38353,南投縣老人機構名冊,包含欄位：「編號」;「公立/私立」;「機構名稱」;「機構地址」;「電話」;「負責人」;「收容對象;」;「核定收容人數」;「床位數」;「立案日期」...等,南投縣政府
南投縣居家托育服務中心,38355,南投縣政府委託民間團體承辦之居家托育服務中心名冊,包含欄位：「保母系統名稱」;「地址」;「E-Mail」;「電話」;「緯度」;「經度」,南投縣政府
南投縣環境教育設施場所名單,38356,南投縣環境教育設施場所名單,環境教育設施場所名單,南投縣政府
南投縣政府警察局固定式自動測速照相桿,38357,南投縣政府警察局轄內「固定式微電腦闖紅燈及自動測速照相桿」設置地點,設置地點(固定式照相桿詳細位置);測照項目(測速或闖紅燈);限速(km/hr),南投縣政府
南投縣文化資產,38360,南投縣境內各類別的文化資產,名稱;保存者/保存團體;類別;種類;級別;公告日期;所在地,南投縣政府
南投活動資料,38361,南投活動資料,包含：「Name活動名稱」;「Add主要活動地點地址」;「Tel活動聯絡電話」;「Org活動主辦單位」;「Start活動開始時間」;「End活動結束時間」...等，請參考http://gis.taiwan.net.tw/Data/%E8%A7%80%E5%85%89%E8%B3%87%E8%A8%8A%E6%A8%99%E6%BA%96v1%200.pdf,南投縣政府
南投縣身心障礙機構名冊,38362,南投縣身心障礙機構名冊,包含欄位：「機構名稱」;「聯絡電話」;「傳真」;「機構型態」;「機構地址」;「緯度」;「經度」,南投縣政府
南投縣環保旅店名單,38363,南投縣環保旅店名單,南投縣環保旅店名單,南投縣政府
南投縣政府資訊大樓假日親子電影院(親子放映室)播放影片節目表,38364,南投縣政府資訊大樓假日親子電影院(親子放映室)播放影片節目表,105年7月份播放影片節目表;105年8月份播放影片節目表;105年6月份播放影片節目表,南投縣政府
南投縣藝文活動,38365,南投縣每月藝文活動資訊,活動名稱;地點名稱;活動展演起日;活動展演迄日;活動型態;辦理單位;活動地點門票與售價,南投縣政府
南投縣iTaiwan熱點,38366,南投縣itaiwan熱點,主管機關(所屬機關名稱);地區(所屬縣市名稱);熱點名稱(依熱點所在地命名);地址(熱點所在詳細地址);緯度(緯度TWD97);經度(經度TWD97),南投縣政府
太極美地XML,38367,太極美地景點等XML,太極美地XML,南投縣政府
南投縣動物用藥品販賣業者,38369,南投縣已申請登記的動物用藥品販賣業者名冊,包含欄位：「商家名稱」;「地址」;「電話」;「備註」<br>,南投縣政府
就業服務據點,38370,南投縣就業服務據點,包含欄位：「名稱」;「地址」;「電話」;「傳真」;「緯度」;「經度」,南投縣政府
南投景點資料,38371,南投景點資料,包含：「Name景點中文名稱」;「Toldescribe特色詳細文字簡述」;「Tel服務電話」;「Add地址」;「Opentime開放時間」...等，請參考http://gis.taiwan.net.tw/Data/%E8%A7%80%E5%85%89%E8%B3%87%E8%A8%8A%E6%A8%99%E6%BA%96v1%200.pdf,南投縣政府
南投縣居家服務提供單位名冊,38372,南投縣居家服務提供單位名冊,包含欄位：「標案」;「鄉鎮」;「居家服務提供單位」;「聯絡人」;「電話」;「傳真」;「地址」;「緯度」;「經度」,南投縣政府
南投縣公共藝術,38373,南投縣境內相關單位設置之公共藝術案基本資料,鄉鎮別;作品名稱;創作者;設置年代（西元）;設置地點;設置地址;作品類型;作品材質;管理單位,南投縣政府
南投縣「乳房Ｘ光攝影醫療機構認證」名單,38374,南投縣「乳房Ｘ光攝影醫療機構認證」名單,鄉鎮別;院所名單;地址;電話;緯度;經度<br>,南投縣政府
100年金融財稅統計年報,38375,南投縣100年度金融財稅資料,包含欄位：「年底別及鄉鎮市別」;「總計」;「本國銀行」;「農會信用部」;「本國壽險公司」;「本國產險公司」...等;包含欄位：「年度別」;「稅課收入」;「工程受益費及信託管理收入」;「罰款及賠償收入」;「規費收入」;「財產收入」;「營業盈餘及事業收入」...等;「印花稅」;「使用牌照稅」;「土石採取景觀維護特別稅」;「地價稅」;「土地增值稅」;「房屋稅」;「娛樂稅」;「契稅」...等;包含欄位：「年度及稅目別」;「實徵數」;「納庫數」;「未納庫數」...等;「福利服務支出」;「國民就業支出」;「醫療保健支出」;「社區發展支出」;「環境保護支出」...等;包含欄位：「年度及月別」;「本年度收入」;「一般政務支出」;「教育科學文化支出」;「經濟發展支出」;「社會福利支出」...等;「融資調度需求」;「融資調度財源」;「自有財源比率」;「賦稅依存度」;「補助依存度」;「債務未償餘額」等;「警政支出」;「債務支出」;「協助及補助支出」;「其他支出」;「以前年度支出」;「預算外支出」...等;包含欄位：「稅課收入」;「工程受益收入」;「罰款及規費收入」;「信託管理收入」;「營業盈餘及事業收入」...等預算和決算資料;包含欄位：「年(月)底別」;「本國銀行存款」;「外國銀行在華分行存款」;「基層金融機構存款」;「中華郵政公司存款」;「本國銀行放款」;「外國銀行在華分行放款」;「基層金融機構放款」...等;包含欄位：「政權行使支出」;「行政支出」;「民政支出」;「財務支出」;「教育支出」...等預算和決算資料,南投縣政府
南投縣各級學校基本資料,38376,南投縣各級學校名錄,包含欄位：「使用單位」;「住址」;「電話」;「傳真」;「網路電話」<br>;「網路電話」,南投縣政府
102年金融財稅統計年報,38377,南投縣102年度金融財稅資料,包含欄位：「年度別」;「融資調度需求」;「融資調度財源」;「自有財源比率」;「賦稅依存度」;「補助依存度」;「債務未償餘額」等;「印花稅」;「使用牌照稅」;「土石採取景觀維護特別稅」;「地價稅」;「土地增值稅」;「房屋稅」;「娛樂稅」;「契稅」...等;「福利服務支出」;「國民就業支出」;「醫療保健支出」;「社區發展支出」;「環境保護支出」...等;包含欄位：「營業基金」;「非營業特種基金」;「作業基金」;「特別收入基金」...等預算和決算資料;包含欄位：「年度及稅目別」;「實徵數」;「納庫數」;「未納庫數」...等;包含欄位：「年底別及鄉鎮市別」;「總計」;「本國銀行」;「農會信用部」;「本國壽險公司」;「本國產險公司」...等 ;包含欄位：「年度及月別」;「本年度收入」;「一般政務支出」;「教育科學文化支出」;「經濟發展支出」;「社會福利支出」...等;包含欄位：「年(月)底別」;「本國銀行存款」;「外國銀行在華分行存款」;「基層金融機構存款」;「中華郵政公司存款」;「本國銀行放款」;「外國銀行在華分行放... 等;「稅課收入」;「工程受益費及信託管理收入」;「罰款及賠償收入」;「規費收入」;「財產收入」;「營業盈餘及事業收入」...等;「警政支出」;「債務支出」;「協助及補助支出」;「其他支出」;「以前年度支出」;「預算外支出」...等;包含欄位：「稅課收入」;「工程受益收入」;「罰款及規費收入」;「信託管理收入」;「營業盈餘及事業收入」...等預算和決算資料;包含欄位：「政權行使支出」;「行政支出」;「民政支出」;「財務支出」;「教育支出」...等預算和決算資料,南投縣政府
南投縣立案演藝團體一覽表,38378,南投縣立案演藝團體名冊,類別;團名;負責人;登記或換證日期;團址,南投縣政府
南投縣休閒農業區,38379,南投縣已辦理登記之休閒農業區,包含欄位：「休閒農業區」;「在地行動組織」;「輔導單位」;「地段」;「面積」;「劃定年度」,南投縣政府
101年金融財稅統計年報,38380,南投縣101年度金融財稅資料,包含欄位：「年度及月別」;「警政支出」;「債務支出」;「協助及補助支出」;「其他支出」;「以前年度支出」;「預算外支出」...等;「本年度收入」;「一般政務支出」;「教育科學文化支出」;「經濟發展支出」;「社會福利支出」...等;包含欄位：「政權行使支出」;「行政支出」;「民政支出」;「財務支出」;「教育支出」...等預算和決算資料;包含欄位：「年底別及鄉鎮市別」;「總計」;「本國銀行」;「農會信用部」;「本國壽險公司」;「本國產險公司」...等;包含欄位：「年度別」;「稅課收入」;「工程受益費及信託管理收入」;「罰款及賠償收入」;「規費收入」;「財產收入」;「營業盈餘及事業收入」...等;「福利服務支出」;「國民就業支出」;「醫療保健支出」;「社區發展支出」;「環境保護支出」...等;「融資調度需求」;「融資調度財源」;「自有財源比率」;「賦稅依存度」;「補助依存度」;「債務未償餘額」等;包含欄位：「年(月)底別」;「本國銀行存款」;「外國銀行在華分行存款」;「基層金融機構存款」;「中華郵政公司存款」;「本國銀行放款」;「外國銀行在華分行放款」;「基層金融機構放款」...等;包含欄位：「稅課收入」;「工程受益收入」;「罰款及規費收入」;「信託管理收入」;「營業盈餘及事業收入」...等預算和決算資料;「印花稅」;「使用牌照稅」;「土石採取景觀維護特別稅」;「地價稅」;「土地增值稅」;「房屋稅」;「娛樂稅」;「契稅」...等;包含欄位：「年度及稅目別」;「實徵數」;「納庫數」;「未納庫數」...等,南投縣政府
南投縣文化設施,38381,南投縣文化設施開館時間、地址、連絡電話,地點名稱;地點類別;地點電話;鄉鎮市區;地點地址;開放時間;休館時間;票價;管理單位;網址;緯度;經度,南投縣政府
南投縣「口腔黏膜健康檢查」醫療院所名單,38382,南投縣「口腔黏膜健康檢查」醫療院所名單,鄉鎮別;院所名單;地址;電話,南投縣政府
南投縣工會名單,38383,工會聯絡資訊,包含欄位：「編號」;「工會名稱」;「理事長」;「會務連絡人」;「會址」;「電話」,南投縣政府
南投縣機車排放空氣污染物檢驗站,38384,南投縣機車排放空氣污染物檢驗站,機車排放空氣污染物檢驗站,南投縣政府
南投縣私立幼兒園通訊資料,38385,南投縣各行政區私立幼兒園名稱、電話及地址,編號;鄉鎮;幼兒園名稱;負責人/園長;幼兒園電話;傳真;總和班級;核定人數;實際人數;幼兒園住址<br>,南投縣政府
南投縣教會堂,38386,南投縣登記有案之教會堂基本資料,包含欄位：「財團法人名稱」;「主管機關」;「行政區」;「地<br>址」;「教<br>別」;「電話」;「負責人」;「緯度」;「經度」,南投縣政府
南投縣公私立骨灰（骸）存放設施【納骨塔】清冊,38387,南投縣公私立骨灰（骸）存放設施【納骨塔】清冊,包含欄位：「編號」;「鄉鎮市」;「管轄單位」;「名稱」;「電話」;包含欄位：「鄉鎮市」;「公司;名稱」;「骨灰（骸）存放設施」;「負責人」;「地址」;「電話」,南投縣政府
南投縣公私立醫院所數、救護車數量,38388,南投縣公私立醫院所數、救護車數量,鄉鎮市別;醫院家數;診所家數;救護車<br>,南投縣政府
南投縣土地筆數面積公告地價,38390,南投縣及各鄉鎮之都市土地、非都市土地之筆數、面積、公告地價總額,南投縣及各鄉鎮之都市土地;非都市土地之筆數;面積;公告地價總額,南投縣政府
南投縣形象商圈聯絡資訊,38392,南投縣形象商圈理事長聯絡資訊,包含欄位：「編號」;「商圈名稱」;「聯絡人」;「職稱」;「聯絡電話」;「地址」<br>,南投縣政府
南投縣消防局各單位地圖,38393,南投縣消防局各單位地圖,包含欄位：「單位」;「地址」;「電話」;「緯度」;「經度」,南投縣政府
南投縣病媒防治業及環境用藥販賣者名冊,38394,病媒防治業及環境用藥販賣者名冊,廠家;地址;核准字號;負責人;專責人員;電話;傳真,南投縣政府
南投縣綠色商店名單,38395,南投縣綠色商店名單,南投縣綠色商店名單,南投縣政府
南投縣土地建物登記管理,38409,本縣受理土地登記案件統計表,103/06 本縣受理土地登記案件統計表,南投縣政府
南投縣主要癌症死亡原因,38411,南投縣主要癌症死亡原因,順位;死亡原因;死亡人數合計;死亡人數男;死亡人數女;每十萬人口死亡率;每十萬人口標準化死亡率;死亡人數結構比%,南投縣政府
南投縣文化基金會一覽表,38412,文化法人會址及成立時間,名稱;地址;立案時間,南投縣政府
104年度推展部落文化健康站,38413,日間關懷站資料,,南投縣政府
南投縣已登記土地筆數面積,38414,南投縣及各鄉鎮之公私有土地之筆數、面積,南投縣及各鄉鎮之公私有土地之筆數;面積,南投縣政府
103年金融財稅統計年報,38415,南投縣103年度金融財稅資料,包含欄位：「年底別及鄉鎮市別」;「總計」;「本國銀行」;「農會信用部」;「本國壽險公司」;「本國產險公司」...等;包含欄位：「年(月)底別」;「本國銀行存款」;「外國銀行在華分行存款」;「基層金融機構存款」;「中華郵政公司存款」;「本國銀行放款」;「外國銀行在華分行放... 等;包含欄位：「年度別」;「福利服務支出」;「國民就業支出」;「醫療保健支出」;「社區發展支出」;「環境保護支出」...等;包含欄位：「政權行使支出」;「行政支出」;「民政支出」;「財務支出」;「教育支出」...等預算和決算資料;包含欄位：「年度及稅目別」;「實徵數」;「納庫數」;「未納庫數」...等;「稅課收入」;「工程受益費及信託管理收入」;「罰款及賠償收入」;「規費收入」;「財產收入」;「營業盈餘及事業收入」...等;「融資調度需求」;「融資調度財源」;「自有財源比率」;「賦稅依存度」;「補助依存度」;「債務未償餘額」等;包含欄位：「年度及月別」;「警政支出」;「債務支出」;「協助及補助支出」;「其他支出」;「以前年度支出」;「預算外支出」...等;「本年度收入」;「一般政務支出」;「教育科學文化支出」;「經濟發展支出」;「社會福利支出」...等;包含欄位：「稅課收入」;「工程受益收入」;「罰款及規費收入」;「信託管理收入」;「營業盈餘及事業收入」...等預算和決算資料;「印花稅」;「使用牌照稅」;「土石採取景觀維護特別稅」;「地價稅」;「土地增值稅」;「房屋稅」;「娛樂稅」;「契稅」...等;包含欄位：「營業基金」;「非營業特種基金」;「作業基金」;「特別收入基金」...等預算和決算資料,南投縣政府
南投縣主要死亡原因,38416,南投縣十大死因,順位;死亡原因;死亡人數合計;死亡人數男;死亡人數女;每十萬人口死亡率;每十萬人口標準化死亡率;死亡人數結構比%;死亡人數結構比%<br>,南投縣政府
南投縣社區照顧關懷據點,38417,社區照顧關懷據點名冊,資源彙整機關;辦理單位;成立日期;負責人;連絡電話;傳真;電子郵件;地址;相關網址;X坐標;Y坐標;備註;最後更新時間<br>,南投縣政府
南投縣轄儲蓄互助社資料查詢名單,38418,社號、社名、地址 、電話,社號;社名;地址;電話,南投縣政府
南投縣菸酒製造業者資料查詢,38421,製造業者名稱、統一編號、負責人、總機構所在地、工廠基本資料、換照日期、執照起始日期、製菸(酒)執照號碼,製造業者名稱;統一編號;負責人;總機構所在地;工廠基本資料;換照日期;執照起始日期;製菸(酒)執照號碼,南投縣政府
南投縣政府文化局文化資產叢書一覽表,38422,南投縣政府文化局出版品資料,類別(所屬類別);叢書號(書籍號碼);文學家作品集序號(作家作品集編號);其它(其他相關資訊);書名(書籍名稱);作者(作家名字);出版年份(西元年);內容介紹(書籍簡介);售價(台幣);展售處(展售地編號),南投縣政府
南投縣南投市防災避難地圖,38775,南投縣南投市防災避難地圖,南投市避難地圖,南投縣政府
南投縣餐盒食品工廠名冊,38776,南投縣餐盒食品工廠名冊,資源彙整機關;廠商名稱;負責人;廠商住址;電話;備註<br>,南投縣政府
南投縣轄內危險水域清冊,38777,南投縣轄內危險水域清冊,包含欄位：「編號」;「河川名稱」;「設置地點」;「轄區分隊」;「備考」,南投縣政府
南投縣加水站業者名單,38783,南投縣加水站業者名單,,南投縣政府
噪音監測,38784,噪音監測,測站編號;監測日期;測站名稱;音源別;日;晚;夜;早晚標準值;日間標準值;夜間標準值;合格;路寬<br>;包含欄位：「監測站名;」;「監測站編號」;「緊鄰道路寬度」;「管制區」...等;104年第二季人工交通;104年第1季人工交通 ;104年度第2季環境;包含欄位：「監測站名」;104年第1季環境噪音;「管制區」...等<br>,南投縣政府
105-106-107-108-109年度南投縣政府及所轄鄉鎮市公所最新債務訊息,38877,105-106-107-108年度南投縣政府及所轄鄉鎮市公所最新債務訊息,項目;1年以上公共債務未償餘額;未滿1年公共債務未償餘額;平均每人負擔公共債務;自償性公共債務未償餘額 (含非營業特種金) ;自償性公共債務未償餘額 (含非營業特種金)<br>;自償性公共債務未償餘額<br>(含非營業特種金),南投縣政府
南投縣免費wifi無線網路熱點,40450,南投縣轄內免費wifi熱點,熱點名稱;地址;緯度;經度,南投縣政府
南投縣政府「縣民時間」辦理時間表,54195,「縣民時間」辦理時間,辦理日期;縣府/鄉鎮;辦理地點;會見時間,南投縣政府
南投縣政府稅務局歲出機關別預算表,57505,提供本年度、上年度預算數及前年度決算數之比較,科目-款;科目-項;科目-目;科目-節;科目-名稱及編號;本年度預算數;上年度預算數;前年度決算數;本年度與上年度比較;說明,南投縣政府
南投縣政府稅務局歲入來源別預算表,78387,提供稅課收入、罰款及賠償收入預算資料,科目-款;科目-項;科目-目;科目-節;科目-名稱及編號;本年度預算數;上年度預算數;前年度決算數;本年度與上年度比較;說明及法令依據;說明,南投縣政府
南投縣使用牌照稅稅源,78388,根據資料倉儲管理系統(LDW)產製,汽缸總排氣量(立方公分);免稅輛數總計;應稅輛數總計;稅額總計;小客車自用免稅輛數;小客車自用應稅輛數;小客車自用稅額;小客車營業用免稅輛數;小客車營業用應稅輛數;小客車營業用稅額;大客車免稅輛數;大客車應稅輛數;大客車稅額;貨車免稅輛數;貨車應稅輛數;貨車稅額;曳引車免稅輛數;曳引車應稅輛數;曳引車稅額;機車免稅輛數;機車應稅輛數;機車稅額,南投縣政府
南投縣稅捐未徵數情形,78389,各稅及各徵收階段未徵稅額,項目;件數合計;金額合計;繳款書未送達未徵件數;繳款書未送達未徵數金額;未逾限繳日未徵件數;未逾限繳日未徵數金額;行政救濟未徵件數;行政救濟未徵數金額;分期繳納未徵件數;分期繳納未徵數金額;特殊原因未徵件數;特殊原因未徵數金額;送達未逾滯納期欠稅件數;送達未逾滯納期欠稅數金額;待移送執行欠稅件數;待移送執行欠稅數金額;移送執行未結欠稅件數;移送執行未結欠稅數金額;取得執行憑證欠稅件數;取得執行憑證欠稅數金額;移送執行結銷欠稅件數;移送執行結銷欠稅數金額;無法執行欠稅件數;無法執行欠稅數金額;取得執行憑證未逾徵收期間欠稅件數;取得執行憑證未逾徵收期間欠稅金額;取得執行憑證已逾徵收期間惟未逾執行期間欠稅件數;取得執行憑證已逾徵收期間惟未逾執行期間欠稅金額;移送執行結銷案欠稅件數;移送執行結銷案欠稅數金額,南投縣政府
南投縣各項稅收稽徵人力,78390,資料來源：以年度結束之現有人力為準，包括正式編製人員、約聘僱人員、工友及司機等。,稅目;合計;地價稅;土地增值稅;房屋稅;使用牌照稅;契稅;印花稅;娛樂稅;特別稅;臨時稅,南投縣政府
南投縣流感抗病毒藥劑合約醫療機構名冊一覽表,78391,南投縣107年度流感抗病毒藥劑合約醫療機構名冊一覽表,,南投縣政府
南投縣查(核)定開徵數情形,78392,資料來源：依表報代號WXX531P1編製。,項目;開徵件數;開徵數金額;實徵件數;實徵數金額;減免註銷件數;減免註銷數金額;逾徵收期限件數;逾徵收期限數金額;逾核課期限件數;逾核課期限數金額;未徵數餘額件數;未徵數餘額金額;逾徵收期間件數;逾徵收期間數金額;逾執行期間件數;逾執行期間數金額;逾核課期間件數;逾核課期間數金額,南投縣政府
南投縣地價稅滯納期滿徵績表,78393,資料來源：依表報代號LND384P編製。,公私有別;原查定件數;原查定稅額;徵期或滯納期增減件數;徵期或滯納期增減稅額;調整後查定件數;調整後查定稅額;徵起件數;徵起稅額;未徵起件數;未徵起稅額;徵績件數;徵績稅額;徵績件數百分比;徵績稅額百分比,南投縣政府
南投縣各項稅收稽徵成本,78394,資料來源：本表根據12月份會計報告及歲出決算報告編製。,稅別;實徵淨額(千元);成本總計(元);直接成本小計;直接成本人事費;直接成本業務費(「稅捐稽徵業務」業務計畫);直接成本獎補助及損失;間接成本小計;間接成本人事費;間接成本業務費(「一般行政」業務計畫);間接成本設備及投資費;間接成本其他;每千元成本;成本總計,南投縣政府
南投縣未變性酒精販賣業者查詢,78396,南投縣未變性酒精販賣業者、統一編號、負責人姓名、公司地址,南投縣未變性酒精販賣業者;統一編號;負責人姓名;公司地址<br>;公司地址,南投縣政府
107年南投縣政府縣庫支付年報表,78397,此項資料提供南投縣政府集中支付預算科目代號支付數、支出收回數及支付淨額等相關數據。,107年南投縣政府縣庫支付年報表,南投縣政府
