資料集名稱,資料集識別碼,資料集描述,主要欄位說明,提供機關
中部科學園區園區活動訊息,5987,有關園區舉辦各項活動訊息，舉凡兩性聯誼、環保、演講等重要活動訊息。,subject;content;post_date;end_date;show_date;hide_date;URL,科技部中部科學園區管理局
南部科學園區園區活動通報資訊,6073,南部科學園區管理局所提供園區活動通報資訊,,科技部南部科學園區管理局
中央研究院植物標本館標本資料,7511,中研院植物標本館主要蒐藏台灣（含附屬島嶼）及東亞維管束植物。特殊的蒐藏有菊科、秋海棠科、鴨跖草科、珍珠菜屬（報春花科）、細辛屬（馬兜鈴科）、魔芋屬（天南星科）、茜草科、地錦屬（大戟科）及茶科。,,科技部
中央研究院魚類標本資料,7512,"魚類資料庫 鑒於魚類分類系統及種名變動頻仍，臺灣魚種之新記錄或時空分布的資料也幾乎是與日俱增，因此有必要建立資料庫，並藉全球資訊網將隨時修訂之臺灣本土魚類資料公開提供各界查詢使用。 建置目的為: 1.提供學界（特別是魚類分類）最新研究成果之資訊，促進國內外學術交流及提昇學術研究水準。 2.提供政府及民間對臺灣水域生態環境保育、評估，以及漁業資源開發及管理背景參考資料。 3.希望有助於魚類名稱（拉丁學名、中文名及中、英文俗名）之正名及統一。 引用資訊:生物多樣性物種出現紀錄:由中央研究院生物多樣性研究中心魚類資料庫提供 (Accessed through TaiBIF, taibif.tw, YYYY-MM-DD)",,科技部
TaiBIF出版品清單,7513,此資料集為TaiBIF研究團隊歷年所出版的書籍清單，包括臺灣物種名錄、論文集…等等出版版,,科技部
GBIF出版品清單,7514,此資料集為TaiBIF研究團隊翻譯國外GBIF相關出版品清單,,科技部
科技部決算書清冊,7515,科技部歷年單位決算、科發基金決算案及主管決算審定版。,標題;日期;連結網址,科技部
科技部人文與社會科學簡訊出版品清冊,7516,報導科技部與人文司之業務及訊息出版品清冊，並提供學界交流研究工作及規劃發展 等事務之平台。,標題;連結網址,科技部
駐外科技組聯絡資訊,7521,提供各駐外科技組相關聯繫資料,ffice Name/Director Name;Address;Phone/Fax/Email,科技部
新竹科學園區管理局園區巡迴巴士時刻表,7522,新竹科學園區管理局園區各線巡迴巴士班表,,科技部新竹科學園區管理局
科技部訴願決定書清冊,7524,科技部2年內作成之訴願決定書清冊,標題;連結網址,科技部
南部科學園區公共藝術,7526,南部科學園區公共藝術分布及介紹,編號;作品名稱;設置時間;設置地點;作者;創作理念;現況照片;尺寸<br>(公分);材質,科技部南部科學園區管理局
南部科學園區免費巡迴巴士,7527,南部科學園區免費巡迴巴士時刻資料(含南環線/北環線/高科線/假日接駁)。,,科技部南部科學園區管理局
南部科學園區性別與外籍員工統計資料集,7528,從業員工數 亦即就業人數，包括園區事業、核准入區工商服務業、事業主管機關分支單位、育成中心、研究機構等之員工數，不包括營造廠或承攬商所僱用之員工數。,,科技部南部科學園區管理局
南部科學園區污水廠排放水質,7529,南部科學園區管理局台南及高雄科學園區污水廠排放水質資料,,科技部南部科學園區管理局
南部科學園區土地規劃資料集,7530,1.總面積:經都市計畫及非都市計畫審議通過之土地總面積。 總面積＝工業區面積 ＋ 住宅區面積 ＋ 其他用地面積 2.工業區面積:經都市計畫及非都市計畫編為事業專用區之面積。 3.住宅區面積:經都市計畫及非都市計畫編為住宅區之面積。 4.其他用地面積:總面積扣除工業區及住宅區面積。,,科技部南部科學園區管理局
南部科學園區新投資案核准資料集,7531,經科技部園區審議委員會核准投資之南科廠商資訊及南科產業概況,,科技部南部科學園區管理局
南部科學園區產業營業額成長情形比較資料集,7532,營業額 : 園區廠商之銷售淨額（含申報書銷售額、收據合計、銷貨退回及折讓、前期銷售額調整）減可抵減項目（含代收代付、出售固定資產、出售廢料、利息收入、樣品贈送）之餘額。,,科技部南部科學園區管理局
南部科學園區用電量統計資料集,7533,用電量:園區各廠商每月與台電公司訂定之用電契約容量。,,科技部南部科學園區管理局
南部科學園區用水量統計資料集,7534,用水量:水公司針對園區各廠商每月之用水量統計。,,科技部南部科學園區管理局
臺灣物種名錄比對工具,7558,為能提升學名之正確性，本系統蒐羅TaiBNET資料庫之學名資料做為比對校正之參考依據，並能顯示簡便明確的拼字差異及相似程度，以方便使用者鑑別學名字母異同之處，順利且省時地進行名錄之修訂,使用者輸入;比對到的最簡學名;完整學名;accepted_name_code;accepted_name,科技部
地理座標資訊轉換服務,7559,有鑑於過去物種生態分布之地理座標系統不同，造成整合地理資訊上之困難，及物種於地圖上標記之錯誤，因此本系統可提供線上地理座標資訊，以便使用者更新老舊生態分布之資料，得以進一步比較分析與研究，系統提供WGS 84、TM2 67與TM2 97三種格式之間的相互轉換。,x;y;座標系統,科技部
物種地理座標驗證工具,7560,為了提高物種分布準確性及達成利用地理資訊整合查詢之目的，故而開發本工具。使用者僅需上傳EXCEL檔案，檔案中包含三個欄位資訊，分別為loc(地點文字說明)、x(經度)、y(緯度)，本工具會依據這進行簡易的判斷，如地點與座標差異過大、或修正座標格式...等等，並將錯誤判別資訊回傳於使用者。,loc;x;y,科技部
臺灣物種出現紀錄資料表格API（包含標本館資料與田野調查資料）,7561,利用API的方式提供取得json格式資料,採集號;連結;機構代碼;學名;中文名,科技部
全國各研發執行部門研發經費統計資料,7562,1.為便於瞭解及掌握我國科技研究發展狀況，進而建立科技指標，並與他國作客觀比較作為國家制定科技發展政策之參考，科技部每年定期辦理「全國研發狀況調查」。本資料集為「全國研發狀況調查」之統計結果之一。 2.“..”係指無任何數值。,,科技部
全國各研發執行部門研發人力統計資料_人數,7563,1.為便於瞭解及掌握我國科技研究發展狀況，進而建立科技指標，並與他國作客觀比較作為國家制定科技發展政策之參考，科技部每年定期辦理「全國研發狀況調查」。本資料集為「全國研發狀況調查」之統計結果之一。 2.“..”係指無數值。 3.“0”係指不及一單位。,,科技部
全國各研發執行部門研發人力統計資料_全時約當數,7564,"1.為便於瞭解及掌握我國科技研究發展狀況，進而建立科技指標，並與他國作客觀比較作為國家制定科技發展政策之參考，科技部每年定期辦理「全國研發狀況調查」。本資料集為「全國研發狀況調查」之統計結果之一。 2.全時約當數(Full-time Equivalent, FTE)係指從事某項研發工作的人數，經折算為全時間從事該項工作的人數。例如某一研究人員全年花一半的工作時間從事教學工作，一半的工作時間做研發，則此一研究人員相當於0.5個「全時約當數」(或0.5人年)；若全時間從事(每年250個工作日計)研究，則相當於1個「全時約當數」。出處：法城手冊(OECD) 3.“..”係指無數值。 4.“0”係指不及一單位。",年;執行部門代號;執行部門;類別;研發人力;研究人員;技術人員;支援人員;男性研發人力;男性研究人員;男性技術人員;男性支援人員;女性研發人力;女性研究人員;女性技術人員;女性支援人員;博士;碩士;學士;專科;其他;女博士;女碩士;女學士;女專科;女其他;博士_研究人員;碩士_研究人員;學士_研究人員;理;工;醫;農;人文;社會,科技部
全國企業部門研發經費_依OECD行業別區分統計資料,7566,1. 為便於瞭解及掌握我國科技研究發展狀況，進而建立科技指標，並與他國作客觀比較作為國家制定科技發展政策之參考，科技部每年定期辦理「全國研發狀況調查」。本資料集為「全國研發狀況調查」之統計結果之一。 2.“..”係指無數值。 3.“0”係指不及一單位。,,科技部
全國企業部門研發人力全時約當數_依OECD行業別區分統計資料,7567,"1.為便於瞭解及掌握我國科技研究發展狀況，進而建立科技指標，並與他國作客觀比較作為國家制定科技發展政策之參考，科技部每年定期辦理「全國研發狀況調查」。本資料集為「全國研發狀況調查」之統計結果之一。 2.全時約當數(Full-time Equivalent, FTE)係指從事某項研發工作的人數，經折算為全時間從事該項工作的人數。例如某一研究人員全年花一半的工作時間從事教學工作，一半的工作時間做研發，則此一研究人員相當於0.5個「全時約當數」(或0.5人年)；若全時間從事(每年250個工作日計)研究，則相當於1個「全時約當數」。出處：法城手冊(OECD) 3.“..”係指無數值。 4.“0”係指不及一單位。",,科技部
全國企業部門研發人力全時約當數_依我國行業別區分統計資料,7569,"1.為便於瞭解及掌握我國科技研究發展狀況，進而建立科技指標，並與他國作客觀比較作為國家制定科技發展政策之參考，科技部每年定期辦理「全國研發狀況調查」。本資料集為「全國研發狀況調查」之統計結果之一。 2.全時約當數(Full-time Equivalent, FTE)係指從事某項研發工作的人數，經折算為全時間從事該項工作的人數。例如某一研究人員全年花一半的工作時間從事教學工作，一半的工作時間做研發，則此一研究人員相當於0.5個「全時約當數」(或0.5人年)；若全時間從事(每年250個工作日計)研究，則相當於1個「全時約當數」。出處：法城手冊(OECD) 3.“..”係指無數值。 4.“0”係指不及一單位。",,科技部
學名書寫形式校對工具,7572,為能提升學名書寫格式之一致性，本系統蒐羅 TaiBNET 名錄資料庫之學名資料做為比對校正之參考依據，提供學名、分類層級標識、命名者及年代之完整書寫順序，不僅能夠補足額外學名資訊外，更可讓使用者能簡便的統一學名資料格式，以提升未來資料比對交換之準確性。,正確的完整學名書寫格式,科技部
臺灣物種出現紀錄資料地圖API（包含各標本館資料與田野調查資料）,7573,利用API的方式取得物種分布資料,以google map呈現物種;類群或特定機構分布,科技部
科技部工程科技研究成果報告清冊,7583,科技部工程處為協助大專校院落實「科技部工程科技計畫成果」的推廣及技轉，促成產業技術之創新與提升，進而為產業界解決急迫性問題，由工程科技推展中心營運工程科技推展平台，將歷年學界豐碩的研發成果整理典藏，並提供研究成果商業化媒合與企劃支援服務。,資料集名稱;下載連結,科技部
科技部約聘僱人員性別統計表,7585,暸解科技部約聘僱人員性別分佈情形,,科技部
科技部職員官等及性別統計表,7586,暸解科技部職員官等性別分佈情形,,科技部
科技部提供政府資訊人民申請案件,7587,科技部暨所屬機關辦理人民申請提供政府資訊案件季年統計總表,標題;連結網址,科技部
科技部公共工程及採購契約書面資料,7588,公共工程及採購契約書面資料,標題;資訊種類;保管場所;發布單位;公開日期;連結網址;,科技部
總統科學獎得獎資訊,7589,歷屆總統科學獎得獎人相關資訊,,科技部
科技部科普活動計畫通過清單,7590,歷年科普活動計畫，通過審查之計畫名冊,標題;連結網址,科技部
科技部科技大觀園演講廳,7591,科技部演講廳收錄科技部補助演講錄影,講者姓名;服務機構;演講時間;標題;摘要;連結網址,科技部
科技部科技大觀園科普知識,7592,學者與教授提供科普知識文章,標題;作者;服務機構;學術分類;連結網址,科技部
科技部科技大觀園影視節目,7593,多媒體公司提供知識性影視節目,標題;節目名稱;製作單位;連結網址,科技部
科技部科學園區土地使用情形資料集,7594,1.總面積:經都市計畫及非都市計畫審議通過之土地總面積。 總面積＝已開發土地面積 ＋ 開發中土地面積 2.可供出租土地面積 工業區面積扣除無法出租興建使用部分(如標準廠房、邊坡、私設道路等)。 3.已出租土地面積 可供出租土地面積中，已簽訂租約且計收土地租金或保留金之土地面積。 4.土地出租率(%) 「已出租土地面積」除以「可供出租土地面積」所得之比率。,,科技部
科技部科學園區標準廠房使用資料集,7595,廠房出租率(%)係「已出租單位數」除以「可供出租單位數」所得之比率。,,科技部
科技部科學園區產業類別及家數統計資料集,7596,1.有效核准廠商家數:經園區審議委員會核准設立之廠商家數，扣除廢止或出區廠商之家數。 2.已入區登記廠商家數:已辦妥(分)公司登記或工廠登記且未辦理解散或遷址出區登記之廠商家數。,,科技部
科技部科學園區產業營額統計資料集,7597,營業額 : 園區廠商之銷售淨額（含申報書銷售額、收據合計、銷貨退回及折讓、前期銷售額調整）減可抵減項目（含代收代付、出售固定資產、出售廢料、利息收入、樣品贈送）之餘額。,,科技部
科技部科學園區進出口資料集,7598,貿易總額=出口額+進口額 。,,科技部
科技部科學園區從業員工數統計資料集,7599,從業員工數 亦即就業人數，包括園區事業、核准入區工商服務業、事業主管機關分支單位、育成中心、研究機構等之員工數，不包括營造廠或承攬商所僱用之員工數。,,科技部
科技部線上虛擬展場清冊,7600,科技部工程處為協助大專校院落實「科技部工程科技計畫成果」的推廣及技轉，促成產業技術之創新與提升，進而為產業界解決急迫性問題，由工程科技推展中心營運工程科技推展平台，將歷年學界豐碩的研發成果整理典藏，並提供研究成果商業化媒合與企劃支援服務。,展覽序號;年度;展覽名稱;開始日期;結束日期;連結,科技部
科技部大屯火山觀測站_火山氣體監測,7601,大屯火山觀測站挑選其中兩處具有代表性的溫泉進行每周一次的監測。這裡呈現的是溫泉中的溫度、總固容量(TDS)、酸鹼值（pH）、電導度等變化，而這些參數皆可以作為反映火山的活動性的指標之一。,,科技部
科技部大屯火山觀測站_地表溫度監測,7602,"大屯火山觀測站對於地溫監測是探討火山活動的主要研究工作之一（Tillting, 1989），如果火山地區地底下有岩漿庫、殘餘的岩漿或有後火成活動，則通常在地表附近可發現較高的地溫，地底下的地溫梯度也會偏大，並呈現較高的熱流值 (Zeni et al., 2007)，然而測量這些溫度參數並無法探討火山的活動性，要了解地底下火山的活動情形，必須對地表的地溫做長期的監測，從溫度的變化趨勢才能進一步推測地下火山活動的異常變化(Sudo and Hurst, 1998)。監測地溫的變化除了有學術上的研究價值外，若能將監測資料隨時展示在公共場所（如遊客中心），讓遊客可以隨時了解這些訊息，亦是一項富有教育意義的工作。","po|,121.5474,25.17777,800M;",科技部
科技部大屯火山觀測站_地殼變形監測,7603,大屯火山觀測站對於陽明山國家公園內設置一共有七個地殼變形觀測站，並利用中研院的GPS(S101)作為基準站來監測七星山附近之火山活動可能引起之地殼變動。包括於竹子湖(YM01)、菁山(YM02)、萬里(YM03)、八煙(YMN4)、冷水坑(YM05)、馬槽(YM06)與小油坑(YM07)兩站，其中又以冷水坑(YM05)、馬槽(YM06)與小油坑(YM07)搭配10米深井下傾斜儀作為地表傾斜的量測紀錄。,日期;站名：竹子湖 YM01;站名：菁山 YM02;站名：萬里 YM03;站名：冷水坑 YM05;站名：馬槽 YM06;站名：小油坑 YM07;站名：八煙 YMN4,科技部
科技部大屯火山觀測站_地震活動監測,7604,大屯火山觀測站對於大屯山地區的地震活動主要集中在七星山及大油坑地區，每月平均約有50個，深度約在地表下5公里內，規模大多為0～1之間，屬於無感地震。此地區一年內有數次在單日中，地震發生個數異常增加的情形，這種情況通常代表本區可能有群震(Swarm)活動。,,科技部
科技部補助延攬科技人才統計資料集,7607,科技部補助延攬客座科技人才、博士後研究人員、研究學者之核定件數（含註銷案件）,,科技部
科技部補助兩岸科技交流統計資料集,7608,科技部補助兩岸科技學術研討會及邀請大陸地區暨香港澳門科技人士來臺短期訪問之核定件數（含註銷案件）,,科技部
行政院傑出科技貢獻獎統計資料集,7609,科技部辦理行政院傑出科技貢獻獎獲獎人數統計資料,,科技部
科技部專題研究計畫相關辦法資料集清單,7610,條列科技部專題研究計畫之作業要點、經費處理相關規定清冊。,標題;連結網址,科技部
科技部專題研究計畫相關函釋資料集清單,7611,條列科技部通函各受補助機構有關補助專題研究計畫相關規定之解釋函清冊。,標題;連結網址,科技部
科技部主管財團法人資訊,7612,科技部主管財團法人相關資訊,標題;日期;連結網址,科技部
科技部預算書清冊,7613,科技部歷年單位預算、科發基金預算及主管預算。,標題;日期;連結網址,科技部
全國企業部門研發經費_依我國行業別區分統計資料,7619,1.為便於瞭解及掌握我國科技研究發展狀況，進而建立科技指標，並與他國作客觀比較作為國家制定科技發展政策之參考，科技部每年定期辦理「全國研發狀況調查」。本資料集為「全國研發狀況調查」之統計結果之一。 2.“..”係指無數值。 3.“0”係指不及一單位。,,科技部
南部科學園區南科簡訊,7714,南部科學園區月刊雜誌,期數;類別;簡述;連結網址,科技部南部科學園區管理局
企業部門研發經費_依企業員工數分層統計資料,7715,1.為便於瞭解及掌握我國科技研究發展狀況，進而建立科技指標，並與他國作客觀比較作為國家制定科技發展政策之參考，科技部每年定期辦理「全國研發狀況調查」。本資料集為「全國研發狀況調查」之統計結果之一。 2.“..”係指無數值。 3.“0”係指不及一單位。,,科技部
科技部補助全國性學術團體辦理學術推廣業務統計資料集,7735,科技部補助全國性學術團體辦理學術推廣業務統計資料，包括核定件數及核定經費,申請年度;學術司室;核定件數;核定經費,科技部
科教國合司國際合作業務各類補助申請時程,7764,提供國際合作處各類補助申請時程資料,,科技部
科技部行政規則清單,7765,科技部主管行政規則清單,行政規則名稱;最新異動日期;連結網址,科技部
科技部專題研究計畫相關表格資料集清單,7767,條列科技部補助專題研究計畫有關申請、執行、經費結案及報告撰寫之各類表格清冊。,標題;連結網址,科技部
科技部傑出技術移轉貢獻獎資訊,7768,科技部辦理傑出技術移轉貢獻獎統計資料。,,科技部
科技部專題研究計畫Q&A問答資料集清單,7783,條列科技部專題研究計畫有關計畫申請資格、補助項目支用原則問題、經費報銷實務運用、助理人員問題、彈性支用額度運用原則等Q&A問答清冊。,標題;日期;分類;連結網址,科技部
新竹科學園區已入區登記廠商資料,7935,新竹科學園區廠商名錄，包括新竹科學園區、竹南科學園區、龍潭科學園區、銅鑼科學園區、宜蘭科學園區等已入區登記廠商資料（已辦妥(分)公司登記或工廠登記且未辦理解散登記、未出區或未廢止投資計畫之廠商）。,廠商代碼;基地別;園區廠商名稱;地址;統一編號;事業類別,科技部新竹科學園區管理局
中部科學園區園區電影活動資料統計,7936,中部科學園區園區電影活動統計資料。,subject;content;post_date;end_date;show_date;hide_date;URL,科技部中部科學園區管理局
中部科學園區最新公告月資料統計,7937,中部科學園區最新公告月統計資料。,subject;content;post_date;end_date;show_date;hide_date;URL,科技部中部科學園區管理局
中部科學園區公共場地租借月報,7938,中部科學園區公共場地租借月報資料。,案件編號;場地編號;場地名稱;借用單位;借用日期;借用時間;活動名稱;有無意願分享場地,科技部中部科學園區管理局
中部科學園區核准投資金額月報,7939,中部科學園區每月核准投資金額資料。,Month;投資額(億);,科技部中部科學園區管理局
中部科學園區職業安全訓練課程暨會議月資料統計,7940,中部科學園區職業安全訓練課程暨會議月統計資料。,C_NAME;c_cont;c_ssdate;c_sedate;c_sdate;c_edate;c_stime;c_etime;c_pmax;codename,科技部中部科學園區管理局
中部科學園區動產擔保交易登記月報,7941,登記機關代碼、證明書編號、登記核准日期、變更文號、變更核准日期、註銷文號、註銷日期、案件類別、債務人名稱、債務人統編、債務人住居所或營業所、債務人代理人名稱、債務人代理人統編、擔保權人名稱、擔保權人統編、擔保權人住居所或營業所、擔保權人代理人名稱、擔保權人代理人統編、擔保權人備註、契約啟始日期、契約終止日期、標的物種類、標的物所有人名稱、標的物所有人統編、標的物所在地、標的物總價格、標的物價格幣別、擔保債權金額、擔保債權金額幣別、最高限額註記、動產明細項數、浮動擔保註記,,科技部中部科學園區管理局
中部科學園區參訪統計月報,7942,中部科學園區內參訪統計資料,,科技部中部科學園區管理局
中部科學園區職業安全最新公告月資料統計,7943,中部科學園區職業安全最新公告月統計資料。,bullsubject;bulldate;stpdate,科技部中部科學園區管理局
中部科學園區創新研發獎助輔助資料統計,7944,中部科學園區創新研發獎助輔助資料。,don_year;don_payee;don_item;aud_date;don_amout;apl_date;apl_amout;don_no,科技部中部科學園區管理局
中部科學園區入區登記(營運)廠商明細表統計月報,7945,中部科學園區入區登記(營運)廠商明細表月報資料。,,科技部中部科學園區管理局
新竹科學園區來賓統計資料,7946,國內外參訪竹科來賓資料統計,統計年月;本國(人);外國(人);亞洲(人);歐洲(人);非洲(人);北美(人);中南美(人);大洋洲(人);本國(批);外國(批),科技部新竹科學園區管理局
新竹科學園區靜心湖導覽,7947,新竹科學園區靜心湖導覽、景點、休憩點、交通資料。,資料類別;景點名稱;說明;照片連結,科技部新竹科學園區管理局
新竹科學園區人才培訓課程,7948,人才培訓相關課程,年度;計劃類別;執行單位;課程名稱,科技部新竹科學園區管理局
新竹科學園區公共藝術,7949,新竹科學園區公共藝術，包括新竹科學園區、竹南科學園區公共藝術資料。,,科技部新竹科學園區管理局
新竹科學園區管理局工程承包商聯絡資料,7950,園區在建中公共工程聯絡資訊,,科技部新竹科學園區管理局
新竹科學園區管理局活動訊息,7951,管理局各組室對外發佈活動訊息，包括：藝文活動、會議、教育訓練等。,發佈單位;發佈日期;下架日期;舉辦時間(起);舉辦時間(迄);活動分類;地點;標題;詳細內容,科技部新竹科學園區管理局
新竹科學園區新設暨遷址入區登記廠商月報,7952,最近1年新竹科學園區新設暨遷址入區登記廠商，包括新竹科學園區、竹南科學園區、龍潭科學園區、銅鑼科學園區、新竹生物醫學園區、宜蘭科學園區等登記廠商資料。,廠商代碼;統一編號;廠商名稱;事業類別;入區核准日期,科技部新竹科學園區管理局
科技部新竹科學園區管理局單位預算(法定預算),12128,科技部新竹科學園區管理局單位預算表,,科技部新竹科學園區管理局
南部科學園區管理局單位預算,12134,南部科學園區管理局單位預算,,科技部南部科學園區管理局
