「愛臺十2建設-綠色造林」植栽統計,['7029']
「政策諮詢(眾開講)」議題,['46772']
「海外僑胞百校植樹愛臺灣計畫」植栽統計,['7030']
世界暨洲際臺灣商會聯合總會會議概況,['7031']
世界暨洲際臺灣商會聯合總會會議活動統計資料,['9745']
世界臺灣商會聯合總會及各分會分布情形,['7028']
世界臺灣商會聯合總會所屬商會個數,['68585']
中華函授學校學生入學人數-性別及年齡別,['56022']
人力性別統計分析,['13262']
人民申請提供政府資訊案件統計,['13092']
人民陳情案件統計,['7200']
休士頓文教中心辦理「臺灣文化導覽-Splendor of Taiwan」活動情形表,['56025']
供應全球僑校教材冊數統計表,['56020']
僑務電子報歷年新聞上傳則數統計,['80151']
僑務電子報訂戶統計,['7199']
僑民對921大地震之反應及捐款情形,['6295']
僑民熱心公益自動捐獻金額,['7022']
僑生就讀大專院校男、女僑生人數及所占比例,['52278']
僑生春節祭祖暨師生聯歡餐會辦理情形,['52279']
僑生申請自行來臺就學人數統計表,['48209']
僑界急難救助協會,['68269']
僑臺商組織幹部培訓班參加人數,['48190']
公益勸募受理捐贈辦理情形,['13091']
函授教育入學及結業學生人數,['6293']
北美地區海外民俗文化種子教師培訓班培訓人數,['6481']
北美地區臺語教師研習會培訓人數,['9746']
北美地區青年志工培訓人數」,['9740']
十月慶典回國僑胞報到人數,['6292']
印尼僑生來臺升學輔導訓練班錄取分發大學校院人數,['46786']
受理捐贈僑生獎助學金核發情形,['9741']
各級學校及海青班在學僑生人數統計,['6112']
各項海外青年研習活動人數,['6480']
國人常赴度假打工地區之緊急聯繫僑團及商會清單,['42791']
國內僑民暨歸僑團體地址及聯絡資訊,['9739']
大專畢業僑生統計,['9742']
大專院校畢業僑生人數,"['6294', '46788', '55929']"
委託研究計畫報告,['13093']
宏觀電子報歷年新聞上傳則數統計,['7198']
授予僑營臺灣美食標章餐廳名單,['31650']
提供政府資訊收費標準表,['13090']
政府資料開放行動方案,['117722']
政策宣導廣告資料,['13259']
春節及國慶文化訪問團辦理情形,['46778']
會計月報,['21116']
核發華僑身分證明書案件,['6303']
歷屆中美洲暨巴拿馬6國中華、華僑總會聯合總會召開年會時間及地點,['6302']
歷屆亞洲華僑、華人聯誼會資料,['7026']
歷屆歐洲華僑團體聯誼會召開年會時間及地點,['6301']
歷屆美洲各地中華會館、中華公所、華僑總會聯誼會召開年會時間及地點,['6300']
歷屆非洲地區華人聯誼會召開年會時間及地點,['7027']
歷年中華函授學校學生入學人數-教育程度別,['56065']
歷年中華函授學校學生入學人數-職業別,['56063']
歷年中華函授學校學生入學人次,['46781']
歷年僑務研究碩博士論文獎助得獎名單,['9744']
歷年大型民俗文化用品採購情形,['55931']
歷年大洋洲華僑團體聯合會,['7033']
歷年採購案件,['13094']
歷年書刊流通中心贈書情形,['55935']
歷年決算書,['13257']
歷年海外僑團回國訪問統計表,['56027']
歷年海外僑社回國參加工作研討會統計表,['56030']
歷年海外僑社工作研討會,['7034']
歷年海外各文教中心績效統計,['46776']
歷年海外臺灣僑民人數,['9732']
歷年海外青年技術訓練班學生報到入學人數統計,['46787']
歷年海外青年臺灣觀摩團人數統計,['52280']
歷年獎勵僑務學術論著名單,['101445']
歷年獎補助資料,['13258']
歷年華文教師線上遠距研習班學員人數,['56062']
歷年補助僑生醫療急難及喪葬慰問金情形,['48212']
歷年補助清寒在學僑生參加全民健康保險人次,['48211']
歷年預算書,['12666']
海外信用保證基金承保情形,['46785']
海外信用保證基金承保案件統計,['6111']
海外信用保證基金累計承保情形,['46784']
海外信用保證基金累計承保案件,['46783']
海外僑商各項會議參加人數,['7025']
海外僑商經貿活動參加人數,"['7021', '68584']"
海外僑教中心地址及聯絡資訊,['6299']
海外僑民兒童或少年至校短期體驗計畫,['112641']
海外僑民團體數,['6109']
海外僑胞以僑安專案來臺健檢醫療機構名單及人數統計表,['31648']
海外各地僑教中心服務績效統計—依活動類別區分,['7023']
海外各地區辦理國父孫中山先生150歲誕辰紀念活動情形彙總表,['46775']
海外巡迴經貿講座辦理一覽表,['46782']
海外數位學習經營管理人員研習班參加人數,['6488']
海外民俗文化種子教師培訓計畫,['59657']
海外漢字文化節系列活動,['56061']
海外社教活動歷年補助統計資料,['7035']
海外華人人數,['6483']
海外華文媒體統計表,['86336']
海外華文學校、中文班分布情形,['6110']
海外華文教師研習會參加人數,['6487']
海外華裔青(少)年暑期研習營人數,['6486']
海外辦理各項節慶活動統計表,['7024']
海外青少年夏令營巡迴教學參加人數,['7036']
海外青年技術訓練班在學人數統計表,['31651']
海外青年技術訓練班實到學生人數統計,['7018']
海外青年技術訓練班畢業學生人數統計表,['106619']
海外青年技術訓練班畢業學生升讀大學人數統計表,['106620']
海外青年臺灣學習體驗營人數統計,['68586']
海外青年臺灣觀摩團人數統計,['7019']
海外青年英語服務營人數,['9743']
海外青年華語文研習班辦理情形統計,['7020']
清寒僑生工讀補助人次,['6484']
獲得學行優良僑生獎學金人數,['6482']
獲頒獎章人數,['68583']
紀念抗戰勝利7十週年活動統計表,['46774']
美國臺灣傳統週暨加拿大亞裔傳統月辦理情形,['46777']
自編教材ISBN,['46779']
自行編製(印)華文教材,['6485']
臺灣宏觀電視自製節目數量統計,['7032']
臺灣青年海外搭僑計畫,['68266']
華文教師回國研習班參加人數,['6479']
華文網路種子師資培訓班(實體班)歷年參加人數,['56021']
華文網路種子師資培訓計畫線上課程學員人數,['46780']
華臺裔民選官員名單,['111906']
行動應用軟體服務績效調查,['13265']
補助國內大學院校選送學生從事華語文教學實習名單,['31649']
補助國內大學院校開設僑務課程情形,['68582']
製作影音數量統計,['7197']
議資料表,['6304']
財團法人海外信用保證基金資料集,['108772']
財團法人海華文教基金會資料集,['107840']
資料開放諮詢小組會議紀錄,['18855']
輔助全國大專校院舉辦應屆畢業僑生畢業聯誼活動參與人數,['68588']
輔助國內大專院校及民間團體赴東南亞僑校志願服務作業計畫統計,['67397']
辦理國家賠償事件收結統計,['12672']
辦理華僑身分證明書、護照加簽僑居身分及役政用華僑身分證明書案件,['6113']
近年華僑身分證明書申辦案件統計,['46773']
遴派文化教師赴海外巡迴教學情形,['7037']
金僑獎歷屆參賽影片統計資料,['7196']
金僑獎歷年獲獎名單,['56057']
