資料集名稱,資料集識別碼,資料集描述,主要欄位說明,提供機關
愛心待用店,110340,提供有需要之弱勢民眾餐點或物資之單位/店家,資源彙整機關;辦理單位;連絡電話;傳真;地址;相關網址;X坐標;Y坐標;備註;最後更新時間,南投縣政府
臨時暨短期照顧服務提供單位,110343,提供失能身心障礙者或失能老人臨時性或短期性之照顧服務，以紓解家庭照顧者之長期照顧壓力之服務提供單位,資源彙整機關;辦理單位;連絡電話;傳真;電子郵件;地址;相關網址;X坐標;Y坐標;備註;最後更新時間,南投縣政府
身心障礙庇護工場,110344,依據「身心障礙者庇護工場設立管理及補助準則」設立之療護工場,資源彙整機關;辦理單位;庇護工場名稱;許可日期;許可文號;連絡電話;傳真;電子郵件;地址;營業項目;welOrgURL;X坐標;Y坐標;備註;最後更新時間,南投縣政府
身心障礙者社區樂活補給站,110345,提供身心障礙者學習技藝等課程活動之服務單位,資源彙整機關;辦理單位;連絡電話;傳真;電子郵件;地址;相關網址;X坐標;Y坐標;備註;最後更新時間,南投縣政府
鄉鎮市區公所,110346,鄉鎮市區公所,資源彙整機關;鄉鎮市區公所名稱;負責人;連絡電話;傳真;電子郵件;地址;相關網址;X坐標;Y坐標;備註;最後更新時間,南投縣政府
村里辦公室,110348,村里辦公室,資源彙整機關;鄉鎮市區;村里辦公室名稱;負責人;連絡電話;傳真;電子郵件;地址;相關網址;X坐標;Y坐標;備註;最後更新時間,南投縣政府
身心障礙者社區日間作業設施,110349,提供具備生活自理與交通能力但無法進入就業職場，且未安置於社會福利機構、醫療或護理機構、精神復健機構之身心障礙者作業活動，以保障與提升其生活品質。,性質;資源彙整機關;辦理單位;成立日期;立案文號;負責人;連絡電話;傳真;電子郵件;地址;核定服務人數_日間社區作業設施;相關網址;X坐標;Y坐標;備註;最後更新時間,南投縣政府
南投縣高齡友善藥局,110350,提供高齡者友善服務(如:具備簡單座椅、用藥指導、分藥服務)之藥局,資源彙整機關;鄉鎮市區;辦理單位;連絡電話;地址<br>,南投縣政府
復康巴士服務單位,110351,提供身心障礙者、失能者或弱勢民眾交通運輸服務單位,資源彙整機關;辦理單位;連絡電話;傳真;電子郵件;地址;服務區域;相關網址;X坐標;Y坐標;備註;最後更新時間,南投縣政府
視障按摩點,110352,由視障者提供接摩服務之據點或院所,資源彙整機關;視障按摩處所名稱;辦理單位;負責人;連絡電話;地址;服務時間;相關網址;X坐標;Y坐標;備註;最後更新時間,南投縣政府
南投縣高齡友善餐廳,110353,提供行動不便的長輩安心用餐之場所,資源彙整機關;辦理單位;連絡電話;地址,南投縣政府
快樂廚房,110354,快樂廚房,資源彙整機關;辦理單位;連絡電話;傳真;電子郵件;地址;相關網址;X坐標;Y坐標;備註;最後更新時間,南投縣政府
身心障礙者生涯轉銜服務提供單位,110355,依據「身心障礙者生涯轉銜計畫實施辦法」設立之生涯輔銜服務單位,資源彙整機關;辦理單位;連絡電話;傳真;電子郵件;地址;相關網址;X坐標;Y坐標;備註;最後更新時間,南投縣政府
失智症服務及資源提供單位,110363,提供失智症民眾服務及資源之單位(如: 小規模多機能、團體家屋、瑞智學堂),資源彙整機關;辦理單位;連絡電話;傳真;地址;服務項目;相關網址;X坐標;Y坐標;備註;最後更新時間,南投縣政府
南投縣一般護理之家,110397,依據「護理機構分類設置標準」設立之護理之家,,南投縣政府
志願服務推廣中心/志願服務協會,110400,志願服務運用或推廣單位,,南投縣政府
南投縣地價稅稅源結構分析,111946,類別：一般土地、工礦業等用地、自用住宅用地、公共設施保留地、合計,類別;比率;稅額,南投縣政府
南投縣使用牌照稅稅源結構分析,111947,類別：小客車、大客車、貨車、曳引車、機車、合計,類別;比率;稅額,南投縣政府
南投縣土地增值稅稅源結構分析,111948,類別：買賣、贈與、法院拍賣、判決移轉、分割、交換、其他、合計,類別;比率;稅額,南投縣政府
南投縣契稅稅源結構分析,111949,類別：買賣契、贈與契、分割契、交換契、合計,類別;比率;稅額,南投縣政府
南投縣房屋稅稅源結構分析,111950,類別：鋼骨混凝土造、鋼骨造、鋼骨鋼筋混凝土造、鋼筋混凝土造、加強磚造、鋼鐵造、雜木、磚石造、其他、合計,類別;比率;查定現值,南投縣政府
南投縣印花稅稅源結構分析,111951,類別：出售印花稅票、金融業、保險業、教育業、醫療業、遺產分割協議書、不動產買賣、不動產贈與、不動產分割合併、承攬契據、其他、合計,類別;比率;稅額,南投縣政府
南投縣社會救助補助項目,112567,急難救助、身心障礙者生活補助費(非低收入戶及中低收入者)、中低收入老人生活津貼、中低收入戶傷病醫療補助、中低收入戶傷病住院看護費用補助、中低收入戶資格認證,,南投縣政府
南投縣娛樂稅稅源結構分析,113360,類別：電影、高爾夫球場、電子遊戲機、視聽視唱業、資訊休閒業、電動搖搖馬、娃娃機、機動遊藝樂園、其他、合計,類別;比率;稅額,南投縣政府
使用牌照稅稅額表-完全以電能為動力之電動大客車及貨車,113673,使用牌照稅法第六條附表六 完全以電能為動力之電動大客車及貨車使用牌照稅稅額表（依照機動車輛類別查詢使用牌照稅稅額）,英制馬力(HP);公制馬力(PS);完全以電能為動力之電動大客車(每車乘人座位在十人以上者);完全以電能為動力之電動貨車,南投縣政府
使用牌照稅稅額表-完全以電能為動力之電動機車,113674,使用牌照稅法第六條附表五 完全以電能為動力之電動機車使用牌照稅稅額表（依照機動車輛類別查詢使用牌照稅稅額）,英制馬力(HP);公制馬力(PS);稅額(新台幣元),南投縣政府
使用牌照稅稅額表-機車,113675,使用牌照稅法第六條附表三機車使用牌照稅稅額表（依照機動車輛類別查詢使用牌照稅稅額）,汽缸總排氣量(立方公分);稅額(新台幣元),南投縣政府
使用牌照稅稅額表-完全以電能為動力之電動小客車,113676,使用牌照稅法第六條附表四 完全以電能為動力之電動小客車使用牌照稅稅額表（依照機動車輛類別查詢使用牌照稅稅額）,英制馬力(HP);公制馬力(PS);自用電動小客車;營業用電動小客車,南投縣政府
使用牌照稅稅額表-小客車,113677,使用牌照稅法第六條附表一小客車使用牌照稅稅額表（依照機動車輛類別查詢使用牌照稅稅額）,汽缸總排氣量;自用小客車;營業用小客車,南投縣政府
使用牌照稅稅額表-大客車及貨車,113678,使用牌照稅法第六條附表二大客車及貨車使用牌照稅稅額表（依照機動車輛類別查詢使用牌照稅稅額）,汽缸總排氣量（立方公分）;大客車（每車乘人座位在十人以上者）;貨車,南投縣政府
南投縣政府109年舉辦大型活動調查表,113909,南投縣政府109年舉辦大型活動調查表，活動日期時間如有異動，以主辦單位規劃為主,月份;活動名稱;內容摘要;活動時間;活動地點;主辦單位;創新內容;備註(縣長出席日期;時間);備註;備註(縣長出席日期時間);地點,南投縣政府
南投縣設置哺集乳室場所,118729,南投縣設置哺集乳室場所,場所名稱;縣市;鄉/鎮/市;村/里;鄰;路/街;段;巷/弄;號;樓;電話;開放時間;注意事項;類型<br>,南投縣政府
南投縣「子宮頸抹片篩檢」醫療院所名單,119347,南投縣「子宮頸抹片篩檢」醫療院所名單,鄉鎮別;院所名稱;地址;電話;緯度;經度<br><br>,南投縣政府
南投縣失智社區服務據點,126621,服務對象： 1.疑似失智症者。 2.經診斷並載明臨床失智症評量表(CDR)值≧0.5分之失智症者。 3.經長期照顧管理中心轉介之個案。 服務項目： 1.認知促進、緩和失智。 2.安全看視。 3.家屬支持團體(輔導諮商)。 4.家屬照顧課程。 服務模式：每一據點每週至少服務2全日或4半日或1全日加2半日(每半日最少3小時)。,編號;單位名稱;服務區域;開班時間;聯絡人;地址;電話,南投縣政府
南投縣失智共照中心,126749,*服務內容：個案管理及共同照護平台服務 *個案管理對象 1.經長照中心、醫療院所或其他單位轉介疑似失智個案。 2.初確診失智症第一年。 3.確診失智症個案並有複雜情緒行為或照顧者的需求。 共照中心協助提供個案及照顧者所需之照顧服務使用、轉介及追蹤；對未確診之疑似個案，協助於半年內完成就醫診斷及醫療照護。 *共同照護平台服務 1.輔導失智社區服務據點。 2.辦理失智照護人才(醫事人員及照服員)培訓與社區失智識能之公共教育宣導。,編號;單位名稱;聯絡人;地址;電話,南投縣政府
南投縣醫事機構辦理巷弄長照站單位,126785,巷弄長照站 服務對象: 1.全台老人年口，以衰弱及輕、中度失能或失智老人為優先，社區健康及亞健康老人亦可一起參與，無須經過照管中心評估。 2.經照管中心評估失能且符合喘息服務使用資格者，可至本縣特約服務提供單位之C級巷弄長照站使用臨托服務。 服務項目: 1.社會參與。 2.健康促進。 3.共餐服務。 4.結合預防及延緩失能服務方案。 5.電話問安或關懷訪視服務。 6.具服務量能單位，提供喘息服務(臨時托顧)。,編號;單位名稱;服務區域;村里別;活動地址;聯絡人;電話;喘息服務,南投縣政府
南投縣長照2.0出院準備服務暨復能多元服務單位,126786,服務介紹 藉由長期照顧管理中心連結醫院出院準備服務的專業醫療團隊共同評估病人身體、經濟、心理或情緒上的照護需求，如有長照需求的服務對象，出院前即完成評估並取得長照服務，協助民眾及時獲得所需服務資源，使病人及其家屬取得完整性及持續性的長照服務。 轄內醫院出院準備小組須於個案出院至少3天前完成初次評估，其中核定照顧服務項目須至少包含居家服務、居家護理、居家復健、喘息及簡易生活輔具等五項長照服務其中之三項，針對有復能潛能之個案，由專業團隊與個案、照顧者共同擬訂復能目標及計畫，照管中心應於個案出院1個月內或第4個月內(復能多元個案)完成複評，期個案出院後可盡速得到長照服務協助，增進返家後照顧品質。 服務內容 出院衛教：教導家屬相關照顧知識及技巧。 居家護理：提供居家照顧患者管路更換、衛生教育、指導傷口換藥等。 病患需要轉介合適之居家護理機構，進一步提供持續性照護。 器材租借：提供病患返家後所需的器材租借資訊或協助租借。 相關資源諮詢：提供社會福利，後送機構和社區資源之諮詢及轉介。,醫院名稱;聯繫窗口;電話,南投縣政府
南投縣109年-110年預防接種合約院所,126787,南投縣109年-110年預防接種合約院所,,南投縣政府
109年度「潛伏結核感染治療指定醫院」暨合作醫師,126814,109年度「潛伏結核感染治療指定醫院」暨合作醫師,縣市;醫療機構名稱;醫事機構代碼;醫師姓名;專科別;門診時間;GRA服務（有/無）;IGRA服務;3HP處方（有/無）;地址;聯絡電話,南投縣政府
109年度南投縣各醫療院所卡介苗接種日程表,126866,1.105年1月開始卡介苗接種時機更改為出生後滿5個月-8個月施打 2.附表為本縣各醫療院所及衛生所卡介苗接種日程表請參考,單位/月/日期;1月;2月;3月;4月;5月;6月;7月;8月;9月;10月;11月;12月;服務時間,南投縣政府
104年金融財稅統計年報,126940,南投縣104年度金融財稅資料,包含欄位：「年度及稅目別」;「實徵數」;「納庫數」;「未納庫數」...等;包含欄位：「營業基金」;「非營業特種基金」;「作業基金」;「特別收入基金」...等預算和決算資料;包含欄位：「年度及月別」;「警政支出」;「債務支出」;「協助及補助支出」;「其他支出」;「以前年度支出」;「預算外支出」...等;包含欄位：「政權行使支出」;「行政支出」;「民政支出」;「財務支出」;「教育支出」...等預算和決算資料;包含欄位：「年度別」;「福利服務支出」;「國民就業支出」;「醫療保健支出」;「社區發展支出」;「環境保護支出」...等;包含欄位：「年底別及鄉鎮市別」;「總計」;「本國銀行」;「農會信用部」;「本國壽險公司」;「本國產險公司」...等;包含欄位：「年(月)底別」;「本國銀行存款」;「外國銀行在華分行存款」;「基層金融機構存款」;「中華郵政公司存款」;「本國銀行放款」;「外國銀行在華分行放... 等;「稅課收入」;「工程受益費及信託管理收入」;「罰款及賠償收入」;「規費收入」;「財產收入」;「營業盈餘及事業收入」...等;「融資調度需求」;「融資調度財源」;「自有財源比率」;「賦稅依存度」;「補助依存度」;「債務未償餘額」等;「印花稅」;「使用牌照稅」;「土石採取景觀維護特別稅」;「地價稅」;「土地增值稅」;「房屋稅」;「娛樂稅」;「契稅」...等;「本年度收入」;「一般政務支出」;「教育科學文化支出」;「經濟發展支出」;「社會福利支出」...等;包含欄位：「稅課收入」;「工程受益收入」;「罰款及規費收入」;「信託管理收入」;「營業盈餘及事業收入」...等預算和決算資料,南投縣政府
107年歲入預決算(按來源別分),127403,包含欄位：「年度別」、「總計」、「稅課收入」、「罰款及賠償收入」、「規費收入」、「財產收入」、「營業盈餘及事業收入」...等預算和決算資料,包含欄位：「年度別」;「總計」;「稅課收入」;「罰款及賠償收入」;「規費收入」;「財產收入」;「營業盈餘及事業收入」...等預算和決算資料,南投縣政府
107年各項稅捐實徵數,127404,包含欄位：「年度別」、「總計」、「國稅」、「縣稅」、「教育捐」、「罰鍰」...等,包含欄位：「年度別」;「總計」;「國稅」;「縣稅」;「教育捐」;「罰鍰」...等,南投縣政府
107年各鄉鎮市歲入預決算(按來源別分),127405,包含欄位：「年度及鄉鎮市別」、「稅課收入」、「工程受益費收入」、「罰款及賠償收入」、「規費收入」、「財產收入」、「營業盈餘及事業收入」...等預算和決算資料,包含欄位：「年度及鄉鎮市別」;「稅課收入」;「工程受益費收入」;「罰款及賠償收入」;「規費收入」;「財產收入」;「營業盈餘及事業收入」...等預算和決算資料,南投縣政府
107年歲出預決算(按政事別分),127406,包含欄位：「年度別」、「政權行使支出」、「行政支出」、「民政支出」、「財務支出」、「教育支出」...等預算和決算資料,包含欄位：「年度別」;「政權行使支出」;「行政支出」;「民政支出」;「財務支出」;「教育支出」...等預算和決算資料,南投縣政府
107年鄉鎮市公庫收支,127407,包含欄位：「年度別」、「本年度收入」、「以前年度收入」、「預算外收入」、「本年度支出」、「以前年度支出」、「預算外支出」、「公庫結存」...等,包含欄位：「年度別」;「本年度收入」;「以前年度收入」;「預算外收入」;「本年度支出」;「以前年度支出」;「預算外支出」;「公庫結存」...等,南投縣政府
107年縣公庫收支,127408,包含欄位：「年度別」、「本年度收入」、「以前年度收入」、「預算外收入」、「本年度支出」、「以前年度支出」、「預算外支出」、「公庫結存」...等,包含欄位：「年度別」;「本年度收入」;「以前年度收入」;「預算外收入」;「本年度支出」;「以前年度支出」;「預算外支出」;「公庫結存」...等,南投縣政府
107年營業基金及非營業特種基金盈虧（餘絀）,127409,包含欄位：「年度別」、「營業基金」、「非營業特種基金」...等,包含欄位：「年度別」;「營業基金」;「非營業特種基金」...等,南投縣政府
107年各鄉鎮市歲出預決算(按政事別分),127410,包含欄位：「年度及鄉鎮市別」、「政權行使支出」、「行政支出」、「民政支出」、「財務支出」、「教育支出」...等預算和決算資料,包含欄位：「年度及鄉鎮市別」;「政權行使支出」;「行政支出」;「民政支出」;「財務支出」;「教育支出」...等預算和決算資料,南投縣政府
107年歷年財政狀況,127411,包含欄位：「年度別」、「融資調度需求」、「融資調度財源」、「自籌財源比率」、「賦稅依存度」、「補助及協助依存度」、「債務未償餘額」等,包含欄位：「年度別」;「融資調度需求」;「融資調度財源」;「自籌財源比率」;「賦稅依存度」;「補助及協助依存度」;「債務未償餘額」等,南投縣政府
107年各項稅捐納庫數,127412,包含欄位：「年度及稅目別」、「實徵數」、「納庫數」、「未納庫數」...等,包含欄位：「年度及稅目別」;「實徵數」;「納庫數」;「未納庫數」...等,南投縣政府
107年金融機構分布,127413,包含欄位：「年底及鄉鎮市別」、「總計」、「本國銀行」、「農會信用部」、「本國壽險公司」、「本國產險公司」...等,包含欄位：「年底及鄉鎮市別」;「總計」;「本國銀行」;「農會信用部」;「本國壽險公司」;「本國產險公司」...等,南投縣政府
107年金融機構存放、款餘額,127414,包含欄位：「年底別」、「本國銀行存款」、「外國銀行在臺分行存款」、「信用合作社存款」、「郵政儲金匯業局存款」、「本國銀行放款」、「外國銀行在臺分行放款」... 等,包含欄位：「年底別」;「本國銀行存款」;「外國銀行在臺分行存款」;「信用合作社存款」;「郵政儲金匯業局存款」;「本國銀行放款」;「外國銀行在臺分行放款」... 等,南投縣政府
南投縣都市計畫區公園一覽表,127415,依據南投縣公園管理維護自治條例第二條，本一覽表彙整公園僅為依都市計畫興闢之公園,公園名稱;編號;里別;面積（m2）;類別;座落位置;使用分區;維護管理單位;所在轄區;X座標及Y座標（TWD97坐標）,南投縣政府
(國姓鄉仁愛鄉)109年公告現值公告地價資料,128006,南投縣公告現值及公告地價(係為產製當時之資料，後續因土地分割、合併等致地價變動，可利用南投縣公告土地現值、公告地價查詢系統(http://link.nantou.gov.tw/land/Land.aspx)所提供公告土地現值及公告地價查詢功能，如有土地合併或分割時，該系統會同步更新土地分割或合併後之地價資料；公告現值於每年1月1日公告，公告地價每2年公告1次，必要時得延長。),縣市別;行政區;段小段;地號(00010000地號為1地號;00010001地號為1-1地號);公告土地現值(元/㎡);公告地價(元/㎡),南投縣政府
南投縣指定開設身心障礙者牙科特別門診資訊,128618,南投縣指定開設身心障礙者牙科特別門診資訊,醫院名稱;地址;電話;網址,南投縣政府
南投縣祥和志工隊,129392,南投縣祥和志工隊,資源彙整機關;辦理單位;連絡電話;傳真;電子郵件;地址;服務時間;相關網址;X座標;Y座標;備註;最後更新時間,南投縣政府
南投縣失業者職業訓練,129393,南投縣失業者職業訓練,資源彙整機關;辦理單位;連絡電話;傳真;電子郵件;地址;服務時間;相關網址;X座標;Y座標;備註;最後更新時間,南投縣政府
南投縣立案人民團體公益活動獲補助單位,129394,南投縣立案人民團體公益活動獲補助單位,資源彙整機關;辦理單位;連絡電話;傳真;電子郵件;地址;服務時間;相關網址;X座標;Y座標;備註;最後更新時間,南投縣政府
南投縣長青大學,129395,南投縣長青大學,資源彙整機關;辦理單位;連絡電話;傳真;地址;X座標;Y座標;備註;最後更新時間,南投縣政府
南投縣原住民部落文化健康站,129396,南投縣原住民部落文化健康站,資源彙整機關;辦理單位;連絡電話;傳真;電子郵件;地址;服務時間;相關網址;X座標;Y座標;備註;最後更新時間,南投縣政府
南投縣早期療育申請數,129894,南投縣早期療育申請數,資源彙整機關;108年申請人數;最後更新時間<br>,南投縣政府
南投縣照顧服務員專班訓練,129909,南投縣照顧服務員專班訓練,資源彙整機關;辦理單位;連絡電話;傳真;電子郵件;地址;服務時間;相關網址;X座標;Y座標;備註;最後更新時間,南投縣政府
南投縣成年心智障礙者社區居住與獨立生活服務單位,129910,南投縣成年心智障礙者社區居住與獨立生活服務單位,資源彙整機關;辦理單位;連絡電話;傳真;電子郵件;地址;服務時間;相關網址;X座標;Y座標;備註;最後更新時間,南投縣政府
南投縣原住民族家庭服務中心,129911,南投縣原住民族家庭服務中心,資源彙整機關;辦理單位;連絡電話;傳真;電子郵件;地址;服務時間;相關網址;X座標;Y座標;備註;最後更新時間,南投縣政府
南投縣低收入戶老人公費養護合約機構,129914,南投縣低收入戶老人公費養護合約機構,資源彙整機關;辦理單位;連絡電話;傳真;電子郵件;地址;服務時間;相關網址;X座標;Y座標;備註;最後更新時間,南投縣政府
南投縣居家托育人員數,129915,南投縣居家托育人員數,資源彙整機關;108年申請人數;最後更新時間<br>,南投縣政府
南投縣災害應變中心,129916,南投縣災害應變中心,資源彙整機關;辦理單位;連絡電話;傳真;電子郵件;地址;服務時間;相關網址;X座標;Y座標;備註;最後更新時間,南投縣政府
南投縣立案人民團體,129917,南投縣立案人民團體,資源彙整機關;辦理單位;連絡電話;傳真;電子郵件;地址;服務時間;相關網址;X座標;Y座標;備註;最後更新時間,南投縣政府
南投縣婦女大學,129918,南投縣婦女大學,鄉鎮;班別;班名;期間;辦理時段;辦理星期;預定人數;地點;講師,南投縣政府
南投縣獨居老人服務單位,129919,南投縣獨居老人服務單位,資源彙整機關;辦理單位;聯絡人;連絡電話;傳真;地址;服務區域;X座標;Y座標;備註;最後更新時間,南投縣政府
南投縣身心障礙者家庭托顧服務單位,129920,南投縣身心障礙者家庭托顧服務單位,資源彙整機關;辦理單位;連絡電話;傳真;電子郵件;地址;服務時間;相關網址;X座標;Y座標;備註;最後更新時間,南投縣政府
南投縣原住民族委員會派駐金融輔導員據點,129921,南投縣原住民族委員會派駐金融輔導員據點,資源彙整機關;辦理單位;連絡電話;傳真;電子郵件;地址;服務時間;相關網址;X座標;Y座標;備註;最後更新時間,南投縣政府
南投縣原住民業務聯絡窗口,129922,南投縣原住民業務聯絡窗口,資源彙整機關;辦理單位;連絡電話;傳真;電子郵件;地址;服務時間;相關網址;X座標;Y座標;備註;最後更新時間,南投縣政府
南投縣到宅沐浴車服務,129923,到宅沐浴車服務,資源彙整機關;辦理單位;連絡電話;傳真;電子郵件;地址;相關網址;X座標;Y座標;備註;最後更新時間,南投縣政府
南投縣身心障礙者手語翻譯服務提供單位,129924,南投縣身心障礙者手語翻譯服務提供單位,資源彙整機關;辦理單位;連絡電話;傳真;電子郵件;地址;服務時間;相關網址;X座標;Y座標;備註;最後更新時間,南投縣政府
南投縣遊民及路倒病人委託安置機構,129925,南投縣遊民及路倒病人委託安置機構,資源彙整機關;辦理單位;連絡電話;傳真;電子郵件;地址;服務時間;相關網址;X座標;Y座標;備註;最後更新時間,南投縣政府
南投縣低收入戶老人公費安養合約機構,129926,南投縣低收入戶老人公費安養合約機構,資源彙整機關;辦理單位;連絡電話;傳真;電子郵件;地址;服務時間;相關網址;X座標;Y座標;備註;最後更新時間,南投縣政府
南投縣無障礙廁所(公共建築物),130052,南投縣無障礙廁所(公共建築物),鄉鎮;名稱;地址;備註,南投縣政府
南投縣無障礙廁所(友善餐廳),130053,南投縣無障礙廁所(友善餐廳),編號;行業別;場域名稱;地址;電話,南投縣政府
