資料集識別碼,資料集名稱,提供機關,服務分類,資料集描述,主要欄位說明,更新頻率,授權方式,相關網址,上架日期,備註
112670,嘉義縣政府受款人筆數總表,嘉義縣政府,公共資訊,嘉義縣政府受款人筆數總表,"ArticleType: 公告模式:0.文章 1.附件 2.連結,FileName: 文章檔案,Link: 文章連結,其餘欄位的說明為格式欄位",每日,政府資料開放授權條款-第1版,,2019/12/01 00:00,
112555,中小企業智權加值服務中心-智財專家團隊,經濟部中小企業處,開創事業,參與本計畫之智權顧問個人簡歷介紹。本計畫團隊特別邀請國內多位智財專家，擔任本計畫專家顧問團隊，依個別專長協助提供中小企業專業智財短期診斷、專利分析教育訓練及智權專案輔導服務,項次;顧問姓名;現職;經歷;電話;分機;電子郵件,每年,政府資料開放授權條款-第1版,,2019/11/30 00:00,
112556,中小企業智權加值服務中心-智權問答,經濟部中小企業處,開創事業,提供中小企業常見的智權問題Q&A題庫，協助企業快速解答智權疑問,項次;標題;內容;更新日期;,每年,政府資料開放授權條款-第1版,,2019/11/30 00:00,
112664,經濟部貿易調查委員會_公告,經濟部貿易調查委員會,公共資訊,經濟部貿易調查委員會所發布之公告訊息,發布日期;公告標題;公告內容,每年,政府資料開放授權條款-第1版,https://www.moeaitc.gov.tw/ITC/main/news/wfrmNews.aspx?kind=3&menu_id=31,2019/11/30 00:00,
112666,經濟部貿易調查委員會_我國貿易救濟案件動態,經濟部貿易調查委員會,公共資訊,經濟部貿易調查委員會辦理貿易救濟案件之動態訊息,發布日期;案件編號;案件名稱;案件標題;案件內容,每年,政府資料開放授權條款-第1版,,2019/11/30 00:00,
