資料集識別碼,資料集名稱,提供機關,服務分類,資料集描述,主要欄位說明,更新頻率,授權方式,相關網址,上架日期,備註
102724,基隆市愛心實物銀行108年度4月份物資捐贈名冊,基隆市政府社會處,公共資訊,基隆市愛心實物銀行108年度4月份物資捐贈名冊,"捐贈日期,捐贈單位/捐贈人,捐贈物資,數量",不更新,政府資料開放授權條款-第1版,,2019/05/27 15:04,
102722,臺中市政府警察局100年9月份交通事故資料,臺中市政府警察局交通警察大隊,交通及通訊,本局100年10月份交通事故資料,年;月;日;時;分;縣市;區;村里;鄰;街道;段;巷;弄;號;附近;事故類別,每月,政府資料開放授權條款-第1版,,2019/04/02 12:00,
102727,地方稅務行事曆,臺北市稅捐稽徵處,公共資訊,重要事項、說明,重要事項;說明,每年,政府資料開放授權條款-第1版,,2013/12/31 00:00,
102726,臺北廣播電臺中文節目表,臺北廣播電臺,公共資訊,廣播內容中文節目表，連結網頁提供線上收聽及過去60天節目音檔,"頻道;, 星期;, 開始時間;,結束時間;, 節目;,主持人",每月,政府資料開放授權條款-第1版,,2016/06/01 00:00,
102147,107年度中央政府總決算歲出政事別決算總表,行政院主計總處,公共資訊,中央政府總決算歲出政事別科目之預算數、決算數及其比較,會計年度;科目_款;科目_名稱;預算數_原預算數;預算數_預算增減數;預算數_合計;決算數_實現數;決算數_應付數;決算數_保留數;決算數_合計;比較增加減數;說明,不更新,政府資料開放授權條款-第1版,,2019/05/27 00:00,
