資料集識別碼,資料集名稱,提供機關,資料集描述,主要欄位說明,更新頻率,授權方式,備註,新增日期
106208,嘉義縣婦幼安全警示地點,嘉義縣警察局,提供嘉義縣婦幼安全警示地點資料,編號、地點位置、管轄分局,每半年,政府資料開放授權條款-第1版,,20190725
106205,基隆市不動產買賣實價登錄Open Data(108年5月買賣登記案件),基隆市政府地政處,不動產賣賣案件實價登錄資訊，包含標的位置(去識別化)、面積、總價等資訊。,鄉鎮市區、交易標的、土地區段位置建物區段門牌、土地移轉總面積平方公尺、都市土地使用分區、非都市土地使用分區、非都市土地使用編定、交易年月日、交易筆棟數、移轉層次、總樓層數、建物型態、主要用途、主要建材、建築完成年月、建物移轉總面積平方公尺、建物現況格局-房、建物現況格局-廳、建物現況格局-衛、建物現況格局-隔間、有無管理組織、總價元、單價元平方公尺、車位類別、車位移轉總面積平方公尺、車位總價元、備註、編號,每月,政府資料開放授權條款-第1版,,20190725
106206,(桃園市)食品(健康食品)標示調查案件統計表,桃園市政府衛生局,(桃園市)食品(健康食品)標示調查案件統計表,日期(日期)、案由(案由)、處分商號名稱(處分商號名稱)、產品名稱(產品名稱)、調查結果(調查結果),每月,政府資料開放授權條款-第1版,依據消費者保護法第33條公布,20190725
106201,100年度1578條土石流潛勢溪流集水區圖,行政院農業委員會,提供100年度1578條土石流潛勢溪流集水區圖shp下載檔案，包含ID(編號)、DEBRISNO(土石流潛勢溪流編號)、OLD(舊編號)、COINTY(縣市)、TOWN(鄉鎮、VILLAGE(村里)、AREA_HA(面積，單位公頃)、CENTROID_X(中心X坐標)、CENTROID_X(中心Y坐標)等欄位。,ID(編號)、DEBRISNO(土石流潛勢溪流編號)、OLD(舊編號)、COINTY(縣市)、TOWN、鄉鎮、VILLAGE(村里)、AREA_HA(面積，單位公頃)、CENTROID_X(中心X坐標)、CENTROID_X(中心Y坐標),不更新,政府資料開放授權條款-第1版,,20190725
106202,103年度1671條土石流潛勢溪流集水區圖,行政院農業委員會,提供103年度1671條土石流潛勢溪流集水區圖shp下載檔案，包含ID(編號)、DEBRISNO(土石流潛勢溪流編號)、OLD(舊編號)、COINTY(縣市)、TOWN(鄉鎮、VILLAGE(村里)、AREA_HA(面積，單位公頃)、CENTROID_X(中心X坐標)、CENTROID_X(中心Y坐標)等欄位。,ID(編號)、DEBRISNO(土石流潛勢溪流編號)、OLD(舊編號)、COINTY(縣市)、TOWN、鄉鎮、VILLAGE(村里)、AREA_HA(面積，單位公頃)、CENTROID_X(中心X坐標)、CENTROID_X(中心Y坐標),不更新,政府資料開放授權條款-第1版,,20190725
106198,岡山路竹延伸線第一階段捷運建設－土建工程進度,高雄市政府捷運工程局,岡山路竹延伸線第一階段捷運建設－土建工程總累計執行進度百分比,年、月、預定(總累計執行進度%)、實際(總累計執行進度%)、備註,每月,政府資料開放授權條款-第1版,,20190725
106199,高雄輕軌月均運量統計,高雄市政府捷運工程局,高雄輕軌每月總運量、日均運量、假日均運量等,年、月、總運量、日均運量、假日均運量、月台上刷卡日均筆數、車上刷卡日均筆數、售票機日均筆數、補票日均筆數、團體票日均筆數,每月,政府資料開放授權條款-第1版,,20190725
106200,高雄市A1交通事故,高雄市政府警察局,高雄市A1交通事故,Seq、編號、年份、月份、日期、時間、星期、行政區、地點、所別、路口段、事故 型態、1方、2方、3方、死亡車輛類別、有無駕照、1方肇因、2方肇因、3方肇因、肇事者 年齡、性別1、死亡人數、受傷、酒測、備註、就醫、機車安全帽,每月,政府資料開放授權條款-第1版,,20190725
