資料集識別碼,資料集名稱,提供機關,服務分類,資料集描述,主要欄位說明,更新頻率,授權方式,相關網址,上架日期,詮釋資料更新時間,備註
97927,臺灣桃園地方法院107年12月份會計報告,臺灣桃園地方法院,公共資訊,臺灣桃園地方法院107年12月份會計報告,,不更新,政府資料開放授權條款-第1版,,2019/01/22 00:00,2019/01/22 16:32,
97933,臺灣新竹地方法院107年12月會計月報,臺灣新竹地方法院,公共資訊,歲入累計表、經費累計表、以前年度歲入轉入數累計表、以前年度歲出轉入數累計表、平衡表、資本資產表、資本資產變動表、歲出用途別累計表、收入實現數與繳付公庫數分析表、支出實現數與公庫撥入數分析表、收入支出彙計表,,每月,政府資料開放授權條款-第1版,,2019/01/22 00:00,2019/01/22 17:43,
97908,馬公港2018年海流觀測月平均資料,交通部運輸研究所,公共資訊,提供馬公港2018年海流月平均統計資料。,觀測時間;資料蒐集率;平均流速;最大流速;主要流向等資料。,每日,政府資料開放授權條款-第1版,https://www.ihmt.gov.tw/opendata/upload/Obs/MK/2018MKCURR.xlsx,2019/01/22 00:00,2019/01/22 11:42,
97909,馬公港2018年波浪觀測月平均資料,交通部運輸研究所,公共資訊,提供馬公港2018年波浪月平均統計資料。,觀測時間;資料蒐集率;有義波高Hs平均;尖峰周期Tp平均;最大Hs波高;最大Tp週期等資料。,每日,政府資料開放授權條款-第1版,https://www.ihmt.gov.tw/opendata/upload/Obs/MK/2018MKWAVE.xlsx,2019/01/22 00:00,2019/01/22 11:45,
97910,馬公港2018年風觀測月平均資料,交通部運輸研究所,公共資訊,提供馬公港2018年風速、風向月平均統計資料。,觀測時間;資料蒐集率;10分鐘風速平均值;10分鐘風速平均最大值;主要風向等資料。,每日,政府資料開放授權條款-第1版,https://www.ihmt.gov.tw/opendata/upload/Obs/MK/2018MKWIND.xlsx,2019/01/22 00:00,2019/01/22 11:49,
97904,內政部空中勤務總隊執行風災搶救任務成效統計表,內政部空中勤務總隊,公共資訊,勤務項目_月份、01月、02月、03月、04月、05月、06月、07月、08月、09月、10月、11月、12月、合計,勤務項目_月份;01月;02月;03月;04月;05月;06月;07月;08月;09月;10月;11月;12月;合計,每年,政府資料開放授權條款-第1版,,2019/01/22 08:31,2019/01/22 08:38,
97921,內政部空中勤務總隊執行震災搶救任務成效統計表,內政部空中勤務總隊,公共資訊,勤務項目_月份、01月、02月、03月、04月、05月、06月、07月、08月、09月、10月、11月、12月、合計,勤務項目_月份;01月;02月;03月;04月;05月;06月;07月;08月;09月;10月;11月;12月;合計,每年,政府資料開放授權條款-第1版,,2019/01/22 13:52,2019/01/22 14:39,
97934,行政院人事行政總處公務人力發展學院107年12月份會計月報,行政院人事行政總處公務人力發展學院,公共資訊,行政院人事行政總處公務人力發展學院107年12月份會計月報,,每月,政府資料開放授權條款-第1版,,2019/01/22 00:00,2019/01/22 17:45,
97911,臺灣菸酒股份有限公司107年度12月止補(捐)助執行情形,臺灣菸酒股份有限公司,公共資訊,臺灣菸酒股份有限公司107年度12月止補(捐)助執行情形,,每月,政府資料開放授權條款-第1版,,2019/01/22 00:00,2019/01/22 13:43,
97913,臺灣菸酒股份有限公司107年度12月止團體會費支用情形,臺灣菸酒股份有限公司,公共資訊,臺灣菸酒股份有限公司107年度12月止團體會費支用情形,,每月,政府資料開放授權條款-第1版,,2019/01/22 00:00,2019/01/22 13:47,
97915,臺灣菸酒股份有限公司107年度11月止補(捐)助執行情形,臺灣菸酒股份有限公司,公共資訊,臺灣菸酒股份有限公司107年度11月止補(捐)助執行情形,,每月,政府資料開放授權條款-第1版,,2019/01/22 00:00,2019/01/22 13:52,
97917,臺灣菸酒股份有限公司107年度11月止團體會費支用情形,臺灣菸酒股份有限公司,公共資訊,臺灣菸酒股份有限公司107年度11月止團體會費支用情形,,每月,政府資料開放授權條款-第1版,,2019/01/22 00:00,2019/01/22 13:52,
97916,2922-02-01-2 臺中市合作社概況,臺中市政府社會局‧長青福利科,公共資訊,本市依據轄區內依合作社法核發之各項合作社登記證資料彙編。,RptNo;RptName;StatCourseNo;StatCourseName;DataDate;PlaceNo;PlaceName;PeriodNo;PeriodName;Complex1;ComplexName;Complex2;Complex2Name;Complex3;Complex3Name;Complex4;Complex4Name;Complex5;omplex5Name;DeriveNo;DeriveExplain;FValue;SValue;RptDeptNo;RptDeptName;CreateTime;ModifyTime,每日,政府資料開放授權條款-第1版,,2019/01/22 13:49,2019/01/22 13:49,
97922,10730-02-03-2 臺中市弱勢兒童及少年扶助概況,臺中市政府社會局‧長青福利科,公共資訊,1.依據本府與所轄兒童及少年福利機構所辦理各項服務(生活扶助、醫療補助、托育補助或津貼及緊急生活扶助)資料彙編。 2.本資料彙整與上傳至衛生福利部統計處資料庫相同。,RptNo;RptName;StatCourseNo;StatCourseName;DataDate;PlaceNo;PlaceName;PeriodNo;PeriodName;Complex1;ComplexName;Complex2;Complex2Name;Complex3;Complex3Name;Complex4;Complex4Name;Complex5;omplex5Name;DeriveNo;DeriveExplain;FValue;SValue;RptDeptNo;RptDeptName;CreateTime;ModifyTime,每月,政府資料開放授權條款-第1版,,2019/01/22 14:47,2019/01/22 14:47,
97875,108年1月1日起實施7項食品管理新制,苗栗縣政府衛生局,生活安全及品質,108年1月1日起實施7項食品管理新制,,不更新,政府資料開放授權條款-第1版,https://www.mlshb.gov.tw/upload/15/2019011909243864755.jpg,2019/01/21 00:00,2019/01/22 15:36,
97923,107年抽驗,苗栗縣政府衛生局,生活安全及品質,107年抽驗,,不更新,政府資料開放授權條款-第1版,https://www.mlshb.gov.tw/tc/includes/GetFile.ashx?mID=34&id=3188&chk=747db081-93d3-4bef-a159-986fdd0f144d,2019/01/22 00:00,2019/01/22 15:36,
