資料集識別碼,資料集名稱,提供機關,服務分類,資料集描述,主要欄位說明,更新頻率,授權方式,相關網址,上架日期,備註
107473,109年度大專校院轉型及退場基金基金附屬單位預算案,教育部會計處,公共資訊,提供大專校院轉型及退場基金預算之主要表XML檔，包含(一)基金來源、用途及餘絀預計表(二)現金流量預計表(三)預計平衡表。,SEQNO;LEVEL;BOLD;前年度決算數;項目;本年度預算數;上年度預算數;比較增減;預算數;說明,每年,政府資料開放授權條款-第1版,,2019/09/03 00:00,
107514,109年度學產基金附屬單位預算案,教育部會計處,公共資訊,提供109年度學產基金附屬單位預算案之主要表XML檔，包含(一)基金來源、用途及餘絀預計表，(二)現金流量預計表。,SEQNO;LEVEL;BOLD;前年度決算數;項目;本年度預算數;上年度預算數;比較增減;預算數;說明,每年,政府資料開放授權條款-第1版,,2019/09/04 00:00,
107510,法務部所屬機關政風機構108年廉政工作聯繫會議,法務部,公共資訊,法務部所屬機關政風機構108年廉政工作聯繫會議,資料名稱;成果資料;摘要,即時,政府資料開放授權條款-第1版,,2019/09/04 00:00,
103136,犯罪被害人保護協會108年度預算書,法務部保護司,公共資訊,犯罪被害人保護協會108年度預算書,,每年,政府資料開放授權條款-第1版,https://www.moj.gov.tw/cp-228-113955-01828-001.html,2019/09/05 00:00,
107407,法務部法醫研究所新聞稿(不定期),法務部法醫研究所,公共資訊,法務部法醫研究所新聞稿(不定期),項目;聯絡人;聯絡電話;連結,即時,政府資料開放授權條款-第1版,,2019/08/30 00:00,
107402,法務部與所屬機關公共建設計畫執行控管及督導作業規定,法務部秘書處,公共資訊,法務部與所屬機關公共建設計畫執行控管及督導作業規定,「法務部與所屬機關公共建設計畫執行控管及督導作業規定」項次;內容,每10年,政府資料開放授權條款-第1版,,2019/09/04 00:00,
107503,山東新華發行商出版大陸叢書,法務部調查局,求學及進修,山東新華發行商出版大陸叢書,編號;書名;作者;發行商;發行地;發行日期;檔案,即時,政府資料開放授權條款-第1版,,2019/09/04 00:00,
107505,臺中市餐館業清冊,臺中市政府經濟發展局,休閒旅遊,設址臺中市營業項目包含餐館業之公司商業清冊,公司統編;公司名稱;公司地址;設立日期,每年,政府資料開放授權條款-第1版,,2019/09/04 14:22,
107526,109年度臺北市總預算案,臺北市政府主計處,公共資訊,109年度臺北市總預算案,109年度臺北市總預算案,每年,政府資料開放授權條款-第1版,,2019/09/04 20:21,
107529,本府各機關學校統編,臺北市稅捐稽徵處,公共資訊,本府各機關學校統編,機關學校名稱及統一編號,每日,政府資料開放授權條款-第1版,,2019/09/04 00:00,
107530,108年8月花蓮縣各項稅捐實徵淨額與預算數及上年同期比較-本月數,花蓮縣政府,公共資訊,108年8月花蓮縣各項稅捐實徵淨額與預算數及上年同期比較-本月數,詳如資料集內容,每日,政府資料開放授權條款-第1版,,2019/09/05 00:00,無
107531,108年8月花蓮縣各項稅捐實徵淨額與預算數及上年同期比較-累計數,花蓮縣政府,公共資訊,108年8月花蓮縣各項稅捐實徵淨額與預算數及上年同期比較-累計數,詳如資料集內容,每日,政府資料開放授權條款-第1版,,2019/09/05 00:00,無
107532,108年8月花蓮縣各項稅捐本月實徵數簡報表,花蓮縣政府,公共資訊,108年8月花蓮縣各項稅捐本月實徵數簡報表,詳如資料集內容,每日,政府資料開放授權條款-第1版,,2019/09/05 00:00,無
107506,UAV空拍正射影像圖磚,行政院農業委員會,公共資訊,蒐集UAV空拍影像，經地理定位與正射處理發布，建立UAV空拍正射影像圖磚提供應用系統介接。,AccessURL;Title;ProjectNo;ProjectName;Date;Class,即時,政府資料開放授權條款-第1版,https://gis.swcb.gov.tw/api/swcb/tiles/ortho,2019/09/04 00:00,
107502,109年度全民健康保險基金預算案,衛生福利部中央健康保險署,公共資訊,預算主要表資料,預算明細,每年,政府資料開放授權條款-第1版,,2019/09/04 00:00,
107498,國民健康署公務預算(109年),衛生福利部國民健康署,公共資訊,包含人事費用分析表、公務車輛明細表、各項費用彙計表、委辦經費分析表、派員出國計畫預算總表、派員出國計畫類別表-考察、派員出國計畫類別表-進修、派員出國計畫類別表-開會、派員赴大陸計畫預算表、捐助經費分析表、歲入來源別預算表、歲入項目說明提要表、歲出用途別科目分析表、歲出按職能及經濟性綜合分類表、歲出計畫提要及分支計畫概況表、歲出機關別預算表、補助經費分析表、資本支出分析表、跨年期計畫概況表、預算員額明細表、辦公房舍明細表、轉帳收支對照表,name;url,每年,政府資料開放授權條款-第1版,,2019/09/04 00:00,
107500,高雄高等行政法院108年8月會計月報,高雄高等行政法院,公共資訊,高雄高等行政法院108年8月會計月報,會計年度;月份;款;項;目;節;預算年度;預算科目編號;預算科目名稱;細目編號;細目名稱;原預算數;追加減數;截至本月止累計分配數_1;本月實現數;截至本月止累計實現數_2;應收收入數_3;分配數預算餘額_4;分支計畫編號;分支計畫名稱;用途別編號;用途別名稱;第一預備金;第二預備金;經費流用數;預算調整數;應付數;已分配尚未執行數;備註_預暫付數;基金別;會計分類;使用機關別;科目分類;會計科目編號;會計科目名稱;金額;科目名稱;取得成本;以前年度累計折舊_長期投資評價;本年度資本資產成本變動_增加數;本年度資本資產成本變動_減少數;本年度累計折舊_長期投資評價變動數;期末帳面金額;備註;業務計畫或工作計畫;經資門;執行數;項目;收入實現數;減項_收入待納庫數;加項_以前年度待納庫繳庫數;加項_以前年度撥款於本年度繳還數_材料;加項_以前年度撥款於本年度繳還數_存出保證金;加項_以前年度撥款於本年度繳還數_其他應收款;加項_預收款;加項_剔除經費;繳付公庫數;一級用途別編號;一級用途別名稱;支出實現數;加項_預付款;加項_材料;加項_存出保證金;加項_零用金;加項_退還收入預收款;加項_其他應收款;減項_以前年度撥款於本年度實現數;公庫撥入數;公庫分配數餘額;金額_本月數;金額_累計數,每月,政府資料開放授權條款-第1版,http://ksb.judicial.gov.tw/chinese/GovPublicInfo.aspx?p=58&pa=10227&n=10347&type=6,2019/09/04 00:00,
