資料集識別碼,資料集名稱,提供機關,服務分類,資料集描述,主要欄位說明,更新頻率,授權方式,相關網址,上架日期,備註
101119,內政部空中勤務總隊近一年執行山難任務飛行架次較多區域報表,內政部空中勤務總隊,公共資訊,日期、單位、縣市、鄉鎮、座標、飛行時間、飛行架次,date;unit;county;township;coordinate;flight duration;No. of sorties,每年,政府資料開放授權條款-第1版,,2019/04/19 09:34,
101121,內政部空中勤務總隊近一年執行緊急救護任務飛行架次較多區域報表,內政部空中勤務總隊,公共資訊,日期、單位、縣市、鄉鎮、座標、飛行時間、飛行架次,date;unit;county;township;coordinate;flight duration;No. of sorties,每年,政府資料開放授權條款-第1版,,2019/04/19 11:18,
101124,嘉義縣警察局犯罪預防宣導,嘉義縣警察局,公共資訊,提供犯罪預防宣導資訊,提供犯罪預防宣導資訊,每周,政府資料開放授權條款-第1版,,2019/04/19 00:00,
101125,嘉義縣警察局員警好人好事事蹟,嘉義縣警察局,公共資訊,提供嘉義縣警察局優良員警事蹟資訊,提供嘉義縣警察局優良員警事蹟資訊,每周,政府資料開放授權條款-第1版,,2019/04/19 00:00,
101122,新北市路口監視器(108新版)-,新北市政府警察局,公共資訊,新北市政府路口監視器資訊主要提供欄位包含分局、派出所、攝影機建置地點、照射方向；因應警察局要求故將「照射方向」改為「建置案單位」。-,Bureau;Unit;District;Location;Build_Case_Unit,每年,政府資料開放授權條款-第1版,,2019/04/19 11:00,
101110,新北市108年度徵起之國稅、縣市稅分成數額表,新北市政府財政局,公共資訊,新北市108年度徵起之國稅、縣市稅分成數額表,field_1;field_2;field_3;field_4;field_5,每月,政府資料開放授權條款-第1版,,2019/04/19 09:16,
101123,最高檢察署108年度會計月報,最高檢察署,公共資訊,最高檢察署108年度會計月報,會計年度;月份;款;項;目;節;預算年度;預算科目編號;預算科目名稱;細目編號;細目名稱;原預算數;追加減數;截至本月止累計分配數_1;本月實現數;截至本月止累計實現數_2;應收收入數_3;分配數預算餘額_4;分支計畫編號;分支計畫名稱;用途別編號;用途別名稱;第一預備金;第二預備金;經費流用數;預算調整數;應付數;已分配尚未執行數;備註_預暫付數;基金別;會計分類;使用機關別;科目分類;會計科目編號;會計科目名稱;金額;科目名稱;取得成本;以前年度累計折舊_長期投資評價;本年度資本資產成本變動_增加數;本年度資本資產成本變動_減少數;本年度累計折舊_長期投資評價變動數;期末帳面金額;備註;業務計畫或工作計畫;經資門;執行數;項目;收入實現數;減項_收入待納庫數;加項_以前年度待納庫繳庫數;加項_以前年度撥款於本年度繳還數_材料;加項_以前年度撥款於本年度繳還數_存出保證金;加項_以前年度撥款於本年度繳還數_其他應收款;加項_預收款;加項_剔除經費;繳付公庫數;一級用途別編號;一級用途別名稱;支出實現數;加項_預付款;加項_材料;加項_存出保證金;加項_零用金;加項_退還收入預收款;加項_其他應收款;減項_以前年度撥款於本年度實現數;公庫撥入數;公庫分配數餘額;金額_本月數;金額_累計數,每月,政府資料開放授權條款-第1版,,2019/04/19 00:00,
101118,臺中市違章建築案件統計（108年03月份報表）,臺中市政府都市發展局‧秘書室第一股,公共資訊,臺中市違章建築案件統計（108年03月份報表）,"新違章建築,既存違章建築,拆除數",每月,政府資料開放授權條款-第1版,,2019/04/19 09:49,
101120,大肚台地產業與資源調查_農業,臺中市政府都市發展局‧秘書室第一股,生活安全及品質,大肚台地產業與資源調查_農業,"編號;區域,經度;緯度;發現作物;備註,照片1;照片2;照片3;照片4;照片5;照片6",即時,政府資料開放授權條款-第1版,,2019/04/19 11:23,
101129,臺中市違章建築拆除案件統計（108年2月份報表）,臺中市政府都市發展局‧秘書室第一股,公共資訊,臺中市違章建築拆除案件統計（108年2月份報表）,"新違章建築,既存違章建築,拆除數",每月,政府資料開放授權條款-第1版,,2019/04/19 16:16,
101139,臺北市士林、北投區已登記公私有土地筆數面積統計表,臺北市士林地政事務所,公共資訊,提供「士林、北投區已登記公私有土地筆數面積」，呈現使民眾了解本所管轄區公私有筆數、面積統計資料。,表報年度;公有;私有;公私共有別;已登記土地面積;已登記土地筆數。,每年,政府資料開放授權條款-第1版,,2014/01/07 00:00,
101135,臺北市大安區已登記公私有土地筆數面積統計表,臺北市大安地政事務所,公共資訊,臺北市大安區已登記公私有土地筆數面積統計表,面積，比數,每年,政府資料開放授權條款-第1版,,2014/01/09 00:00,
101148,臺北市-政府行政機關辦公日曆表,臺北市政府人事處,公共資訊,政府行政機關辦公日曆表,date;name;isHoliday;holidayCategory;description,每年,政府資料開放授權條款-第1版,,2012/12/21 00:00,
101134,臺北市老舊聚落分布圖,臺北市政府工務局大地工程處,公共資訊,臺北市24處山坡地老舊聚落所在位置,類別;編號,每年,政府資料開放授權條款-第1版,,2012/01/13 00:00,
101133,臺北市藍色公路碼頭,臺北市政府工務局水利工程處,休閒旅遊,"藍色公路碼頭位置,WGS84座標","Riverside_Park,Location,Latitude,Longitude,Photo",每年,政府資料開放授權條款-第1版,,2012/07/06 00:00,
101138,臺北市水利處雨量站,臺北市政府工務局水利工程處,公共資訊,雨量站位置,名稱;所屬單位;座標;行政區,每日,政府資料開放授權條款-第1版,,2012/01/04 00:00,
101136,臺北市消防分隊駐地位置圖,臺北市政府消防局,公共資訊,臺北市消防分隊駐地位置,分隊名稱;座標,每日,政府資料開放授權條款-第1版,,2018/06/12 00:00,
101132,臺北市空氣品質監測站基本資料,臺北市政府環境保護局,生活安全及品質,臺北市空氣品質監測站種類、分類、名稱、地址、監測項目等資訊,"測站種類;測站分類;測站名稱;測站地址;監測項目;經度;,緯度",每日,政府資料開放授權條款-第1版,,2013/05/06 00:00,
101151,臺北市核准身障福利團體設置舊衣回收箱,臺北市政府環境保護局,公共資訊,臺北市核准身障福利團體設置舊衣回收箱,"核准編號,團體名稱,電話,行政區,臺北市核准地點,備註,經度,緯度",每日,政府資料開放授權條款-第1版,,2019/04/12 00:00,
101131,臺北市北投垃圾焚化廠營運管理及環境品質監測報告,臺北市政府環境保護局北投垃圾焚化廠,公共資訊,本資料集涵蓋北投垃圾焚化廠（以下簡稱本廠）營運操作之處理物來源及產出物統計：如垃圾進廠量、焚化量、底渣及飛灰產生量，以及進出本廠之清運車輛、廚餘進廠量等統計數據。 另外亦針對本廠污染防制之作為如：廢氣、水污染、噪音、底渣灼燒減量、飛灰及底渣穩定化物重金屬及戴奧辛等項目，進行監控防制與相關數據統計報告。 本廠敦親睦鄰及回饋設施之使用人數亦一併收集於本資料集之中,內容摘要;焚化廠營運管理;污染防制及監測;敦親睦鄰與回饋設施及景觀維護;結論與建議及其他事項,每半年,政府資料開放授權條款-第1版,,2014/02/17 00:00,
101140,臺北市民眾繳納違反環保法令行政罰鍰之方式及其他相關注意事項,臺北市政府環境保護局環保稽查大隊,公共資訊,提供便民繳納環保罰鍰方式之管道、程序與注意事項說明,環保罰緩繳納方式;注意事項,每日,政府資料開放授權條款-第1版,,2014/02/14 00:00,
101137,臺北市-OK認證-製麵業,臺北市政府衛生局,公共資訊,臺北市製麵業,標題;OK認證類別;連絡電話;交通資訊;顯示用地址;系統辨識用地址,每日,政府資料開放授權條款-第1版,,2012/01/04 00:00,場地設施
101141,臺北市居家廢棄藥物檢收站,臺北市政府衛生局,公共資訊,居家廢棄藥物檢收站,"name;, address_for_diaplay;, address_for_system;telephone;",每日,政府資料開放授權條款-第1版,,2013/06/10 00:00,
101142,臺北市-OK認證-中央廚房,臺北市政府衛生局,公共資訊,臺北市中央廚房,標題;Ok認證類別;連絡電話;交通資訊;顯示用地址;系統辨識用地址,每日,政府資料開放授權條款-第1版,,2012/01/04 00:00,場地設施
101143,臺北市-OK認證-溫泉業,臺北市政府衛生局,公共資訊,臺北市溫泉業,標題;Ok認證類別;連絡電話;交通資訊;顯示用地址;系統辨識用地址,每日,政府資料開放授權條款-第1版,,2012/01/04 00:00,場地設施
101146,臺北市藥局,臺北市政府衛生局,公共資訊,全區藥局(含健康保險),健保特約註記;機構名稱;地址;電話,每月,政府資料開放授權條款-第1版,,2012/01/03 00:00,
101147,臺北市健康促進醫院,臺北市政府衛生局,公共資訊,臺北市健康促進醫院,"title;, address_for_display;, telephone",每日,政府資料開放授權條款-第1版,,2013/06/10 00:00,
101144,臺北市國民住宅配售(租)概況,臺北市政府都市發展局,公共資訊,臺北市國民住宅配售(租)概況,臺北市國民住宅配售;概況,每季,政府資料開放授權條款-第1版,,2014/06/06 00:00,
101145,廢巷及改道公告,臺北市政府都市發展局,公共資訊,廢巷及改道公告,廢巷及改道公告,每日,政府資料開放授權條款-第1版,,2014/06/06 00:00,
101149,免建築線指示地區公告,臺北市政府都市發展局,公共資訊,免建築線指示地區公告,免建築線指示地區公告,每日,政府資料開放授權條款-第1版,,2014/06/06 00:00,
101107,苗栗縣政府97年度總決算主要表.,苗栗縣政府主計處,公共資訊,苗栗縣政府97年度總決算主要表,,不更新,政府資料開放授權條款-第1版,,2019/04/19 00:00,
101108,苗栗縣政府98年度總決算主要表,苗栗縣政府主計處,公共資訊,苗栗縣政府98年度總決算主要表,,不更新,政府資料開放授權條款-第1版,,2019/04/19 00:00,
101109,苗栗縣政府99年度總決算主要表,苗栗縣政府主計處,公共資訊,苗栗縣政府99年度總決算主要表,,不更新,政府資料開放授權條款-第1版,,2019/04/19 00:00,
101111,苗栗縣政府100年度總決算主要表,苗栗縣政府主計處,公共資訊,苗栗縣政府100年度總決算主要表,,不更新,政府資料開放授權條款-第1版,,2019/04/19 00:00,
