資料集識別碼,資料集名稱,提供機關,服務分類,資料集描述,主要欄位說明,更新頻率,授權方式,相關網址,上架日期,備註
126771,中央警察大學學士班四年制歷年最低錄取分數,中央警察大學,公共資訊,中央警察大學學士班四年制歷年最低錄取分數,Year;Candidate;admission score,每年,政府資料開放授權條款-第1版,,2020/05/05 14:45,
126772,中央警察大學學士班四年制招生複試體檢結果統計,中央警察大學,公共資訊,中央警察大學學士班四年制招生複試體檢結果統計,Sort;Group_A_Male;Group_B_Male;Group_A_Female;Group_B_Female;Total,每年,政府資料開放授權條款-第1版,,2020/05/11 10:34,
126773,中央警察大學犯罪防治學系暨研究所學生總數,中央警察大學,公共資訊,中央警察大學犯罪防治學系暨研究所歷年各班學生總數,Class;Number_of_Students;Male;Female;Suspension,每年,政府資料開放授權條款-第1版,,2020/05/07 15:45,
126776,中央警察大學歷年汽機車安全駕駛訓練人數統計表,中央警察大學,公共資訊,中央警察大學歷年汽機車安全駕駛訓練人數統計表,Year;Scooter_safety_driving training;Automobile_safety_driving training;Advanced_automobile_safety driving_training;Scooter_safety_driving training_for_seeded_teachers,每年,政府資料開放授權條款-第1版,,2020/05/08 15:20,
126777,中央警察大學警政管理學院歷年各系所學生與老師比例,中央警察大學,公共資訊,中央警察大學警政管理學院歷年各系所學生與老師比例,Department;Year;number_of_teachers;number_of_students;student_teacher_ratio,每年,政府資料開放授權條款-第1版,,2020/05/13 16:49,
126778,中央警察大學校長信箱存查案件數統計,中央警察大學,公共資訊,中央警察大學校長信箱歷年存查案件數統計,Year_Month;Source_of_Complaints_and_Petitions;Amount;Numbers_of_reference;Reason_of_reference;Note,每年,政府資料開放授權條款-第1版,,2020/05/07 15:47,
126779,中央警察大學行政警察學系專任教師職位分布表,中央警察大學,公共資訊,中央警察大學行政警察學系歷年專任教師職位分布表,Position;Number of people,每年,政府資料開放授權條款-第1版,,2020/05/05 14:45,
126781,中央警察大學警學知識庫論文清單,中央警察大學,公共資訊,中央警察大學歷年警學知識庫論文清單,No;Article_Title;Author_TC;Author_EN;Journal_Title_TC;Journal_Title_EN;Volume_No;Issue_No;Total_period_No;Issue_Date;Language,每年,政府資料開放授權條款-第1版,,2020/05/13 08:38,
126782,中央警察大學刑事警察學系專任教師職位分布表,中央警察大學,公共資訊,中央警察大學刑事警察學系歷年專任教師職位分布表,Position;Number of people,每年,政府資料開放授權條款-第1版,,2020/05/05 15:17,
126784,中央警察大學行政管理學系教師人數統計表,中央警察大學,公共資訊,中央警察大學行政管理學系教師人數統計表,Position;Number of people,每年,政府資料開放授權條款-第1版,,2020/05/05 14:45,
126789,中央警察大學外事警察學系教師人數統計表,中央警察大學,公共資訊,中央警察大學外事警察學系歷年教師人數統計表,Position;Number_of_people,每年,政府資料開放授權條款-第1版,,2020/05/12 11:13,
126792,中央警察大學推廣教育訓練中心警職人員進修結訓人數一覽表,中央警察大學,公共資訊,中央警察大學推廣教育訓練中心歷年警職人員進修結訓人數一覽表,Year;Class;Number_of_Students;Training_period;受訓期程;Note,每年,政府資料開放授權條款-第1版,,2020/05/15 13:21,
126793,中央警察大學鑑識科學學系教師執行計畫數統計表,中央警察大學,公共資訊,中央警察大學鑑識科學學系歷年教師執行計畫數統計表,Number of teachers;Number of research project executions;Average number of research project executions,每年,政府資料開放授權條款-第1版,,2020/05/07 14:20,
126797,中央警察大學警察科技學院歷年各系所學生與老師比例,中央警察大學,公共資訊,中央警察大學警察科技學院歷年各系所學生與老師比例,Department;Year;number of teachers;number of students;student-teacher ratio,每年,政府資料開放授權條款-第1版,,2020/05/07 15:46,
126798,中央警察大學法律學系專任教師資訊,中央警察大學,公共資訊,中央警察大學歷年法律學系專任教師資訊,Name;Position;Specialty;Contact Number;Teacher Research Office;Email address,每年,政府資料開放授權條款-第1版,,2020/05/06 09:02,
126799,中央警察大學水上警察學系動力小船訓練參訓及通過人數統計表,中央警察大學,公共資訊,中央警察大學水上警察學系動力小船訓練參訓及通過人數統計表,Year;Class;Number_of_participants;Number_of_people_who_passed_the_test,每年,政府資料開放授權條款-第1版,,2020/05/19 10:50,
126800,中央警察大學鑑識科學研究委員會接受委託鑑定案件數統計,中央警察大學,公共資訊,中央警察大學鑑識科學研究委員會歷年接受委託鑑定案件數統計,Year;Category;Number_of_cases;,每年,政府資料開放授權條款-第1版,,2020/05/12 11:11,
126775,臺東機場入境人次預報,內政部移民署,休閒旅遊,臺東機場入境人次每小時更新近3小時出境人次,debarkationTime;inOutTransit;port;shipNo;previousPort;gender;nationality;age;countNum;idType;nextPort,每年,政府資料開放授權條款-第1版,,2020/05/19 10:37,文件說明: http://opendata.immigration.gov.tw/v2/api-docs
126780,嘉義機場出境人次預報,內政部移民署,休閒旅遊,嘉義機場出境人次每小時更新近3小時出境人次,debarkationTime;inOutTransit;port;shipNo;previousPort;gender;nationality;age;countNum;idType;nextPort,每年,政府資料開放授權條款-第1版,,2020/05/19 10:38,文件說明: http://opendata.immigration.gov.tw/v2/api-docs
126783,澎湖馬公機場入境人次預報,內政部移民署,休閒旅遊,澎湖馬公機場入境人次每小時更新近3小時出境人次,debarkationTime;inOutTransit;port;shipNo;previousPort;gender;nationality;age;countNum;idType;nextPort,每年,政府資料開放授權條款-第1版,,2020/05/19 10:38,文件說明: http://opendata.immigration.gov.tw/v2/api-docs
126788,花蓮機場入境人次預報,內政部移民署,休閒旅遊,花蓮機場入境人次每小時更新近3小時出境人次,debarkationTime;inOutTransit;port;shipNo;previousPort;gender;nationality;age;countNum;idType;nextPort,每年,政府資料開放授權條款-第1版,,2020/05/19 10:39,文件說明: http://opendata.immigration.gov.tw/v2/api-docs
126790,花蓮機場出境人次預報,內政部移民署,休閒旅遊,花蓮機場出境人次每小時更新近3小時出境人次,debarkationTime;inOutTransit;port;shipNo;previousPort;gender;nationality;age;countNum;idType;nextPort,每年,政府資料開放授權條款-第1版,,2020/05/19 10:39,文件說明: http://opendata.immigration.gov.tw/v2/api-docs
126795,臺南機場入境人次預報,內政部移民署,休閒旅遊,臺南機場入境人次每小時更新近3小時出境人次,debarkationTime;inOutTransit;port;shipNo;previousPort;gender;nationality;age;countNum;idType;nextPort,每年,政府資料開放授權條款-第1版,,2020/05/19 10:39,文件說明: http://opendata.immigration.gov.tw/v2/api-docs
126796,臺南機場出境人次預報,內政部移民署,休閒旅遊,臺南機場出境人次每小時更新近3小時出境人次,debarkationTime;inOutTransit;port;shipNo;previousPort;gender;nationality;age;countNum;idType;nextPort,每年,政府資料開放授權條款-第1版,,2020/05/19 10:39,文件說明: http://opendata.immigration.gov.tw/v2/api-docs
126802,澎湖馬公機場出境人次預報,內政部移民署,休閒旅遊,澎湖馬公機場出境人次每小時更新近3小時出境人次,debarkationTime;inOutTransit;port;shipNo;previousPort;gender;nationality;age;countNum;idType;nextPort,每年,政府資料開放授權條款-第1版,,2020/05/19 10:38,文件說明: http://opendata.immigration.gov.tw/v2/api-docs
126803,臺東機場出境人次預報,內政部移民署,休閒旅遊,臺東機場出境人次每小時更新近3小時出境人次,debarkationTime;inOutTransit;port;shipNo;previousPort;gender;nationality;age;countNum;idType;nextPort,每年,政府資料開放授權條款-第1版,,2020/05/19 10:35,文件說明: http://opendata.immigration.gov.tw/v2/api-docs
126785,南投縣醫事機構辦理巷弄長照站單位,南投縣政府,生育保健,巷弄長照站 服務對象: 1.全台老人年口，以衰弱及輕、中度失能或失智老人為優先，社區健康及亞健康老人亦可一起參與，無須經過照管中心評估。 2.經照管中心評估失能且符合喘息服務使用資格者，可至本縣特約服務提供單位之C級巷弄長照站使用臨托服務。 服務項目: 1.社會參與。 2.健康促進。 3.共餐服務。 4.結合預防及延緩失能服務方案。 5.電話問安或關懷訪視服務。 6.具服務量能單位，提供喘息服務(臨時托顧)。,編號;單位名稱;服務區域;村里別;活動地址;聯絡人;電話;喘息服務,每日,政府資料開放授權條款-第1版,,2020/06/05 00:00,
126786,長照出院準備服務暨復能多元服務試辦計畫,南投縣政府,生育保健,服務介紹 藉由長期照顧管理中心連結醫院出院準備服務的專業醫療團隊共同評估病人身體、經濟、心理或情緒上的照護需求，如有長照需求的服務對象，出院前即完成評估並取得長照服務，協助民眾及時獲得所需服務資源，使病人及其家屬取得完整性及持續性的長照服務。 轄內醫院出院準備小組須於個案出院至少3天前完成初次評估，其中核定照顧服務項目須至少包含居家服務、居家護理、居家復健、喘息及簡易生活輔具等五項長照服務其中之三項，針對有復能潛能之個案，由專業團隊與個案、照顧者共同擬訂復能目標及計畫，照管中心應於個案出院1個月內或第4個月內(復能多元個案)完成複評，期個案出院後可盡速得到長照服務協助，增進返家後照顧品質。 服務內容 出院衛教：教導家屬相關照顧知識及技巧。 居家護理：提供居家照顧患者管路更換、衛生教育、指導傷口換藥等。 病患需要轉介合適之居家護理機構，進一步提供持續性照護。 器材租借：提供病患返家後所需的器材租借資訊或協助租借。 相關資源諮詢：提供社會福利，後送機構和社區資源之諮詢及轉介。,醫院名稱;聯繫窗口;電話,每日,政府資料開放授權條款-第1版,,2020/06/05 00:00,
126787,南投縣109年-110年預防接種合約院所,南投縣政府,就醫,南投縣109年-110年預防接種合約院所,單位十碼章;醫療院所名稱;縣市別;行政區;郵遞區號;地址;連絡電話;座標緯度;座標經度,每日,政府資料開放授權條款-第1版,,2020/06/05 00:00,
126814,109年度「潛伏結核感染治療指定醫院」暨合作醫師,南投縣政府,生育保健,109年度「潛伏結核感染治療指定醫院」暨合作醫師,縣市;醫療機構名稱;醫療機構代碼;醫師姓名;專科別;門診時間;GRA服務;IGRA服務;3HP處方;地址;聯絡電話,每日,政府資料開放授權條款-第1版,,2020/06/05 00:00,
126753,國史館臺灣文獻館109年度5月份會計月報,國史館臺灣文獻館,公共資訊,國史館臺灣文獻館109年度5月份會計月報資料,會計年度;月份;款;項;目;節;預算年度;預算科目編號;預算科目名稱;細目編號;細目名稱;原預算數;追加減數;截至本月止累計分配數_1;本月實現數;截至本月止累計實現數_2;應收收入數_3;分配數預算餘額_4;分支計畫編號;分支計畫名稱;用途別編號;用途別名稱;第一預備金;第二預備金;經費流用數;預算調整數;應付數;已分配尚未執行數;備註_預暫付數;業務計畫或工作計畫;經資門;執行數;會計分類;項目;收入實現數;減項_收入待納庫數;加項_以前年度待納庫繳庫數;加項_以前年度撥款於本年度繳還數_材料;加項_以前年度撥款於本年度繳還數_存出保證金;加項_以前年度撥款於本年度繳還數_其他應收款;加項_預收款;加項_剔除經費;繳付公庫數;一級用途別編號;一級用途別名稱;支出實現數;加項_預付款;加項_材料;加項_存出保證金;加項_零用金;加項_退還收入預收款;加項_其他應收款;減項_以前年度撥款於本年度實現數;公庫撥入數;公庫分配數餘額;基金別;使用機關別;科目分類;會計科目編號;會計科目名稱;金額;金額_本月數;金額_累計數;科目名稱;取得成本;以前年度累計折舊_長期投資評價;本年度資本資產成本變動_增加數;本年度資本資產成本變動_減少數;本年度累計折舊_長期投資評價變動數;期末帳面金額;備註;預算項目;預算執行數;調整數;會計收支;會計科目,每月,政府資料開放授權條款-第1版,,2020/06/05 00:00,
126754,108年預算、決算及會計報告,國立歷史博物館,公共資訊,108年預算、決算及會計報告,Id;UnitId;ImageName;BaseCategoryName;PublishTime;Subject;Content;FileName;Url;PageUrl;Mutilimage;Mutilattach,每周,政府資料開放授權條款-第1版,,2020/06/06 00:00,
126766,東美館政策宣導廣告相關執行情形,國立臺東生活美學館,公共資訊,東美館政策宣導廣告相關執行情形,Id;UnitId;ImageName;BaseCategoryName;PublishTime;Subject;Content;FileName;Url;PageUrl;Mutilimage;Mutilattach,每半年,政府資料開放授權條款-第1版,https://opendata.culture.tw/,2020/06/06 00:00,
126774,姓氏排名與人數按三階段年齡分,戶政司,公共資訊,全國姓氏排名及按0~14歲、15~64歲、65歲以上年齡組分。,statistic_yyy;ranking;lastname;age;population,每5年,政府資料開放授權條款-第1版,,2020/05/29 08:16,依全國姓名統計分析出版時間更新資料。
126794,臺灣宗教文化資產嘉義縣點位資訊,民政司,公共資訊,臺灣宗教文化資產嘉義縣點位資訊,中文名稱;縣市;鄉鎮市區;完整地址;位置緯度;位置經度,每10年,政府資料開放授權條款-第1版,https://www.taiwangods.com/;https://www.taiwangods.com/,2020/04/28 09:42,https://www.taiwangods.com/API/v2/Chiayi
126770,臺南市政府所屬機關單位主管法規數量統計,法制處,公共資訊,臺南市政府所屬機關單位主管法規數量統計,單位;自治條例;自治規則;行政規則;總計,每月,政府資料開放授權條款-第1版,https://data.tainan.gov.tw/dataset/109-6,2020/06/05 03:36,
126756,礦務局_歷年大理石(供交水泥)生產及銷售數量表,經濟部礦務局,公共資訊,礦務局_歷年大理石(供交水泥)生產及銷售數量表,年度;預估產量(萬公噸);產量(萬公噸),每年,政府資料開放授權條款-第1版,,2020/06/05 00:00,
126769,臺中市地標_WGS84,臺中市政府研究發展考核委員會,公共資訊,"以107年地標資料為基礎,再擇使用率高者更新為108年度成果",X坐標;Y坐標;地標大分類;地標小分類;地標名稱;地標別名;備註,每年,政府資料開放授權條款-第1版,,2020/06/05 01:12,臺中市政府OAS標準之API說明文件:https://datacenter.taichung.gov.tw/swagger/yaml/387220000A ，Swagger 產生API說明頁面網址。https://datacenter.taichung.gov.tw/swagger/api-docs/
126760,臺南市電子遊戲場業清冊,臺南市政府經濟發展局,公共資訊,本資料集提供電子遊戲場業者資料。,商業/公司名稱;統一編號;營業地址,每月,政府資料開放授權條款-第1版,https://data.tainan.gov.tw/dataset/data3,2020/06/04 09:30,
126761,臺南市商業、公司、工廠異動表,臺南市政府經濟發展局,公共資訊,本資料集提供商業、公司、工廠數據資料。,行業別;上月底家數;本月異動家數_新登記;本月異動家數_歇業;本月異動家數_異動調整;本月底家數;上月底資本額_仟元;本月異動_新設立家數;本月異動_新設立資本額_仟元;本月異動_解散撤銷及廢止家數;本月異動_解散撤銷及廢止資本額_仟元;本月異動_增資家數;本月異動_增資資本額_仟元;本月異動_減資家數;本月異動_減資資本額_仟元;本月異動_遷入家數;本月異動_遷入資本額_仟元;本月異動_遷出家數;本月異動_遷出資本額_仟元;本月異動_行業變動家數;本月異動_行業變動資本額_仟元;本月異動_異動調整家數;本月異動_異動調整資本額_仟元;本月底資本額_仟元;上月底_現有家數;本月異動家數_新設立;本月異動家數_增資_仟元;本月異動家數_減資_仟元 ;本月異動家數_遷入;本月異動家數_遷出;本月異動家數_行業變動;本月底_現有家數;上月底_資本總額_仟元;本月異動資本額_新設立_仟元;本月異動資本額_增資_仟元;本月異動資本額_減資_仟元;本月異動資本額_歇業_仟元;本月異動資本額_遷入_仟元;本月異動資本額_遷出_仟元;本月異動資本額_行業變動_仟元;本月異動資本額_異動調整_仟元;本月底_資本總額_仟元,每月,政府資料開放授權條款-第1版,https://data.tainan.gov.tw/dataset/data6;https://data.tainan.gov.tw/dataset/data6;https://data.tainan.gov.tw/dataset/data6,2020/06/04 09:30,公司登記異動表為宏碁公司每月10日產製
126762,臺南市自來水承裝商業者名單,臺南市政府經濟發展局,公共資訊,本資料集提供自來水承裝商業者資料。,承裝商名稱;等級;營業地址,每月,政府資料開放授權條款-第1版,https://data.tainan.gov.tw/dataset/data4,2020/06/04 09:30,
126763,臺南市特定工廠登記清冊,臺南市政府經濟發展局,公共資訊,本資料集提供特定工廠登記資料。,工廠名稱;廠址;統一編號;產業類別,每月,政府資料開放授權條款-第1版,https://data.tainan.gov.tw/dataset/data5,2020/06/04 09:30,
126764,臺南市資訊休閒業清冊,臺南市政府經濟發展局,公共資訊,本資料集資訊休閒業者資料。,商業/公司名稱;統一編號;營業地址,每月,政府資料開放授權條款-第1版,https://data.tainan.gov.tw/dataset/data2,2020/06/04 08:38,
126765,臺南市公司登記清冊,臺南市政府經濟發展局,公共資訊,本資料集公司登記每月異動資料。,統一編號;公司名稱;公司地址;核准設立日期;核准解散日期;核准變更日期,每月,政府資料開放授權條款-第1版,https://data.tainan.gov.tw/dataset/data1;https://data.tainan.gov.tw/dataset/data1;https://data.tainan.gov.tw/dataset/data1,2020/06/04 08:30,
126751,臺灣嘉義地方法院 109年5月份會計月報,臺灣嘉義地方法院,公共資訊,臺灣嘉義地方法院 109年5月份會計月報,會計年度;月份;款;項;目;節;預算年度;預算科目編號;預算科目名稱;細目編號;細目名稱;原預算數;追加減數;截至本月止累計分配數_1;本月實現數;截至本月止累計實現數_2;應收收入數_3;分配數預算餘額_4;分支計畫編號;分支計畫名稱;用途別編號;用途別名稱;第一預備金;第二預備金;經費流用數;預算調整數;應付數;已分配尚未執行數;備註_預暫付數;以前年度轉入數;應收數;保留數;減免;截至本月止累計實現數;調整數;尚未執行數;業務計畫或工作計畫;經資門;執行數;會計分類;項目;收入實現數;減項_收入待納庫數;加項_以前年度待納庫繳庫數;加項_以前年度撥款於本年度繳還數_材料;加項_以前年度撥款於本年度繳還數_存出保證金;加項_以前年度撥款於本年度繳還數_其他應收款;加項_預收款;加項_剔除經費;繳付公庫數;一級用途別編號;一級用途別名稱;支出實現數;加項_預付款;加項_材料;加項_存出保證金;加項_零用金;加項_退還收入預收款;加項_其他應收款;減項_以前年度撥款於本年度實現數;公庫撥入數;公庫分配數餘額;基金別;使用機關別;科目分類;會計科目編號;會計科目名稱;金額;金額_本月數;金額_累計數;科目名稱;取得成本;以前年度累計折舊_長期投資評價;本年度資本資產成本變動_增加數;本年度資本資產成本變動_減少數;本年度累計折舊_長期投資評價變動數;期末帳面金額;備註;預算項目;預算執行數;會計收支;會計科目,不更新,政府資料開放授權條款-第1版,,2020/06/05 00:00,
126767,中央政府嚴重特殊傳染性肺炎防治及紓困振興特別預算執行狀況月報表及會計月報,財政部會計處,公共資訊,中央政府嚴重特殊傳染性肺炎防治及紓困振興特別預算執行狀況月報表及會計月報,會計年度;月份;款;項;目;節;預算年度;預算科目編號;預算科目名稱;分支計畫編號;分支計畫名稱;用途別編號;用途別名稱;原預算數;追加減數;第一預備金;第二預備金;經費流用數;預算調整數;截至本月止累計分配數_1;本月實現數;截至本月止累計實現數_2;應付數;已分配尚未執行數;備註_預暫付數;會計分類;項目;一級用途別編號;一級用途別名稱;經資門;支出實現數;加項_預付款;加項_材料;加項_存出保證金;加項_零用金;加項_退還收入預收款;加項_其他應收款;減項_以前年度撥款於本年度實現數;公庫撥入數;公庫分配數餘額;基金別;使用機關別;科目分類;會計科目編號;會計科目名稱;金額;金額_本月數;金額_累計數;預算項目;預算執行數;調整數;會計收支;會計科目,每月,政府資料開放授權條款-第1版,,2020/06/05 00:00,
