資料集識別碼,資料集名稱,提供機關,服務分類,資料集描述,主要欄位說明,更新頻率,授權方式,相關網址,上架日期,備註
119241,國家教育研究院109年02月會計月報,國家教育研究院,公共資訊,會計月報_歲入累計表 會計月報_經費累計表 會計月報_以前年度歲入轉入數累計表 會計月報_以前年度歲出轉入數累計表 繳付公庫數分析表 歲出用途別累計表 平衡表 收入支出表 長期投資、固定資產、遞耗資產及無形資產變動表 公庫撥入數分析表,,每月,政府資料開放授權條款-第1版,http://www.naer.edu.tw/ezfiles/0/1000/img/37/10902.7z,2020/03/17 00:00,
119240,國家發展委員會資料開放行動方案,國家發展委員會,公共資訊,行政院於108年6月6日函頒「智慧政府行動方案」，各部會應據以提出「資料開放行動方案」，提供民眾「機器可讀、結構化、開放格式且符合領域資料標準」之資料，爰訂定本行動方案，期達成政府開放資料透明，極大化加值應用。,項次;版本日期;訂定/修訂;說明;檔案下載連結_PDF;檔案下載連結_DOCX;檔案下載連結_ODT,每季,政府資料開放授權條款-第1版,https://www.ndc.gov.tw/News_Content.aspx?n=9D32B61B1E56E558&sms=9D3CAFD318C60877&s=B7F9DF5B7C347667,2020/03/17 00:00,
119239,新竹縣受理國家賠償件數及處理結果(108年1月至12月),新竹縣政府,公共資訊,新竹縣受理國家賠償件數及處理結果(108年1月至12月),新收案件件數;拒絕賠償件數;已結案件件數;未結案件件數;賠償總金額;協議成立賠償件數;協議成立賠償金額;訴訟件數;判決確定賠償件數;判決確定賠償金額;依第2條賠償件數;依第3條賠償件數;行使求償權總件數;獲償總件數;獲償總金額;行政懲處戒件數;行政懲處戒人數,每半年,政府資料開放授權條款-第1版,,2020/01/17 00:00,
114782,矯正署臺中看守所109年會計報告(按月),法務部矯正署,公共資訊,矯正署臺中看守所108年會計報告(按月),,即時,政府資料開放授權條款-第1版,https://www.tcd.moj.gov.tw/media/20264529/109年1月份會計報告-xml.7z?mediaDL=true;https://www.tcd.moj.gov.tw/media/20264529/109年1月份會計報告-xml.7z?mediaDL=true,2020/03/17 00:00,
119225,矯正署宜蘭監獄109年度會計月報(按月),法務部矯正署宜蘭監獄,公共資訊,矯正署宜蘭監獄109年度會計月報(按月),會計年度;月份;款;項;目;節;預算年度;預算科目編號;預算科目名稱;細目編號;細目名稱;原預算數;追加減數;截至本月止累計分配數_1;本月實現數;截至本月止累計實現數_2;應收收入數_3;分配數預算餘額_4;分支計畫編號;分支計畫名稱;用途別編號;用途別名稱;第一預備金;第二預備金;經費流用數;預算調整數;應付數;已分配尚未執行數;備註_預暫付數;以前年度轉入數;保留數;減免;截至本月止累計實現數;調整數;尚未執行數;基金別;會計分類;使用機關別;科目分類;會計科目編號;會計科目名稱;金額;科目名稱;取得成本;以前年度累計折舊_長期投資評價;本年度資本資產成本變動_增加數;本年度資本資產成本變動_減少數;本年度累計折舊_長期投資評價變動數;期末帳面金額;備註;業務計畫或工作計畫;經資門;執行數;項目;收入實現數;減項_收入待納庫數;加項_以前年度待納庫繳庫數;加項_以前年度撥款於本年度繳還數_材料;加項_以前年度撥款於本年度繳還數_存出保證金;加項_以前年度撥款於本年度繳還數_其他應收款;加項_預收款;加項_剔除經費;繳付公庫數;一級用途別編號;一級用途別名稱;支出實現數;加項_預付款;加項_材料;加項_存出保證金;加項_零用金;加項_退還收入預收款;加項_其他應收款;減項_以前年度撥款於本年度實現數;公庫撥入數;公庫分配數餘額;金額_本月數;金額_累計數,每月,政府資料開放授權條款-第1版,,2020/03/17 00:00,
119227,矯正署宜蘭少年觀護所109年度會計月報(按月),法務部矯正署宜蘭監獄,公共資訊,矯正署宜蘭少年觀護所109年度會計月報(按月),會計年度;月份;款;項;目;節;預算年度;預算科目編號;預算科目名稱;分支計畫編號;分支計畫名稱;用途別編號;用途別名稱;原預算數;追加減數;第一預備金;第二預備金;經費流用數;預算調整數;截至本月止累計分配數_1;本月實現數;截至本月止累計實現數_2;應付數;已分配尚未執行數;備註_預暫付數;細目編號;細目名稱;以前年度轉入數;應收數;保留數;減免;截至本月止累計實現數;調整數;尚未執行數;基金別;會計分類;使用機關別;科目分類;會計科目編號;會計科目名稱;金額;科目名稱;取得成本;以前年度累計折舊_長期投資評價;本年度資本資產成本變動_增加數;本年度資本資產成本變動_減少數;本年度累計折舊_長期投資評價變動數;期末帳面金額;備註;業務計畫或工作計畫;經資門;執行數;項目;一級用途別編號;一級用途別名稱;支出實現數;加項_預付款;加項_材料;加項_存出保證金;加項_零用金;加項_退還收入預收款;加項_其他應收款;減項_以前年度撥款於本年度實現數;公庫撥入數;公庫分配數餘額;金額_本月數;金額_累計數,每月,政府資料開放授權條款-第1版,,2020/03/17 00:00,
119228,矯正署宜蘭看守所109年度會計月報(按月),法務部矯正署宜蘭監獄,公共資訊,矯正署宜蘭看守所109年度會計月報(按月),會計年度;月份;款;項;目;節;預算年度;預算科目編號;預算科目名稱;細目編號;細目名稱;原預算數;追加減數;截至本月止累計分配數_1;本月實現數;截至本月止累計實現數_2;應收收入數_3;分配數預算餘額_4;分支計畫編號;分支計畫名稱;用途別編號;用途別名稱;第一預備金;第二預備金;經費流用數;預算調整數;應付數;已分配尚未執行數;備註_預暫付數;以前年度轉入數;應收數;保留數;減免;截至本月止累計實現數;調整數;尚未執行數;基金別;會計分類;使用機關別;科目分類;會計科目編號;會計科目名稱;金額;科目名稱;取得成本;以前年度累計折舊_長期投資評價;本年度資本資產成本變動_增加數;本年度資本資產成本變動_減少數;本年度累計折舊_長期投資評價變動數;期末帳面金額;備註;業務計畫或工作計畫;經資門;執行數;項目;收入實現數;減項_收入待納庫數;加項_以前年度待納庫繳庫數;加項_以前年度撥款於本年度繳還數_材料;加項_以前年度撥款於本年度繳還數_存出保證金;加項_以前年度撥款於本年度繳還數_其他應收款;加項_預收款;加項_剔除經費;繳付公庫數;一級用途別編號;一級用途別名稱;支出實現數;加項_預付款;加項_材料;加項_存出保證金;加項_零用金;加項_退還收入預收款;加項_其他應收款;減項_以前年度撥款於本年度實現數;公庫撥入數;公庫分配數餘額;金額_本月數;金額_累計數,每月,政府資料開放授權條款-第1版,,2020/03/17 00:00,
119273,臺北捷運車站無障礙設施異常公告,臺北大眾捷運股份有限公司,交通及通訊,捷運車站無障礙設施異常公告,無障礙設施,每日,政府資料開放授權條款-第1版,無,2020/03/17 21:45,
116077,臺灣臺中地方檢察署109年度會計報告,臺灣臺中地方檢察署,公共資訊,臺灣臺中地方檢察署109年度會計報告,會計年度;月份;款;項;目;節;預算年度;預算科目編號;預算科目名稱;細目編號;細目名稱;原預算數;追加減數;截至本月止累計分配數_1;本月實現數;截至本月止累計實現數_2;應收收入數_3;分配數預算餘額_4;分支計畫編號;分支計畫名稱;用途別編號;用途別名稱;第一預備金;第二預備金;經費流用數;預算調整數;應付數;已分配尚未執行數;備註_預暫付數;以前年度轉入數;應收數;保留數;減免;截至本月止累計實現數;調整數;尚未執行數;基金別;會計分類;使用機關別;科目分類;會計科目編號;會計科目名稱;金額;科目名稱;取得成本;以前年度累計折舊_長期投資評價;本年度資本資產成本變動_增加數;本年度資本資產成本變動_減少數;本年度累計折舊_長期投資評價變動數;期末帳面金額;備註;業務計畫或工作計畫;經資門;執行數;項目;收入實現數;減項_收入待納庫數;加項_以前年度待納庫繳庫數;加項_以前年度撥款於本年度繳還數_材料;加項_以前年度撥款於本年度繳還數_存出保證金;加項_以前年度撥款於本年度繳還數_其他應收款;加項_預收款;加項_剔除經費;繳付公庫數;一級用途別編號;一級用途別名稱;支出實現數;加項_預付款;加項_材料;加項_存出保證金;加項_零用金;加項_退還收入預收款;加項_其他應收款;減項_以前年度撥款於本年度實現數;公庫撥入數;公庫分配數餘額;金額_本月數;金額_累計數,每月,政府資料開放授權條款-第1版,,2020/03/18 00:00,
119229,103年度行政院原子能委員會輻射偵測中心決算書表,行政院原子能委員會輻射偵測中心,公共資訊,103年度行政院原子能委員會輻射偵測中心決算書表,輻射偵測中心決算書表;下載位置,不更新,政府資料開放授權條款-第1版,,2020/03/17 00:00,
119233,全國環境輻射偵測即時資訊,行政院原子能委員會輻射偵測中心,公共資訊,提供全國57個輻射監測站之即時監測值,監測站;監測站(英文);監測值(微西弗/時);時間;GPS經度;GPS緯度,即時,政府資料開放授權條款-第1版,,2020/03/17 00:00,
119236,行政院原子能委員會輻射偵測中心規費收費標準,行政院原子能委員會輻射偵測中心,公共資訊,行政院原子能委員會輻射偵測中心規費收費標準,編號;收費事項;收費基準;新臺幣元,不更新,政府資料開放授權條款-第1版,,2020/03/17 00:00,
119245,行政院原子能委員會輻射偵測中心104 年度決算書表,行政院原子能委員會輻射偵測中心,公共資訊,行政院原子能委員會輻射偵測中心104 年度決算書表,輻射偵測中心決算書表;下載位置,不更新,政府資料開放授權條款-第1版,,2020/03/17 00:00,
119249,行政院原子能委員會輻射偵測中心104年會計月報,行政院原子能委員會輻射偵測中心,公共資訊,行政院原子能委員會輻射偵測中心104年會計月報,輻射偵測中心會計月報;下載位置,不更新,政府資料開放授權條款-第1版,,2020/03/17 00:00,
119251,行政院原子能委員會輻射偵測中心105年度會計月報,行政院原子能委員會輻射偵測中心,公共資訊,行政院原子能委員會輻射偵測中心105年度會計月報,輻射偵測中心會計月報;下載位置,不更新,政府資料開放授權條款-第1版,,2020/03/17 00:00,
119253,104年度行政院原子能委員會輻射偵測中心法定預算書表,行政院原子能委員會輻射偵測中心,公共資訊,104年度行政院原子能委員會輻射偵測中心法定預算書表,輻射偵測中心預算書表;下載位置,不更新,政府資料開放授權條款-第1版,,2020/03/17 00:00,
119255,104年度行政院原子能委員會輻射偵測中心預算案書表,行政院原子能委員會輻射偵測中心,公共資訊,104年度行政院原子能委員會輻射偵測中心預算案書表,輻射偵測中心預算案書表;下載位置,不更新,政府資料開放授權條款-第1版,,2020/03/17 00:00,
119258,行政院原子能委員會輻射偵測中心105年度法定預算書表,行政院原子能委員會輻射偵測中心,公共資訊,行政院原子能委員會輻射偵測中心105年度法定預算書表,輻射偵測中心預算書表;下載位置,,政府資料開放授權條款-第1版,,2020/03/17 00:00,
119260,行政院原子能委員會輻射偵測中心105年度預算案書表,行政院原子能委員會輻射偵測中心,公共資訊,行政院原子能委員會輻射偵測中心105年度預算案書表,輻射偵測中心預算案書表;下載位置,不更新,政府資料開放授權條款-第1版,,2020/03/17 00:00,
119262,行政院原子能委員會輻射偵測中心106年度預算案書表,行政院原子能委員會輻射偵測中心,公共資訊,行政院原子能委員會輻射偵測中心106年度預算案書表,,不更新,政府資料開放授權條款-第1版,,2020/03/17 00:00,
119234,行政院農業委員會畜產試驗所會計報告,行政院農業委員會,公共資訊,行政院農業委員會畜產試驗所會計報告下載網址,檔案名稱;下載連結,每月,政府資料開放授權條款-第1版,https://www.tlri.gov.tw/modules/download.aspx?path=132&amp;c=ac2ff787-0bed-406f-9a26-f51065c2eedf;https://www.tlri.gov.tw/modules/download.aspx?path=132&amp;c=ac2ff787-0bed-406f-9a26-f51065c2eedf;https://www.tlri.gov.tw/modules/download.aspx?path=132&amp;c=ac2ff787-0bed-406f-9a26-f51065c2eedf,2020/03/17 00:00,
119247,行政院農業委員會林業試驗所單位決算,行政院農業委員會,公共資訊,單位決算歲入來源別決算表、歲出政事別決算表、歲出機關別決算表、以前年度歲出政事別轉入數決算表、以前年度歲出機關別轉入數決算表、歲入類平衡表、經費類平衡表等表。,檔案名稱;下載連結,每年,政府資料開放授權條款-第1版,https://www.tfri.gov.tw/main/news.aspx?siteid=&amp;ver=&amp;usid=&amp;mnuid=5362&amp;modid=526&amp;mode=&amp;cid=87&amp;noframe=#page_con;https://www.tfri.gov.tw/main/news.aspx?siteid=&amp;ver=&amp;usid=&amp;mnuid=5362&amp;modid=526&amp;mode=&amp;cid=87&amp;noframe=#page_con,2020/03/05 00:00,
