資料集識別碼,資料集名稱,提供機關,服務分類,資料集描述,主要欄位說明,更新頻率,授權方式,相關網址,上架日期,備註
117947,臺灣苗栗地方法院-108年度單位決算,臺灣苗栗地方法院,公共資訊,臺灣苗栗地方法院-108年度單位決算,會計年度;款;項;目;節;預算科目編號;預算科目名稱;細目編號;細目名稱;預算數_原預算數;預算數_預算增減數;預算數_合計1;決算數_實現數;決算數_應收數;決算數_保留數;決算數_合計2;預決算比較增減數;決算數占預算數之比率;分計畫編號;分計畫名稱;用途別編號;用途別名稱;原預算數;預算追加減數;動支第一預備金數;動支第二預備金數;經費流用數;預算調整數;預算增減數小計;預算數合計1;實現數;應付數;保留數;決算數合計2;預算年度;以前年度轉入數_應收數;以前年度轉入數_保留數;本年度減免註銷數_應收數;本年度減免註銷數_保留數;本年度實現數_應收數;本年度實現數_保留數;本年度調整數_應收數;本年度調整數_保留數;本年度未結清數_應收數;本年度未結清數_保留數;月份;基金別;會計分類;使用機關別;科目分類;會計科目編號;會計科目名稱;本年度金額;上年度金額,每年,政府資料開放授權條款-第1版,,2020/02/21 00:00,
117976,臺灣雲林地方法院108年度單位決算,臺灣雲林地方法院,公共資訊,臺灣雲林地方法院108年度單位決算,,不更新,政府資料開放授權條款-第1版,,2020/02/21 00:00,
117923,健康醫院認證名單,衛生福利部國民健康署,就醫,106-108年度通過健康醫院認證名單(含縣市、醫院名稱、效期),縣市別;醫事機構名稱;健康醫院認證效期,每年,政府資料開放授權條款-第1版,,2020/02/20 00:00,
117945,國民健康署公務會計月報(109年),衛生福利部國民健康署,公共資訊,國民健康署公務會計月報,會計年度;月份;款;項;目;節;預算年度;預算科目編號;預算科目名稱;細目編號;細目名稱;原預算數;追加減數;截至本月止累計分配數_1;本月實現數;截至本月止累計實現數_2;應收收入數_3;分配數預算餘額_4;分支計畫編號;分支計畫名稱;用途別編號;用途別名稱;第一預備金;第二預備金;經費流用數;預算調整數;應付數;已分配尚未執行數;備註_預暫付數;以前年度轉入數;應收數;保留數;減免;截至本月止累計實現數;調整數;尚未執行數;基金別;會計分類;使用機關別;科目分類;會計科目編號;會計科目名稱;金額;業務計畫或工作計畫;經資門;執行數;項目;收入實現數;減項_收入待納庫數;加項_以前年度待納庫繳庫數;加項_以前年度撥款於本年度繳還數_材料;加項_以前年度撥款於本年度繳還數_存出保證金;加項_以前年度撥款於本年度繳還數_其他應收款;加項_預收款;加項_剔除經費;繳付公庫數;一級用途別編號;一級用途別名稱;支出實現數;加項_預付款;加項_材料;加項_存出保證金;加項_零用金;加項_退還收入預收款;加項_其他應收款;減項_以前年度撥款於本年度實現數;公庫撥入數;公庫分配數餘額;金額_本月數;金額_累計數,每月,政府資料開放授權條款-第1版,,2020/02/21 00:00,
117957,衛生福利部社會及家庭署社會福利基金109年度1月會計月報,衛生福利部社會及家庭署,生活安全及品質,基金來源、用途及餘絀表、平衡表 、主要業務計畫執行明細表以及資本資產及長期負債增減情形表等,SEQNO;LEVEL;BOLD;項目;本年度法定預算數;本月份實際數;本月份預算數;本月份比較增減-金額;本月份比較增減-百分比;本年度截至本月份實際數;本年度截至本月份預算數;本年度截至本月份比較增減-金額;本年度截至本月份比較增減-百分比;業務計畫項目;單位;本月數量-實際數;本月數量-預算數;本月數量-占預算數-百分比;本月執行數-實際數;本月執行數-預算數;本月執行數-比較增減;本月執行數-百分比;累計數量-實際數;累計數量-預算數;累計數量-占預算數-百分比;累計執行數-實際數;累計執行數-預算數;累計執行數-比較增減;累計執行數-百分比;取得成本;以前年度累計折舊耗or長期投資評價;本年度成本變動-增加數;本年度成本變動-減少數;本年度累計折舊耗or長期投資評價變動數;期末帳面餘額;計畫名稱;以前年度保留數;本年度奉准先行辦理數;調整數;合計;累計預算分配數;實支數;應付未付數;累計執行數-合計;比較增減;比較增減-百分比;差異或落後原因;改進措施;科目;金額;百分比;本月數;累計數;科目名稱;法定預算數;本年度截至本月份累計-實際數;本年度截至本月份累計-預算數,每月,政府資料開放授權條款-第1版,https://www.sfaa.gov.tw/SFAA/Pages/ashx/File.ashx?FilePath=~/File/Attach/9488/File_179012.zip,2020/02/21 00:00,
117964,衛生福利部社會及家庭署社會福利基金108年度決算(自編版),衛生福利部社會及家庭署,生活安全及品質,基金來源、用途及餘絀決算表、現金流量決算表、平衡表等報表等,SEQNO;LEVEL;BOLD;項目;本年度預算數-金額;本年度預算數-百分比;本年度決算數-金額;本年度決算數-百分比;比較增減-金額;比較增減-百分比;上年度決算數-金額;上年度決算數-百分比;預算數;決算數;科目;可用預算數-金額;備註;可用預算數-以前年度保留數;可用預算數-本年度預算數;可用預算數-本年度奉准先行辦理數;可用預算數-調整數;可用預算數-合計;比較增減數;本年度保留數;取得成本或舉債數;以前年度累計折舊;本年度增加數;本年度變動增加類型;本年度減少數;本年度變動減少類型;本年度變動主要增減原因說明;本年度提列折舊;期末餘額;科目名稱;預算數-正式員額薪資;預算數-聘僱人員薪資;預算數-超時工作報酬;預算數-津貼;預算數-獎金;預算數-退休及卹償金;預算數-資遣費;預算數-福利費;預算數-提繳費;預算數-合計;預算數-兼任人員用人費用;預算數-總計;決算數-正式員額薪資;決算數-聘僱人員薪資;決算數-超時工作報酬;決算數-津貼;決算數-獎金;決算數-退休及卹償金;決算數-資遣費;決算數-福利費;決算數-提繳費;決算數-合計;決算數-兼任人員用人費用;決算數-總計;比較增減;車輛類型;預算數-輛數;預算數-金額;決算數-輛數;決算數-金額;比較增減-輛數;比較增減-輛數-百分比;比較增減-金額-百分比;數量單位;預算數-數量;決算數-數量;比較增減-數量;比較增減-數量-百分比,每年,政府資料開放授權條款-第1版,https://www.sfaa.gov.tw/SFAA/Pages/ashx/File.ashx?FilePath=~/File/Attach/9489/File_179017.zip,2020/02/21 00:00,
117958,109年2月份高雄市疫病蟲害主動調查監測-小黃薊馬蟲數資料表,高雄市政府農業局,公共資訊,109年2月份高雄市疫病蟲害主動調查監測-小黃薊馬蟲數資料表,地區;編號;蟲數;調查起日;調查迄日;週遭作物,每月,政府資料開放授權條款-第1版,https://data.kcg.gov.tw/dataset/109-2s,2020/02/20 13:58,
117959,109年2月份高雄市疫病蟲害主動調查監測-瓜實蠅蟲數資料,高雄市政府農業局,公共資訊,109年2月份高雄市疫病蟲害主動調查監測-瓜實蠅蟲數資料,地區;編號;蟲數;調查起日;調查迄日;週遭作物,每月,政府資料開放授權條款-第1版,https://data.kcg.gov.tw/dataset/109-2d,2020/02/15 08:58,
117960,109年2月份高雄市疫病蟲害主動調查監測-東方實蠅蟲數資料,高雄市政府農業局,公共資訊,109年2月份高雄市疫病蟲害主動調查監測-東方果實蠅蟲數資料,地區;編號;蟲數;調查起日;調查迄日;週遭作物,每月,政府資料開放授權條款-第1版,https://data.kcg.gov.tw/dataset/109-2b,2020/02/15 08:57,
117997,高雄高等行政法院109年1月會計月報,高雄高等行政法院,公共資訊,高雄高等行政法院109年1月會計月報,會計年度;月份;款;項;目;節;預算年度;預算科目編號;預算科目名稱;細目編號;細目名稱;原預算數;追加減數;截至本月止累計分配數_1;本月實現數;截至本月止累計實現數_2;應收收入數_3;分配數預算餘額_4;分支計畫編號;分支計畫名稱;用途別編號;用途別名稱;第一預備金;第二預備金;經費流用數;預算調整數;應付數;已分配尚未執行數;備註_預暫付數;基金別;會計分類;使用機關別;科目分類;會計科目編號;會計科目名稱;金額;科目名稱;取得成本;以前年度累計折舊_長期投資評價;本年度資本資產成本變動_增加數;本年度資本資產成本變動_減少數;本年度累計折舊_長期投資評價變動數;期末帳面金額;備註;業務計畫或工作計畫;經資門;執行數;項目;收入實現數;減項_收入待納庫數;加項_以前年度待納庫繳庫數;加項_以前年度撥款於本年度繳還數_材料;加項_以前年度撥款於本年度繳還數_存出保證金;加項_以前年度撥款於本年度繳還數_其他應收款;加項_預收款;加項_剔除經費;繳付公庫數;一級用途別編號;一級用途別名稱;支出實現數;加項_預付款;加項_材料;加項_存出保證金;加項_零用金;加項_退還收入預收款;加項_其他應收款;減項_以前年度撥款於本年度實現數;公庫撥入數;公庫分配數餘額;金額_本月數;金額_累計數,每月,政府資料開放授權條款-第1版,http://ksb.judicial.gov.tw/chinese/GovPublicInfo.aspx?p=58&pa=10227&n=10347&type=6,2020/02/21 00:00,
