資料集識別碼,資料集名稱,提供機關,服務分類,資料集描述,主要欄位說明,更新頻率,授權方式,相關網址,上架日期,備註
127516,嘉義縣縣庫向非營業特種基金調借之基金會計月報,嘉義縣政府,公共資訊,標題、網址,"ArticleType: 公告模式:0.文章 1.附件 2.連結,FileName: 文章檔案,Link: 文章連結,其餘欄位的說明為格式欄位",每月,政府資料開放授權條款-第1版,,2020/06/22 00:00,
127520,歷年度地價稅開徵查定戶數及稅額統計,嘉義縣財政稅務局,公共資訊,歷年度地價稅開徵查定戶數及稅額統計,年度;自用住宅用地查定戶數;自用住宅用地查定稅額;非自用住宅用地查定戶數;非自用住宅用地查定稅額,每日,政府資料開放授權條款-第1版,,2020/06/22 00:00,
127515,臺中市所屬大型運動場館,臺中市政府運動局,休閒旅遊,提供臺中市所屬較大型運動場館名稱、位置及聯絡方式。,場地名稱;區域;地址;經度;緯度;管理機關;聯絡人;連絡電話,每半年,政府資料開放授權條款-第1版,,2020/06/20 12:00,臺中市政府OAS標準之API說明文件:https://datacenter.taichung.gov.tw/swagger/yaml/387390000E ，Swagger 產生API說明頁面網址。https://datacenter.taichung.gov.tw/swagger/api-docs/
127521,109年5月臺南市不動產實價登錄資訊(買賣案件),臺南市政府地政局,公共資訊,109年5月臺南市不動產實價登錄資訊(買賣案件),鄉鎮市區;交易標的;土地區段位置或建物區門牌;土地移轉總面積平方公尺;都市土地使用分區;非都市土益也使用分區;非都市土地使用編定;交易年月;交易筆棟數;移轉層次;總樓層數;建物型態;主要用途;主要建材;建築完成年月;建物移轉總面積平方公尺;建物現況格局-房;建物現況格局-廳;建物現況格局-衛;建物現況格局-隔間;有無管理組織;總價元;單價每平方公尺;車位類別;車位移轉總面積平方公尺;車位總價元;特殊交易備註;備註;編號,每月,政府資料開放授權條款-第1版,https://data.tainan.gov.tw/dataset/109-5-tn-land-value-06,2020/06/22 02:38,
127522,109年臺南市醫事人員執業統計資料,臺南市政府衛生局,公共資訊,109年臺南市醫事人員執業統計資料,人員類別;停業;執業;歇業;總和,每月,政府資料開放授權條款-第1版,https://data.tainan.gov.tw/dataset/https-health-tainan-gov-tw-default-asp,2020/06/20 09:28,
127523,106年度各類食品抽驗結果,臺南市政府衛生局,公共資訊,106年度各類食品抽驗結果,序號;稽查日期;受稽查廠商;產品名稱;檢驗項目;檢驗值;檢驗結果,每月,政府資料開放授權條款-第1版,https://data.tainan.gov.tw/dataset/10601-10612,2020/06/20 04:10,
