資料集識別碼,資料集名稱,提供機關,服務分類,資料集描述,主要欄位說明,更新頻率,授權方式,相關網址,上架日期,備註
129320,109年桃園市交通事故資料表-含第二當事人,桃園市政府警察局,交通及通訊,1.提供桃園市交通事故資料彙整，資料包含事故現場環境及相關肇事因素等。 2.資料包含所有當事人，可使用當事人順位欄位進行篩選。 3.交通事故資料表自106年起更新格式，整合經緯度及代碼對照。 4.107年起新增當事人性別及年齡欄位。,發生日期;發生時間;發生年度;發生月份;發生星期;到場處理日期;到場處理時間;結束_事故排除_日期;結束_事故排除_時間;GPS經度;GPS緯度;事故類別名稱;地址類型名稱;發生縣市名稱;發生市區鄉鎮名稱;發生地址_村里代碼;發生地址_村里名稱;發生地址_鄰;發生地址_路街代碼;發生地址_路街;發生地址_段;發生地址_巷;發生地址_弄;發生地址_號;發生地址_前幾公尺;發生地址_側名稱;發生交叉路口_村里名稱;發生交叉路口_路街口;發生交叉路口_段;發生交叉路口_巷;發生交叉路口_弄;發生地址_其他;死亡人數_24小時內;死亡人數_2_30日內;受傷人數;天候代碼;天候名稱;光線代碼;光線名稱;道路第1當事者_代碼;道路第1當事者_名稱;速限_第1當事者;道路型態大類別代碼;道路型態大類別名稱;道路型態子類別代碼;道路型態子類別名稱;事故位置大類別代碼;事故位置大類別名稱;事故位置子類別代碼;事故位置子類別名稱;路面狀況_路面鋪裝代碼;路面狀況_路面鋪裝名稱;路面狀況_路面狀態代碼;路面狀況_路面狀態名稱;路面狀況_路面缺陷代碼;路面狀況_路面缺陷名稱;道路障礙_障礙物代碼;道路障礙_障礙物名稱;道路障礙_視距品質代碼;道路障礙_視距品質名稱;道路障礙_視距代碼;道路障礙_視距名稱;號誌_號誌種類代碼;號誌_號誌種類名稱;號誌_號誌動作代碼;號誌_號誌動作名稱;車道劃分設施_分向設施大類別代碼;車道劃分設施_分向設施大類別名稱;車道劃分設施_分向設施子類別代碼;車道劃分設施_分向設施子類別名稱;車道劃分設施_快車道或一般車道間代碼;車道劃分設施_快車道或一般車道間名稱;車道劃分設施_快慢車道間代碼;車道劃分設施_快慢車道間名稱;車道劃分設施_路面邊線代碼;車道劃分設施_路面邊線名稱;事故類型及型態大類別代碼;事故類型及型態大類別名稱;事故類型及型態子類別代碼;事故類型及型態子類別名稱;肇因研判大類別代碼_主要;肇因研判大類別名稱_主要;肇因研判子類別代碼_主要;肇因研判子類別名稱_主要;當事者順位;國籍;當事者屬性別名稱;當事者事故發生時年齡;牌照種類代碼;牌照種類名稱;乘坐車輛的牌照種類代碼;乘坐車輛的牌照種類名稱;乘坐車輛的當事者區分_大類別代碼_車種;乘坐車輛的當事者區分_大類別名稱_車種;乘坐車輛的當事者區分_子類別代碼_車種;乘坐車輛的當事者區分_子類別名稱_車種;受傷程度代碼;受傷程度名稱;主要傷處代碼;主要傷處名稱;保護裝備代碼;保護裝備名稱;行動電話_電腦或其他相類功能裝置代碼;行動電話_電腦或其他相類功能裝置名稱;車輛用途代碼;車輛用途名稱;當事者行動狀態大類別代碼;當事者行動狀態大類別名稱;當事者行動狀態子類別代碼;當事者行動狀態子類別名稱;駕駛資格情形代碼;駕駛資格情形名稱;駕駛執照種類大類別代碼;駕駛執照種類大類別名稱;駕駛執照種類子類別代碼;駕駛執照種類子類別名稱;飲酒情形代碼;飲酒情形名稱;車輛撞擊部位大類別代碼_最初;車輛撞擊部位大類別名稱_最初;車輛撞擊部位子類別代碼_最初;車輛撞擊部位子類別名稱_最初;車輛撞擊部位大類別代碼_其他;車輛撞擊部位大類別名稱_其他;車輛撞擊部位子類別代碼_其他;車輛撞擊部位子類別名稱_其他;肇因研判大類別代碼_個別;肇因研判大類別名稱_個別;肇因研判子類別代碼_個別;肇因研判子類別名稱_個別;肇事逃逸類別代碼_是否肇逃;肇事逃逸類別名稱_是否肇逃;職業代碼;職業名稱;旅次目的代碼;旅次目的名稱,每月,政府資料開放授權條款-第1版,,2020/08/24 13:30,
129325,近海水文資料浮標站位置圖,經濟部水利署,公共資訊,近海水文資料浮標站位置圖,檔案描述;檔案格式;資源網址,每年,政府資料開放授權條款-第1版,https://data.wra.gov.tw/WraStandardWrisp/Query/StandardDetail.aspx?DictID=372,2020/08/25 00:21,
129332,pay.taipei支援無卡進出停車場清單,臺北市政府資訊局,公共資訊,提供合作支付業者pay.taipei合作停車場業者及停車場地址即時更新資訊，以利後續資訊介接及帳務結算。,parkid;營運單位;停車場名稱;狀態;停車場電話;停車場地址;備註,每月,政府資料開放授權條款-第1版,,2020/08/11 00:00,臺北市政府OAS標準之API說明文件：https://data.taipei/api/comments/doc
129331,臺北都市更新容積獎勵案件統計表,臺北市都市更新處,公共資訊,臺北都市更新容積獎勵案件統計表,cSubj;cLink,每年,政府資料開放授權條款-第1版,,2020/08/20 00:00,臺北市政府OAS標準之API說明文件：https://data.taipei/api/comments/doc
129321,水利署與台南市合建淹水感測器感測資料,臺南市政府,公共資訊,本資料集API連結由民生公共物聯網(https://ci.taiwan.gov.tw/dsp/index.aspx)所提供。 API架構及說明請參考民生公共物聯網API說明網頁 : https://ci.taiwan.gov.tw/dsp/sta_guide.aspx,@iot.count;value,每月,政府資料開放授權條款-第1版,https://data.tainan.gov.tw/dataset/wsensor,2020/08/24 07:58,
129329,109年7月會計月報,臺灣橋頭地方法院,公共資訊,109年7月會計月報,會計年度;月份;款;項;目;節;預算年度;預算科目編號;預算科目名稱;細目編號;細目名稱;原預算數;追加減數;截至本月止累計分配數_1;本月實現數;截至本月止累計實現數_2;應收收入數_3;分配數預算餘額_4;分支計畫編號;分支計畫名稱;用途別編號;用途別名稱;第一預備金;第二預備金;經費流用數;預算調整數;應付數;已分配尚未執行數;備註_預暫付數;以前年度轉入數;應收數;保留數;減免;截至本月止累計實現數;調整數;尚未執行數;業務計畫或工作計畫;經資門;執行數;會計分類;項目;收入實現數;減項_收入待納庫數;加項_以前年度待納庫繳庫數;加項_以前年度撥款於本年度繳還數_材料;加項_以前年度撥款於本年度繳還數_存出保證金;加項_以前年度撥款於本年度繳還數_其他應收款;加項_預收款;加項_剔除經費;繳付公庫數;一級用途別編號;一級用途別名稱;支出實現數;加項_預付款;加項_材料;加項_存出保證金;加項_零用金;加項_退還收入預收款;加項_其他應收款;減項_以前年度撥款於本年度實現數;公庫撥入數;公庫分配數餘額;基金別;使用機關別;科目分類;會計科目編號;會計科目名稱;金額;金額_本月數;金額_累計數;科目名稱;取得成本;以前年度累計折舊_長期投資評價;本年度資本資產成本變動_增加數;本年度資本資產成本變動_減少數;本年度累計折舊_長期投資評價變動數;期末帳面金額;備註;預算項目;預算執行數;會計收支;會計科目,每月,政府資料開放授權條款-第1版,http://ctd.judicial.gov.tw/UserFiles/10907月報XML.zip,2020/08/25 00:00,109年7月會計月報
129086,苗栗縣104年多元繳稅統計表(csv格式),苗栗縣政府稅務局,公共資訊,苗栗縣104年多元繳稅統計表csv格式,繳稅方式;信用卡件數;信用卡金額;自動櫃員機件數;自動櫃員機金額;活期(儲蓄)存款件數;活期(儲蓄)存款金額;電話語音件數;電話語音金額;便利商店件數;便利商店金額;晶片金融卡件數;晶片金融卡金額;金融機構臨櫃件數;金融機構臨櫃金額;長期約定轉帳件數;長期約定轉帳金額,不更新,政府資料開放授權條款-第1版,,2020/08/24 00:00,
129087,105年多元繳稅統計表(csv格式),苗栗縣政府稅務局,公共資訊,105年多元繳稅統計表(csv格式),繳稅方式;信用卡件數;信用卡金額;自動櫃員機件數;自動櫃員機金額;活期(儲蓄)存款件數;活期(儲蓄)存款金額;電話語音件數;電話語音金額;便利商店件數;便利商店金額;晶片金融卡件數;晶片金融卡金額;金融機構臨櫃件數;金融機構臨櫃金額;長期約定轉帳件數;長期約定轉帳金額,不更新,政府資料開放授權條款-第1版,,2020/08/24 00:00,
129328,新竹縣受理國家賠償件數及處理結果(109年1月至6月),行政處,公共資訊,新竹縣受理國家賠償件數及處理結果(109年1月至6月),新收案件件數;拒絕賠償件數;已結案件件數;未結案件件數;賠償總金額;協議成立賠償件數;協議成立賠償金額;訴訟件數;判決確定賠償件數;判決確定賠償金額;依第2條賠償件數;依第3條賠償件數;行使求償權總件數;獲償總件數;獲償總金額;行政懲處戒件數;行政懲處戒人數,每半年,政府資料開放授權條款-第1版,,2020/08/25 00:00,
