資料集識別碼,資料集名稱,提供機關,服務分類,資料集描述,主要欄位說明,更新頻率,授權方式,相關網址,上架日期,備註
114593,108年度12月基隆市土地建物登記管理資料,基隆市政府地政處,購屋及遷徙,購屋及遷徙: 係指各種房屋買賣、房屋遷移、移⺠等相關資料集,,每月,政府資料開放授權條款-第1版,,2020/01/17 00:00,
114646,108年12月份土地及建物登記管理統計表,宜蘭縣政府,購屋及遷徙,宜蘭地政事務所轄區內土地及建物登記管理統計表,"登記原因,件 數,土地筆數,土地面積;,建物棟數,建物面積",每日,政府資料開放授權條款-第1版,,2020/01/17 00:00,無
114635,食品業者登錄數,新北市政府衛生局,生活安全及品質,食品業者登錄數,number of food businesses,每季,政府資料開放授權條款-第1版,,2020/01/17 09:21,
114633,20903-90-11-2 臺中市政府地方稅務局全功能服務櫃臺績效統計,臺中市政府地方稅務局,公共資訊,臺中市政府地方稅務局全功能服務櫃臺績效統計,RptNo;RptName;StatCourseNo;StatCourseName;DataDate;PlaceNo;PlaceName;PeriodNo;PeriodName;Complex1;ComplexName;Complex2;Complex2Name;Complex3;Complex3Name;Complex4;Complex4Name;Complex5;Complex5Name;DeriveNo;DeriveExplain;FValue;SValue;RptDeptNo;RptDeptName;CreateTime;ModifyTime,每月,政府資料開放授權條款-第1版,,2020/01/17 08:41,臺中市政府OAS標準之API說明文件:https://datacenter.taichung.gov.tw/swagger/yaml/387260000D ，Swagger 產生API說明頁面網址。https://datacenter.taichung.gov.tw/swagger/api-docs/
114638,2613-01-16-2 臺中市印花稅查徵統計-以前年度,臺中市政府地方稅務局,公共資訊,臺中市印花稅查徵統計-以前年度,RptNo;RptName;StatCourseNo;StatCourseName;DataDate;PlaceNo;PlaceName;PeriodNo;PeriodName;Complex1;ComplexName;Complex2;Complex2Name;Complex3;Complex3Name;Complex4;Complex4Name;Complex5;Complex5Name;DeriveNo;DeriveExplain;FValue;SValue;RptDeptNo;RptDeptName;CreateTime;ModifyTime,每月,政府資料開放授權條款-第1版,,2020/01/17 10:09,臺中市政府OAS標準之API說明文件:https://datacenter.taichung.gov.tw/swagger/yaml/387260000D ，Swagger 產生API說明頁面網址。https://datacenter.taichung.gov.tw/swagger/api-docs/
114641,2613-90-08-2 臺中市地方稅案件提起行政救濟件數統計表,臺中市政府地方稅務局,公共資訊,地方稅案件提起行政救濟件數統計，即各稅復查、訴願、行政訴訟第一審及上訴審件數統計,RptNo;RptName;StatCourseNo;StatCourseName;DataDate;PlaceNo;PlaceName;PeriodNo;PeriodName;Complex1;ComplexName;Complex2;Complex2Name;Complex3;Complex3Name;Complex4;Complex4Name;Complex5;Complex5Name;DeriveNo;DeriveExplain;FValue;SValue;RptDeptNo;RptDeptName;CreateTime;ModifyTime,每季,政府資料開放授權條款-第1版,,2020/01/17 11:44,臺中市政府OAS標準之API說明文件:https://datacenter.taichung.gov.tw/swagger/yaml/387260000D ，Swagger 產生API說明頁面網址。https://datacenter.taichung.gov.tw/swagger/api-docs/
114642,20903-90-08-2 臺中市地方稅案件提起行政救濟件數統計表,臺中市政府地方稅務局,公共資訊,地方稅案件提起行政救濟件數統計，即各稅復查、訴願、行政訴訟第一審及上訴審件數統計,RptNo;RptName;StatCourseNo;StatCourseName;DataDate;PlaceNo;PlaceName;PeriodNo;PeriodName;Complex1;ComplexName;Complex2;Complex2Name;Complex3;Complex3Name;Complex4;Complex4Name;Complex5;Complex5Name;DeriveNo;DeriveExplain;FValue;SValue;RptDeptNo;RptDeptName;CreateTime;ModifyTime,每季,政府資料開放授權條款-第1版,,2020/01/17 11:51,臺中市政府OAS標準之API說明文件:https://datacenter.taichung.gov.tw/swagger/yaml/387260000D ，Swagger 產生API說明頁面網址。https://datacenter.taichung.gov.tw/swagger/api-docs/
114649,臺中市各行政區契稅實徵數趨勢表,臺中市政府地方稅務局,公共資訊,該資料係表現臺中市各行政區103年至108年契稅實徵數之趨勢表,銷號年度;分局;區別;已納金額,每年,政府資料開放授權條款-第1版,,2020/01/17 04:57,臺中市政府OAS標準之API說明文件:https://datacenter.taichung.gov.tw/swagger/yaml/387260000D ，Swagger 產生API說明頁面網址。https://datacenter.taichung.gov.tw/swagger/api-docs/
114643,臺中市108年11月份十大易肇事路段(口),臺中市政府警察局,交通及通訊,臺中市108年11月份十大高肇事路口交通事故資料,編號;轄區分局;路口名稱;A1;A2件數;A2受傷;A3;總件數;發生時間;主要肇因,每月,政府資料開放授權條款-第1版,,2020/01/17 03:07,臺中市政府OAS標準之API說明文件:https://datacenter.taichung.gov.tw/swagger/yaml/387130000C ，Swagger 產生API說明頁面網址。https://datacenter.taichung.gov.tw/swagger/api-docs/
114644,臺中市政府警察局108年11月份交通事故資料,臺中市政府警察局,交通及通訊,本局108年11月份交通事故逐案細部資料,年;月;日;時;分;縣市;區;死;受傷;2-30;天候;光線;道路類別;速限;道路型態;事故位置;路面鋪裝;路面狀態;路面缺陷;障礙物;視距;號誌種類;號誌動作;分向設施;快車道或一般車道間;快慢車道間;路面邊線;事故類型及型態;主要肇因;受傷程度;主要傷處;保護裝備;行動電話;當事者區分;車輛用途;當事者行動狀態;駕駛資格情形;駕駛執照種類;飲酒情形;車輛撞擊部位最初;車輛撞擊部位其他;肇事因素個別;肇事因素主要;肇事逃逸;職業;旅次目的;車種;GPS座標;事故類別,每月,政府資料開放授權條款-第1版,,2020/01/17 03:09,臺中市政府OAS標準之API說明文件:https://datacenter.taichung.gov.tw/swagger/yaml/387130000C ，Swagger 產生API說明頁面網址。https://datacenter.taichung.gov.tw/swagger/api-docs/
114647,臺灣高等法院高雄分院108年度12月份會計報告,臺灣高等法院高雄分院,公共資訊,臺灣高等法院高雄分院108年度12月份會計報告,會計年度;月份;款;項;目;節;預算年度;預算科目編號;預算科目名稱;細目編號;細目名稱;原預算數;追加減數;截至本月止分配預算數_1;本月實現數;截至本月止累計實現數_2;應收收入數_3;保留數_4;分配數預算餘額_5;分支計畫編號;分支計畫名稱;用途別編號;用途別名稱;第一預備金;第二預備金;經費流用數;預算調整數;截至本月止累計分配數_1;應付數;保留數;已分配尚未執行數;備註_預暫付數;基金別;會計分類;使用機關別;科目分類;會計科目編號;會計科目名稱;金額;科目名稱;取得成本;以前年度累計折舊_長期投資評價;本年度資本資產成本變動_增加數;本年度資本資產成本變動_減少數;本年度累計折舊_長期投資評價變動數;期末帳面金額;備註;業務計畫或工作計畫;經資門;執行數;項目;收入實現數;減項_收入待納庫數;加項_以前年度待納庫繳庫數;加項_以前年度撥款於本年度繳還數_材料;加項_以前年度撥款於本年度繳還數_存出保證金;加項_以前年度撥款於本年度繳還數_其他應收款;加項_預收款;加項_剔除經費;繳付公庫數;一級用途別編號;一級用途別名稱;支出實現數;加項_預付款;加項_材料;加項_存出保證金;加項_零用金;加項_退還收入預收款;加項_其他應收款;減項_以前年度撥款於本年度實現數;公庫撥入數;公庫分配數餘額;金額_本月數;金額_累計數,不更新,政府資料開放授權條款-第1版,,2020/01/17 00:00,
114636,國民健康署108年菸害防制及衛生保健基金法定預算,衛生福利部國民健康署,公共資訊,國民健康署108年菸害防制及衛生保健基金法定預算,SEQNO;LEVEL;BOLD;前年度決算數;項目;本年度預算數;上年度預算數;比較增減;預算數;說明;科目及業務項目;單位;預算數-數量;預算數-利率;預算數-金額;業務計畫及用途別科目;計畫內容說明;計畫別;單位成本或平均利率;數量;民國106年12月31日實際數;科目;民國108年12月31日預計數;民國107年12月31日預計數;年度及項目;上年度最高可進用員額數;本年度增減數;本年度最高可進用員額數;正式員額薪資;聘僱人員薪資;超時工作報酬;津貼;獎金-年終獎金;獎金-考績獎金;獎金-其他;退休及卹償金-退休金;退休及卹償金-卹償金;資遣費;福利費-分擔保險費;福利費-傷病醫藥費;福利費-提撥福利金;福利費-其他;提繳費;合計;兼任人員用人費用;總計;科目名稱;菸害防制及衛生保健計畫;一般行政管理計畫;取得成本_舉債數;以前年度累計折舊_長期投資評價_未攤銷溢價;本年度增加數;本年度減少數;本年度累計折舊_長期投資評價變動數_攤銷數;期末餘額;本年度增加類型;本年度減少類型;主要增減原因說明,每年,政府資料開放授權條款-第1版,,2020/01/17 00:00,
114632,連江縣108年下期都市土地地價指數,連江縣地政局,公共資訊,本期地價總指數較上期下跌0.42％，住宅區、商業區地價分別較上期上漲0.3％及下跌1.59％。本縣積極推動觀光行銷，加上持續推動各項重大土地開發案及公共設施建設，除保存馬祖傳統的民俗文化及活化軍事廢棄營區，並且運用現代化科技發展觀光資源，使生活環境呈現多元化發展，更提升觀光競爭的軟實力，惟整體不動產交易因受限交通、天候(離島特殊性)等條件，，致交易動能有停滯現象，本期整體地價變動幅度持平。,,即時,政府資料開放授權條款-第1版,http://www.matsu-land.gov.tw/userfiles/Files/news1_12_14325.pdf,2020/01/17 00:00,
